results/fp8/predictions_SOLModel.csv
row_idx,in_dtype,acc_dtype,out_dtype,sf_dtype,sf_vec_size,a_major,b_major,c_major,mma_m,mma_n,cta_m,cta_n,cluster_m,cluster_n,m,n,k,actual_runtime,predicted_runtime,ratio,runtime,bound
0,fp8,fp32,fp8,,0,k,k,n,128,64,64,64,2,1,4096,7168,128000,10095.001220703123,2384.3659043659045,0.23619273066316993,2384.3659043659045,MATH
1,fp8,fp32,fp8,,0,k,k,n,128,64,64,64,2,2,4096,7168,128000,5797.055816650391,2384.3659043659045,0.41130635615366906,2384.3659043659045,MATH
2,fp8,fp32,fp8,,0,k,k,n,128,128,64,128,2,1,4096,7168,128000,5914.6240234375,2384.3659043659045,0.4031305954389546,2384.3659043659045,MATH
3,fp8,fp32,fp8,,0,k,k,n,128,128,64,128,2,2,4096,7168,128000,3912.499237060547,2384.3659043659045,0.6094227142028209,2384.3659043659045,MATH
4,fp8,fp32,fp8,,0,k,k,n,128,192,64,192,2,1,4096,7168,128000,4231.167984008789,2384.3659043659045,0.5635242829822262,2384.3659043659045,MATH
5,fp8,fp32,fp8,,0,k,k,n,128,192,64,192,2,2,4096,7168,128000,3395.993423461914,2384.3659043659045,0.7021114610802912,2384.3659043659045,MATH
6,fp8,fp32,fp8,,0,k,k,n,128,256,64,256,2,1,4096,7168,128000,3564.339065551758,2384.3659043659045,0.6689503609266774,2384.3659043659045,MATH
7,fp8,fp32,fp8,,0,k,k,n,128,256,64,256,2,2,4096,7168,128000,2921.881675720215,2384.3659043659045,0.816037803371412,2384.3659043659045,MATH
8,fp8,fp32,fp8,,0,k,k,n,256,64,128,64,2,1,4096,7168,128000,7378.943634033203,2384.3659043659045,0.32313106355342236,2384.3659043659045,MATH
9,fp8,fp32,fp8,,0,k,k,n,256,64,128,64,2,2,4096,7168,128000,4604.108810424805,2384.3659043659045,0.5178778353298534,2384.3659043659045,MATH
10,fp8,fp32,fp8,,0,k,k,n,256,128,128,128,2,1,4096,7168,128000,4425.31852722168,2384.3659043659045,0.5388009675911095,2384.3659043659045,MATH
11,fp8,fp32,fp8,,0,k,k,n,256,128,128,128,2,2,4096,7168,128000,2790.809631347656,2384.3659043659045,0.8543635071284015,2384.3659043659045,MATH
12,fp8,fp32,fp8,,0,k,k,n,256,192,128,192,2,1,4096,7168,128000,2687.99991607666,2384.3659043659045,0.8870409147356177,2384.3659043659045,MATH
13,fp8,fp32,fp8,,0,k,k,n,256,192,128,192,2,2,4096,7168,128000,2970.419120788574,2384.3659043659045,0.8027035268117023,2384.3659043659045,MATH
14,fp8,fp32,fp8,,0,k,k,n,256,256,128,256,2,1,4096,7168,128000,2796.563148498535,2384.3659043659045,0.8526057799360126,2384.3659043659045,MATH
15,fp8,fp32,fp8,,0,k,k,n,256,256,128,256,2,2,4096,7168,128000,2757.638359069824,2384.3659043659045,0.8646405343629511,2384.3659043659045,MATH
16,fp8,fp32,fp8,,0,k,k,n,128,64,64,64,2,1,4096,128000,7168,6072.934341430664,2384.3659043659045,0.392621716342185,2384.3659043659045,MATH
17,fp8,fp32,fp8,,0,k,k,n,128,64,64,64,2,2,4096,128000,7168,5642.035293579102,2384.3659043659045,0.4226074067773776,2384.3659043659045,MATH
18,fp8,fp32,fp8,,0,k,k,n,128,128,64,128,2,1,4096,128000,7168,4067.327880859376,2384.3659043659045,0.5862241683505776,2384.3659043659045,MATH
19,fp8,fp32,fp8,,0,k,k,n,128,128,64,128,2,2,4096,128000,7168,3634.995269775391,2384.3659043659045,0.6559474572612679,2384.3659043659045,MATH
20,fp8,fp32,fp8,,0,k,k,n,128,192,64,192,2,1,4096,128000,7168,3038.412857055664,2384.3659043659045,0.7847405920591201,2384.3659043659045,MATH
21,fp8,fp32,fp8,,0,k,k,n,128,192,64,192,2,2,4096,128000,7168,3207.372665405273,2384.3659043659045,0.7434015791441011,2384.3659043659045,MATH
22,fp8,fp32,fp8,,0,k,k,n,128,256,64,256,2,1,4096,128000,7168,2623.488044738769,2384.3659043659045,0.9088533523709368,2384.3659043659045,MATH
23,fp8,fp32,fp8,,0,k,k,n,128,256,64,256,2,2,4096,128000,7168,2828.4927368164062,2384.3659043659045,0.8429810949592941,2384.3659043659045,MATH
24,fp8,fp32,fp8,,0,k,k,n,256,64,128,64,2,1,4096,128000,7168,5220.147323608398,2384.3659043659045,0.45676218630506477,2384.3659043659045,MATH
25,fp8,fp32,fp8,,0,k,k,n,256,64,128,64,2,2,4096,128000,7168,4246.323013305664,2384.3659043659045,0.5615130777603589,2384.3659043659045,MATH
26,fp8,fp32,fp8,,0,k,k,n,256,128,128,128,2,1,4096,128000,7168,3080.191993713379,2384.3659043659045,0.7740965203572882,2384.3659043659045,MATH
27,fp8,fp32,fp8,,0,k,k,n,256,128,128,128,2,2,4096,128000,7168,2683.9040756225586,2384.3659043659045,0.8883946062091757,2384.3659043659045,MATH
28,fp8,fp32,fp8,,0,k,k,n,256,192,128,192,2,1,4096,128000,7168,2399.0272521972656,2384.3659043659045,0.9938886280604221,2384.3659043659045,MATH
29,fp8,fp32,fp8,,0,k,k,n,256,192,128,192,2,2,4096,128000,7168,2679.814338684082,2384.3659043659045,0.8897504091782504,2384.3659043659045,MATH
30,fp8,fp32,fp8,,0,k,k,n,256,256,128,256,2,1,4096,128000,7168,2404.3519973754883,2384.3659043659045,0.9916875345076761,2384.3659043659045,MATH
31,fp8,fp32,fp8,,0,k,k,n,256,256,128,256,2,2,4096,128000,7168,2690.457534790039,2384.3659043659045,0.8862306405263439,2384.3659043659045,MATH
32,fp8,fp32,fp8,,0,k,k,n,128,64,64,64,2,1,128000,7168,4096,8427.519989013672,2384.3659043659045,0.28292616421844435,2384.3659043659045,MATH
33,fp8,fp32,fp8,,0,k,k,n,128,64,64,64,2,2,128000,7168,4096,6091.3665771484375,2384.3659043659045,0.3914336584684913,2384.3659043659045,MATH
34,fp8,fp32,fp8,,0,k,k,n,128,128,64,128,2,1,128000,7168,4096,4516.454315185547,2384.3659043659045,0.5279287108803511,2384.3659043659045,MATH
35,fp8,fp32,fp8,,0,k,k,n,128,128,64,128,2,2,128000,7168,4096,3847.987365722656,2384.3659043659045,0.6196397435203425,2384.3659043659045,MATH
36,fp8,fp32,fp8,,0,k,k,n,128,192,64,192,2,1,128000,7168,4096,3459.904098510742,2384.3659043659045,0.6891421948348843,2384.3659043659045,MATH
37,fp8,fp32,fp8,,0,k,k,n,128,192,64,192,2,2,128000,7168,4096,3350.9376525878906,2384.3659043659045,0.7115518555006496,2384.3659043659045,MATH
38,fp8,fp32,fp8,,0,k,k,n,128,256,64,256,2,1,128000,7168,4096,2924.3392944335938,2384.3659043659045,0.8153520040935349,2384.3659043659045,MATH
39,fp8,fp32,fp8,,0,k,k,n,128,256,64,256,2,2,128000,7168,4096,3024.486351013184,2384.3659043659045,0.7883539972224232,2384.3659043659045,MATH
40,fp8,fp32,fp8,,0,k,k,n,256,64,128,64,2,1,128000,7168,4096,8110.899353027344,2384.3659043659045,0.2939705944539867,2384.3659043659045,MATH
41,fp8,fp32,fp8,,0,k,k,n,256,64,128,64,2,2,128000,7168,4096,5421.260833740234,2384.3659043659045,0.4398175954800691,2384.3659043659045,MATH
42,fp8,fp32,fp8,,0,k,k,n,256,128,128,128,2,1,128000,7168,4096,4378.214263916016,2384.3659043659045,0.5445978110338645,2384.3659043659045,MATH
43,fp8,fp32,fp8,,0,k,k,n,256,128,128,128,2,2,128000,7168,4096,3078.553581237793,2384.3659043659045,0.7745084960993998,2384.3659043659045,MATH
44,fp8,fp32,fp8,,0,k,k,n,256,192,128,192,2,1,128000,7168,4096,3241.779327392578,2384.3659043659045,0.7355114779770322,2384.3659043659045,MATH
45,fp8,fp32,fp8,,0,k,k,n,256,192,128,192,2,2,128000,7168,4096,2746.982383728028,2384.3659043659045,0.8679946105551636,2384.3659043659045,MATH
46,fp8,fp32,fp8,,0,k,k,n,256,256,128,256,2,1,128000,7168,4096,2565.7344818115234,2384.3659043659045,0.929311244506655,2384.3659043659045,MATH
47,fp8,fp32,fp8,,0,k,k,n,256,256,128,256,2,2,128000,7168,4096,2685.5424880981445,2384.3659043659045,0.8878526088985738,2384.3659043659045,MATH
48,fp8,fp32,fp8,,0,k,k,n,128,64,64,64,2,1,4096,512,7168,36.04480028152466,9.537463617463617,0.2646002625336281,9.537463617463617,MATH
49,fp8,fp32,fp8,,0,k,k,n,128,64,64,64,2,2,4096,512,7168,35.22560000419617,9.537463617463617,0.2707537590935992,9.537463617463617,MATH
50,fp8,fp32,fp8,,0,k,k,n,128,128,64,128,2,1,4096,512,7168,25.600001215934757,9.537463617463617,0.37255715486165714,9.537463617463617,MATH
51,fp8,fp32,fp8,,0,k,k,n,128,128,64,128,2,2,4096,512,7168,25.39519965648651,9.537463617463617,0.37556167096436005,9.537463617463617,MATH
52,fp8,fp32,fp8,,0,k,k,n,128,192,64,192,2,1,4096,512,7168,29.08799946308136,9.537463617463617,0.3278831062125333,9.537463617463617,MATH
53,fp8,fp32,fp8,,0,k,k,n,128,192,64,192,2,2,4096,512,7168,31.21280074119568,9.537463617463617,0.30556257019498284,9.537463617463617,MATH
54,fp8,fp32,fp8,,0,k,k,n,128,256,64,256,2,1,4096,512,7168,24.780799448490143,9.537463617463617,0.38487312071139496,9.537463617463617,MATH
55,fp8,fp32,fp8,,0,k,k,n,128,256,64,256,2,2,4096,512,7168,25.07520020008087,9.537463617463617,0.38035443551245735,9.537463617463617,MATH
56,fp8,fp32,fp8,,0,k,k,n,256,64,128,64,2,1,4096,512,7168,28.87679934501648,9.537463617463617,0.33028118883644836,9.537463617463617,MATH
57,fp8,fp32,fp8,,0,k,k,n,256,64,128,64,2,2,4096,512,7168,29.95840013027191,9.537463617463617,0.3183569074446784,9.537463617463617,MATH
58,fp8,fp32,fp8,,0,k,k,n,256,128,128,128,2,1,4096,512,7168,24.780799448490143,9.537463617463617,0.38487312071139496,9.537463617463617,MATH
59,fp8,fp32,fp8,,0,k,k,n,256,128,128,128,2,2,4096,512,7168,24.57599937915802,9.537463617463617,0.3880803978841235,9.537463617463617,MATH
60,fp8,fp32,fp8,,0,k,k,n,256,192,128,192,2,1,4096,512,7168,31.136000156402588,9.537463617463617,0.3063162760006089,9.537463617463617,MATH
61,fp8,fp32,fp8,,0,k,k,n,256,192,128,192,2,2,4096,512,7168,31.12959861755371,9.537463617463617,0.3063792673537886,9.537463617463617,MATH
62,fp8,fp32,fp8,,0,k,k,n,256,256,128,256,2,1,4096,512,7168,35.64159870147705,9.537463617463617,0.26759359750796946,9.537463617463617,MATH
63,fp8,fp32,fp8,,0,k,k,n,256,256,128,256,2,2,4096,512,7168,35.22560000419617,9.537463617463617,0.2707537590935992,9.537463617463617,MATH
64,fp8,fp32,fp8,,0,k,k,n,128,64,64,64,2,1,4096,7168,512,50.36799907684326,9.537463617463617,0.18935561849326024,9.537463617463617,MATH
65,fp8,fp32,fp8,,0,k,k,n,128,64,64,64,2,2,4096,7168,512,56.10880255699158,9.537463617463617,0.16998159259905962,9.537463617463617,MATH
66,fp8,fp32,fp8,,0,k,k,n,128,128,64,128,2,1,4096,7168,512,32.56320059299469,9.537463617463617,0.29289085359488304,9.537463617463617,MATH
67,fp8,fp32,fp8,,0,k,k,n,128,128,64,128,2,2,4096,7168,512,35.29599905014038,9.537463617463617,0.2702137317012899,9.537463617463617,MATH
68,fp8,fp32,fp8,,0,k,k,n,128,192,64,192,2,1,4096,7168,512,29.08160090446472,9.537463617463617,0.32795524733301007,9.537463617463617,MATH
69,fp8,fp32,fp8,,0,k,k,n,128,192,64,192,2,2,4096,7168,512,31.839999556541446,9.537463617463617,0.2995434594943067,9.537463617463617,MATH
70,fp8,fp32,fp8,,0,k,k,n,128,256,64,256,2,1,4096,7168,512,30.31040132045746,9.537463617463617,0.31465976041123805,9.537463617463617,MATH
71,fp8,fp32,fp8,,0,k,k,n,128,256,64,256,2,2,4096,7168,512,30.30399978160858,9.537463617463617,0.31472623040513215,9.537463617463617,MATH
72,fp8,fp32,fp8,,0,k,k,n,256,64,128,64,2,1,4096,7168,512,33.17759931087494,9.537463617463617,0.2874669601045375,9.537463617463617,MATH
73,fp8,fp32,fp8,,0,k,k,n,256,64,128,64,2,2,4096,7168,512,36.03839874267578,9.537463617463617,0.2646472637578536,9.537463617463617,MATH
74,fp8,fp32,fp8,,0,k,k,n,256,128,128,128,2,1,4096,7168,512,29.286399483680725,9.537463617463617,0.3256618698648218,9.537463617463617,MATH
75,fp8,fp32,fp8,,0,k,k,n,256,128,128,128,2,2,4096,7168,512,30.105599761009216,9.537463617463617,0.3168003193152096,9.537463617463617,MATH
76,fp8,fp32,fp8,,0,k,k,n,256,192,128,192,2,1,4096,7168,512,25.600001215934757,9.537463617463617,0.37255715486165714,9.537463617463617,MATH
77,fp8,fp32,fp8,,0,k,k,n,256,192,128,192,2,2,4096,7168,512,27.02080011367798,9.537463617463617,0.35296747606802864,9.537463617463617,MATH
78,fp8,fp32,fp8,,0,k,k,n,256,256,128,256,2,1,4096,7168,512,24.985599517822266,9.537463617463617,0.3817184218717878,9.537463617463617,MATH
79,fp8,fp32,fp8,,0,k,k,n,256,256,128,256,2,2,4096,7168,512,26.918399333953857,9.537463617463617,0.35431020615826214,9.537463617463617,MATH
80,fp8,fp32,fp8,,0,k,k,n,128,64,64,64,2,1,7168,512,4096,37.2736006975174,9.537463617463617,0.255877174165759,9.537463617463617,MATH
81,fp8,fp32,fp8,,0,k,k,n,128,64,64,64,2,2,7168,512,4096,37.33760118484497,9.537463617463617,0.25543857438101286,9.537463617463617,MATH
82,fp8,fp32,fp8,,0,k,k,n,128,128,64,128,2,1,7168,512,4096,27.436798810958862,9.537463617463617,0.3476157580619115,9.537463617463617,MATH
83,fp8,fp32,fp8,,0,k,k,n,128,128,64,128,2,2,7168,512,4096,28.67200076580048,9.537463617463617,0.33264032375584185,9.537463617463617,MATH
84,fp8,fp32,fp8,,0,k,k,n,128,192,64,192,2,1,7168,512,4096,27.033600211143494,9.537463617463617,0.35280035004483745,9.537463617463617,MATH
85,fp8,fp32,fp8,,0,k,k,n,128,192,64,192,2,2,7168,512,4096,33.587199449539185,9.537463617463617,0.28396126422485846,9.537463617463617,MATH
86,fp8,fp32,fp8,,0,k,k,n,128,256,64,256,2,1,7168,512,4096,26.630398631095886,9.537463617463617,0.3581419771286065,9.537463617463617,MATH
87,fp8,fp32,fp8,,0,k,k,n,128,256,64,256,2,2,7168,512,4096,26.009601354599,9.537463617463617,0.3666901113721687,9.537463617463617,MATH
88,fp8,fp32,fp8,,0,k,k,n,256,64,128,64,2,1,7168,512,4096,33.184000849723816,9.537463617463617,0.28741150473852506,9.537463617463617,MATH
89,fp8,fp32,fp8,,0,k,k,n,256,64,128,64,2,2,7168,512,4096,33.17759931087494,9.537463617463617,0.2874669601045375,9.537463617463617,MATH
90,fp8,fp32,fp8,,0,k,k,n,256,128,128,128,2,1,7168,512,4096,27.033600211143494,9.537463617463617,0.35280035004483745,9.537463617463617,MATH
91,fp8,fp32,fp8,,0,k,k,n,256,128,128,128,2,2,7168,512,4096,26.50879919528961,9.537463617463617,0.35978482266214246,9.537463617463617,MATH
92,fp8,fp32,fp8,,0,k,k,n,256,192,128,192,2,1,7168,512,4096,31.9487988948822,9.537463617463617,0.29852338577245857,9.537463617463617,MATH
93,fp8,fp32,fp8,,0,k,k,n,256,192,128,192,2,2,7168,512,4096,33.25439989566803,9.537463617463617,0.28680305906545733,9.537463617463617,MATH
94,fp8,fp32,fp8,,0,k,k,n,256,256,128,256,2,1,7168,512,4096,26.412799954414368,9.537463617463617,0.361092486745981,9.537463617463617,MATH
95,fp8,fp32,fp8,,0,k,k,n,256,256,128,256,2,2,7168,512,4096,28.26879918575287,9.537463617463617,0.3373848161994225,9.537463617463617,MATH
96,fp8,fp32,fp8,,0,k,k,n,128,64,64,64,2,1,4096,1536,7168,84.3775987625122,28.61239085239085,0.33909937319883693,28.61239085239085,MATH
97,fp8,fp32,fp8,,0,k,k,n,128,64,64,64,2,2,4096,1536,7168,88.07039856910706,28.61239085239085,0.32488090569885736,28.61239085239085,MATH
98,fp8,fp32,fp8,,0,k,k,n,128,128,64,128,2,1,4096,1536,7168,58.16320180892944,28.61239085239085,0.49193287099951505,28.61239085239085,MATH
99,fp8,fp32,fp8,,0,k,k,n,128,128,64,128,2,2,4096,1536,7168,58.982402086257935,28.61239085239085,0.48510046794206657,28.61239085239085,MATH
100,fp8,fp32,fp8,,0,k,k,n,128,192,64,192,2,1,4096,1536,7168,54.4704020023346,28.61239085239085,0.5252832694564017,28.61239085239085,MATH
101,fp8,fp32,fp8,,0,k,k,n,128,192,64,192,2,2,4096,1536,7168,54.444801807403564,28.61239085239085,0.5255302600532206,28.61239085239085,MATH
102,fp8,fp32,fp8,,0,k,k,n,128,256,64,256,2,1,4096,1536,7168,54.476797580718994,28.61239085239085,0.5252216011779233,28.61239085239085,MATH
103,fp8,fp32,fp8,,0,k,k,n,128,256,64,256,2,2,4096,1536,7168,54.07360196113586,28.61239085239085,0.5291378753158582,28.61239085239085,MATH
104,fp8,fp32,fp8,,0,k,k,n,256,64,128,64,2,1,4096,1536,7168,68.77440214157104,28.61239085239085,0.4160325638817286,28.61239085239085,MATH
105,fp8,fp32,fp8,,0,k,k,n,256,64,128,64,2,2,4096,1536,7168,70.04160284996033,28.61239085239085,0.4085056550416601,28.61239085239085,MATH
106,fp8,fp32,fp8,,0,k,k,n,256,128,128,128,2,1,4096,1536,7168,54.06079888343811,28.61239085239085,0.5292631896558312,28.61239085239085,MATH
107,fp8,fp32,fp8,,0,k,k,n,256,128,128,128,2,2,4096,1536,7168,54.1375994682312,28.61239085239085,0.5285123672537615,28.61239085239085,MATH
108,fp8,fp32,fp8,,0,k,k,n,256,192,128,192,2,1,4096,1536,7168,54.06720042228699,28.61239085239085,0.5292005250672562,28.61239085239085,MATH
109,fp8,fp32,fp8,,0,k,k,n,256,192,128,192,2,2,4096,1536,7168,53.6575973033905,28.61239085239085,0.5332402546951706,28.61239085239085,MATH
110,fp8,fp32,fp8,,0,k,k,n,256,256,128,256,2,1,4096,1536,7168,64.30720090866089,28.61239085239085,0.4449329227224588,28.61239085239085,MATH
111,fp8,fp32,fp8,,0,k,k,n,256,256,128,256,2,2,4096,1536,7168,63.8975977897644,28.61239085239085,0.44778507865868783,28.61239085239085,MATH
112,fp8,fp32,fp8,,0,k,k,n,128,64,64,64,2,1,4096,7168,1536,95.84640264511108,28.61239085239085,0.29852336720798467,28.61239085239085,MATH
113,fp8,fp32,fp8,,0,k,k,n,128,64,64,64,2,2,4096,7168,1536,104.44159507751463,28.61239085239085,0.27395589689295013,28.61239085239085,MATH
114,fp8,fp32,fp8,,0,k,k,n,128,128,64,128,2,1,4096,7168,1536,61.86879873275757,28.61239085239085,0.4624688282050237,28.61239085239085,MATH
115,fp8,fp32,fp8,,0,k,k,n,128,128,64,128,2,2,4096,7168,1536,65.12640118598938,28.61239085239085,0.4393362803923246,28.61239085239085,MATH
116,fp8,fp32,fp8,,0,k,k,n,128,192,64,192,2,1,4096,7168,1536,54.476797580718994,28.61239085239085,0.5252216011779233,28.61239085239085,MATH
117,fp8,fp32,fp8,,0,k,k,n,128,192,64,192,2,2,4096,7168,1536,54.88640069961548,28.61239085239085,0.5213020071944944,28.61239085239085,MATH
118,fp8,fp32,fp8,,0,k,k,n,128,256,64,256,2,1,4096,7168,1536,52.019202709198,28.61239085239085,0.5500351670582531,28.61239085239085,MATH
119,fp8,fp32,fp8,,0,k,k,n,128,256,64,256,2,2,4096,7168,1536,54.07360196113586,28.61239085239085,0.5291378753158582,28.61239085239085,MATH
120,fp8,fp32,fp8,,0,k,k,n,256,64,128,64,2,1,4096,7168,1536,67.99359917640686,28.61239085239085,0.42081006446146596,28.61239085239085,MATH
121,fp8,fp32,fp8,,0,k,k,n,256,64,128,64,2,2,4096,7168,1536,81.10079765319824,28.61239085239085,0.35280036300928425,28.61239085239085,MATH
122,fp8,fp32,fp8,,0,k,k,n,256,128,128,128,2,1,4096,7168,1536,52.22399830818176,28.61239085239085,0.5478782126857613,28.61239085239085,MATH
123,fp8,fp32,fp8,,0,k,k,n,256,128,128,128,2,2,4096,7168,1536,54.48319911956787,28.61239085239085,0.52515988992494,28.61239085239085,MATH
124,fp8,fp32,fp8,,0,k,k,n,256,192,128,192,2,1,4096,7168,1536,53.6512017250061,28.61239085239085,0.5333038204632609,28.61239085239085,MATH
125,fp8,fp32,fp8,,0,k,k,n,256,192,128,192,2,2,4096,7168,1536,56.12159967422485,28.61239085239085,0.5098284977349239,28.61239085239085,MATH
126,fp8,fp32,fp8,,0,k,k,n,256,256,128,256,2,1,4096,7168,1536,53.6512017250061,28.61239085239085,0.5333038204632609,28.61239085239085,MATH
127,fp8,fp32,fp8,,0,k,k,n,256,256,128,256,2,2,4096,7168,1536,53.85599732398987,28.61239085239085,0.5312758517916372,28.61239085239085,MATH
128,fp8,fp32,fp8,,0,k,k,n,128,64,64,64,2,1,7168,1536,4096,88.07039856910706,28.61239085239085,0.32488090569885736,28.61239085239085,MATH
129,fp8,fp32,fp8,,0,k,k,n,128,64,64,64,2,2,7168,1536,4096,91.839998960495,28.61239085239085,0.3115460711699102,28.61239085239085,MATH
130,fp8,fp32,fp8,,0,k,k,n,128,128,64,128,2,1,7168,1536,4096,59.79520082473755,28.61239085239085,0.47850647640192845,28.61239085239085,MATH
131,fp8,fp32,fp8,,0,k,k,n,128,128,64,128,2,2,7168,1536,4096,62.66880035400391,28.61239085239085,0.4565651598684672,28.61239085239085,MATH
132,fp8,fp32,fp8,,0,k,k,n,128,192,64,192,2,1,7168,1536,4096,54.88640069961548,28.61239085239085,0.5213020071944944,28.61239085239085,MATH
133,fp8,fp32,fp8,,0,k,k,n,128,192,64,192,2,2,7168,1536,4096,54.88640069961548,28.61239085239085,0.5213020071944944,28.61239085239085,MATH
134,fp8,fp32,fp8,,0,k,k,n,128,256,64,256,2,1,7168,1536,4096,53.043198585510254,28.61239085239085,0.5394167700174639,28.61239085239085,MATH
135,fp8,fp32,fp8,,0,k,k,n,128,256,64,256,2,2,7168,1536,4096,58.57279896736145,28.61239085239085,0.48849280479723267,28.61239085239085,MATH
136,fp8,fp32,fp8,,0,k,k,n,256,64,128,64,2,1,7168,1536,4096,70.04160284996033,28.61239085239085,0.4085056550416601,28.61239085239085,MATH
137,fp8,fp32,fp8,,0,k,k,n,256,64,128,64,2,2,7168,1536,4096,74.54079985618591,28.61239085239085,0.38384872321726765,28.61239085239085,MATH
138,fp8,fp32,fp8,,0,k,k,n,256,128,128,128,2,1,7168,1536,4096,53.6575973033905,28.61239085239085,0.5332402546951706,28.61239085239085,MATH
139,fp8,fp32,fp8,,0,k,k,n,256,128,128,128,2,2,7168,1536,4096,58.16320180892944,28.61239085239085,0.49193287099951505,28.61239085239085,MATH
140,fp8,fp32,fp8,,0,k,k,n,256,192,128,192,2,1,7168,1536,4096,56.93439841270447,28.61239085239085,0.5025501568486972,28.61239085239085,MATH
141,fp8,fp32,fp8,,0,k,k,n,256,192,128,192,2,2,7168,1536,4096,58.16320180892944,28.61239085239085,0.49193287099951505,28.61239085239085,MATH
142,fp8,fp32,fp8,,0,k,k,n,256,256,128,256,2,1,7168,1536,4096,58.24639797210693,28.61239085239085,0.49123021935352584,28.61239085239085,MATH
143,fp8,fp32,fp8,,0,k,k,n,256,256,128,256,2,2,7168,1536,4096,57.75359869003296,28.61239085239085,0.49542178325467257,28.61239085239085,MATH
144,fp8,fp32,fp8,,0,k,k,n,128,64,64,64,2,1,4096,16384,512,104.85759973526,21.79991683991684,0.20790020842510548,21.79991683991684,MATH
145,fp8,fp32,fp8,,0,k,k,n,128,64,64,64,2,2,4096,16384,512,117.12640523910522,21.79991683991684,0.18612299075869237,21.79991683991684,MATH
146,fp8,fp32,fp8,,0,k,k,n,128,128,64,128,2,1,4096,16384,512,62.66880035400391,21.79991683991684,0.3478591694235941,21.79991683991684,MATH
147,fp8,fp32,fp8,,0,k,k,n,128,128,64,128,2,2,4096,16384,512,68.81279945373535,21.79991683991684,0.3168003193152096,21.79991683991684,MATH
148,fp8,fp32,fp8,,0,k,k,n,128,192,64,192,2,1,4096,16384,512,52.019202709198,21.79991683991684,0.41907441299676423,21.79991683991684,MATH
149,fp8,fp32,fp8,,0,k,k,n,128,192,64,192,2,2,4096,16384,512,58.771198987960815,21.79991683991684,0.37092857071679813,21.79991683991684,MATH
150,fp8,fp32,fp8,,0,k,k,n,128,256,64,256,2,1,4096,16384,512,56.11519813537598,21.79991683991684,0.38848507292668366,21.79991683991684,MATH
151,fp8,fp32,fp8,,0,k,k,n,128,256,64,256,2,2,4096,16384,512,56.93439841270447,21.79991683991684,0.38289535759900745,21.79991683991684,MATH
152,fp8,fp32,fp8,,0,k,k,n,256,64,128,64,2,1,4096,16384,512,66.45119786262512,21.79991683991684,0.32805904996602037,21.79991683991684,MATH
153,fp8,fp32,fp8,,0,k,k,n,256,64,128,64,2,2,4096,16384,512,71.27040028572083,21.79991683991684,0.3058761667188854,21.79991683991684,MATH
154,fp8,fp32,fp8,,0,k,k,n,256,128,128,128,2,1,4096,16384,512,55.295997858047485,21.79991683991684,0.3942404095117382,21.79991683991684,MATH
155,fp8,fp32,fp8,,0,k,k,n,256,128,128,128,2,2,4096,16384,512,54.95679974555969,21.79991683991684,0.3966736953542895,21.79991683991684,MATH
156,fp8,fp32,fp8,,0,k,k,n,256,192,128,192,2,1,4096,16384,512,45.46560049057007,21.79991683991684,0.4794815553890753,21.79991683991684,MATH
157,fp8,fp32,fp8,,0,k,k,n,256,192,128,192,2,2,4096,16384,512,49.15199875831604,21.79991683991684,0.44352045472471263,21.79991683991684,MATH
158,fp8,fp32,fp8,,0,k,k,n,256,256,128,256,2,1,4096,16384,512,44.230398535728455,21.79991683991684,0.49287181580123657,21.79991683991684,MATH
159,fp8,fp32,fp8,,0,k,k,n,256,256,128,256,2,2,4096,16384,512,47.513601183891296,21.79991683991684,0.45881424048547476,21.79991683991684,MATH
160,fp8,fp32,fp8,,0,k,k,n,128,64,64,64,2,1,4096,512,16384,69.0176010131836,21.79991683991684,0.3158602518762231,21.79991683991684,MATH
161,fp8,fp32,fp8,,0,k,k,n,128,64,64,64,2,2,4096,512,16384,68.00000071525574,21.79991683991684,0.32058700897963444,21.79991683991684,MATH
162,fp8,fp32,fp8,,0,k,k,n,128,128,64,128,2,1,4096,512,16384,46.694400906562805,21.79991683991684,0.4668636156942942,21.79991683991684,MATH
163,fp8,fp32,fp8,,0,k,k,n,128,128,64,128,2,2,4096,512,16384,47.10400104522705,21.79991683991684,0.46280393079529664,21.79991683991684,MATH
164,fp8,fp32,fp8,,0,k,k,n,128,192,64,192,2,1,4096,512,16384,56.518399715423584,21.79991683991684,0.3857136251146855,21.79991683991684,MATH
165,fp8,fp32,fp8,,0,k,k,n,128,192,64,192,2,2,4096,512,16384,58.24639797210693,21.79991683991684,0.37427064331697213,21.79991683991684,MATH
166,fp8,fp32,fp8,,0,k,k,n,128,256,64,256,2,1,4096,512,16384,44.23680007457733,21.79991683991684,0.49280049196969705,21.79991683991684,MATH
167,fp8,fp32,fp8,,0,k,k,n,128,256,64,256,2,2,4096,512,16384,43.41759979724884,21.79991683991684,0.5020986176508586,21.79991683991684,MATH
168,fp8,fp32,fp8,,0,k,k,n,256,64,128,64,2,1,4096,512,16384,54.88640069961548,21.79991683991684,0.39718248167199577,21.79991683991684,MATH
169,fp8,fp32,fp8,,0,k,k,n,256,64,128,64,2,2,4096,512,16384,55.295997858047485,21.79991683991684,0.3942404095117382,21.79991683991684,MATH
170,fp8,fp32,fp8,,0,k,k,n,256,128,128,128,2,1,4096,512,16384,43.827199935913086,21.79991683991684,0.4974061056100792,21.79991683991684,MATH
171,fp8,fp32,fp8,,0,k,k,n,256,128,128,128,2,2,4096,512,16384,43.41759979724884,21.79991683991684,0.5020986176508586,21.79991683991684,MATH
172,fp8,fp32,fp8,,0,k,k,n,256,192,128,192,2,1,4096,512,16384,57.34400153160095,21.79991683991684,0.38016037000667646,21.79991683991684,MATH
173,fp8,fp32,fp8,,0,k,k,n,256,192,128,192,2,2,4096,512,16384,57.34400153160095,21.79991683991684,0.38016037000667646,21.79991683991684,MATH
174,fp8,fp32,fp8,,0,k,k,n,256,256,128,256,2,1,4096,512,16384,68.60799789428711,21.79991683991684,0.31774599914002283,21.79991683991684,MATH
175,fp8,fp32,fp8,,0,k,k,n,256,256,128,256,2,2,4096,512,16384,66.75840020179749,21.79991683991684,0.3265494196089179,21.79991683991684,MATH
176,fp8,fp32,fp8,,0,k,k,n,128,64,64,64,2,1,512,16384,4096,66.96959733963013,21.79991683991684,0.32551960450591594,21.79991683991684,MATH
177,fp8,fp32,fp8,,0,k,k,n,128,64,64,64,2,2,512,16384,4096,73.7280011177063,21.79991683991684,0.2956802911978233,21.79991683991684,MATH
178,fp8,fp32,fp8,,0,k,k,n,128,128,64,128,2,1,512,16384,4096,46.26559913158417,21.79991683991684,0.4711906308165515,21.79991683991684,MATH
179,fp8,fp32,fp8,,0,k,k,n,128,128,64,128,2,2,512,16384,4096,47.92320132255554,21.79991683991684,0.45489275003121477,21.79991683991684,MATH
180,fp8,fp32,fp8,,0,k,k,n,128,192,64,192,2,1,512,16384,4096,43.39840114116669,21.79991683991684,0.5023207368632288,21.79991683991684,MATH
181,fp8,fp32,fp8,,0,k,k,n,128,192,64,192,2,2,512,16384,4096,47.116801142692566,21.79991683991684,0.462678202068432,21.79991683991684,MATH
182,fp8,fp32,fp8,,0,k,k,n,128,256,64,256,2,1,512,16384,4096,44.6399986743927,21.79991683991684,0.4883494060769798,21.79991683991684,MATH
183,fp8,fp32,fp8,,0,k,k,n,128,256,64,256,2,2,512,16384,4096,43.62240135669708,21.79991683991684,0.49974132926934867,21.79991683991684,MATH
184,fp8,fp32,fp8,,0,k,k,n,256,64,128,64,2,1,512,16384,4096,52.505600452423096,21.79991683991684,0.41519222048837245,21.79991683991684,MATH
185,fp8,fp32,fp8,,0,k,k,n,256,64,128,64,2,2,512,16384,4096,57.74719715118408,21.79991683991684,0.3775060594342602,21.79991683991684,MATH
186,fp8,fp32,fp8,,0,k,k,n,256,128,128,128,2,1,512,16384,4096,44.23680007457733,21.79991683991684,0.49280049196969705,21.79991683991684,MATH
187,fp8,fp32,fp8,,0,k,k,n,256,128,128,128,2,2,512,16384,4096,43.62240135669708,21.79991683991684,0.49974132926934867,21.79991683991684,MATH
188,fp8,fp32,fp8,,0,k,k,n,256,192,128,192,2,1,512,16384,4096,46.374401450157166,21.79991683991684,0.4700851365887108,21.79991683991684,MATH
189,fp8,fp32,fp8,,0,k,k,n,256,192,128,192,2,2,512,16384,4096,47.10400104522705,21.79991683991684,0.46280393079529664,21.79991683991684,MATH
190,fp8,fp32,fp8,,0,k,k,n,256,256,128,256,2,1,512,16384,4096,44.230398535728455,21.79991683991684,0.49287181580123657,21.79991683991684,MATH
191,fp8,fp32,fp8,,0,k,k,n,256,256,128,256,2,2,512,16384,4096,43.41759979724884,21.79991683991684,0.5020986176508586,21.79991683991684,MATH
192,fp8,fp32,fp8,,0,k,k,n,128,64,64,64,2,1,4096,16384,1536,193.7471985816956,65.39975051975051,0.3375519800983032,65.39975051975051,MATH
193,fp8,fp32,fp8,,0,k,k,n,128,64,64,64,2,2,4096,16384,1536,216.27519130706787,65.39975051975051,0.30239136594680355,65.39975051975051,MATH
194,fp8,fp32,fp8,,0,k,k,n,128,128,64,128,2,1,4096,16384,1536,122.06720113754272,65.39975051975051,0.535768412073768,65.39975051975051,MATH
195,fp8,fp32,fp8,,0,k,k,n,128,128,64,128,2,2,4096,16384,1536,128.61440181732178,65.39975051975051,0.5084947688256672,65.39975051975051,MATH
196,fp8,fp32,fp8,,0,k,k,n,128,192,64,192,2,1,4096,16384,1536,106.91200494766235,65.39975051975051,0.6117156866692967,65.39975051975051,MATH
197,fp8,fp32,fp8,,0,k,k,n,128,192,64,192,2,2,4096,16384,1536,107.315194606781,65.39975051975051,0.6094174339373378,65.39975051975051,MATH
198,fp8,fp32,fp8,,0,k,k,n,128,256,64,256,2,1,4096,16384,1536,99.94239807128906,65.39975051975051,0.6543744374944933,65.39975051975051,MATH
199,fp8,fp32,fp8,,0,k,k,n,128,256,64,256,2,2,4096,16384,1536,103.2256007194519,65.39975051975051,0.6335613458670485,65.39975051975051,MATH
200,fp8,fp32,fp8,,0,k,k,n,256,64,128,64,2,1,4096,16384,1536,137.21599578857422,65.39975051975051,0.4766189987100342,65.39975051975051,MATH
201,fp8,fp32,fp8,,0,k,k,n,256,64,128,64,2,2,4096,16384,1536,165.07519483566284,65.39975051975051,0.39618157400848664,65.39975051975051,MATH
202,fp8,fp32,fp8,,0,k,k,n,256,128,128,128,2,1,4096,16384,1536,99.12959933280943,65.39975051975051,0.6597398855631692,65.39975051975051,MATH
203,fp8,fp32,fp8,,0,k,k,n,256,128,128,128,2,2,4096,16384,1536,104.44799661636353,65.39975051975051,0.6261465287837272,65.39975051975051,MATH
204,fp8,fp32,fp8,,0,k,k,n,256,192,128,192,2,1,4096,16384,1536,99.11680221557616,65.39975051975051,0.6598250655575828,65.39975051975051,MATH
205,fp8,fp32,fp8,,0,k,k,n,256,192,128,192,2,2,4096,16384,1536,104.44799661636353,65.39975051975051,0.6261465287837272,65.39975051975051,MATH
206,fp8,fp32,fp8,,0,k,k,n,256,256,128,256,2,1,4096,16384,1536,98.31039905548096,65.39975051975051,0.6652373619482768,65.39975051975051,MATH
207,fp8,fp32,fp8,,0,k,k,n,256,256,128,256,2,2,4096,16384,1536,104.85759973526,65.39975051975051,0.6237006252753164,65.39975051975051,MATH
208,fp8,fp32,fp8,,0,k,k,n,128,64,64,64,2,1,4096,1536,16384,169.1648006439209,65.39975051975051,0.38660377496268883,65.39975051975051,MATH
209,fp8,fp32,fp8,,0,k,k,n,128,64,64,64,2,2,4096,1536,16384,174.48960542678833,65.39975051975051,0.3748059969520115,65.39975051975051,MATH
210,fp8,fp32,fp8,,0,k,k,n,128,128,64,128,2,1,4096,1536,16384,119.60320472717284,65.39975051975051,0.5468060046462304,65.39975051975051,MATH
211,fp8,fp32,fp8,,0,k,k,n,128,128,64,128,2,2,4096,1536,16384,115.09759426116943,65.39975051975051,0.568211272699159,65.39975051975051,MATH
212,fp8,fp32,fp8,,0,k,k,n,128,192,64,192,2,1,4096,1536,16384,106.91200494766235,65.39975051975051,0.6117156866692967,65.39975051975051,MATH
213,fp8,fp32,fp8,,0,k,k,n,128,192,64,192,2,2,4096,1536,16384,107.315194606781,65.39975051975051,0.6094174339373378,65.39975051975051,MATH
214,fp8,fp32,fp8,,0,k,k,n,128,256,64,256,2,1,4096,1536,16384,106.496000289917,65.39975051975051,0.6141052278180491,65.39975051975051,MATH
215,fp8,fp32,fp8,,0,k,k,n,128,256,64,256,2,2,4096,1536,16384,106.09279870986938,65.39975051975051,0.6164391109956329,65.39975051975051,MATH
216,fp8,fp32,fp8,,0,k,k,n,256,64,128,64,2,1,4096,1536,16384,144.17920112609863,65.39975051975051,0.45360045005764815,65.39975051975051,MATH
217,fp8,fp32,fp8,,0,k,k,n,256,64,128,64,2,2,4096,1536,16384,137.63200044631958,65.39975051975051,0.4751783764507462,65.39975051975051,MATH
218,fp8,fp32,fp8,,0,k,k,n,256,128,128,128,2,1,4096,1536,16384,106.07999563217165,65.39975051975051,0.6165135106766186,65.39975051975051,MATH
219,fp8,fp32,fp8,,0,k,k,n,256,128,128,128,2,2,4096,1536,16384,105.2672028541565,65.39975051975051,0.6212737561798736,65.39975051975051,MATH
220,fp8,fp32,fp8,,0,k,k,n,256,192,128,192,2,1,4096,1536,16384,105.67679405212402,65.39975051975051,0.618865769976829,65.39975051975051,MATH
221,fp8,fp32,fp8,,0,k,k,n,256,192,128,192,2,2,4096,1536,16384,104.87680435180664,65.39975051975051,0.6235864157375416,65.39975051975051,MATH
222,fp8,fp32,fp8,,0,k,k,n,256,256,128,256,2,1,4096,1536,16384,127.7951955795288,65.39975051975051,0.511754375609929,65.39975051975051,MATH
223,fp8,fp32,fp8,,0,k,k,n,256,256,128,256,2,2,4096,1536,16384,126.5663981437683,65.39975051975051,0.5167228543982277,65.39975051975051,MATH
224,fp8,fp32,fp8,,0,k,k,n,128,64,64,64,2,1,1536,16384,4096,169.1648006439209,65.39975051975051,0.38660377496268883,65.39975051975051,MATH
225,fp8,fp32,fp8,,0,k,k,n,128,64,64,64,2,2,1536,16384,4096,184.72959995269773,65.39975051975051,0.3540296224129588,65.39975051975051,MATH
226,fp8,fp32,fp8,,0,k,k,n,128,128,64,128,2,1,1536,16384,4096,112.23039627075195,65.39975051975051,0.5827276093900254,65.39975051975051,MATH
227,fp8,fp32,fp8,,0,k,k,n,128,128,64,128,2,2,1536,16384,4096,117.15199947357178,65.39975051975051,0.5582469852296801,65.39975051975051,MATH
228,fp8,fp32,fp8,,0,k,k,n,128,192,64,192,2,1,1536,16384,4096,100.35200119018556,65.39975051975051,0.651703501117092,65.39975051975051,MATH
229,fp8,fp32,fp8,,0,k,k,n,128,192,64,192,2,2,1536,16384,4096,106.496000289917,65.39975051975051,0.6141052278180491,65.39975051975051,MATH
230,fp8,fp32,fp8,,0,k,k,n,128,256,64,256,2,1,1536,16384,4096,100.76160430908205,65.39975051975051,0.6490542798340079,65.39975051975051,MATH
231,fp8,fp32,fp8,,0,k,k,n,128,256,64,256,2,2,1536,16384,4096,105.2672028541565,65.39975051975051,0.6212737561798736,65.39975051975051,MATH
232,fp8,fp32,fp8,,0,k,k,n,256,64,128,64,2,1,1536,16384,4096,136.8064045906067,65.39975051975051,0.47804597098695295,65.39975051975051,MATH
233,fp8,fp32,fp8,,0,k,k,n,256,64,128,64,2,2,1536,16384,4096,147.4560022354126,65.39975051975051,0.4435204367967349,65.39975051975051,MATH
234,fp8,fp32,fp8,,0,k,k,n,256,128,128,128,2,1,1536,16384,4096,100.76800584793092,65.39975051975051,0.6490130470423849,65.39975051975051,MATH
235,fp8,fp32,fp8,,0,k,k,n,256,128,128,128,2,2,1536,16384,4096,104.85759973526,65.39975051975051,0.6237006252753164,65.39975051975051,MATH
236,fp8,fp32,fp8,,0,k,k,n,256,192,128,192,2,1,1536,16384,4096,97.8879988193512,65.39975051975051,0.6681079530540145,65.39975051975051,MATH
237,fp8,fp32,fp8,,0,k,k,n,256,192,128,192,2,2,1536,16384,4096,104.85759973526,65.39975051975051,0.6237006252753164,65.39975051975051,MATH
238,fp8,fp32,fp8,,0,k,k,n,256,256,128,256,2,1,1536,16384,4096,106.08639717102052,65.39975051975051,0.6164763085913871,65.39975051975051,MATH
239,fp8,fp32,fp8,,0,k,k,n,256,256,128,256,2,2,1536,16384,4096,104.85759973526,65.39975051975051,0.6237006252753164,65.39975051975051,MATH
240,fp8,fp32,fp8,,0,k,k,n,128,64,64,64,2,1,4096,8192,7168,380.92799186706543,152.59941787941787,0.4005991188294489,152.59941787941787,MATH
241,fp8,fp32,fp8,,0,k,k,n,128,64,64,64,2,2,4096,8192,7168,380.3136110305786,152.59941787941787,0.40124627006091645,152.59941787941787,MATH
242,fp8,fp32,fp8,,0,k,k,n,128,128,64,128,2,1,4096,8192,7168,232.64639377593997,152.59941787941787,0.6559285764230898,152.59941787941787,MATH
243,fp8,fp32,fp8,,0,k,k,n,128,128,64,128,2,2,4096,8192,7168,235.51359176635745,152.59941787941787,0.647943147293193,152.59941787941787,MATH
244,fp8,fp32,fp8,,0,k,k,n,128,192,64,192,2,1,4096,8192,7168,203.1615972518921,152.59941787941787,0.7511233419287201,152.59941787941787,MATH
245,fp8,fp32,fp8,,0,k,k,n,128,192,64,192,2,2,4096,8192,7168,222.82240390777588,152.59941787941787,0.6848477316606698,152.59941787941787,MATH
246,fp8,fp32,fp8,,0,k,k,n,128,256,64,256,2,1,4096,8192,7168,195.79520225524905,152.59941787941787,0.7793828251239842,152.59941787941787,MATH
247,fp8,fp32,fp8,,0,k,k,n,128,256,64,256,2,2,4096,8192,7168,209.71519947052,152.59941787941787,0.7276507294878692,152.59941787941787,MATH
248,fp8,fp32,fp8,,0,k,k,n,256,64,128,64,2,1,4096,8192,7168,285.0879907608032,152.59941787941787,0.5352712945648175,152.59941787941787,MATH
249,fp8,fp32,fp8,,0,k,k,n,256,64,128,64,2,2,4096,8192,7168,287.9487991333008,152.59941787941787,0.5299533053748722,152.59941787941787,MATH
250,fp8,fp32,fp8,,0,k,k,n,256,128,128,128,2,1,4096,8192,7168,195.3663945198059,152.59941787941787,0.7810934846522317,152.59941787941787,MATH
251,fp8,fp32,fp8,,0,k,k,n,256,128,128,128,2,2,4096,8192,7168,208.90240669250488,152.59941787941787,0.7304818565543741,152.59941787941787,MATH
252,fp8,fp32,fp8,,0,k,k,n,256,192,128,192,2,1,4096,8192,7168,203.98080348968503,152.59941787941787,0.7481067594046151,152.59941787941787,MATH
253,fp8,fp32,fp8,,0,k,k,n,256,192,128,192,2,2,4096,8192,7168,213.40160369873047,152.59941787941787,0.7150809330132775,152.59941787941787,MATH
254,fp8,fp32,fp8,,0,k,k,n,256,256,128,256,2,1,4096,8192,7168,192.92160272598267,152.59941787941787,0.7909918626177046,152.59941787941787,MATH
255,fp8,fp32,fp8,,0,k,k,n,256,256,128,256,2,2,4096,8192,7168,208.0832004547119,152.59941787941787,0.7333577028128719,152.59941787941787,MATH
256,fp8,fp32,fp8,,0,k,k,n,128,64,64,64,2,1,4096,7168,8192,387.6863956451416,152.59941787941787,0.3936156119831857,152.59941787941787,MATH
257,fp8,fp32,fp8,,0,k,k,n,128,64,64,64,2,2,4096,7168,8192,376.62720680236816,152.59941787941787,0.405173644185225,152.59941787941787,MATH
258,fp8,fp32,fp8,,0,k,k,n,128,128,64,128,2,1,4096,7168,8192,234.2911958694458,152.59941787941787,0.6513237397296436,152.59941787941787,MATH
259,fp8,fp32,fp8,,0,k,k,n,128,128,64,128,2,2,4096,7168,8192,235.52000522613525,152.59941787941787,0.6479255031134152,152.59941787941787,MATH
260,fp8,fp32,fp8,,0,k,k,n,128,192,64,192,2,1,4096,7168,8192,207.2767972946167,152.59941787941787,0.7362108054116538,152.59941787941787,MATH
261,fp8,fp32,fp8,,0,k,k,n,128,192,64,192,2,2,4096,7168,8192,218.72639656066892,152.59941787941787,0.6976726187554178,152.59941787941787,MATH
262,fp8,fp32,fp8,,0,k,k,n,128,256,64,256,2,1,4096,7168,8192,203.98080348968503,152.59941787941787,0.7481067594046151,152.59941787941787,MATH
263,fp8,fp32,fp8,,0,k,k,n,128,256,64,256,2,2,4096,7168,8192,210.1248025894165,152.59941787941787,0.7262322962301451,152.59941787941787,MATH
264,fp8,fp32,fp8,,0,k,k,n,256,64,128,64,2,1,4096,7168,8192,314.7775888442993,152.59941787941787,0.48478488713152706,152.59941787941787,MATH
265,fp8,fp32,fp8,,0,k,k,n,256,64,128,64,2,2,4096,7168,8192,286.31041049957275,152.59941787941787,0.5329859211656071,152.59941787941787,MATH
266,fp8,fp32,fp8,,0,k,k,n,256,128,128,128,2,1,4096,7168,8192,203.98080348968503,152.59941787941787,0.7481067594046151,152.59941787941787,MATH
267,fp8,fp32,fp8,,0,k,k,n,256,128,128,128,2,2,4096,7168,8192,208.89599323272705,152.59941787941787,0.7305042835810152,152.59941787941787,MATH
268,fp8,fp32,fp8,,0,k,k,n,256,192,128,192,2,1,4096,7168,8192,208.076810836792,152.59941787941787,0.7333802227443375,152.59941787941787,MATH
269,fp8,fp32,fp8,,0,k,k,n,256,192,128,192,2,2,4096,7168,8192,221.18399143218997,152.59941787941787,0.6899207166455418,152.59941787941787,MATH
270,fp8,fp32,fp8,,0,k,k,n,256,256,128,256,2,1,4096,7168,8192,211.35358810424805,152.59941787941787,0.7220100649729672,152.59941787941787,MATH
271,fp8,fp32,fp8,,0,k,k,n,256,256,128,256,2,2,4096,7168,8192,207.67359733581543,152.59941787941787,0.7348041341656893,152.59941787941787,MATH
272,fp8,fp32,fp8,,0,k,k,n,128,64,64,64,2,1,7168,8192,4096,388.50560188293457,152.59941787941787,0.3927856307343529,152.59941787941787,MATH
273,fp8,fp32,fp8,,0,k,k,n,128,64,64,64,2,2,7168,8192,4096,397.72799015045166,152.59941787941787,0.3836778443018127,152.59941787941787,MATH
274,fp8,fp32,fp8,,0,k,k,n,128,128,64,128,2,1,7168,8192,4096,232.64639377593997,152.59941787941787,0.6559285764230898,152.59941787941787,MATH
275,fp8,fp32,fp8,,0,k,k,n,128,128,64,128,2,2,7168,8192,4096,241.6640043258667,152.59941787941787,0.6314528235394479,152.59941787941787,MATH
276,fp8,fp32,fp8,,0,k,k,n,128,192,64,192,2,1,7168,8192,4096,203.97439002990723,152.59941787941787,0.7481302817331301,152.59941787941787,MATH
277,fp8,fp32,fp8,,0,k,k,n,128,192,64,192,2,2,7168,8192,4096,220.77438831329343,152.59941787941787,0.6912007277894446,152.59941787941787,MATH
278,fp8,fp32,fp8,,0,k,k,n,128,256,64,256,2,1,7168,8192,4096,199.0656018257141,152.59941787941787,0.7665785373257088,152.59941787941787,MATH
279,fp8,fp32,fp8,,0,k,k,n,128,256,64,256,2,2,7168,8192,4096,210.9503984451294,152.59941787941787,0.7233900433665723,152.59941787941787,MATH
280,fp8,fp32,fp8,,0,k,k,n,256,64,128,64,2,1,7168,8192,4096,325.83680152893066,152.59941787941787,0.46833082439851026,152.59941787941787,MATH
281,fp8,fp32,fp8,,0,k,k,n,256,64,128,64,2,2,7168,8192,4096,310.2720022201538,152.59941787941787,0.49182464672123655,152.59941787941787,MATH
282,fp8,fp32,fp8,,0,k,k,n,256,128,128,128,2,1,7168,8192,4096,199.88479614257807,152.59941787941787,0.7634368437435758,152.59941787941787,MATH
283,fp8,fp32,fp8,,0,k,k,n,256,128,128,128,2,2,7168,8192,4096,210.94400882720947,152.59941787941787,0.7234119552758504,152.59941787941787,MATH
284,fp8,fp32,fp8,,0,k,k,n,256,192,128,192,2,1,7168,8192,4096,199.4815945625305,152.59941787941787,0.7649799381946654,152.59941787941787,MATH
285,fp8,fp32,fp8,,0,k,k,n,256,192,128,192,2,2,7168,8192,4096,211.76319122314453,152.59941787941787,0.7206135164378823,152.59941787941787,MATH
286,fp8,fp32,fp8,,0,k,k,n,256,256,128,256,2,1,7168,8192,4096,202.7519941329956,152.59941787941787,0.7526407744198065,152.59941787941787,MATH
287,fp8,fp32,fp8,,0,k,k,n,256,256,128,256,2,2,7168,8192,4096,208.076810836792,152.59941787941787,0.7333802227443375,152.59941787941787,MATH
288,fp8,fp32,fp8,,0,k,k,n,128,64,64,64,2,1,4096,8192,1536,106.90560340881348,32.699875259875256,0.30587615819190467,32.699875259875256,MATH
289,fp8,fp32,fp8,,0,k,k,n,128,64,64,64,2,2,4096,8192,1536,116.32640361785889,32.699875259875256,0.2811044977140086,32.699875259875256,MATH
290,fp8,fp32,fp8,,0,k,k,n,128,128,64,128,2,1,4096,8192,1536,68.5375988483429,32.699875259875256,0.4771085624436911,32.699875259875256,MATH
291,fp8,fp32,fp8,,0,k,k,n,128,128,64,128,2,2,4096,8192,1536,70.43840289115906,32.699875259875256,0.4642336270798599,32.699875259875256,MATH
292,fp8,fp32,fp8,,0,k,k,n,128,192,64,192,2,1,4096,8192,1536,59.801602363586426,32.699875259875256,0.5468060046462303,32.699875259875256,MATH
293,fp8,fp32,fp8,,0,k,k,n,128,192,64,192,2,2,4096,8192,1536,61.849600076675415,32.699875259875256,0.5286998657927775,32.699875259875256,MATH
294,fp8,fp32,fp8,,0,k,k,n,128,256,64,256,2,1,4096,8192,1536,56.52480125427246,32.699875259875256,0.5785049134941207,32.699875259875256,MATH
295,fp8,fp32,fp8,,0,k,k,n,128,256,64,256,2,2,4096,8192,1536,59.801602363586426,32.699875259875256,0.5468060046462303,32.699875259875256,MATH
296,fp8,fp32,fp8,,0,k,k,n,256,64,128,64,2,1,4096,8192,1536,75.36640167236328,32.699875259875256,0.4338786851205905,32.699875259875256,MATH
297,fp8,fp32,fp8,,0,k,k,n,256,64,128,64,2,2,4096,8192,1536,89.69600200653076,32.699875259875256,0.3645633531971066,32.699875259875256,MATH
298,fp8,fp32,fp8,,0,k,k,n,256,128,128,128,2,1,4096,8192,1536,55.70560097694397,32.699875259875256,0.5870123414234312,32.699875259875256,MATH
299,fp8,fp32,fp8,,0,k,k,n,256,128,128,128,2,2,4096,8192,1536,59.89120006561279,32.699875259875256,0.5459879786020561,32.699875259875256,MATH
300,fp8,fp32,fp8,,0,k,k,n,256,192,128,192,2,1,4096,8192,1536,57.75359869003296,32.699875259875256,0.5661963237196258,32.699875259875256,MATH
301,fp8,fp32,fp8,,0,k,k,n,256,192,128,192,2,2,4096,8192,1536,60.62080264091492,32.699875259875256,0.5394167321335509,32.699875259875256,MATH
302,fp8,fp32,fp8,,0,k,k,n,256,256,128,256,2,1,4096,8192,1536,55.78879714012146,32.699875259875256,0.5861369474904593,32.699875259875256,MATH
303,fp8,fp32,fp8,,0,k,k,n,256,256,128,256,2,2,4096,8192,1536,59.39199924468994,32.699875259875256,0.5505771093031332,32.699875259875256,MATH
304,fp8,fp32,fp8,,0,k,k,n,128,64,64,64,2,1,4096,1536,8192,93.79839897155762,32.699875259875256,0.34861869305243476,32.699875259875256,MATH
305,fp8,fp32,fp8,,0,k,k,n,128,64,64,64,2,2,4096,1536,8192,99.11680221557616,32.699875259875256,0.3299125327787914,32.699875259875256,MATH
306,fp8,fp32,fp8,,0,k,k,n,128,128,64,128,2,1,4096,1536,8192,64.30720090866089,32.699875259875256,0.5084947688256672,32.699875259875256,MATH
307,fp8,fp32,fp8,,0,k,k,n,128,128,64,128,2,2,4096,1536,8192,65.53599834442139,32.699875259875256,0.49896051156530163,32.699875259875256,MATH
308,fp8,fp32,fp8,,0,k,k,n,128,192,64,192,2,1,4096,1536,8192,60.62719821929932,32.699875259875256,0.5393598289268459,32.699875259875256,MATH
309,fp8,fp32,fp8,,0,k,k,n,128,192,64,192,2,2,4096,1536,8192,59.807997941970825,32.699875259875256,0.5467475318535585,32.699875259875256,MATH
310,fp8,fp32,fp8,,0,k,k,n,128,256,64,256,2,1,4096,1536,8192,60.21119952201843,32.699875259875256,0.5430862616832164,32.699875259875256,MATH
311,fp8,fp32,fp8,,0,k,k,n,128,256,64,256,2,2,4096,1536,8192,59.79520082473755,32.699875259875256,0.5468645444593467,32.699875259875256,MATH
312,fp8,fp32,fp8,,0,k,k,n,256,64,128,64,2,1,4096,1536,8192,76.5887975692749,32.699875259875256,0.42695376213862185,32.699875259875256,MATH
313,fp8,fp32,fp8,,0,k,k,n,256,64,128,64,2,2,4096,1536,8192,78.23359966278076,32.699875259875256,0.41797738312982236,32.699875259875256,MATH
314,fp8,fp32,fp8,,0,k,k,n,256,128,128,128,2,1,4096,1536,8192,59.79520082473755,32.699875259875256,0.5468645444593467,32.699875259875256,MATH
315,fp8,fp32,fp8,,0,k,k,n,256,128,128,128,2,2,4096,1536,8192,59.48160290718079,32.699875259875256,0.5497477146152635,32.699875259875256,MATH
316,fp8,fp32,fp8,,0,k,k,n,256,192,128,192,2,1,4096,1536,8192,59.79520082473755,32.699875259875256,0.5468645444593467,32.699875259875256,MATH
317,fp8,fp32,fp8,,0,k,k,n,256,192,128,192,2,2,4096,1536,8192,59.801602363586426,32.699875259875256,0.5468060046462303,32.699875259875256,MATH
318,fp8,fp32,fp8,,0,k,k,n,256,256,128,256,2,1,4096,1536,8192,71.27040028572083,32.699875259875256,0.45881425007832805,32.699875259875256,MATH
319,fp8,fp32,fp8,,0,k,k,n,256,256,128,256,2,2,4096,1536,8192,70.86079716682434,32.699875259875256,0.461466375870588,32.699875259875256,MATH
320,fp8,fp32,fp8,,0,k,k,n,128,64,64,64,2,1,1536,8192,4096,93.79839897155762,32.699875259875256,0.34861869305243476,32.699875259875256,MATH
321,fp8,fp32,fp8,,0,k,k,n,128,64,64,64,2,2,1536,8192,4096,102.80959606170654,32.699875259875256,0.31806248164080636,32.699875259875256,MATH
322,fp8,fp32,fp8,,0,k,k,n,128,128,64,128,2,1,1536,8192,4096,63.48800063133239,32.699875259875256,0.5150559938051872,32.699875259875256,MATH
323,fp8,fp32,fp8,,0,k,k,n,128,128,64,128,2,2,1536,8192,4096,66.35519862174988,32.699875259875256,0.49280050303635,32.699875259875256,MATH
324,fp8,fp32,fp8,,0,k,k,n,128,192,64,192,2,1,1536,8192,4096,56.13440275192261,32.699875259875256,0.5825282475060319,32.699875259875256,MATH
325,fp8,fp32,fp8,,0,k,k,n,128,192,64,192,2,2,1536,8192,4096,60.21119952201843,32.699875259875256,0.5430862616832164,32.699875259875256,MATH
326,fp8,fp32,fp8,,0,k,k,n,128,256,64,256,2,1,1536,8192,4096,60.20479798316956,32.699875259875256,0.5431440077087645,32.699875259875256,MATH
327,fp8,fp32,fp8,,0,k,k,n,128,256,64,256,2,2,1536,8192,4096,59.801602363586426,32.699875259875256,0.5468060046462303,32.699875259875256,MATH
328,fp8,fp32,fp8,,0,k,k,n,256,64,128,64,2,1,1536,8192,4096,74.54720139503479,32.699875259875256,0.43864658428415837,32.699875259875256,MATH
329,fp8,fp32,fp8,,0,k,k,n,256,64,128,64,2,2,1536,8192,4096,81.09440207481384,32.699875259875256,0.4032322136083808,32.699875259875256,MATH
330,fp8,fp32,fp8,,0,k,k,n,256,128,128,128,2,1,1536,8192,4096,59.801602363586426,32.699875259875256,0.5468060046462303,32.699875259875256,MATH
331,fp8,fp32,fp8,,0,k,k,n,256,128,128,128,2,2,1536,8192,4096,59.807997941970825,32.699875259875256,0.5467475318535585,32.699875259875256,MATH
332,fp8,fp32,fp8,,0,k,k,n,256,192,128,192,2,1,1536,8192,4096,59.38559770584106,32.699875259875256,0.5506364593962646,32.699875259875256,MATH
333,fp8,fp32,fp8,,0,k,k,n,256,192,128,192,2,2,1536,8192,4096,58.982402086257935,32.699875259875256,0.5544005347909332,32.699875259875256,MATH
334,fp8,fp32,fp8,,0,k,k,n,256,256,128,256,2,1,1536,8192,4096,59.801602363586426,32.699875259875256,0.5468060046462303,32.699875259875256,MATH
335,fp8,fp32,fp8,,0,k,k,n,256,256,128,256,2,2,1536,8192,4096,59.801602363586426,32.699875259875256,0.5468060046462303,32.699875259875256,MATH
336,fp8,fp32,fp8,,0,k,k,n,128,64,64,64,2,1,4096,4096,192,26.822400093078613,2.24,0.08351228794689484,2.24,DRAM
337,fp8,fp32,fp8,,0,k,k,n,128,64,64,64,2,2,4096,4096,192,28.972798585891724,2.24,0.07731389818485696,2.24,DRAM
338,fp8,fp32,fp8,,0,k,k,n,128,128,64,128,2,1,4096,4096,192,19.6480005979538,2.24,0.11400651118838424,2.24,DRAM
339,fp8,fp32,fp8,,0,k,k,n,128,128,64,128,2,2,4096,4096,192,20.67839950323105,2.24,0.10832559839314425,2.24,DRAM
340,fp8,fp32,fp8,,0,k,k,n,128,192,64,192,2,1,4096,4096,192,18.02240014076233,2.24,0.12428977175651869,2.24,DRAM
341,fp8,fp32,fp8,,0,k,k,n,128,192,64,192,2,2,4096,4096,192,19.66080069541931,2.24,0.11393228763678422,2.24,DRAM
342,fp8,fp32,fp8,,0,k,k,n,128,256,64,256,2,1,4096,4096,192,18.22080016136169,2.24,0.12293642321757393,2.24,DRAM
343,fp8,fp32,fp8,,0,k,k,n,128,256,64,256,2,2,4096,4096,192,19.251200556755062,2.24,0.1163563796136343,2.24,DRAM
344,fp8,fp32,fp8,,0,k,k,n,256,64,128,64,2,1,4096,4096,192,19.251200556755062,2.24,0.1163563796136343,2.24,DRAM
345,fp8,fp32,fp8,,0,k,k,n,256,64,128,64,2,2,4096,4096,192,19.44960057735443,2.24,0.11516946022059076,2.24,DRAM
346,fp8,fp32,fp8,,0,k,k,n,256,128,128,128,2,1,4096,4096,192,18.01600009202957,2.24,0.12433392476452056,2.24,DRAM
347,fp8,fp32,fp8,,0,k,k,n,256,128,128,128,2,2,4096,4096,192,18.649600446224213,2.24,0.12010981181387773,2.24,DRAM
348,fp8,fp32,fp8,,0,k,k,n,256,192,128,192,2,1,4096,4096,192,16.998399794101715,2.24,0.13177711002992523,2.24,DRAM
349,fp8,fp32,fp8,,0,k,k,n,256,192,128,192,2,2,4096,4096,192,17.612800002098083,2.24,0.1271802325429895,2.24,DRAM
350,fp8,fp32,fp8,,0,k,k,n,256,256,128,256,2,1,4096,4096,192,18.22720021009445,2.24,0.12289325701044643,2.24,DRAM
351,fp8,fp32,fp8,,0,k,k,n,256,256,128,256,2,2,4096,4096,192,18.02240014076233,2.24,0.12428977175651869,2.24,DRAM
352,fp8,fp32,fp8,,0,k,k,n,128,64,64,64,2,1,4096,192,4096,18.01600009202957,2.24,0.12433392476452056,2.24,DRAM
353,fp8,fp32,fp8,,0,k,k,n,128,64,64,64,2,2,4096,192,4096,17.612800002098083,2.24,0.1271802325429895,2.24,DRAM
354,fp8,fp32,fp8,,0,k,k,n,128,128,64,128,2,1,4096,192,4096,14.745600521564484,2.24,0.15190971684904564,2.24,DRAM
355,fp8,fp32,fp8,,0,k,k,n,128,128,64,128,2,2,4096,192,4096,15.564799308776855,2.24,0.14391448007536362,2.24,DRAM
356,fp8,fp32,fp8,,0,k,k,n,128,192,64,192,2,1,4096,192,4096,15.769599378108976,2.24,0.14204546014716904,2.24,DRAM
357,fp8,fp32,fp8,,0,k,k,n,128,192,64,192,2,2,4096,192,4096,16.58879965543747,2.24,0.13503086700222905,2.24,DRAM
358,fp8,fp32,fp8,,0,k,k,n,128,256,64,256,2,1,4096,192,4096,17.40799993276596,2.24,0.12867647108521593,2.24,DRAM
359,fp8,fp32,fp8,,0,k,k,n,128,256,64,256,2,2,4096,192,4096,17.817600071430206,2.24,0.1257183903005966,2.24,DRAM
360,fp8,fp32,fp8,,0,k,k,n,256,64,128,64,2,1,4096,192,4096,15.9743994474411,2.24,0.1402243638247584,2.24,DRAM
361,fp8,fp32,fp8,,0,k,k,n,256,64,128,64,2,2,4096,192,4096,15.9743994474411,2.24,0.1402243638247584,2.24,DRAM
362,fp8,fp32,fp8,,0,k,k,n,256,128,128,128,2,1,4096,192,4096,17.817600071430206,2.24,0.1257183903005966,2.24,DRAM
363,fp8,fp32,fp8,,0,k,k,n,256,128,128,128,2,2,4096,192,4096,17.612800002098083,2.24,0.1271802325429895,2.24,DRAM
364,fp8,fp32,fp8,,0,k,k,n,256,192,128,192,2,1,4096,192,4096,19.046400487422943,2.24,0.11760752387198603,2.24,DRAM
365,fp8,fp32,fp8,,0,k,k,n,256,192,128,192,2,2,4096,192,4096,19.129599630832672,2.24,0.11709602099510838,2.24,DRAM
366,fp8,fp32,fp8,,0,k,k,n,256,256,128,256,2,1,4096,192,4096,22.9312002658844,2.24,0.09768350430973871,2.24,DRAM
367,fp8,fp32,fp8,,0,k,k,n,256,256,128,256,2,2,4096,192,4096,22.93760031461716,2.24,0.09765624866052545,2.24,DRAM
368,fp8,fp32,fp8,,0,k,k,n,128,64,64,64,2,1,192,4096,4096,16.991999745368958,2.24,0.13182674397170324,2.24,DRAM
369,fp8,fp32,fp8,,0,k,k,n,128,64,64,64,2,2,192,4096,4096,17.606399953365326,2.24,0.1272264634413148,2.24,DRAM
370,fp8,fp32,fp8,,0,k,k,n,128,128,64,128,2,1,192,4096,4096,14.534400403499603,2.24,0.15411712473950087,2.24,DRAM
371,fp8,fp32,fp8,,0,k,k,n,128,128,64,128,2,2,192,4096,4096,16.806399822235107,2.24,0.13328256043489148,2.24,DRAM
372,fp8,fp32,fp8,,0,k,k,n,128,192,64,192,2,1,192,4096,4096,15.98079949617386,2.24,0.14016820626128895,2.24,DRAM
373,fp8,fp32,fp8,,0,k,k,n,128,192,64,192,2,2,192,4096,4096,16.58879965543747,2.24,0.13503086700222905,2.24,DRAM
374,fp8,fp32,fp8,,0,k,k,n,128,256,64,256,2,1,192,4096,4096,17.40799993276596,2.24,0.12867647108521593,2.24,DRAM
375,fp8,fp32,fp8,,0,k,k,n,128,256,64,256,2,2,192,4096,4096,17.612800002098083,2.24,0.1271802325429895,2.24,DRAM
376,fp8,fp32,fp8,,0,k,k,n,256,64,128,64,2,1,192,4096,4096,15.769599378108976,2.24,0.14204546014716904,2.24,DRAM
377,fp8,fp32,fp8,,0,k,k,n,256,64,128,64,2,2,192,4096,4096,15.571199357509611,2.24,0.14385532858261832,2.24,DRAM
378,fp8,fp32,fp8,,0,k,k,n,256,128,128,128,2,1,192,4096,4096,17.40799993276596,2.24,0.12867647108521593,2.24,DRAM
379,fp8,fp32,fp8,,0,k,k,n,256,128,128,128,2,2,192,4096,4096,17.40799993276596,2.24,0.12867647108521593,2.24,DRAM
380,fp8,fp32,fp8,,0,k,k,n,256,192,128,192,2,1,192,4096,4096,19.64160054922104,2.24,0.11404365924185521,2.24,DRAM
381,fp8,fp32,fp8,,0,k,k,n,256,192,128,192,2,2,192,4096,4096,19.257600605487823,2.24,0.11631770986888518,2.24,DRAM
382,fp8,fp32,fp8,,0,k,k,n,256,256,128,256,2,1,192,4096,4096,22.732800245285038,2.24,0.09853603497284036,2.24,DRAM
383,fp8,fp32,fp8,,0,k,k,n,256,256,128,256,2,2,192,4096,4096,22.72640019655228,2.24,0.09856378399689629,2.24,DRAM
384,fp8,fp32,fp8,,0,k,k,n,128,64,64,64,2,1,4096,16384,4096,420.0384140014648,174.39933471933472,0.41519853638607096,174.39933471933472,MATH
385,fp8,fp32,fp8,,0,k,k,n,128,64,64,64,2,2,4096,16384,4096,450.75840950012207,174.39933471933472,0.38690201013163233,174.39933471933472,MATH
386,fp8,fp32,fp8,,0,k,k,n,128,128,64,128,2,1,4096,16384,4096,262.5472068786621,174.39933471933472,0.6642589604845216,174.39933471933472,MATH
387,fp8,fp32,fp8,,0,k,k,n,128,128,64,128,2,2,4096,16384,4096,269.92640495300293,174.39933471933472,0.6460995720285294,174.39933471933472,MATH
388,fp8,fp32,fp8,,0,k,k,n,128,192,64,192,2,1,4096,16384,4096,229.3760061264038,174.39933471933472,0.7603207400133529,174.39933471933472,MATH
389,fp8,fp32,fp8,,0,k,k,n,128,192,64,192,2,2,4096,16384,4096,240.42880535125727,174.39933471933472,0.7253678878641183,174.39933471933472,MATH
390,fp8,fp32,fp8,,0,k,k,n,128,256,64,256,2,1,4096,16384,4096,217.907190322876,174.39933471933472,0.8003376779854069,174.39933471933472,MATH
391,fp8,fp32,fp8,,0,k,k,n,128,256,64,256,2,2,4096,16384,4096,229.3760061264038,174.39933471933472,0.7603207400133529,174.39933471933472,MATH
392,fp8,fp32,fp8,,0,k,k,n,256,64,128,64,2,1,4096,16384,4096,332.3904037475586,174.39933471933472,0.5246822193211879,174.39933471933472,MATH
393,fp8,fp32,fp8,,0,k,k,n,256,64,128,64,2,2,4096,16384,4096,348.7744092941284,174.39933471933472,0.5000347791350147,174.39933471933472,MATH
394,fp8,fp32,fp8,,0,k,k,n,256,128,128,128,2,1,4096,16384,4096,216.2879943847656,174.39933471933472,0.8063292427090842,174.39933471933472,MATH
395,fp8,fp32,fp8,,0,k,k,n,256,128,128,128,2,2,4096,16384,4096,228.55679988861084,174.39933471933472,0.763045924708124,174.39933471933472,MATH
396,fp8,fp32,fp8,,0,k,k,n,256,192,128,192,2,1,4096,16384,4096,218.3167934417725,174.39933471933472,0.7988360948781018,174.39933471933472,MATH
397,fp8,fp32,fp8,,0,k,k,n,256,192,128,192,2,2,4096,16384,4096,229.7919988632202,174.39933471933472,0.7589443304470448,174.39933471933472,MATH
398,fp8,fp32,fp8,,0,k,k,n,256,256,128,256,2,1,4096,16384,4096,215.03360271453855,174.39933471933472,0.811032938655887,174.39933471933472,MATH
399,fp8,fp32,fp8,,0,k,k,n,256,256,128,256,2,2,4096,16384,4096,231.8336009979248,174.39933471933472,0.7522608196941039,174.39933471933472,MATH
400,fp8,fp32,fp8,,0,k,k,n,128,64,64,64,2,1,4096,4096,16384,435.6095790863037,174.39933471933472,0.40035697811131565,174.39933471933472,MATH
401,fp8,fp32,fp8,,0,k,k,n,128,64,64,64,2,2,4096,4096,16384,413.4912014007568,174.39933471933472,0.4217727828996932,174.39933471933472,MATH
402,fp8,fp32,fp8,,0,k,k,n,128,128,64,128,2,1,4096,4096,16384,269.51680183410645,174.39933471933472,0.6470814937418312,174.39933471933472,MATH
403,fp8,fp32,fp8,,0,k,k,n,128,128,64,128,2,2,4096,4096,16384,278.93760204315186,174.39933471933472,0.6252270523654785,174.39933471933472,MATH
404,fp8,fp32,fp8,,0,k,k,n,128,192,64,192,2,1,4096,4096,16384,246.58560752868647,174.39933471933472,0.7072567473308272,174.39933471933472,MATH
405,fp8,fp32,fp8,,0,k,k,n,128,192,64,192,2,2,4096,4096,16384,255.9999942779541,174.39933471933472,0.6812474164744676,174.39933471933472,MATH
406,fp8,fp32,fp8,,0,k,k,n,128,256,64,256,2,1,4096,4096,16384,217.4976110458374,174.39933471933472,0.8018448289189725,174.39933471933472,MATH
407,fp8,fp32,fp8,,0,k,k,n,128,256,64,256,2,2,4096,4096,16384,235.51359176635745,174.39933471933472,0.7405064540493634,174.39933471933472,MATH
408,fp8,fp32,fp8,,0,k,k,n,256,64,128,64,2,1,4096,4096,16384,345.9199905395508,174.39933471933472,0.5041609027778774,174.39933471933472,MATH
409,fp8,fp32,fp8,,0,k,k,n,256,64,128,64,2,2,4096,4096,16384,325.0175952911377,174.39933471933472,0.5365842872694778,174.39933471933472,MATH
410,fp8,fp32,fp8,,0,k,k,n,256,128,128,128,2,1,4096,4096,16384,217.9136037826538,174.39933471933472,0.8003141230837518,174.39933471933472,MATH
411,fp8,fp32,fp8,,0,k,k,n,256,128,128,128,2,2,4096,4096,16384,232.65280723571777,174.39933471933472,0.749611993904023,174.39933471933472,MATH
412,fp8,fp32,fp8,,0,k,k,n,256,192,128,192,2,1,4096,4096,16384,224.87680912017825,174.39933471933472,0.7755327701494223,174.39933471933472,MATH
413,fp8,fp32,fp8,,0,k,k,n,256,192,128,192,2,2,4096,4096,16384,257.6256036758423,174.39933471933472,0.6769487668577107,174.39933471933472,MATH
414,fp8,fp32,fp8,,0,k,k,n,256,256,128,256,2,1,4096,4096,16384,236.33921146392825,174.39933471933472,0.7379195929404747,174.39933471933472,MATH
415,fp8,fp32,fp8,,0,k,k,n,256,256,128,256,2,2,4096,4096,16384,231.42399787902832,174.39933471933472,0.7535922649236145,174.39933471933472,MATH
416,fp8,fp32,fp8,,0,k,k,n,128,64,64,64,2,1,4096,7168,16384,765.1328086853027,305.19883575883574,0.3988834778673872,305.19883575883574,MATH
417,fp8,fp32,fp8,,0,k,k,n,128,64,64,64,2,2,4096,7168,16384,705.7407855987549,305.19883575883574,0.4324517471381552,305.19883575883574,MATH
418,fp8,fp32,fp8,,0,k,k,n,128,128,64,128,2,1,4096,7168,16384,481.4847946166992,305.19883575883574,0.6338701432966303,305.19883575883574,MATH
419,fp8,fp32,fp8,,0,k,k,n,128,128,64,128,2,2,4096,7168,16384,466.7391777038574,305.19883575883574,0.6538959023330203,305.19883575883574,MATH
420,fp8,fp32,fp8,,0,k,k,n,128,192,64,192,2,1,4096,7168,16384,418.4063911437988,305.19883575883574,0.729431581875489,305.19883575883574,MATH
421,fp8,fp32,fp8,,0,k,k,n,128,192,64,192,2,2,4096,7168,16384,433.1520080566406,305.19883575883574,0.7045998404304449,305.19883575883574,MATH
422,fp8,fp32,fp8,,0,k,k,n,128,256,64,256,2,1,4096,7168,16384,374.9887943267822,305.19883575883574,0.8138878824546198,305.19883575883574,MATH
423,fp8,fp32,fp8,,0,k,k,n,128,256,64,256,2,2,4096,7168,16384,395.26400566101074,305.19883575883574,0.7721392066764172,305.19883575883574,MATH
424,fp8,fp32,fp8,,0,k,k,n,256,64,128,64,2,1,4096,7168,16384,606.6175937652588,305.19883575883574,0.5031157007241991,305.19883575883574,MATH
425,fp8,fp32,fp8,,0,k,k,n,256,64,128,64,2,2,4096,7168,16384,542.5151824951172,305.19883575883574,0.5625627551199134,305.19883575883574,MATH
426,fp8,fp32,fp8,,0,k,k,n,256,128,128,128,2,1,4096,7168,16384,379.9040079116821,305.19883575883574,0.803357767759551,305.19883575883574,MATH
427,fp8,fp32,fp8,,0,k,k,n,256,128,128,128,2,2,4096,7168,16384,377.04319953918457,305.19883575883574,0.8094532301122107,305.19883575883574,MATH
428,fp8,fp32,fp8,,0,k,k,n,256,192,128,192,2,1,4096,7168,16384,373.7600088119507,305.19883575883574,0.8165636466270257,305.19883575883574,MATH
429,fp8,fp32,fp8,,0,k,k,n,256,192,128,192,2,2,4096,7168,16384,399.9743938446045,305.19883575883574,0.7630459360791222,305.19883575883574,MATH
430,fp8,fp32,fp8,,0,k,k,n,256,256,128,256,2,1,4096,7168,16384,381.7471981048584,305.19883575883574,0.7994789150358181,305.19883575883574,MATH
431,fp8,fp32,fp8,,0,k,k,n,256,256,128,256,2,2,4096,7168,16384,372.9471921920776,305.19883575883574,0.8183432993957234,305.19883575883574,MATH
432,fp8,fp32,fp8,,0,k,k,n,128,64,64,64,2,1,4096,16384,7168,783.9744091033936,305.19883575883574,0.3892969365006211,305.19883575883574,MATH
433,fp8,fp32,fp8,,0,k,k,n,128,64,64,64,2,2,4096,16384,7168,733.5936069488525,305.19883575883574,0.4160325728957924,305.19883575883574,MATH
434,fp8,fp32,fp8,,0,k,k,n,128,128,64,128,2,1,4096,16384,7168,472.88317680358887,305.19883575883574,0.6454000707358627,305.19883575883574,MATH
435,fp8,fp32,fp8,,0,k,k,n,128,128,64,128,2,2,4096,16384,7168,451.1744022369385,305.19883575883574,0.6764542364230977,305.19883575883574,MATH
436,fp8,fp32,fp8,,0,k,k,n,128,192,64,192,2,1,4096,16384,7168,378.2655954360962,305.19883575883574,0.8068374164638923,305.19883575883574,MATH
437,fp8,fp32,fp8,,0,k,k,n,128,192,64,192,2,2,4096,16384,7168,399.5584011077881,305.19883575883574,0.763840367046876,305.19883575883574,MATH
438,fp8,fp32,fp8,,0,k,k,n,128,256,64,256,2,1,4096,16384,7168,348.37119579315186,305.19883575883574,0.8760736807300509,305.19883575883574,MATH
439,fp8,fp32,fp8,,0,k,k,n,128,256,64,256,2,2,4096,16384,7168,368.8512086868286,305.19883575883574,0.8274307595341605,305.19883575883574,MATH
440,fp8,fp32,fp8,,0,k,k,n,256,64,128,64,2,1,4096,16384,7168,617.2671794891357,305.19883575883574,0.49443554736123374,305.19883575883574,MATH
441,fp8,fp32,fp8,,0,k,k,n,256,64,128,64,2,2,4096,16384,7168,549.0687847137451,305.19883575883574,0.5558480909053134,305.19883575883574,MATH
442,fp8,fp32,fp8,,0,k,k,n,256,128,128,128,2,1,4096,16384,7168,352.46078968048096,305.19883575883574,0.8659086193261668,305.19883575883574,MATH
443,fp8,fp32,fp8,,0,k,k,n,256,128,128,128,2,2,4096,16384,7168,368.4351921081543,305.19883575883574,0.8283650484431587,305.19883575883574,MATH
444,fp8,fp32,fp8,,0,k,k,n,256,192,128,192,2,1,4096,16384,7168,348.5759973526001,305.19883575883574,0.8755589543651612,305.19883575883574,MATH
445,fp8,fp32,fp8,,0,k,k,n,256,192,128,192,2,2,4096,16384,7168,368.8512086868286,305.19883575883574,0.8274307595341605,305.19883575883574,MATH
446,fp8,fp32,fp8,,0,k,k,n,256,256,128,256,2,1,4096,16384,7168,342.01600551605225,305.19883575883574,0.8923524947270676,305.19883575883574,MATH
447,fp8,fp32,fp8,,0,k,k,n,256,256,128,256,2,2,4096,16384,7168,374.5856046676636,305.19883575883574,0.8147639203316729,305.19883575883574,MATH
448,fp8,fp32,fp8,,0,k,k,n,128,64,64,64,2,1,16384,7168,4096,748.748779296875,305.19883575883574,0.40761179743817116,305.19883575883574,MATH
449,fp8,fp32,fp8,,0,k,k,n,128,64,64,64,2,2,16384,7168,4096,769.6383953094482,305.19883575883574,0.3965483500028927,305.19883575883574,MATH
450,fp8,fp32,fp8,,0,k,k,n,128,128,64,128,2,1,16384,7168,4096,466.3296222686768,305.19883575883574,0.6544701884346407,305.19883575883574,MATH
451,fp8,fp32,fp8,,0,k,k,n,128,128,64,128,2,2,16384,7168,4096,471.2448120117188,305.19883575883574,0.6476439166639486,305.19883575883574,MATH
452,fp8,fp32,fp8,,0,k,k,n,128,192,64,192,2,1,16384,7168,4096,404.8895835876465,305.19883575883574,0.7537828784196651,305.19883575883574,MATH
453,fp8,fp32,fp8,,0,k,k,n,128,192,64,192,2,2,16384,7168,4096,425.7791996002197,305.19883575883574,0.7168007174737482,305.19883575883574,MATH
454,fp8,fp32,fp8,,0,k,k,n,128,256,64,256,2,1,16384,7168,4096,363.5200023651123,305.19883575883574,0.839565453821438,305.19883575883574,MATH
455,fp8,fp32,fp8,,0,k,k,n,128,256,64,256,2,2,16384,7168,4096,396.6975927352905,305.19883575883574,0.7693488474544127,305.19883575883574,MATH
456,fp8,fp32,fp8,,0,k,k,n,256,64,128,64,2,1,16384,7168,4096,671.9488143920898,305.19883575883574,0.4541995301159185,305.19883575883574,MATH
457,fp8,fp32,fp8,,0,k,k,n,256,64,128,64,2,2,16384,7168,4096,606.6175937652588,305.19883575883574,0.5031157007241991,305.19883575883574,MATH
458,fp8,fp32,fp8,,0,k,k,n,256,128,128,128,2,1,16384,7168,4096,388.0959987640381,305.19883575883574,0.78640036674121,305.19883575883574,MATH
459,fp8,fp32,fp8,,0,k,k,n,256,128,128,128,2,2,16384,7168,4096,374.9887943267822,305.19883575883574,0.8138878824546198,305.19883575883574,MATH
460,fp8,fp32,fp8,,0,k,k,n,256,192,128,192,2,1,16384,7168,4096,349.1904020309448,305.19883575883574,0.874018397939212,305.19883575883574,MATH
461,fp8,fp32,fp8,,0,k,k,n,256,192,128,192,2,2,16384,7168,4096,371.3088035583496,305.19883575883574,0.8219542139427756,305.19883575883574,MATH
462,fp8,fp32,fp8,,0,k,k,n,256,256,128,256,2,1,16384,7168,4096,350.41279792785645,305.19883575883574,0.8709694325196152,305.19883575883574,MATH
463,fp8,fp32,fp8,,0,k,k,n,256,256,128,256,2,2,16384,7168,4096,373.7792015075684,305.19883575883574,0.8165217179764775,305.19883575883574,MATH
464,fp8,fp32,fp8,,0,k,k,n,128,64,64,64,2,1,4096,18432,7168,889.6512031555176,343.3486902286902,0.38593629616962405,343.3486902286902,MATH
465,fp8,fp32,fp8,,0,k,k,n,128,64,64,64,2,2,4096,18432,7168,820.8383560180664,343.3486902286902,0.4182902610622318,343.3486902286902,MATH
466,fp8,fp32,fp8,,0,k,k,n,128,128,64,128,2,1,4096,18432,7168,555.2127838134766,343.3486902286902,0.6184091941658858,343.3486902286902,MATH
467,fp8,fp32,fp8,,0,k,k,n,128,128,64,128,2,2,4096,18432,7168,503.19361686706543,343.3486902286902,0.6823391210055764,343.3486902286902,MATH
468,fp8,fp32,fp8,,0,k,k,n,128,192,64,192,2,1,4096,18432,7168,429.2736053466797,343.3486902286902,0.7998364817967393,343.3486902286902,MATH
469,fp8,fp32,fp8,,0,k,k,n,128,192,64,192,2,2,4096,18432,7168,449.3311882019043,343.3486902286902,0.7641327805502975,343.3486902286902,MATH
470,fp8,fp32,fp8,,0,k,k,n,128,256,64,256,2,1,4096,18432,7168,390.1439905166626,343.3486902286902,0.8800563345189504,343.3486902286902,MATH
471,fp8,fp32,fp8,,0,k,k,n,128,256,64,256,2,2,4096,18432,7168,409.8112106323242,343.3486902286902,0.8378216147355152,343.3486902286902,MATH
472,fp8,fp32,fp8,,0,k,k,n,256,64,128,64,2,1,4096,18432,7168,732.3520183563232,343.3486902286902,0.4688301276199052,343.3486902286902,MATH
473,fp8,fp32,fp8,,0,k,k,n,256,64,128,64,2,2,4096,18432,7168,614.4000053405762,343.3486902286902,0.5588357539781662,343.3486902286902,MATH
474,fp8,fp32,fp8,,0,k,k,n,256,128,128,128,2,1,4096,18432,7168,399.564790725708,343.3486902286902,0.859306671153593,343.3486902286902,MATH
475,fp8,fp32,fp8,,0,k,k,n,256,128,128,128,2,2,4096,18432,7168,407.7695846557617,343.3486902286902,0.8420164307216402,343.3486902286902,MATH
476,fp8,fp32,fp8,,0,k,k,n,256,192,128,192,2,1,4096,18432,7168,380.3136110305786,343.3486902286902,0.902804107637062,343.3486902286902,MATH
477,fp8,fp32,fp8,,0,k,k,n,256,192,128,192,2,2,4096,18432,7168,416.3584232330322,343.3486902286902,0.824646917342467,343.3486902286902,MATH
478,fp8,fp32,fp8,,0,k,k,n,256,256,128,256,2,1,4096,18432,7168,383.59038829803467,343.3486902286902,0.8950920062207652,343.3486902286902,MATH
479,fp8,fp32,fp8,,0,k,k,n,256,256,128,256,2,2,4096,18432,7168,415.53921699523926,343.3486902286902,0.826272650536914,343.3486902286902,MATH
480,fp8,fp32,fp8,,0,k,k,n,128,64,64,64,2,1,4096,7168,18432,859.340763092041,343.3486902286902,0.3995489391114981,343.3486902286902,MATH
481,fp8,fp32,fp8,,0,k,k,n,128,64,64,64,2,2,4096,7168,18432,783.5648059844971,343.3486902286902,0.4381879936494792,343.3486902286902,MATH
482,fp8,fp32,fp8,,0,k,k,n,128,128,64,128,2,1,4096,7168,18432,556.6463947296143,343.3486902286902,0.6168165166963285,343.3486902286902,MATH
483,fp8,fp32,fp8,,0,k,k,n,128,128,64,128,2,2,4096,7168,18432,532.473611831665,343.3486902286902,0.644818226855598,343.3486902286902,MATH
484,fp8,fp32,fp8,,0,k,k,n,128,192,64,192,2,1,4096,7168,18432,471.6544151306152,343.3486902286902,0.7279666620604128,343.3486902286902,MATH
485,fp8,fp32,fp8,,0,k,k,n,128,192,64,192,2,2,4096,7168,18432,490.0864124298096,343.3486902286902,0.7005880626773442,343.3486902286902,MATH
486,fp8,fp32,fp8,,0,k,k,n,128,256,64,256,2,1,4096,7168,18432,420.4544067382813,343.3486902286902,0.8166133705013423,343.3486902286902,MATH
487,fp8,fp32,fp8,,0,k,k,n,128,256,64,256,2,2,4096,7168,18432,440.934419631958,343.3486902286902,0.7786842553939851,343.3486902286902,MATH
488,fp8,fp32,fp8,,0,k,k,n,256,64,128,64,2,1,4096,7168,18432,659.8656177520752,343.3486902286902,0.5203312325899866,343.3486902286902,MATH
489,fp8,fp32,fp8,,0,k,k,n,256,64,128,64,2,2,4096,7168,18432,632.0127964019775,343.3486902286902,0.5432622443459373,343.3486902286902,MATH
490,fp8,fp32,fp8,,0,k,k,n,256,128,128,128,2,1,4096,7168,18432,426.5984058380127,343.3486902286902,0.8048522580721177,343.3486902286902,MATH
491,fp8,fp32,fp8,,0,k,k,n,256,128,128,128,2,2,4096,7168,18432,420.4607963562012,343.3486902286902,0.8166009606703403,343.3486902286902,MATH
492,fp8,fp32,fp8,,0,k,k,n,256,192,128,192,2,1,4096,7168,18432,415.1296138763428,343.3486902286902,0.8270879232695878,343.3486902286902,MATH
493,fp8,fp32,fp8,,0,k,k,n,256,192,128,192,2,2,4096,7168,18432,445.03040313720703,343.3486902286902,0.7715173790560835,343.3486902286902,MATH
494,fp8,fp32,fp8,,0,k,k,n,256,256,128,256,2,1,4096,7168,18432,423.3215808868408,343.3486902286902,0.8110824151922262,343.3486902286902,MATH
495,fp8,fp32,fp8,,0,k,k,n,256,256,128,256,2,2,4096,7168,18432,414.3167972564697,343.3486902286902,0.8287105241744545,343.3486902286902,MATH
496,fp8,fp32,fp8,,0,k,k,n,128,64,64,64,2,1,7168,18432,4096,925.887966156006,343.3486902286902,0.37083178827149615,343.3486902286902,MATH
497,fp8,fp32,fp8,,0,k,k,n,128,64,64,64,2,2,7168,18432,4096,868.7552452087402,343.3486902286902,0.395219127737401,343.3486902286902,MATH
498,fp8,fp32,fp8,,0,k,k,n,128,128,64,128,2,1,7168,18432,4096,544.9728012084961,343.3486902286902,0.6300290390039697,343.3486902286902,MATH
499,fp8,fp32,fp8,,0,k,k,n,128,128,64,128,2,2,7168,18432,4096,504.422378540039,343.3486902286902,0.6806769581128657,343.3486902286902,MATH
500,fp8,fp32,fp8,,0,k,k,n,128,192,64,192,2,1,7168,18432,4096,418.8159942626953,343.3486902286902,0.8198079704027027,343.3486902286902,MATH
501,fp8,fp32,fp8,,0,k,k,n,128,192,64,192,2,2,7168,18432,4096,442.1631813049317,343.3486902286902,0.776520309120683,343.3486902286902,MATH
502,fp8,fp32,fp8,,0,k,k,n,128,256,64,256,2,1,7168,18432,4096,386.86718940734863,343.3486902286902,0.8875104936003348,343.3486902286902,MATH
503,fp8,fp32,fp8,,0,k,k,n,128,256,64,256,2,2,7168,18432,4096,415.7440185546875,343.3486902286902,0.8258656165934127,343.3486902286902,MATH
504,fp8,fp32,fp8,,0,k,k,n,256,64,128,64,2,1,7168,18432,4096,730.3167819976807,343.3486902286902,0.47013665671149896,343.3486902286902,MATH
505,fp8,fp32,fp8,,0,k,k,n,256,64,128,64,2,2,7168,18432,4096,663.5519981384277,343.3486902286902,0.5174405188921789,343.3486902286902,MATH
506,fp8,fp32,fp8,,0,k,k,n,256,128,128,128,2,1,7168,18432,4096,429.8751831054688,343.3486902286902,0.798717171222351,343.3486902286902,MATH
507,fp8,fp32,fp8,,0,k,k,n,256,128,128,128,2,2,7168,18432,4096,413.0815982818604,343.3486902286902,0.8311885391573678,343.3486902286902,MATH
508,fp8,fp32,fp8,,0,k,k,n,256,192,128,192,2,1,7168,18432,4096,382.3616027832031,343.3486902286902,0.8979685400664223,343.3486902286902,MATH
509,fp8,fp32,fp8,,0,k,k,n,256,192,128,192,2,2,7168,18432,4096,407.7568054199219,343.3486902286902,0.8420428198006358,343.3486902286902,MATH
510,fp8,fp32,fp8,,0,k,k,n,256,256,128,256,2,1,7168,18432,4096,383.9999914169312,343.3486902286902,0.8941372341227385,343.3486902286902,MATH
511,fp8,fp32,fp8,,0,k,k,n,256,256,128,256,2,2,7168,18432,4096,409.3952178955078,343.3486902286902,0.8386729380808864,343.3486902286902,MATH
512,fp8,fp32,fp8,,0,k,k,n,128,64,64,64,2,1,18432,7168,4096,871.4176177978516,343.3486902286902,0.39401164632907276,343.3486902286902,MATH
513,fp8,fp32,fp8,,0,k,k,n,128,64,64,64,2,2,18432,7168,4096,862.6175880432129,343.3486902286902,0.39803117277906713,343.3486902286902,MATH
514,fp8,fp32,fp8,,0,k,k,n,128,128,64,128,2,1,18432,7168,4096,545.5872058868408,343.3486902286902,0.6293195414481613,343.3486902286902,MATH
515,fp8,fp32,fp8,,0,k,k,n,128,128,64,128,2,2,18432,7168,4096,539.0336036682129,343.3486902286902,0.6369708454021151,343.3486902286902,MATH
516,fp8,fp32,fp8,,0,k,k,n,128,192,64,192,2,1,18432,7168,4096,462.6431941986084,343.3486902286902,0.7421457713723415,343.3486902286902,MATH
517,fp8,fp32,fp8,,0,k,k,n,128,192,64,192,2,2,18432,7168,4096,484.3520164489746,343.3486902286902,0.7088825452734772,343.3486902286902,MATH
518,fp8,fp32,fp8,,0,k,k,n,128,256,64,256,2,1,18432,7168,4096,412.6719951629639,343.3486902286902,0.8320135464804245,343.3486902286902,MATH
519,fp8,fp32,fp8,,0,k,k,n,128,256,64,256,2,2,18432,7168,4096,439.29600715637207,343.3486902286902,0.7815884611636627,343.3486902286902,MATH
520,fp8,fp32,fp8,,0,k,k,n,256,64,128,64,2,1,18432,7168,4096,759.8080158233643,343.3486902286902,0.4518887443647474,343.3486902286902,MATH
521,fp8,fp32,fp8,,0,k,k,n,256,64,128,64,2,2,18432,7168,4096,681.1647891998291,343.3486902286902,0.5040611254025993,343.3486902286902,MATH
522,fp8,fp32,fp8,,0,k,k,n,256,128,128,128,2,1,18432,7168,4096,439.29600715637207,343.3486902286902,0.7815884611636627,343.3486902286902,MATH
523,fp8,fp32,fp8,,0,k,k,n,256,128,128,128,2,2,18432,7168,4096,424.5567798614502,343.3486902286902,0.808722664470789,343.3486902286902,MATH
524,fp8,fp32,fp8,,0,k,k,n,256,192,128,192,2,1,18432,7168,4096,387.47520446777344,343.3486902286902,0.8861178373989264,343.3486902286902,MATH
525,fp8,fp32,fp8,,0,k,k,n,256,192,128,192,2,2,18432,7168,4096,416.3584232330322,343.3486902286902,0.824646917342467,343.3486902286902,MATH
526,fp8,fp32,fp8,,0,k,k,n,256,256,128,256,2,1,18432,7168,4096,384.8191976547241,343.3486902286902,0.8922337875065085,343.3486902286902,MATH
527,fp8,fp32,fp8,,0,k,k,n,256,256,128,256,2,2,18432,7168,4096,408.9856147766113,343.3486902286902,0.8395128772835393,343.3486902286902,MATH
528,fp8,fp32,fp8,,0,k,k,n,128,64,64,64,2,1,4096,257,7168,27.846398949623108,4.7873596673596674,0.1719202427581561,4.7873596673596674,MATH
529,fp8,fp32,fp8,,0,k,k,n,128,64,64,64,2,2,4096,257,7168,28.05759906768799,4.7873596673596674,0.17062613432497656,4.7873596673596674,MATH
530,fp8,fp32,fp8,,0,k,k,n,128,128,64,128,2,1,4096,257,7168,23.769600689411163,4.7873596673596674,0.20140681915167097,4.7873596673596674,MATH
531,fp8,fp32,fp8,,0,k,k,n,128,128,64,128,2,2,4096,257,7168,24.985599517822266,4.7873596673596674,0.19160475472861224,4.7873596673596674,MATH
532,fp8,fp32,fp8,,0,k,k,n,128,192,64,192,2,1,4096,257,7168,19.85920071601868,4.7873596673596674,0.2410650728504961,4.7873596673596674,MATH
533,fp8,fp32,fp8,,0,k,k,n,128,192,64,192,2,2,4096,257,7168,20.479999482631683,4.7873596673596674,0.23375780216301503,4.7873596673596674,MATH
534,fp8,fp32,fp8,,0,k,k,n,128,256,64,256,2,1,4096,257,7168,22.93760031461716,4.7873596673596674,0.20871231522457412,4.7873596673596674,MATH
535,fp8,fp32,fp8,,0,k,k,n,128,256,64,256,2,2,4096,257,7168,23.96160066127777,4.7873596673596674,0.1997929827407606,4.7873596673596674,MATH
536,fp8,fp32,fp8,,0,k,k,n,256,64,128,64,2,1,4096,257,7168,26.82879865169525,4.7873596673596674,0.17844107481335789,4.7873596673596674,MATH
537,fp8,fp32,fp8,,0,k,k,n,256,64,128,64,2,2,4096,257,7168,27.084800601005558,4.7873596673596674,0.17675447339944347,4.7873596673596674,MATH
538,fp8,fp32,fp8,,0,k,k,n,256,128,128,128,2,1,4096,257,7168,22.93760031461716,4.7873596673596674,0.20871231522457412,4.7873596673596674,MATH
539,fp8,fp32,fp8,,0,k,k,n,256,128,128,128,2,2,4096,257,7168,23.231999576091766,4.7873596673596674,0.20606748255481103,4.7873596673596674,MATH
540,fp8,fp32,fp8,,0,k,k,n,256,192,128,192,2,1,4096,257,7168,27.66720056533813,4.7873596673596674,0.1730337572843326,4.7873596673596674,MATH
541,fp8,fp32,fp8,,0,k,k,n,256,192,128,192,2,2,4096,257,7168,27.436798810958862,4.7873596673596674,0.17448681605842042,4.7873596673596674,MATH
542,fp8,fp32,fp8,,0,k,k,n,256,256,128,256,2,1,4096,257,7168,34.39359962940216,4.7873596673596674,0.139193330123756,4.7873596673596674,MATH
543,fp8,fp32,fp8,,0,k,k,n,256,256,128,256,2,2,4096,257,7168,33.587199449539185,4.7873596673596674,0.14253524395661843,4.7873596673596674,MATH
544,fp8,fp32,fp8,,0,k,k,n,128,64,64,64,2,1,4096,7168,257,46.28480076789856,4.7873596673596674,0.10343265149539121,4.7873596673596674,MATH
545,fp8,fp32,fp8,,0,k,k,n,128,64,64,64,2,2,4096,7168,257,49.97119903564453,4.7873596673596674,0.09580237736430612,4.7873596673596674,MATH
546,fp8,fp32,fp8,,0,k,k,n,128,128,64,128,2,1,4096,7168,257,35.43039858341217,4.7873596673596674,0.135120118846222,4.7873596673596674,MATH
547,fp8,fp32,fp8,,0,k,k,n,128,128,64,128,2,2,4096,7168,257,31.942400336265568,4.7873596673596674,0.14987476260274574,4.7873596673596674,MATH
548,fp8,fp32,fp8,,0,k,k,n,128,192,64,192,2,1,4096,7168,257,33.1712007522583,4.7873596673596674,0.14432277273031013,4.7873596673596674,MATH
549,fp8,fp32,fp8,,0,k,k,n,128,192,64,192,2,2,4096,7168,257,31.12959861755371,4.7873596673596674,0.15378803068344468,4.7873596673596674,MATH
550,fp8,fp32,fp8,,0,k,k,n,128,256,64,256,2,1,4096,7168,257,35.63520014286041,4.7873596673596674,0.13434356052911983,4.7873596673596674,MATH
551,fp8,fp32,fp8,,0,k,k,n,128,256,64,256,2,2,4096,7168,257,35.22560000419617,4.7873596673596674,0.13590569548252932,4.7873596673596674,MATH
552,fp8,fp32,fp8,,0,k,k,n,256,64,128,64,2,1,4096,7168,257,41.77919924259186,4.7873596673596674,0.11458715710566295,4.7873596673596674,MATH
553,fp8,fp32,fp8,,0,k,k,n,256,64,128,64,2,2,4096,7168,257,31.21280074119568,4.7873596673596674,0.15337808699240352,4.7873596673596674,MATH
554,fp8,fp32,fp8,,0,k,k,n,256,128,128,128,2,1,4096,7168,257,35.22560000419617,4.7873596673596674,0.13590569548252932,4.7873596673596674,MATH
555,fp8,fp32,fp8,,0,k,k,n,256,128,128,128,2,2,4096,7168,257,31.12959861755371,4.7873596673596674,0.15378803068344468,4.7873596673596674,MATH
556,fp8,fp32,fp8,,0,k,k,n,256,192,128,192,2,1,4096,7168,257,29.491201043128967,4.7873596673596674,0.16233179721498844,4.7873596673596674,MATH
557,fp8,fp32,fp8,,0,k,k,n,256,192,128,192,2,2,4096,7168,257,27.033600211143494,4.7873596673596674,0.17708923820610006,4.7873596673596674,MATH
558,fp8,fp32,fp8,,0,k,k,n,256,256,128,256,2,1,4096,7168,257,27.033600211143494,4.7873596673596674,0.17708923820610006,4.7873596673596674,MATH
559,fp8,fp32,fp8,,0,k,k,n,256,256,128,256,2,2,4096,7168,257,25.196799635887142,4.7873596673596674,0.1899987195413959,4.7873596673596674,MATH
560,fp8,fp32,fp8,,0,k,k,n,128,64,64,64,2,1,7168,257,4096,27.033600211143494,4.7873596673596674,0.17708923820610006,4.7873596673596674,MATH
561,fp8,fp32,fp8,,0,k,k,n,128,64,64,64,2,2,7168,257,4096,31.21919929981232,4.7873596673596674,0.15334665125086816,4.7873596673596674,MATH
562,fp8,fp32,fp8,,0,k,k,n,128,128,64,128,2,1,7168,257,4096,22.93760031461716,4.7873596673596674,0.20871231522457412,4.7873596673596674,MATH
563,fp8,fp32,fp8,,0,k,k,n,128,128,64,128,2,2,7168,257,4096,28.147199749946594,4.7873596673596674,0.17008298196230873,4.7873596673596674,MATH
564,fp8,fp32,fp8,,0,k,k,n,128,192,64,192,2,1,7168,257,4096,21.107199788093567,4.7873596673596674,0.226811690580585,4.7873596673596674,MATH
565,fp8,fp32,fp8,,0,k,k,n,128,192,64,192,2,2,7168,257,4096,21.913599967956543,4.7873596673596674,0.21846523046692687,4.7873596673596674,MATH
566,fp8,fp32,fp8,,0,k,k,n,128,256,64,256,2,1,7168,257,4096,24.7871994972229,4.7873596673596674,0.19313838450753712,4.7873596673596674,MATH
567,fp8,fp32,fp8,,0,k,k,n,128,256,64,256,2,2,7168,257,4096,24.979199469089508,4.7873596673596674,0.19165384676493666,4.7873596673596674,MATH
568,fp8,fp32,fp8,,0,k,k,n,256,64,128,64,2,1,7168,257,4096,22.93760031461716,4.7873596673596674,0.20871231522457412,4.7873596673596674,MATH
569,fp8,fp32,fp8,,0,k,k,n,256,64,128,64,2,2,7168,257,4096,27.44320034980774,4.7873596673596674,0.17444611438669932,4.7873596673596674,MATH
570,fp8,fp32,fp8,,0,k,k,n,256,128,128,128,2,1,7168,257,4096,24.985599517822266,4.7873596673596674,0.19160475472861224,4.7873596673596674,MATH
571,fp8,fp32,fp8,,0,k,k,n,256,128,128,128,2,2,7168,257,4096,24.985599517822266,4.7873596673596674,0.19160475472861224,4.7873596673596674,MATH
572,fp8,fp32,fp8,,0,k,k,n,256,192,128,192,2,1,7168,257,4096,21.09439969062805,4.7873596673596674,0.22694932008359664,4.7873596673596674,MATH
573,fp8,fp32,fp8,,0,k,k,n,256,192,128,192,2,2,7168,257,4096,21.09439969062805,4.7873596673596674,0.22694932008359664,4.7873596673596674,MATH
574,fp8,fp32,fp8,,0,k,k,n,256,256,128,256,2,1,7168,257,4096,24.991999566555023,4.7873596673596674,0.19155568783564814,4.7873596673596674,MATH
575,fp8,fp32,fp8,,0,k,k,n,256,256,128,256,2,2,7168,257,4096,25.26080012321472,4.7873596673596674,0.18951734086047714,4.7873596673596674,MATH
576,fp8,fp32,fp8,,0,k,k,n,128,64,64,64,2,1,4096,2048,7168,104.4543981552124,38.14985446985447,0.36522975713446054,38.14985446985447,MATH
577,fp8,fp32,fp8,,0,k,k,n,128,64,64,64,2,2,4096,2048,7168,112.64640092849731,38.14985446985447,0.33866909333455064,38.14985446985447,MATH
578,fp8,fp32,fp8,,0,k,k,n,128,128,64,128,2,1,4096,2048,7168,69.23519968986511,38.14985446985447,0.5510181907576556,38.14985446985447,MATH
579,fp8,fp32,fp8,,0,k,k,n,128,128,64,128,2,2,4096,2048,7168,74.54079985618591,38.14985446985447,0.5117982976230235,38.14985446985447,MATH
580,fp8,fp32,fp8,,0,k,k,n,128,192,64,192,2,1,4096,2048,7168,66.76480174064636,38.14985446985447,0.5714066914787057,38.14985446985447,MATH
581,fp8,fp32,fp8,,0,k,k,n,128,192,64,192,2,2,4096,2048,7168,74.34239983558655,38.14985446985447,0.5131641506626845,38.14985446985447,MATH
582,fp8,fp32,fp8,,0,k,k,n,128,256,64,256,2,1,4096,2048,7168,68.40959787368774,38.14985446985447,0.5576681584986772,38.14985446985447,MATH
583,fp8,fp32,fp8,,0,k,k,n,128,256,64,256,2,2,4096,2048,7168,67.58400201797485,38.14985446985447,0.5644805476258717,38.14985446985447,MATH
584,fp8,fp32,fp8,,0,k,k,n,256,64,128,64,2,1,4096,2048,7168,82.32960104942322,38.14985446985447,0.4633795619506617,38.14985446985447,MATH
585,fp8,fp32,fp8,,0,k,k,n,256,64,128,64,2,2,4096,2048,7168,89.70239758491516,38.14985446985447,0.4252935874288153,38.14985446985447,MATH
586,fp8,fp32,fp8,,0,k,k,n,256,128,128,128,2,1,4096,2048,7168,67.58400201797485,38.14985446985447,0.5644805476258717,38.14985446985447,MATH
587,fp8,fp32,fp8,,0,k,k,n,256,128,128,128,2,2,4096,2048,7168,67.52640008926392,38.14985446985447,0.564962065494736,38.14985446985447,MATH
588,fp8,fp32,fp8,,0,k,k,n,256,192,128,192,2,1,4096,2048,7168,72.90880084037781,38.14985446985447,0.5232544498074724,38.14985446985447,MATH
589,fp8,fp32,fp8,,0,k,k,n,256,192,128,192,2,2,4096,2048,7168,73.72159957885742,38.14985446985447,0.5174854410076507,38.14985446985447,MATH
590,fp8,fp32,fp8,,0,k,k,n,256,256,128,256,2,1,4096,2048,7168,68.07680130004883,38.14985446985447,0.5603943449356382,38.14985446985447,MATH
591,fp8,fp32,fp8,,0,k,k,n,256,256,128,256,2,2,4096,2048,7168,66.76480174064636,38.14985446985447,0.5714066914787057,38.14985446985447,MATH
592,fp8,fp32,fp8,,0,k,k,n,128,64,64,64,2,1,4096,7168,2048,116.73599481582642,38.14985446985447,0.32680455184404117,38.14985446985447,MATH
593,fp8,fp32,fp8,,0,k,k,n,128,64,64,64,2,2,4096,7168,2048,126.16319656372072,38.14985446985447,0.30238497049007695,38.14985446985447,MATH
594,fp8,fp32,fp8,,0,k,k,n,128,128,64,128,2,1,4096,7168,2048,74.9567985534668,38.14985446985447,0.5089578958290504,38.14985446985447,MATH
595,fp8,fp32,fp8,,0,k,k,n,128,128,64,128,2,2,4096,7168,2048,78.64959836006165,38.14985446985447,0.48506102084848035,38.14985446985447,MATH
596,fp8,fp32,fp8,,0,k,k,n,128,192,64,192,2,1,4096,7168,2048,68.00000071525574,38.14985446985447,0.5610272657143602,38.14985446985447,MATH
597,fp8,fp32,fp8,,0,k,k,n,128,192,64,192,2,2,4096,7168,2048,69.63199973106384,38.14985446985447,0.5478781970530607,38.14985446985447,MATH
598,fp8,fp32,fp8,,0,k,k,n,128,256,64,256,2,1,4096,7168,2048,65.26079773902893,38.14985446985447,0.584575362109604,38.14985446985447,MATH
599,fp8,fp32,fp8,,0,k,k,n,128,256,64,256,2,2,4096,7168,2048,67.98719763755798,38.14985446985447,0.561132916129778,38.14985446985447,MATH
600,fp8,fp32,fp8,,0,k,k,n,256,64,128,64,2,1,4096,7168,2048,86.01599931716919,38.14985446985447,0.4435204470412934,38.14985446985447,MATH
601,fp8,fp32,fp8,,0,k,k,n,256,64,128,64,2,2,4096,7168,2048,94.2143976688385,38.14985446985447,0.40492594989515673,38.14985446985447,MATH
602,fp8,fp32,fp8,,0,k,k,n,256,128,128,128,2,1,4096,7168,2048,65.2351975440979,38.14985446985447,0.5848047665382757,38.14985446985447,MATH
603,fp8,fp32,fp8,,0,k,k,n,256,128,128,128,2,2,4096,7168,2048,67.59039759635925,38.14985446985447,0.5644271350152467,38.14985446985447,MATH
604,fp8,fp32,fp8,,0,k,k,n,256,192,128,192,2,1,4096,7168,2048,67.26400256156921,38.14985446985447,0.5671659880027881,38.14985446985447,MATH
605,fp8,fp32,fp8,,0,k,k,n,256,192,128,192,2,2,4096,7168,2048,70.44479846954346,38.14985446985447,0.5415567266666028,38.14985446985447,MATH
606,fp8,fp32,fp8,,0,k,k,n,256,256,128,256,2,1,4096,7168,2048,66.76480174064636,38.14985446985447,0.5714066914787057,38.14985446985447,MATH
607,fp8,fp32,fp8,,0,k,k,n,256,256,128,256,2,2,4096,7168,2048,67.99359917640686,38.14985446985447,0.5610800859486214,38.14985446985447,MATH
608,fp8,fp32,fp8,,0,k,k,n,128,64,64,64,2,1,7168,2048,4096,111.00800037384032,38.14985446985447,0.3436676126169074,38.14985446985447,MATH
609,fp8,fp32,fp8,,0,k,k,n,128,64,64,64,2,2,7168,2048,4096,118.3743953704834,38.14985446985447,0.3222813037435553,38.14985446985447,MATH
610,fp8,fp32,fp8,,0,k,k,n,128,128,64,128,2,1,7168,2048,4096,74.1312026977539,38.14985446985447,0.5146261369237217,38.14985446985447,MATH
611,fp8,fp32,fp8,,0,k,k,n,128,128,64,128,2,2,7168,2048,4096,76.94079875946045,38.14985446985447,0.49583387597940237,38.14985446985447,MATH
612,fp8,fp32,fp8,,0,k,k,n,128,192,64,192,2,1,7168,2048,4096,68.40959787368774,38.14985446985447,0.5576681584986772,38.14985446985447,MATH
613,fp8,fp32,fp8,,0,k,k,n,128,192,64,192,2,2,7168,2048,4096,77.00480222702026,38.14985446985447,0.4954217576896528,38.14985446985447,MATH
614,fp8,fp32,fp8,,0,k,k,n,128,256,64,256,2,1,7168,2048,4096,67.58400201797485,38.14985446985447,0.5644805476258717,38.14985446985447,MATH
615,fp8,fp32,fp8,,0,k,k,n,128,256,64,256,2,2,7168,2048,4096,67.59039759635925,38.14985446985447,0.5644271350152467,38.14985446985447,MATH
616,fp8,fp32,fp8,,0,k,k,n,256,64,128,64,2,1,7168,2048,4096,89.70879912376404,38.14985446985447,0.4252632388626914,38.14985446985447,MATH
617,fp8,fp32,fp8,,0,k,k,n,256,64,128,64,2,2,7168,2048,4096,94.20160055160522,38.14985446985447,0.40498095835383746,38.14985446985447,MATH
618,fp8,fp32,fp8,,0,k,k,n,256,128,128,128,2,1,7168,2048,4096,68.1984007358551,38.14985446985447,0.5593951479539211,38.14985446985447,MATH
619,fp8,fp32,fp8,,0,k,k,n,256,128,128,128,2,2,7168,2048,4096,68.81279945373535,38.14985446985447,0.5544005588016168,38.14985446985447,MATH
620,fp8,fp32,fp8,,0,k,k,n,256,192,128,192,2,1,7168,2048,4096,70.86079716682434,38.14985446985447,0.538377438515686,38.14985446985447,MATH
621,fp8,fp32,fp8,,0,k,k,n,256,192,128,192,2,2,7168,2048,4096,79.87200021743774,38.14985446985447,0.4776373994140383,38.14985446985447,MATH
622,fp8,fp32,fp8,,0,k,k,n,256,256,128,256,2,1,7168,2048,4096,71.67999744415283,38.14985446985447,0.5322245512017171,38.14985446985447,MATH
623,fp8,fp32,fp8,,0,k,k,n,256,256,128,256,2,2,7168,2048,4096,72.90880084037781,38.14985446985447,0.5232544498074724,38.14985446985447,MATH
624,fp8,fp32,fp8,,0,k,k,n,128,64,64,64,2,1,2048,7168,4096,109.3824028968811,38.14985446985447,0.3487750630768257,38.14985446985447,MATH
625,fp8,fp32,fp8,,0,k,k,n,128,64,64,64,2,2,2048,7168,4096,115.50719738006592,38.14985446985447,0.33028118883644836,38.14985446985447,MATH
626,fp8,fp32,fp8,,0,k,k,n,128,128,64,128,2,1,2048,7168,4096,72.10879921913147,38.14985446985447,0.5290596277150705,38.14985446985447,MATH
627,fp8,fp32,fp8,,0,k,k,n,128,128,64,128,2,2,2048,7168,4096,75.78240036964417,38.14985446985447,0.5034131181352233,38.14985446985447,MATH
628,fp8,fp32,fp8,,0,k,k,n,128,192,64,192,2,1,2048,7168,4096,67.17439889907837,38.14985446985447,0.5679225284497169,38.14985446985447,MATH
629,fp8,fp32,fp8,,0,k,k,n,128,192,64,192,2,2,2048,7168,4096,70.83520293235779,38.14985446985447,0.5385719654997624,38.14985446985447,MATH
630,fp8,fp32,fp8,,0,k,k,n,128,256,64,256,2,1,2048,7168,4096,67.58400201797485,38.14985446985447,0.5644805476258717,38.14985446985447,MATH
631,fp8,fp32,fp8,,0,k,k,n,128,256,64,256,2,2,2048,7168,4096,68.40320229530334,38.14985446985447,0.5577202994847785,38.14985446985447,MATH
632,fp8,fp32,fp8,,0,k,k,n,256,64,128,64,2,1,2048,7168,4096,84.78720188140869,38.14985446985447,0.4499482660509828,38.14985446985447,MATH
633,fp8,fp32,fp8,,0,k,k,n,256,64,128,64,2,2,2048,7168,4096,91.74399971961977,38.14985446985447,0.4158294230297874,38.14985446985447,MATH
634,fp8,fp32,fp8,,0,k,k,n,256,128,128,128,2,1,2048,7168,4096,67.58400201797485,38.14985446985447,0.5644805476258717,38.14985446985447,MATH
635,fp8,fp32,fp8,,0,k,k,n,256,128,128,128,2,2,2048,7168,4096,67.59039759635925,38.14985446985447,0.5644271350152467,38.14985446985447,MATH
636,fp8,fp32,fp8,,0,k,k,n,256,192,128,192,2,1,2048,7168,4096,70.86079716682434,38.14985446985447,0.538377438515686,38.14985446985447,MATH
637,fp8,fp32,fp8,,0,k,k,n,256,192,128,192,2,2,2048,7168,4096,70.04160284996033,38.14985446985447,0.5446742067222134,38.14985446985447,MATH
638,fp8,fp32,fp8,,0,k,k,n,256,256,128,256,2,1,2048,7168,4096,71.75679802894592,38.14985446985447,0.5316549165761999,38.14985446985447,MATH
639,fp8,fp32,fp8,,0,k,k,n,256,256,128,256,2,2,2048,7168,4096,72.49919772148132,38.14985446985447,0.5262107122400717,38.14985446985447,MATH
