results/fp16/predictions_SOLModel.csv
row_idx,in_dtype,acc_dtype,out_dtype,sf_dtype,sf_vec_size,a_major,b_major,c_major,mma_m,mma_n,cta_m,cta_n,cluster_m,cluster_n,m,n,k,actual_runtime,predicted_runtime,ratio,runtime,bound
0,fp16,fp32,fp16,,0,k,k,n,128,64,64,64,2,1,4096,7168,128000,21252.096557617188,4768.731808731809,0.2243887701057239,4768.731808731809,MATH
1,fp16,fp32,fp16,,0,k,k,n,128,64,64,64,2,2,4096,7168,128000,12189.491271972656,4768.731808731809,0.39121663917973115,4768.731808731809,MATH
2,fp16,fp32,fp16,,0,k,k,n,128,128,64,128,2,1,4096,7168,128000,12638.617706298828,4768.731808731809,0.3773143487325494,4768.731808731809,MATH
3,fp16,fp32,fp16,,0,k,k,n,128,128,64,128,2,2,4096,7168,128000,8048.025512695312,4768.731808731809,0.5925343801668372,4768.731808731809,MATH
4,fp16,fp32,fp16,,0,k,k,n,128,192,64,192,2,1,4096,7168,128000,9741.926574707031,4768.731808731809,0.48950603067701925,4768.731808731809,MATH
5,fp16,fp32,fp16,,0,k,k,n,128,192,64,192,2,2,4096,7168,128000,6977.33154296875,4768.731808731809,0.6834606868491712,4768.731808731809,MATH
6,fp16,fp32,fp16,,0,k,k,n,128,256,64,256,2,1,4096,7168,128000,7021.1517333984375,4768.731808731809,0.6791950935980708,4768.731808731809,MATH
7,fp16,fp32,fp16,,0,k,k,n,128,256,64,256,2,2,4096,7168,128000,6410.841369628906,4768.731808731809,0.7438542827347869,4768.731808731809,MATH
8,fp16,fp32,fp16,,0,k,k,n,256,64,128,64,2,1,4096,7168,128000,16423.936462402344,4768.731808731809,0.2903525485286907,4768.731808731809,MATH
9,fp16,fp32,fp16,,0,k,k,n,256,64,128,64,2,2,4096,7168,128000,9407.481384277344,4768.731808731809,0.5069084501938804,4768.731808731809,MATH
10,fp16,fp32,fp16,,0,k,k,n,256,128,128,128,2,1,4096,7168,128000,7875.583648681641,4768.731808731809,0.605508368834364,4768.731808731809,MATH
11,fp16,fp32,fp16,,0,k,k,n,256,128,128,128,2,2,4096,7168,128000,6016.819381713867,4768.731808731809,0.7925668872867935,4768.731808731809,MATH
12,fp16,fp32,fp16,,0,k,k,n,256,192,128,192,2,1,4096,7168,128000,5463.0401611328125,4768.731808731809,0.8729080636564399,4768.731808731809,MATH
13,fp16,fp32,fp16,,0,k,k,n,256,192,128,192,2,2,4096,7168,128000,5936.742401123047,4768.731808731809,0.8032573230446571,4768.731808731809,MATH
14,fp16,fp32,fp16,,0,k,k,n,256,256,128,256,2,1,4096,7168,128000,5575.680160522461,4768.731808731809,0.8552735579231937,4768.731808731809,MATH
15,fp16,fp32,fp16,,0,k,k,n,256,256,128,256,2,2,4096,7168,128000,5507.680130004883,4768.731808731809,0.8658331087080726,4768.731808731809,MATH
16,fp16,fp32,fp16,,0,k,k,n,128,64,64,64,2,1,4096,128000,7168,12412.108612060549,4768.731808731809,0.38419997421696317,4768.731808731809,MATH
17,fp16,fp32,fp16,,0,k,k,n,128,64,64,64,2,2,4096,128000,7168,10512.569427490234,4768.731808731809,0.4536219086707419,4768.731808731809,MATH
18,fp16,fp32,fp16,,0,k,k,n,128,128,64,128,2,1,4096,128000,7168,8172.544097900391,4768.731808731809,0.5835064028540322,4768.731808731809,MATH
19,fp16,fp32,fp16,,0,k,k,n,128,128,64,128,2,2,4096,128000,7168,7609.958648681641,4768.731808731809,0.6266435901800794,4768.731808731809,MATH
20,fp16,fp32,fp16,,0,k,k,n,128,192,64,192,2,1,4096,128000,7168,6789.119720458984,4768.731808731809,0.7024079711484915,4768.731808731809,MATH
21,fp16,fp32,fp16,,0,k,k,n,128,192,64,192,2,2,4096,128000,7168,6863.667297363281,4768.731808731809,0.6947789865286369,4768.731808731809,MATH
22,fp16,fp32,fp16,,0,k,k,n,128,256,64,256,2,1,4096,128000,7168,6280.192184448242,4768.731808731809,0.7593289613876323,4768.731808731809,MATH
23,fp16,fp32,fp16,,0,k,k,n,128,256,64,256,2,2,4096,128000,7168,6401.023864746094,4768.731808731809,0.7449951616327817,4768.731808731809,MATH
24,fp16,fp32,fp16,,0,k,k,n,256,64,128,64,2,1,4096,128000,7168,10153.177642822266,4768.731808731809,0.4696787524547094,4768.731808731809,MATH
25,fp16,fp32,fp16,,0,k,k,n,256,64,128,64,2,2,4096,128000,7168,8670.822143554688,4768.731808731809,0.5499745848525526,4768.731808731809,MATH
26,fp16,fp32,fp16,,0,k,k,n,256,128,128,128,2,1,4096,128000,7168,6233.087921142578,4768.731808731809,0.7650673099855232,4768.731808731809,MATH
27,fp16,fp32,fp16,,0,k,k,n,256,128,128,128,2,2,4096,128000,7168,5682.790374755859,4768.731808731809,0.839153214222983,4768.731808731809,MATH
28,fp16,fp32,fp16,,0,k,k,n,256,192,128,192,2,1,4096,128000,7168,4924.211120605469,4768.731808731809,0.9684255390222704,4768.731808731809,MATH
29,fp16,fp32,fp16,,0,k,k,n,256,192,128,192,2,2,4096,128000,7168,5431.084823608398,4768.731808731809,0.8780440673661724,4768.731808731809,MATH
30,fp16,fp32,fp16,,0,k,k,n,256,256,128,256,2,1,4096,128000,7168,4841.881561279297,4768.731808731809,0.9848922879211939,4768.731808731809,MATH
31,fp16,fp32,fp16,,0,k,k,n,256,256,128,256,2,2,4096,128000,7168,5418.393707275391,4768.731808731809,0.8801006472321738,4768.731808731809,MATH
32,fp16,fp32,fp16,,0,k,k,n,128,64,64,64,2,1,128000,7168,4096,17461.23504638672,4768.731808731809,0.27310392398151756,4768.731808731809,MATH
33,fp16,fp32,fp16,,0,k,k,n,128,64,64,64,2,2,128000,7168,4096,12197.273254394531,4768.731808731809,0.3909670390481489,4768.731808731809,MATH
34,fp16,fp32,fp16,,0,k,k,n,128,128,64,128,2,1,128000,7168,4096,9418.547058105469,4768.731808731809,0.506312892987874,4768.731808731809,MATH
35,fp16,fp32,fp16,,0,k,k,n,128,128,64,128,2,2,128000,7168,4096,7710.720062255859,4768.731808731809,0.6184547967283696,4768.731808731809,MATH
36,fp16,fp32,fp16,,0,k,k,n,128,192,64,192,2,1,128000,7168,4096,7125.196838378906,4768.731808731809,0.6692772027076757,4768.731808731809,MATH
37,fp16,fp32,fp16,,0,k,k,n,128,192,64,192,2,2,128000,7168,4096,6805.101013183594,4768.731808731809,0.7007584162958485,4768.731808731809,MATH
38,fp16,fp32,fp16,,0,k,k,n,128,256,64,256,2,1,128000,7168,4096,6376.038360595703,4768.731808731809,0.747914541763559,4768.731808731809,MATH
39,fp16,fp32,fp16,,0,k,k,n,128,256,64,256,2,2,128000,7168,4096,6318.694305419922,4768.731808731809,0.754702091639626,4768.731808731809,MATH
40,fp16,fp32,fp16,,0,k,k,n,256,64,128,64,2,1,128000,7168,4096,16603.135681152344,4768.731808731809,0.28721874592310953,4768.731808731809,MATH
41,fp16,fp32,fp16,,0,k,k,n,256,64,128,64,2,2,128000,7168,4096,11055.923461914062,4768.731808731809,0.4313282219399717,4768.731808731809,MATH
42,fp16,fp32,fp16,,0,k,k,n,256,128,128,128,2,1,128000,7168,4096,9229.106903076172,4768.731808731809,0.5167056638104748,4768.731808731809,MATH
43,fp16,fp32,fp16,,0,k,k,n,256,128,128,128,2,2,128000,7168,4096,6815.744018554688,4768.731808731809,0.6996641592979077,4768.731808731809,MATH
44,fp16,fp32,fp16,,0,k,k,n,256,192,128,192,2,1,128000,7168,4096,6778.880310058594,4768.731808731809,0.7034689492386966,4768.731808731809,MATH
45,fp16,fp32,fp16,,0,k,k,n,256,192,128,192,2,2,128000,7168,4096,5652.275085449219,4768.731808731809,0.8436836029102802,4768.731808731809,MATH
46,fp16,fp32,fp16,,0,k,k,n,256,256,128,256,2,1,128000,7168,4096,5395.865631103516,4768.731808731809,0.8837751224276779,4768.731808731809,MATH
47,fp16,fp32,fp16,,0,k,k,n,256,256,128,256,2,2,128000,7168,4096,5483.520126342773,4768.731808731809,0.869647908434378,4768.731808731809,MATH
48,fp16,fp32,fp16,,0,k,k,n,128,64,64,64,2,1,4096,512,7168,60.41600108146668,19.074927234927234,0.3157264117697239,19.074927234927234,MATH
49,fp16,fp32,fp16,,0,k,k,n,128,64,64,64,2,2,4096,512,7168,59.39199924468994,19.074927234927234,0.3211699804268277,19.074927234927234,MATH
50,fp16,fp32,fp16,,0,k,k,n,128,128,64,128,2,1,4096,512,7168,40.95999896526337,19.074927234927234,0.4656964774609482,19.074927234927234,MATH
51,fp16,fp32,fp16,,0,k,k,n,128,128,64,128,2,2,4096,512,7168,40.95999896526337,19.074927234927234,0.4656964774609482,19.074927234927234,MATH
52,fp16,fp32,fp16,,0,k,k,n,128,192,64,192,2,1,4096,512,7168,48.742398619651794,19.074927234927234,0.391341578894656,19.074927234927234,MATH
53,fp16,fp32,fp16,,0,k,k,n,128,192,64,192,2,2,4096,512,7168,50.79039931297302,19.074927234927234,0.37556167096436005,19.074927234927234,MATH
54,fp16,fp32,fp16,,0,k,k,n,128,256,64,256,2,1,4096,512,7168,37.27999925613403,19.074927234927234,0.5116665132923428,19.074927234927234,MATH
55,fp16,fp32,fp16,,0,k,k,n,128,256,64,256,2,2,4096,512,7168,37.27999925613403,19.074927234927234,0.5116665132923428,19.074927234927234,MATH
56,fp16,fp32,fp16,,0,k,k,n,256,64,128,64,2,1,4096,512,7168,48.127999901771545,19.074927234927234,0.39633741842293146,19.074927234927234,MATH
57,fp16,fp32,fp16,,0,k,k,n,256,64,128,64,2,2,4096,512,7168,47.7183997631073,19.074927234927234,0.39973945751790907,19.074927234927234,MATH
58,fp16,fp32,fp16,,0,k,k,n,256,128,128,128,2,1,4096,512,7168,37.2736006975174,19.074927234927234,0.511754348331518,19.074927234927234,MATH
59,fp16,fp32,fp16,,0,k,k,n,256,128,128,128,2,2,4096,512,7168,37.47200071811676,19.074927234927234,0.5090448033030964,19.074927234927234,MATH
60,fp16,fp32,fp16,,0,k,k,n,256,192,128,192,2,1,4096,512,7168,49.215999245643616,19.074927234927234,0.38757573811966567,19.074927234927234,MATH
61,fp16,fp32,fp16,,0,k,k,n,256,192,128,192,2,2,4096,512,7168,49.15199875831604,19.074927234927234,0.3880803978841235,19.074927234927234,MATH
62,fp16,fp32,fp16,,0,k,k,n,256,256,128,256,2,1,4096,512,7168,59.39199924468994,19.074927234927234,0.3211699804268277,19.074927234927234,MATH
63,fp16,fp32,fp16,,0,k,k,n,256,256,128,256,2,2,4096,512,7168,57.8112006187439,19.074927234927234,0.3299521032390157,19.074927234927234,MATH
64,fp16,fp32,fp16,,0,k,k,n,128,64,64,64,2,1,4096,7168,512,72.08960056304932,19.074927234927234,0.2646002625336281,19.074927234927234,MATH
65,fp16,fp32,fp16,,0,k,k,n,128,64,64,64,2,2,4096,7168,512,79.04639840126038,19.074927234927234,0.24131304677662693,19.074927234927234,MATH
66,fp16,fp32,fp16,,0,k,k,n,128,128,64,128,2,1,4096,7168,512,48.339200019836426,19.074927234927234,0.3946057697913839,19.074927234927234,MATH
67,fp16,fp32,fp16,,0,k,k,n,128,128,64,128,2,2,4096,7168,512,49.23520088195801,19.074927234927234,0.38742458430624876,19.074927234927234,MATH
68,fp16,fp32,fp16,,0,k,k,n,128,192,64,192,2,1,4096,7168,512,45.05600035190582,19.074927234927234,0.423360420053805,19.074927234927234,MATH
69,fp16,fp32,fp16,,0,k,k,n,128,192,64,192,2,2,4096,7168,512,45.67039906978607,19.074927234927234,0.4176650001630166,19.074927234927234,MATH
70,fp16,fp32,fp16,,0,k,k,n,128,256,64,256,2,1,4096,7168,512,43.07839870452881,19.074927234927234,0.4427956425623104,19.074927234927234,MATH
71,fp16,fp32,fp16,,0,k,k,n,128,256,64,256,2,2,4096,7168,512,43.41759979724884,19.074927234927234,0.43933629044450123,19.074927234927234,MATH
72,fp16,fp32,fp16,,0,k,k,n,256,64,128,64,2,1,4096,7168,512,53.248000144958496,19.074927234927234,0.3582280495605287,19.074927234927234,MATH
73,fp16,fp32,fp16,,0,k,k,n,256,64,128,64,2,2,4096,7168,512,55.28320074081421,19.074927234927234,0.34504021075691244,19.074927234927234,MATH
74,fp16,fp32,fp16,,0,k,k,n,256,128,128,128,2,1,4096,7168,512,41.58720076084137,19.074927234927234,0.45867302645885805,19.074927234927234,MATH
75,fp16,fp32,fp16,,0,k,k,n,256,128,128,128,2,2,4096,7168,512,41.42720103263855,19.074927234927234,0.4604445089085066,19.074927234927234,MATH
76,fp16,fp32,fp16,,0,k,k,n,256,192,128,192,2,1,4096,7168,512,39.38559889793396,19.074927234927234,0.4843122300706678,19.074927234927234,MATH
77,fp16,fp32,fp16,,0,k,k,n,256,192,128,192,2,2,4096,7168,512,39.32160139083862,19.074927234927234,0.4851004679420666,19.074927234927234,MATH
78,fp16,fp32,fp16,,0,k,k,n,256,256,128,256,2,1,4096,7168,512,38.91200125217438,19.074927234927234,0.4902067902215988,19.074927234927234,MATH
79,fp16,fp32,fp16,,0,k,k,n,256,256,128,256,2,2,4096,7168,512,38.91200125217438,19.074927234927234,0.4902067902215988,19.074927234927234,MATH
80,fp16,fp32,fp16,,0,k,k,n,128,64,64,64,2,1,7168,512,4096,62.23999857902527,19.074927234927234,0.30647377362497946,19.074927234927234,MATH
81,fp16,fp32,fp16,,0,k,k,n,128,64,64,64,2,2,7168,512,4096,60.00000238418579,19.074927234927234,0.3179154412826293,19.074927234927234,MATH
82,fp16,fp32,fp16,,0,k,k,n,128,128,64,128,2,1,7168,512,4096,46.48959934711456,19.074927234927234,0.41030526188243316,19.074927234927234,MATH
83,fp16,fp32,fp16,,0,k,k,n,128,128,64,128,2,2,7168,512,4096,45.45919895172119,19.074927234927234,0.41960544124821214,19.074927234927234,MATH
84,fp16,fp32,fp16,,0,k,k,n,128,192,64,192,2,1,7168,512,4096,45.87520062923432,19.074927234927234,0.41580041009720603,19.074927234927234,MATH
85,fp16,fp32,fp16,,0,k,k,n,128,192,64,192,2,2,7168,512,4096,57.13279843330383,19.074927234927234,0.333869996884453,19.074927234927234,MATH
86,fp16,fp32,fp16,,0,k,k,n,128,256,64,256,2,1,7168,512,4096,40.95999896526337,19.074927234927234,0.4656964774609482,19.074927234927234,MATH
87,fp16,fp32,fp16,,0,k,k,n,128,256,64,256,2,2,7168,512,4096,40.97279906272888,19.074927234927234,0.4655509916645856,19.074927234927234,MATH
88,fp16,fp32,fp16,,0,k,k,n,256,64,128,64,2,1,7168,512,4096,58.36799740791321,19.074927234927234,0.32680455184404117,19.074927234927234,MATH
89,fp16,fp32,fp16,,0,k,k,n,256,64,128,64,2,2,7168,512,4096,55.295997858047485,19.074927234927234,0.34496035832277094,19.074927234927234,MATH
90,fp16,fp32,fp16,,0,k,k,n,256,128,128,128,2,1,7168,512,4096,41.785600781440735,19.074927234927234,0.45649522510633495,19.074927234927234,MATH
91,fp16,fp32,fp16,,0,k,k,n,256,128,128,128,2,2,7168,512,4096,41.37600064277649,19.074927234927234,0.4610142821586933,19.074927234927234,MATH
92,fp16,fp32,fp16,,0,k,k,n,256,192,128,192,2,1,7168,512,4096,53.248000144958496,19.074927234927234,0.3582280495605287,19.074927234927234,MATH
93,fp16,fp32,fp16,,0,k,k,n,256,192,128,192,2,2,7168,512,4096,54.476797580718994,19.074927234927234,0.35014773411861555,19.074927234927234,MATH
94,fp16,fp32,fp16,,0,k,k,n,256,256,128,256,2,1,7168,512,4096,41.363200545310974,19.074927234927234,0.461156945871047,19.074927234927234,MATH
95,fp16,fp32,fp16,,0,k,k,n,256,256,128,256,2,2,7168,512,4096,41.574400663375854,19.074927234927234,0.45881424459669756,19.074927234927234,MATH
96,fp16,fp32,fp16,,0,k,k,n,128,64,64,64,2,1,4096,1536,7168,146.63679599761963,57.2247817047817,0.39024844559281446,57.2247817047817,MATH
97,fp16,fp32,fp16,,0,k,k,n,128,64,64,64,2,2,4096,1536,7168,152.37760543823242,57.2247817047817,0.37554587854432625,57.2247817047817,MATH
98,fp16,fp32,fp16,,0,k,k,n,128,128,64,128,2,1,4096,1536,7168,102.80319452285768,57.2247817047817,0.5566440028481615,57.2247817047817,MATH
99,fp16,fp32,fp16,,0,k,k,n,128,128,64,128,2,2,4096,1536,7168,99.94239807128906,57.2247817047817,0.5725776328076816,57.2247817047817,MATH
100,fp16,fp32,fp16,,0,k,k,n,128,192,64,192,2,1,4096,1536,7168,92.57599711418152,57.2247817047817,0.6181384320840931,57.2247817047817,MATH
101,fp16,fp32,fp16,,0,k,k,n,128,192,64,192,2,2,4096,1536,7168,92.97279715538023,57.2247817047817,0.6155002694943675,57.2247817047817,MATH
102,fp16,fp32,fp16,,0,k,k,n,128,256,64,256,2,1,4096,1536,7168,91.33440256118774,57.2247817047817,0.6265413699558066,57.2247817047817,MATH
103,fp16,fp32,fp16,,0,k,k,n,128,256,64,256,2,2,4096,1536,7168,91.75040125846864,57.2247817047817,0.623700615145809,57.2247817047817,MATH
104,fp16,fp32,fp16,,0,k,k,n,256,64,128,64,2,1,4096,1536,7168,125.7472038269043,57.2247817047817,0.45507796565841524,57.2247817047817,MATH
105,fp16,fp32,fp16,,0,k,k,n,256,64,128,64,2,2,4096,1536,7168,119.20640468597412,57.2247817047817,0.4800478787656515,57.2247817047817,MATH
106,fp16,fp32,fp16,,0,k,k,n,256,128,128,128,2,1,4096,1536,7168,91.34079813957214,57.2247817047817,0.6264975002445249,57.2247817047817,MATH
107,fp16,fp32,fp16,,0,k,k,n,256,128,128,128,2,2,4096,1536,7168,91.34719967842102,57.2247817047817,0.626453595799718,57.2247817047817,MATH
108,fp16,fp32,fp16,,0,k,k,n,256,192,128,192,2,1,4096,1536,7168,89.29920196533203,57.2247817047817,0.6408207514216941,57.2247817047817,MATH
109,fp16,fp32,fp16,,0,k,k,n,256,192,128,192,2,2,4096,1536,7168,89.9071991443634,57.2247817047817,0.6364872029090378,57.2247817047817,MATH
110,fp16,fp32,fp16,,0,k,k,n,256,256,128,256,2,1,4096,1536,7168,110.18240451812744,57.2247817047817,0.5193640668403362,57.2247817047817,MATH
111,fp16,fp32,fp16,,0,k,k,n,256,256,128,256,2,2,4096,1536,7168,108.953595161438,57.2247817047817,0.5252216011779233,57.2247817047817,MATH
112,fp16,fp32,fp16,,0,k,k,n,128,64,64,64,2,1,4096,7168,1536,152.37120389938354,57.2247817047817,0.37556165627311955,57.2247817047817,MATH
113,fp16,fp32,fp16,,0,k,k,n,128,64,64,64,2,2,4096,7168,1536,167.53920316696167,57.2247817047817,0.34156054596818264,57.2247817047817,MATH
114,fp16,fp32,fp16,,0,k,k,n,128,128,64,128,2,1,4096,7168,1536,103.62880229949953,57.2247817047817,0.5522092356080243,57.2247817047817,MATH
115,fp16,fp32,fp16,,0,k,k,n,128,128,64,128,2,2,4096,7168,1536,107.7183961868286,57.2247817047817,0.5312442788837115,57.2247817047817,MATH
116,fp16,fp32,fp16,,0,k,k,n,128,192,64,192,2,1,4096,7168,1536,93.094402551651,57.2247817047817,0.6146962667603137,57.2247817047817,MATH
117,fp16,fp32,fp16,,0,k,k,n,128,192,64,192,2,2,4096,7168,1536,98.31039905548096,57.2247817047817,0.5820826917047421,57.2247817047817,MATH
118,fp16,fp32,fp16,,0,k,k,n,128,256,64,256,2,1,4096,7168,1536,89.2799973487854,57.2247817047817,0.6409585954760358,57.2247817047817,MATH
119,fp16,fp32,fp16,,0,k,k,n,128,256,64,256,2,2,4096,7168,1536,95.23199796676636,57.2247817047817,0.6008986782441732,57.2247817047817,MATH
120,fp16,fp32,fp16,,0,k,k,n,256,64,128,64,2,1,4096,7168,1536,121.65119647979736,57.2247817047817,0.470400484012379,57.2247817047817,MATH
121,fp16,fp32,fp16,,0,k,k,n,256,64,128,64,2,2,4096,7168,1536,136.00000143051147,57.2247817047817,0.4207704492857702,57.2247817047817,MATH
122,fp16,fp32,fp16,,0,k,k,n,256,128,128,128,2,1,4096,7168,1536,89.4976019859314,57.2247817047817,0.6394001675461334,57.2247817047817,MATH
123,fp16,fp32,fp16,,0,k,k,n,256,128,128,128,2,2,4096,7168,1536,96.26240134239195,57.2247817047817,0.5944665924262695,57.2247817047817,MATH
124,fp16,fp32,fp16,,0,k,k,n,256,192,128,192,2,1,4096,7168,1536,89.08799886703491,57.2247817047817,0.6423399608536553,57.2247817047817,MATH
125,fp16,fp32,fp16,,0,k,k,n,256,192,128,192,2,2,4096,7168,1536,93.79839897155762,57.2247817047817,0.6100827128417609,57.2247817047817,MATH
126,fp16,fp32,fp16,,0,k,k,n,256,256,128,256,2,1,4096,7168,1536,90.11200070381165,57.2247817047817,0.6350406300807074,57.2247817047817,MATH
127,fp16,fp32,fp16,,0,k,k,n,256,256,128,256,2,2,4096,7168,1536,89.4976019859314,57.2247817047817,0.6394001675461334,57.2247817047817,MATH
128,fp16,fp32,fp16,,0,k,k,n,128,64,64,64,2,1,7168,1536,4096,153.19039821624756,57.2247817047817,0.37355331907944844,57.2247817047817,MATH
129,fp16,fp32,fp16,,0,k,k,n,128,64,64,64,2,2,7168,1536,4096,154.82879877090454,57.2247817047817,0.36960037253441114,57.2247817047817,MATH
130,fp16,fp32,fp16,,0,k,k,n,128,128,64,128,2,1,7168,1536,4096,103.21919918060304,57.2247817047817,0.5544005588016166,57.2247817047817,MATH
131,fp16,fp32,fp16,,0,k,k,n,128,128,64,128,2,2,7168,1536,4096,105.67679405212402,57.2247817047817,0.5415075487297253,57.2247817047817,MATH
132,fp16,fp32,fp16,,0,k,k,n,128,192,64,192,2,1,7168,1536,4096,95.23839950561523,57.2247817047817,0.6008582882727648,57.2247817047817,MATH
133,fp16,fp32,fp16,,0,k,k,n,128,192,64,192,2,2,7168,1536,4096,94.624000787735,57.2247817047817,0.6047596934011595,57.2247817047817,MATH
134,fp16,fp32,fp16,,0,k,k,n,128,256,64,256,2,1,7168,1536,4096,91.09119772911072,57.2247817047817,0.6282141758082728,57.2247817047817,MATH
135,fp16,fp32,fp16,,0,k,k,n,128,256,64,256,2,2,7168,1536,4096,101.58079862594604,57.2247817047817,0.56334250644654,57.2247817047817,MATH
136,fp16,fp32,fp16,,0,k,k,n,256,64,128,64,2,1,7168,1536,4096,133.52960348129272,57.2247817047817,0.4285550186090292,57.2247817047817,MATH
137,fp16,fp32,fp16,,0,k,k,n,256,64,128,64,2,2,7168,1536,4096,128.61440181732178,57.2247817047817,0.4449329227224588,57.2247817047817,MATH
138,fp16,fp32,fp16,,0,k,k,n,256,128,128,128,2,1,7168,1536,4096,90.12479782104492,57.2247817047817,0.6349504585675666,57.2247817047817,MATH
139,fp16,fp32,fp16,,0,k,k,n,256,128,128,128,2,2,7168,1536,4096,101.99040174484252,57.2247817047817,0.5610800695534612,57.2247817047817,MATH
140,fp16,fp32,fp16,,0,k,k,n,256,192,128,192,2,1,7168,1536,4096,97.4847972393036,57.2247817047817,0.5870123683419839,57.2247817047817,MATH
141,fp16,fp32,fp16,,0,k,k,n,256,192,128,192,2,2,7168,1536,4096,98.6944019794464,57.2247817047817,0.5798179081798281,57.2247817047817,MATH
142,fp16,fp32,fp16,,0,k,k,n,256,256,128,256,2,1,7168,1536,4096,98.71360063552856,57.2247817047817,0.5797051402882938,57.2247817047817,MATH
143,fp16,fp32,fp16,,0,k,k,n,256,256,128,256,2,2,7168,1536,4096,98.30399751663208,57.2247817047817,0.5821205968261852,57.2247817047817,MATH
144,fp16,fp32,fp16,,0,k,k,n,128,64,64,64,2,1,4096,16384,512,148.69120121002197,43.59983367983368,0.29322403292882265,43.59983367983368,MATH
145,fp16,fp32,fp16,,0,k,k,n,128,64,64,64,2,2,4096,16384,512,165.07519483566284,43.59983367983368,0.2641210493389911,43.59983367983368,MATH
146,fp16,fp32,fp16,,0,k,k,n,128,128,64,128,2,1,4096,16384,512,97.4847972393036,43.59983367983368,0.44724751873674967,43.59983367983368,MATH
147,fp16,fp32,fp16,,0,k,k,n,128,128,64,128,2,2,4096,16384,512,97.89440035820007,43.59983367983368,0.44537617596409906,43.59983367983368,MATH
148,fp16,fp32,fp16,,0,k,k,n,128,192,64,192,2,1,4096,16384,512,88.0511999130249,43.59983367983368,0.49516456019793786,43.59983367983368,MATH
149,fp16,fp32,fp16,,0,k,k,n,128,192,64,192,2,2,4096,16384,512,87.24480271339417,43.59983367983368,0.49974132926934867,43.59983367983368,MATH
150,fp16,fp32,fp16,,0,k,k,n,128,256,64,256,2,1,4096,16384,512,82.7455997467041,43.59983367983368,0.526914226415651,43.59983367983368,MATH
151,fp16,fp32,fp16,,0,k,k,n,128,256,64,256,2,2,4096,16384,512,83.92959833145142,43.59983367983368,0.5194810239368829,43.59983367983368,MATH
152,fp16,fp32,fp16,,0,k,k,n,256,64,128,64,2,1,4096,16384,512,107.32159614562988,43.59983367983368,0.40625405552737914,43.59983367983368,MATH
153,fp16,fp32,fp16,,0,k,k,n,256,64,128,64,2,2,4096,16384,512,112.23679780960084,43.59983367983368,0.3884629152891255,43.59983367983368,MATH
154,fp16,fp32,fp16,,0,k,k,n,256,128,128,128,2,1,4096,16384,512,81.08159899711609,43.59983367983368,0.5377278472441624,43.59983367983368,MATH
155,fp16,fp32,fp16,,0,k,k,n,256,128,128,128,2,2,4096,16384,512,79.6671986579895,43.59983367983368,0.5472745924832544,43.59983367983368,MATH
156,fp16,fp32,fp16,,0,k,k,n,256,192,128,192,2,1,4096,16384,512,74.54720139503479,43.59983367983368,0.5848621123788779,43.59983367983368,MATH
157,fp16,fp32,fp16,,0,k,k,n,256,192,128,192,2,2,4096,16384,512,74.9567985534668,43.59983367983368,0.5816661666617718,43.59983367983368,MATH
158,fp16,fp32,fp16,,0,k,k,n,256,256,128,256,2,1,4096,16384,512,73.31200242042542,43.59983367983368,0.5947161752559954,43.59983367983368,MATH
159,fp16,fp32,fp16,,0,k,k,n,256,256,128,256,2,2,4096,16384,512,72.70399928092957,43.59983367983368,0.5996896197052811,43.59983367983368,MATH
160,fp16,fp32,fp16,,0,k,k,n,128,64,64,64,2,1,4096,512,16384,134.75840091705322,43.59983367983368,0.3235407468709156,43.59983367983368,MATH
161,fp16,fp32,fp16,,0,k,k,n,128,64,64,64,2,2,4096,512,16384,119.19360160827635,43.59983367983368,0.3657900515761097,43.59983367983368,MATH
162,fp16,fp32,fp16,,0,k,k,n,128,128,64,128,2,1,4096,512,16384,82.12479948997498,43.59983367983368,0.5308972922990933,43.59983367983368,MATH
163,fp16,fp32,fp16,,0,k,k,n,128,128,64,128,2,2,4096,512,16384,80.07680177688599,43.59983367983368,0.5444752127003489,43.59983367983368,MATH
164,fp16,fp32,fp16,,0,k,k,n,128,192,64,192,2,1,4096,512,16384,98.30399751663208,43.59983367983368,0.44352045472471263,43.59983367983368,MATH
165,fp16,fp32,fp16,,0,k,k,n,128,192,64,192,2,2,4096,512,16384,99.53280091285706,43.59983367983368,0.4380448784718336,43.59983367983368,MATH
166,fp16,fp32,fp16,,0,k,k,n,128,256,64,256,2,1,4096,512,16384,73.10720086097717,43.59983367983368,0.5963822053964892,43.59983367983368,MATH
167,fp16,fp32,fp16,,0,k,k,n,128,256,64,256,2,2,4096,512,16384,72.70399928092957,43.59983367983368,0.5996896197052811,43.59983367983368,MATH
168,fp16,fp32,fp16,,0,k,k,n,256,64,128,64,2,1,4096,512,16384,96.25599980354308,43.59983367983368,0.4529570496262075,43.59983367983368,MATH
169,fp16,fp32,fp16,,0,k,k,n,256,64,128,64,2,2,4096,512,16384,96.2495982646942,43.59983367983368,0.45298717569636604,43.59983367983368,MATH
170,fp16,fp32,fp16,,0,k,k,n,256,128,128,128,2,1,4096,512,16384,72.28800058364868,43.59983367983368,0.6031406779522385,43.59983367983368,MATH
171,fp16,fp32,fp16,,0,k,k,n,256,128,128,128,2,2,4096,512,16384,71.27040028572083,43.59983367983368,0.6117523334377708,43.59983367983368,MATH
172,fp16,fp32,fp16,,0,k,k,n,256,192,128,192,2,1,4096,512,16384,96.66560292243958,43.59983367983368,0.45103772553734917,43.59983367983368,MATH
173,fp16,fp32,fp16,,0,k,k,n,256,192,128,192,2,2,4096,512,16384,97.07520008087158,43.59983367983368,0.44913462597565035,43.59983367983368,MATH
174,fp16,fp32,fp16,,0,k,k,n,256,256,128,256,2,1,4096,512,16384,118.78399848937988,43.59983367983368,0.3670514062020888,43.59983367983368,MATH
175,fp16,fp32,fp16,,0,k,k,n,256,256,128,256,2,2,4096,512,16384,117.56160259246826,43.59983367983368,0.3708679766043523,43.59983367983368,MATH
176,fp16,fp32,fp16,,0,k,k,n,128,64,64,64,2,1,512,16384,4096,109.77280139923096,43.59983367983368,0.39718248167199577,43.59983367983368,MATH
177,fp16,fp32,fp16,,0,k,k,n,128,64,64,64,2,2,512,16384,4096,121.65759801864624,43.59983367983368,0.3583815099912725,43.59983367983368,MATH
178,fp16,fp32,fp16,,0,k,k,n,128,128,64,128,2,1,512,16384,4096,79.25119996070862,43.59983367983368,0.5501472999960849,43.59983367983368,MATH
179,fp16,fp32,fp16,,0,k,k,n,128,128,64,128,2,2,512,16384,4096,81.10079765319824,43.59983367983368,0.5376005531570046,43.59983367983368,MATH
180,fp16,fp32,fp16,,0,k,k,n,128,192,64,192,2,1,512,16384,4096,74.1375982761383,43.59983367983368,0.5880934194474248,43.59983367983368,MATH
181,fp16,fp32,fp16,,0,k,k,n,128,192,64,192,2,2,512,16384,4096,80.28159737586975,43.59983367983368,0.5430862751236,43.59983367983368,MATH
182,fp16,fp32,fp16,,0,k,k,n,128,256,64,256,2,1,512,16384,4096,74.1375982761383,43.59983367983368,0.5880934194474248,43.59983367983368,MATH
183,fp16,fp32,fp16,,0,k,k,n,128,256,64,256,2,2,512,16384,4096,74.1375982761383,43.59983367983368,0.5880934194474248,43.59983367983368,MATH
184,fp16,fp32,fp16,,0,k,k,n,256,64,128,64,2,1,512,16384,4096,92.56960153579712,43.59983367983368,0.4709951534464952,43.59983367983368,MATH
185,fp16,fp32,fp16,,0,k,k,n,256,64,128,64,2,2,512,16384,4096,96.67199850082396,43.59983367983368,0.45100788600601927,43.59983367983368,MATH
186,fp16,fp32,fp16,,0,k,k,n,256,128,128,128,2,1,512,16384,4096,74.54079985618591,43.59983367983368,0.5849123401405983,43.59983367983368,MATH
187,fp16,fp32,fp16,,0,k,k,n,256,128,128,128,2,2,512,16384,4096,73.31200242042542,43.59983367983368,0.5947161752559954,43.59983367983368,MATH
188,fp16,fp32,fp16,,0,k,k,n,256,192,128,192,2,1,512,16384,4096,79.2639970779419,43.59983367983368,0.5500584790968979,43.59983367983368,MATH
189,fp16,fp32,fp16,,0,k,k,n,256,192,128,192,2,2,512,16384,4096,78.44480276107788,43.59983367983368,0.5558027064282033,43.59983367983368,MATH
190,fp16,fp32,fp16,,0,k,k,n,256,256,128,256,2,1,512,16384,4096,72.90880084037781,43.59983367983368,0.5980050854942541,43.59983367983368,MATH
191,fp16,fp32,fp16,,0,k,k,n,256,256,128,256,2,2,512,16384,4096,72.08960056304932,43.59983367983368,0.6048006000768643,43.59983367983368,MATH
192,fp16,fp32,fp16,,0,k,k,n,128,64,64,64,2,1,4096,16384,1536,319.26400661468506,130.79950103950102,0.40969072093792575,130.79950103950102,MATH
193,fp16,fp32,fp16,,0,k,k,n,128,64,64,64,2,2,4096,16384,1536,356.15360736846924,130.79950103950102,0.36725586469822985,130.79950103950102,MATH
194,fp16,fp32,fp16,,0,k,k,n,128,128,64,128,2,1,4096,16384,1536,205.6256055831909,130.79950103950102,0.6361051225528568,130.79950103950102,MATH
195,fp16,fp32,fp16,,0,k,k,n,128,128,64,128,2,2,4096,16384,1536,214.63680267333984,130.79950103950102,0.609399224226087,130.79950103950102,MATH
196,fp16,fp32,fp16,,0,k,k,n,128,192,64,192,2,1,4096,16384,1536,185.13920307159424,130.79950103950102,0.7064927301697427,130.79950103950102,MATH
197,fp16,fp32,fp16,,0,k,k,n,128,192,64,192,2,2,4096,16384,1536,194.9695944786072,130.79950103950102,0.6708712781051244,130.79950103950102,MATH
198,fp16,fp32,fp16,,0,k,k,n,128,256,64,256,2,1,4096,16384,1536,175.30879974365234,130.79950103950102,0.7461091584151187,130.79950103950102,MATH
199,fp16,fp32,fp16,,0,k,k,n,128,256,64,256,2,2,4096,16384,1536,188.0064010620117,130.79950103950102,0.6957183388471883,130.79950103950102,MATH
200,fp16,fp32,fp16,,0,k,k,n,256,64,128,64,2,1,4096,16384,1536,260.915207862854,130.79950103950102,0.501310376312958,130.79950103950102,MATH
201,fp16,fp32,fp16,,0,k,k,n,256,64,128,64,2,2,4096,16384,1536,288.35840225219727,130.79950103950102,0.45360045005764815,130.79950103950102,MATH
202,fp16,fp32,fp16,,0,k,k,n,256,128,128,128,2,1,4096,16384,1536,178.5856008529663,130.79950103950102,0.7324190775447306,130.79950103950102,MATH
203,fp16,fp32,fp16,,0,k,k,n,256,128,128,128,2,2,4096,16384,1536,188.0128026008606,130.79950103950102,0.6956946507370574,130.79950103950102,MATH
204,fp16,fp32,fp16,,0,k,k,n,256,192,128,192,2,1,4096,16384,1536,166.71359539031982,130.79950103950102,0.7845760913095625,130.79950103950102,MATH
205,fp16,fp32,fp16,,0,k,k,n,256,192,128,192,2,2,4096,16384,1536,176.12799406051636,130.79950103950102,0.7426389072174365,130.79950103950102,MATH
206,fp16,fp32,fp16,,0,k,k,n,256,256,128,256,2,1,4096,16384,1536,164.24959897994995,130.79950103950102,0.79634593844864,130.79950103950102,MATH
207,fp16,fp32,fp16,,0,k,k,n,256,256,128,256,2,2,4096,16384,1536,178.17599773406982,130.79950103950102,0.7341028124041775,130.79950103950102,MATH
208,fp16,fp32,fp16,,0,k,k,n,128,64,64,64,2,1,4096,1536,16384,368.63999366760254,130.79950103950102,0.35481636091129354,130.79950103950102,MATH
209,fp16,fp32,fp16,,0,k,k,n,128,64,64,64,2,2,4096,1536,16384,334.23359394073486,130.79950103950102,0.39134157490672206,130.79950103950102,MATH
210,fp16,fp32,fp16,,0,k,k,n,128,128,64,128,2,1,4096,1536,16384,234.6816062927246,130.79950103950102,0.5573487547905707,130.79950103950102,MATH
211,fp16,fp32,fp16,,0,k,k,n,128,128,64,128,2,2,4096,1536,16384,219.9552059173584,130.79950103950102,0.5946642658171275,130.79950103950102,MATH
212,fp16,fp32,fp16,,0,k,k,n,128,192,64,192,2,1,4096,1536,16384,193.74079704284668,130.79950103950102,0.6751262668263623,130.79950103950102,MATH
213,fp16,fp32,fp16,,0,k,k,n,128,192,64,192,2,2,4096,1536,16384,189.23519849777225,130.79950103950102,0.6912006966877299,130.79950103950102,MATH
214,fp16,fp32,fp16,,0,k,k,n,128,256,64,256,2,1,4096,1536,16384,183.50720405578613,130.79950103950102,0.7127758373983946,130.79950103950102,MATH
215,fp16,fp32,fp16,,0,k,k,n,128,256,64,256,2,2,4096,1536,16384,181.86880350112915,130.79950103950102,0.7191970174185972,130.79950103950102,MATH
216,fp16,fp32,fp16,,0,k,k,n,256,64,128,64,2,1,4096,1536,16384,278.52799892425537,130.79950103950102,0.46960988318833774,130.79950103950102,MATH
217,fp16,fp32,fp16,,0,k,k,n,256,64,128,64,2,2,4096,1536,16384,264.6080017089844,130.79950103950102,0.49431423159815924,130.79950103950102,MATH
218,fp16,fp32,fp16,,0,k,k,n,256,128,128,128,2,1,4096,1536,16384,182.2720050811768,130.79950103950102,0.7176060908599106,130.79950103950102,MATH
219,fp16,fp32,fp16,,0,k,k,n,256,128,128,128,2,2,4096,1536,16384,181.04959726333615,130.79950103950102,0.7224512123562115,130.79950103950102,MATH
220,fp16,fp32,fp16,,0,k,k,n,256,192,128,192,2,1,4096,1536,16384,178.17599773406982,130.79950103950102,0.7341028124041775,130.79950103950102,MATH
221,fp16,fp32,fp16,,0,k,k,n,256,192,128,192,2,2,4096,1536,16384,176.53759717941284,130.79950103950102,0.7409158339601236,130.79950103950102,MATH
222,fp16,fp32,fp16,,0,k,k,n,256,256,128,256,2,1,4096,1536,16384,228.55679988861084,130.79950103950102,0.572284443531093,130.79950103950102,MATH
223,fp16,fp32,fp16,,0,k,k,n,256,256,128,256,2,2,4096,1536,16384,224.05118942260745,130.79950103950102,0.5837929331086289,130.79950103950102,MATH
224,fp16,fp32,fp16,,0,k,k,n,128,64,64,64,2,1,1536,16384,4096,319.28319931030273,130.79950103950102,0.4096660936812416,130.79950103950102,MATH
225,fp16,fp32,fp16,,0,k,k,n,128,64,64,64,2,2,1536,16384,4096,320.5120086669922,130.79950103950102,0.408095476932348,130.79950103950102,MATH
226,fp16,fp32,fp16,,0,k,k,n,128,128,64,128,2,1,1536,16384,4096,222.82240390777588,130.79950103950102,0.5870123414234312,130.79950103950102,MATH
227,fp16,fp32,fp16,,0,k,k,n,128,128,64,128,2,2,1536,16384,4096,209.3183994293213,130.79950103950102,0.6248829601034043,130.79950103950102,MATH
228,fp16,fp32,fp16,,0,k,k,n,128,192,64,192,2,1,1536,16384,4096,183.9167952537537,130.79950103950102,0.7111884526860873,130.79950103950102,MATH
229,fp16,fp32,fp16,,0,k,k,n,128,192,64,192,2,2,1536,16384,4096,190.0544047355652,130.79950103950102,0.6882213607282119,130.79950103950102,MATH
230,fp16,fp32,fp16,,0,k,k,n,128,256,64,256,2,1,1536,16384,4096,178.9952039718628,130.79950103950102,0.7307430486241525,130.79950103950102,MATH
231,fp16,fp32,fp16,,0,k,k,n,128,256,64,256,2,2,1536,16384,4096,183.50720405578613,130.79950103950102,0.7127758373983946,130.79950103950102,MATH
232,fp16,fp32,fp16,,0,k,k,n,256,64,128,64,2,1,1536,16384,4096,262.55359649658203,130.79950103950102,0.4981820960932973,130.79950103950102,MATH
233,fp16,fp32,fp16,,0,k,k,n,256,64,128,64,2,2,1536,16384,4096,253.54239940643308,130.79950103950102,0.5158880776774027,130.79950103950102,MATH
234,fp16,fp32,fp16,,0,k,k,n,256,128,128,128,2,1,1536,16384,4096,185.95839738845825,130.79950103950102,0.7033804489413139,130.79950103950102,MATH
235,fp16,fp32,fp16,,0,k,k,n,256,128,128,128,2,2,1536,16384,4096,181.4527988433838,130.79950103950102,0.7208458721675447,130.79950103950102,MATH
236,fp16,fp32,fp16,,0,k,k,n,256,192,128,192,2,1,1536,16384,4096,166.29760265350342,130.79950103950102,0.78653870502291,130.79950103950102,MATH
237,fp16,fp32,fp16,,0,k,k,n,256,192,128,192,2,2,1536,16384,4096,177.3568034172058,130.79950103950102,0.73749356393064,130.79950103950102,MATH
238,fp16,fp32,fp16,,0,k,k,n,256,256,128,256,2,1,1536,16384,4096,182.2720050811768,130.79950103950102,0.7176060908599106,130.79950103950102,MATH
239,fp16,fp32,fp16,,0,k,k,n,256,256,128,256,2,2,1536,16384,4096,176.9536018371582,130.79950103950102,0.739173996355663,130.79950103950102,MATH
240,fp16,fp32,fp16,,0,k,k,n,128,64,64,64,2,1,4096,8192,7168,772.0960140228271,305.19883575883574,0.395286117549899,305.19883575883574,MATH
241,fp16,fp32,fp16,,0,k,k,n,128,64,64,64,2,2,4096,8192,7168,706.1503887176514,305.19883575883574,0.4322009031434054,305.19883575883574,MATH
242,fp16,fp32,fp16,,0,k,k,n,128,128,64,128,2,1,4096,8192,7168,476.1600017547608,305.19883575883574,0.6409585740803654,305.19883575883574,MATH
243,fp16,fp32,fp16,,0,k,k,n,128,128,64,128,2,2,4096,8192,7168,467.9679870605469,305.19883575883574,0.6521788759010738,305.19883575883574,MATH
244,fp16,fp32,fp16,,0,k,k,n,128,192,64,192,2,1,4096,8192,7168,408.1664085388184,305.19883575883574,0.7477313893894578,305.19883575883574,MATH
245,fp16,fp32,fp16,,0,k,k,n,128,192,64,192,2,2,4096,8192,7168,442.5727844238281,305.19883575883574,0.6896014542696399,305.19883575883574,MATH
246,fp16,fp32,fp16,,0,k,k,n,128,256,64,256,2,1,4096,8192,7168,375.8016109466553,305.19883575883574,0.8121275344989366,305.19883575883574,MATH
247,fp16,fp32,fp16,,0,k,k,n,128,256,64,256,2,2,4096,8192,7168,409.8048210144043,305.19883575883574,0.7447419359376162,305.19883575883574,MATH
248,fp16,fp32,fp16,,0,k,k,n,256,64,128,64,2,1,4096,8192,7168,596.5888023376465,305.19883575883574,0.5115731883718878,305.19883575883574,MATH
249,fp16,fp32,fp16,,0,k,k,n,256,64,128,64,2,2,4096,8192,7168,552.345609664917,305.19883575883574,0.5525504872646422,305.19883575883574,MATH
250,fp16,fp32,fp16,,0,k,k,n,256,128,128,128,2,1,4096,8192,7168,374.1631984710693,305.19883575883574,0.8156837364175837,305.19883575883574,MATH
251,fp16,fp32,fp16,,0,k,k,n,256,128,128,128,2,2,4096,8192,7168,386.6431951522827,305.19883575883574,0.7893552494532603,305.19883575883574,MATH
252,fp16,fp32,fp16,,0,k,k,n,256,192,128,192,2,1,4096,8192,7168,353.2799959182739,305.19883575883574,0.8639006999689814,305.19883575883574,MATH
253,fp16,fp32,fp16,,0,k,k,n,256,192,128,192,2,2,4096,8192,7168,383.9999914169312,305.19883575883574,0.7947886525535454,305.19883575883574,MATH
254,fp16,fp32,fp16,,0,k,k,n,256,256,128,256,2,1,4096,8192,7168,331.1552047729492,305.19883575883574,0.9216187194402998,305.19883575883574,MATH
255,fp16,fp32,fp16,,0,k,k,n,256,256,128,256,2,2,4096,8192,7168,370.8928108215332,305.19883575883574,0.8228761163712386,305.19883575883574,MATH
256,fp16,fp32,fp16,,0,k,k,n,128,64,64,64,2,1,4096,7168,8192,768.4224128723145,305.19883575883574,0.39717586401211513,305.19883575883574,MATH
257,fp16,fp32,fp16,,0,k,k,n,128,64,64,64,2,2,4096,7168,8192,697.9584217071533,305.19883575883574,0.43727366311068006,305.19883575883574,MATH
258,fp16,fp32,fp16,,0,k,k,n,128,128,64,128,2,1,4096,7168,8192,496.230411529541,305.19883575883574,0.6150345256311784,305.19883575883574,MATH
259,fp16,fp32,fp16,,0,k,k,n,128,128,64,128,2,2,4096,7168,8192,471.6544151306152,305.19883575883574,0.6470814773870336,305.19883575883574,MATH
260,fp16,fp32,fp16,,0,k,k,n,128,192,64,192,2,1,4096,7168,8192,428.4416198730469,305.19883575883574,0.7123463772013334,305.19883575883574,MATH
261,fp16,fp32,fp16,,0,k,k,n,128,192,64,192,2,2,4096,7168,8192,437.6575946807861,305.19883575883574,0.6973461433508045,305.19883575883574,MATH
262,fp16,fp32,fp16,,0,k,k,n,128,256,64,256,2,1,4096,7168,8192,392.5951957702637,305.19883575883574,0.7773881062401743,305.19883575883574,MATH
263,fp16,fp32,fp16,,0,k,k,n,128,256,64,256,2,2,4096,7168,8192,408.5760116577149,305.19883575883574,0.746981778300084,305.19883575883574,MATH
264,fp16,fp32,fp16,,0,k,k,n,256,64,128,64,2,1,4096,7168,8192,629.5551776885986,305.19883575883574,0.48478488713152706,305.19883575883574,MATH
265,fp16,fp32,fp16,,0,k,k,n,256,64,128,64,2,2,4096,7168,8192,555.2127838134766,305.19883575883574,0.5496970614807873,305.19883575883574,MATH
266,fp16,fp32,fp16,,0,k,k,n,256,128,128,128,2,1,4096,7168,8192,397.5167989730835,305.19883575883574,0.7677633663464403,305.19883575883574,MATH
267,fp16,fp32,fp16,,0,k,k,n,256,128,128,128,2,2,4096,7168,8192,390.1439905166626,305.19883575883574,0.7822722973501781,305.19883575883574,MATH
268,fp16,fp32,fp16,,0,k,k,n,256,192,128,192,2,1,4096,7168,8192,365.5679941177368,305.19883575883574,0.8348620247661553,305.19883575883574,MATH
269,fp16,fp32,fp16,,0,k,k,n,256,192,128,192,2,2,4096,7168,8192,398.74560832977295,305.19883575883574,0.7653973595777597,305.19883575883574,MATH
270,fp16,fp32,fp16,,0,k,k,n,256,256,128,256,2,1,4096,7168,8192,373.9648103713989,305.19883575883574,0.8161164561332147,305.19883575883574,MATH
271,fp16,fp32,fp16,,0,k,k,n,256,256,128,256,2,2,4096,7168,8192,370.4832077026367,305.19883575883574,0.8237858812856086,305.19883575883574,MATH
272,fp16,fp32,fp16,,0,k,k,n,128,64,64,64,2,1,7168,8192,4096,780.2879810333252,305.19883575883574,0.39113614867508906,305.19883575883574,MATH
273,fp16,fp32,fp16,,0,k,k,n,128,64,64,64,2,2,7168,8192,4096,717.6191806793213,305.19883575883574,0.4252935874288153,305.19883575883574,MATH
274,fp16,fp32,fp16,,0,k,k,n,128,128,64,128,2,1,7168,8192,4096,473.4975814819336,305.19883575883574,0.6445626074871106,305.19883575883574,MATH
275,fp16,fp32,fp16,,0,k,k,n,128,128,64,128,2,2,7168,8192,4096,481.07519149780273,305.19883575883574,0.6344098410242585,305.19883575883574,MATH
276,fp16,fp32,fp16,,0,k,k,n,128,192,64,192,2,1,7168,8192,4096,407.7568054199219,305.19883575883574,0.7484825064894541,305.19883575883574,MATH
277,fp16,fp32,fp16,,0,k,k,n,128,192,64,192,2,2,7168,8192,4096,442.5727844238281,305.19883575883574,0.6896014542696399,305.19883575883574,MATH
278,fp16,fp32,fp16,,0,k,k,n,128,256,64,256,2,1,7168,8192,4096,387.2767925262451,305.19883575883574,0.7880638387030457,305.19883575883574,MATH
279,fp16,fp32,fp16,,0,k,k,n,128,256,64,256,2,2,7168,8192,4096,410.0096225738525,305.19883575883574,0.744369934156514,305.19883575883574,MATH
280,fp16,fp32,fp16,,0,k,k,n,256,64,128,64,2,1,7168,8192,4096,647.9872226715088,305.19883575883574,0.47099514478166415,305.19883575883574,MATH
281,fp16,fp32,fp16,,0,k,k,n,256,64,128,64,2,2,7168,8192,4096,584.3071937561035,305.19883575883574,0.5223259939637663,305.19883575883574,MATH
282,fp16,fp32,fp16,,0,k,k,n,256,128,128,128,2,1,7168,8192,4096,404.0703773498535,305.19883575883574,0.7553110865501221,305.19883575883574,MATH
283,fp16,fp32,fp16,,0,k,k,n,256,128,128,128,2,2,7168,8192,4096,390.1439905166626,305.19883575883574,0.7822722973501781,305.19883575883574,MATH
284,fp16,fp32,fp16,,0,k,k,n,256,192,128,192,2,1,7168,8192,4096,348.7744092941284,305.19883575883574,0.8750608634862757,305.19883575883574,MATH
285,fp16,fp32,fp16,,0,k,k,n,256,192,128,192,2,2,7168,8192,4096,382.77759552001953,305.19883575883574,0.7973268010741597,305.19883575883574,MATH
286,fp16,fp32,fp16,,0,k,k,n,256,256,128,256,2,1,7168,8192,4096,352.46078968048096,305.19883575883574,0.8659086193261668,305.19883575883574,MATH
287,fp16,fp32,fp16,,0,k,k,n,256,256,128,256,2,2,7168,8192,4096,373.3504056930542,305.19883575883574,0.8174594994541173,305.19883575883574,MATH
288,fp16,fp32,fp16,,0,k,k,n,128,64,64,64,2,1,4096,8192,1536,168.74879598617554,65.39975051975051,0.38755684233212706,65.39975051975051,MATH
289,fp16,fp32,fp16,,0,k,k,n,128,64,64,64,2,2,4096,8192,1536,188.82559537887573,65.39975051975051,0.34635002944662713,65.39975051975051,MATH
290,fp16,fp32,fp16,,0,k,k,n,128,128,64,128,2,1,4096,8192,1536,114.69440460205078,65.39975051975051,0.5702087276765124,65.39975051975051,MATH
291,fp16,fp32,fp16,,0,k,k,n,128,128,64,128,2,2,4096,8192,1536,118.3743953704834,65.39975051975051,0.5524822349889519,65.39975051975051,MATH
292,fp16,fp32,fp16,,0,k,k,n,128,192,64,192,2,1,4096,8192,1536,101.99040174484252,65.39975051975051,0.6412343652039557,65.39975051975051,MATH
293,fp16,fp32,fp16,,0,k,k,n,128,192,64,192,2,2,4096,8192,1536,112.63999938964844,65.39975051975051,0.5806085837546686,65.39975051975051,MATH
294,fp16,fp32,fp16,,0,k,k,n,128,256,64,256,2,1,4096,8192,1536,97.89440035820007,65.39975051975051,0.6680642639461486,65.39975051975051,MATH
295,fp16,fp32,fp16,,0,k,k,n,128,256,64,256,2,2,4096,8192,1536,105.67679405212402,65.39975051975051,0.618865769976829,65.39975051975051,MATH
296,fp16,fp32,fp16,,0,k,k,n,256,64,128,64,2,1,4096,8192,1536,138.44480514526367,65.39975051975051,0.47238862051291564,65.39975051975051,MATH
297,fp16,fp32,fp16,,0,k,k,n,256,64,128,64,2,2,4096,8192,1536,154.41919565200806,65.39975051975051,0.4235208598491366,65.39975051975051,MATH
298,fp16,fp32,fp16,,0,k,k,n,256,128,128,128,2,1,4096,8192,1536,98.71360063552856,65.39975051975051,0.6625201603294787,65.39975051975051,MATH
299,fp16,fp32,fp16,,0,k,k,n,256,128,128,128,2,2,4096,8192,1536,107.32159614562988,65.39975051975051,0.6093810832910687,65.39975051975051,MATH
300,fp16,fp32,fp16,,0,k,k,n,256,192,128,192,2,1,4096,8192,1536,96.66560292243958,65.39975051975051,0.6765565883060237,65.39975051975051,MATH
301,fp16,fp32,fp16,,0,k,k,n,256,192,128,192,2,2,4096,8192,1536,103.21919918060304,65.39975051975051,0.633600638630419,65.39975051975051,MATH
302,fp16,fp32,fp16,,0,k,k,n,256,256,128,256,2,1,4096,8192,1536,93.39519739151,65.39975051975051,0.7002474682461094,65.39975051975051,MATH
303,fp16,fp32,fp16,,0,k,k,n,256,256,128,256,2,2,4096,8192,1536,99.94239807128906,65.39975051975051,0.6543744374944933,65.39975051975051,MATH
304,fp16,fp32,fp16,,0,k,k,n,128,64,64,64,2,1,4096,1536,8192,170.80960273742676,65.39975051975051,0.38288099422773564,65.39975051975051,MATH
305,fp16,fp32,fp16,,0,k,k,n,128,64,64,64,2,2,4096,1536,8192,169.9903964996338,65.39975051975051,0.38472614845563585,65.39975051975051,MATH
306,fp16,fp32,fp16,,0,k,k,n,128,128,64,128,2,1,4096,1536,8192,118.3743953704834,65.39975051975051,0.5524822349889519,65.39975051975051,MATH
307,fp16,fp32,fp16,,0,k,k,n,128,128,64,128,2,2,4096,1536,8192,111.81440353393556,65.39975051975051,0.5848955810053733,65.39975051975051,MATH
308,fp16,fp32,fp16,,0,k,k,n,128,192,64,192,2,1,4096,1536,8192,104.4543981552124,65.39975051975051,0.6261081550876466,65.39975051975051,MATH
309,fp16,fp32,fp16,,0,k,k,n,128,192,64,192,2,2,4096,1536,8192,104.038405418396,65.39975051975051,0.6286116194951463,65.39975051975051,MATH
310,fp16,fp32,fp16,,0,k,k,n,128,256,64,256,2,1,4096,1536,8192,101.98400020599364,65.39975051975051,0.641274615504903,65.39975051975051,MATH
311,fp16,fp32,fp16,,0,k,k,n,128,256,64,256,2,2,4096,1536,8192,101.57439708709715,65.39975051975051,0.6438605829348126,65.39975051975051,MATH
312,fp16,fp32,fp16,,0,k,k,n,256,64,128,64,2,1,4096,1536,8192,144.17920112609863,65.39975051975051,0.45360045005764815,65.39975051975051,MATH
313,fp16,fp32,fp16,,0,k,k,n,256,64,128,64,2,2,4096,1536,8192,134.75199937820437,65.39975051975051,0.4853341755337893,65.39975051975051,MATH
314,fp16,fp32,fp16,,0,k,k,n,256,128,128,128,2,1,4096,1536,8192,101.58079862594604,65.39975051975051,0.6438200073674744,65.39975051975051,MATH
315,fp16,fp32,fp16,,0,k,k,n,256,128,128,128,2,2,4096,1536,8192,102.400004863739,65.39975051975051,0.6386694083342696,65.39975051975051,MATH
316,fp16,fp32,fp16,,0,k,k,n,256,192,128,192,2,1,4096,1536,8192,100.35840272903442,65.39975051975051,0.6516619310525344,65.39975051975051,MATH
317,fp16,fp32,fp16,,0,k,k,n,256,192,128,192,2,2,4096,1536,8192,99.53920245170592,65.39975051975051,0.6570250605682815,65.39975051975051,MATH
318,fp16,fp32,fp16,,0,k,k,n,256,256,128,256,2,1,4096,1536,8192,124.1152048110962,65.39975051975051,0.5269277895427008,65.39975051975051,MATH
319,fp16,fp32,fp16,,0,k,k,n,256,256,128,256,2,2,4096,1536,8192,122.06079959869383,65.39975051975051,0.5357965107124397,65.39975051975051,MATH
320,fp16,fp32,fp16,,0,k,k,n,128,64,64,64,2,1,1536,8192,4096,158.11200141906738,65.39975051975051,0.41362926237592795,65.39975051975051,MATH
321,fp16,fp32,fp16,,0,k,k,n,128,64,64,64,2,2,1536,8192,4096,174.48960542678833,65.39975051975051,0.3748059969520115,65.39975051975051,MATH
322,fp16,fp32,fp16,,0,k,k,n,128,128,64,128,2,1,1536,8192,4096,111.81440353393556,65.39975051975051,0.5848955810053733,65.39975051975051,MATH
323,fp16,fp32,fp16,,0,k,k,n,128,128,64,128,2,2,1536,8192,4096,111.82719469070436,65.39975051975051,0.5848286787541749,65.39975051975051,MATH
324,fp16,fp32,fp16,,0,k,k,n,128,192,64,192,2,1,1536,8192,4096,97.4847972393036,65.39975051975051,0.6708712781051244,65.39975051975051,MATH
325,fp16,fp32,fp16,,0,k,k,n,128,192,64,192,2,2,1536,8192,4096,103.6352038383484,65.39975051975051,0.6310572864966033,65.39975051975051,MATH
326,fp16,fp32,fp16,,0,k,k,n,128,256,64,256,2,1,1536,8192,4096,102.400004863739,65.39975051975051,0.6386694083342696,65.39975051975051,MATH
327,fp16,fp32,fp16,,0,k,k,n,128,256,64,256,2,2,1536,8192,4096,101.99040174484252,65.39975051975051,0.6412343652039557,65.39975051975051,MATH
328,fp16,fp32,fp16,,0,k,k,n,256,64,128,64,2,1,1536,8192,4096,138.84799480438232,65.39975051975051,0.4710168887342575,65.39975051975051,MATH
329,fp16,fp32,fp16,,0,k,k,n,256,64,128,64,2,2,1536,8192,4096,135.57759523391724,65.39975051975051,0.48237874707036815,65.39975051975051,MATH
330,fp16,fp32,fp16,,0,k,k,n,256,128,128,128,2,1,1536,8192,4096,104.0511965751648,65.39975051975051,0.628534343403796,65.39975051975051,MATH
331,fp16,fp32,fp16,,0,k,k,n,256,128,128,128,2,2,1536,8192,4096,102.81599760055542,65.39975051975051,0.6360853568121895,65.39975051975051,MATH
332,fp16,fp32,fp16,,0,k,k,n,256,192,128,192,2,1,1536,8192,4096,101.99040174484252,65.39975051975051,0.6412343652039557,65.39975051975051,MATH
333,fp16,fp32,fp16,,0,k,k,n,256,192,128,192,2,2,1536,8192,4096,99.53280091285706,65.39975051975051,0.6570673177077504,65.39975051975051,MATH
334,fp16,fp32,fp16,,0,k,k,n,256,256,128,256,2,1,1536,8192,4096,101.17119550704956,65.39975051975051,0.6464265860651364,65.39975051975051,MATH
335,fp16,fp32,fp16,,0,k,k,n,256,256,128,256,2,2,1536,8192,4096,99.53280091285706,65.39975051975051,0.6570673177077504,65.39975051975051,MATH
336,fp16,fp32,fp16,,0,k,k,n,128,64,64,64,2,1,4096,4096,192,28.467199206352237,4.48,0.15737410510691627,4.48,DRAM
337,fp16,fp32,fp16,,0,k,k,n,128,64,64,64,2,2,4096,4096,192,31.12959861755371,4.48,0.14391448007536362,4.48,DRAM
338,fp16,fp32,fp16,,0,k,k,n,128,128,64,128,2,1,4096,4096,192,21.062399446964264,4.48,0.2127013121786419,4.48,DRAM
339,fp16,fp32,fp16,,0,k,k,n,128,128,64,128,2,2,4096,4096,192,22.32320010662079,4.48,0.2006880724359626,4.48,DRAM
340,fp16,fp32,fp16,,0,k,k,n,128,192,64,192,2,1,4096,4096,192,19.85920071601868,4.48,0.2255881323756588,4.48,DRAM
341,fp16,fp32,fp16,,0,k,k,n,128,192,64,192,2,2,4096,4096,192,21.09439969062805,4.48,0.2123786438914591,4.48,DRAM
342,fp16,fp32,fp16,,0,k,k,n,128,256,64,256,2,1,4096,4096,192,19.26400065422058,4.48,0.2325581316370268,4.48,DRAM
343,fp16,fp32,fp16,,0,k,k,n,128,256,64,256,2,2,4096,4096,192,20.05760073661804,4.48,0.22335672440727744,4.48,DRAM
344,fp16,fp32,fp16,,0,k,k,n,256,64,128,64,2,1,4096,4096,192,21.503999829292297,4.48,0.20833333498717008,4.48,DRAM
345,fp16,fp32,fp16,,0,k,k,n,256,64,128,64,2,2,4096,4096,192,22.412799298763275,4.48,0.1998857858084333,4.48,DRAM
346,fp16,fp32,fp16,,0,k,k,n,256,128,128,128,2,1,4096,4096,192,18.860800564289093,4.48,0.2375296841048413,4.48,DRAM
347,fp16,fp32,fp16,,0,k,k,n,256,128,128,128,2,2,4096,4096,192,19.45600062608719,4.48,0.23026315048495025,4.48,DRAM
348,fp16,fp32,fp16,,0,k,k,n,256,192,128,192,2,1,4096,4096,192,18.22080016136169,4.48,0.24587284643514787,4.48,DRAM
349,fp16,fp32,fp16,,0,k,k,n,256,192,128,192,2,2,4096,4096,192,19.66080069541931,4.48,0.22786457527356843,4.48,DRAM
350,fp16,fp32,fp16,,0,k,k,n,256,256,128,256,2,1,4096,4096,192,19.654400646686558,4.48,0.22793877465580525,4.48,DRAM
351,fp16,fp32,fp16,,0,k,k,n,256,256,128,256,2,2,4096,4096,192,19.046400487422943,4.48,0.23521504774397206,4.48,DRAM
352,fp16,fp32,fp16,,0,k,k,n,128,64,64,64,2,1,4096,192,4096,23.14240038394928,4.48,0.19358406758475946,4.48,DRAM
353,fp16,fp32,fp16,,0,k,k,n,128,64,64,64,2,2,4096,192,4096,22.815999388694763,4.48,0.19635344144599787,4.48,DRAM
354,fp16,fp32,fp16,,0,k,k,n,128,128,64,128,2,1,4096,192,4096,19.0528005361557,4.48,0.23513603637945468,4.48,DRAM
355,fp16,fp32,fp16,,0,k,k,n,128,128,64,128,2,2,4096,192,4096,18.860800564289093,4.48,0.2375296841048413,4.48,DRAM
356,fp16,fp32,fp16,,0,k,k,n,128,192,64,192,2,1,4096,192,4096,20.05760073661804,4.48,0.22335672440727744,4.48,DRAM
357,fp16,fp32,fp16,,0,k,k,n,128,192,64,192,2,2,4096,192,4096,21.09439969062805,4.48,0.2123786438914591,4.48,DRAM
358,fp16,fp32,fp16,,0,k,k,n,128,256,64,256,2,1,4096,192,4096,22.62399941682816,4.48,0.19801980708449327,4.48,DRAM
359,fp16,fp32,fp16,,0,k,k,n,128,256,64,256,2,2,4096,192,4096,24.672000110149384,4.48,0.18158235976000386,4.48,DRAM
360,fp16,fp32,fp16,,0,k,k,n,256,64,128,64,2,1,4096,192,4096,19.66080069541931,4.48,0.22786457527356843,4.48,DRAM
361,fp16,fp32,fp16,,0,k,k,n,256,64,128,64,2,2,4096,192,4096,20.870399475097656,4.48,0.214658085742225,4.48,DRAM
362,fp16,fp32,fp16,,0,k,k,n,256,128,128,128,2,1,4096,192,4096,22.732800245285038,4.48,0.19707206994568072,4.48,DRAM
363,fp16,fp32,fp16,,0,k,k,n,256,128,128,128,2,2,4096,192,4096,23.14240038394928,4.48,0.19358406758475946,4.48,DRAM
364,fp16,fp32,fp16,,0,k,k,n,256,192,128,192,2,1,4096,192,4096,28.87040078639984,4.48,0.15517623164103844,4.48,DRAM
365,fp16,fp32,fp16,,0,k,k,n,256,192,128,192,2,2,4096,192,4096,29.08160090446472,4.48,0.15404929098357215,4.48,DRAM
366,fp16,fp32,fp16,,0,k,k,n,256,256,128,256,2,1,4096,192,4096,35.22560000419617,4.48,0.1271802325429895,4.48,DRAM
367,fp16,fp32,fp16,,0,k,k,n,256,256,128,256,2,2,4096,192,4096,36.44799888134003,4.48,0.12291484134931721,4.48,DRAM
368,fp16,fp32,fp16,,0,k,k,n,128,64,64,64,2,1,192,4096,4096,23.14240038394928,4.48,0.19358406758475946,4.48,DRAM
369,fp16,fp32,fp16,,0,k,k,n,128,64,64,64,2,2,192,4096,4096,22.52800017595291,4.48,0.1988636348104299,4.48,DRAM
370,fp16,fp32,fp16,,0,k,k,n,128,128,64,128,2,1,192,4096,4096,19.046400487422943,4.48,0.23521504774397206,4.48,DRAM
371,fp16,fp32,fp16,,0,k,k,n,128,128,64,128,2,2,192,4096,4096,19.45600062608719,4.48,0.23026315048495025,4.48,DRAM
372,fp16,fp32,fp16,,0,k,k,n,128,192,64,192,2,1,192,4096,4096,20.68479955196381,4.48,0.21658416310709042,4.48,DRAM
373,fp16,fp32,fp16,,0,k,k,n,128,192,64,192,2,2,192,4096,4096,20.88959962129593,4.48,0.21446078820164935,4.48,DRAM
374,fp16,fp32,fp16,,0,k,k,n,128,256,64,256,2,1,192,4096,4096,23.14240038394928,4.48,0.19358406758475946,4.48,DRAM
375,fp16,fp32,fp16,,0,k,k,n,128,256,64,256,2,2,192,4096,4096,23.14240038394928,4.48,0.19358406758475946,4.48,DRAM
376,fp16,fp32,fp16,,0,k,k,n,256,64,128,64,2,1,192,4096,4096,20.870399475097656,4.48,0.214658085742225,4.48,DRAM
377,fp16,fp32,fp16,,0,k,k,n,256,64,128,64,2,2,192,4096,4096,20.838400721549988,4.48,0.21498770754355528,4.48,DRAM
378,fp16,fp32,fp16,,0,k,k,n,256,128,128,128,2,1,192,4096,4096,22.93760031461716,4.48,0.1953124973210509,4.48,DRAM
379,fp16,fp32,fp16,,0,k,k,n,256,128,128,128,2,2,192,4096,4096,23.96160066127777,4.48,0.18696580680604252,4.48,DRAM
380,fp16,fp32,fp16,,0,k,k,n,256,192,128,192,2,1,192,4096,4096,28.966400027275085,4.48,0.15466195301389135,4.48,DRAM
381,fp16,fp32,fp16,,0,k,k,n,256,192,128,192,2,2,192,4096,4096,29.36959862709045,4.48,0.152538686581425,4.48,DRAM
382,fp16,fp32,fp16,,0,k,k,n,256,256,128,256,2,1,192,4096,4096,35.28960049152374,4.48,0.12694958111175153,4.48,DRAM
383,fp16,fp32,fp16,,0,k,k,n,256,256,128,256,2,2,192,4096,4096,35.308799147605896,4.48,0.12688055408714646,4.48,DRAM
384,fp16,fp32,fp16,,0,k,k,n,128,64,64,64,2,1,4096,16384,4096,921.8048095703124,348.79866943866944,0.3783866886106371,348.79866943866944,MATH
385,fp16,fp32,fp16,,0,k,k,n,128,64,64,64,2,2,4096,16384,4096,828.2112121582031,348.79866943866944,0.4211470025016308,348.79866943866944,MATH
386,fp16,fp32,fp16,,0,k,k,n,128,128,64,128,2,1,4096,16384,4096,569.9584007263184,348.79866943866944,0.6119721526942717,348.79866943866944,MATH
387,fp16,fp32,fp16,,0,k,k,n,128,128,64,128,2,2,4096,16384,4096,531.8655967712402,348.79866943866944,0.6558022770340804,348.79866943866944,MATH
388,fp16,fp32,fp16,,0,k,k,n,128,192,64,192,2,1,4096,16384,4096,451.1744022369385,348.79866943866944,0.7730905559121116,348.79866943866944,MATH
389,fp16,fp32,fp16,,0,k,k,n,128,192,64,192,2,2,4096,16384,4096,470.4256057739258,348.79866943866944,0.7414534097582539,348.79866943866944,MATH
390,fp16,fp32,fp16,,0,k,k,n,128,256,64,256,2,1,4096,16384,4096,415.334415435791,348.79866943866944,0.8398019920229612,348.79866943866944,MATH
391,fp16,fp32,fp16,,0,k,k,n,128,256,64,256,2,2,4096,16384,4096,455.679988861084,348.79866943866944,0.7654465369665426,348.79866943866944,MATH
392,fp16,fp32,fp16,,0,k,k,n,256,64,128,64,2,1,4096,16384,4096,723.3471870422363,348.79866943866944,0.4822009066834223,348.79866943866944,MATH
393,fp16,fp32,fp16,,0,k,k,n,256,64,128,64,2,2,4096,16384,4096,630.3743839263916,348.79866943866944,0.5533198656742981,348.79866943866944,MATH
394,fp16,fp32,fp16,,0,k,k,n,256,128,128,128,2,1,4096,16384,4096,437.0431900024414,348.79866943866944,0.7980874142821468,348.79866943866944,MATH
395,fp16,fp32,fp16,,0,k,k,n,256,128,128,128,2,2,4096,16384,4096,433.1520080566406,348.79866943866944,0.805256960491937,348.79866943866944,MATH
396,fp16,fp32,fp16,,0,k,k,n,256,192,128,192,2,1,4096,16384,4096,383.5968017578125,348.79866943866944,0.9092846130111554,348.79866943866944,MATH
397,fp16,fp32,fp16,,0,k,k,n,256,192,128,192,2,2,4096,16384,4096,414.7200107574463,348.79866943866944,0.8410461525635624,348.79866943866944,MATH
398,fp16,fp32,fp16,,0,k,k,n,256,256,128,256,2,1,4096,16384,4096,374.5728015899658,348.79866943866944,0.9311905935457893,348.79866943866944,MATH
399,fp16,fp32,fp16,,0,k,k,n,256,256,128,256,2,2,4096,16384,4096,420.0384140014648,348.79866943866944,0.8303970727721419,348.79866943866944,MATH
400,fp16,fp32,fp16,,0,k,k,n,128,64,64,64,2,1,4096,4096,16384,918.5088157653807,348.79866943866944,0.3797444983127574,348.79866943866944,MATH
401,fp16,fp32,fp16,,0,k,k,n,128,64,64,64,2,2,4096,4096,16384,869.7855949401855,348.79866943866944,0.4010168384803568,348.79866943866944,MATH
402,fp16,fp32,fp16,,0,k,k,n,128,128,64,128,2,1,4096,4096,16384,579.1744232177734,348.79866943866944,0.6022342414584126,348.79866943866944,MATH
403,fp16,fp32,fp16,,0,k,k,n,128,128,64,128,2,2,4096,4096,16384,574.8735904693604,348.79866943866944,0.606739768918398,348.79866943866944,MATH
404,fp16,fp32,fp16,,0,k,k,n,128,192,64,192,2,1,4096,4096,16384,499.0975856781006,348.79866943866944,0.6988586590030744,348.79866943866944,MATH
405,fp16,fp32,fp16,,0,k,k,n,128,192,64,192,2,2,4096,4096,16384,508.10880661010737,348.79866943866944,0.6864645227578527,348.79866943866944,MATH
406,fp16,fp32,fp16,,0,k,k,n,128,256,64,256,2,1,4096,4096,16384,420.0448036193848,348.79866943866944,0.8303844409767448,348.79866943866944,MATH
407,fp16,fp32,fp16,,0,k,k,n,128,256,64,256,2,2,4096,4096,16384,461.00478172302246,348.79866943866944,0.7566053179210451,348.79866943866944,MATH
408,fp16,fp32,fp16,,0,k,k,n,256,64,128,64,2,1,4096,4096,16384,670.3104019165039,348.79866943866944,0.520353956079764,348.79866943866944,MATH
409,fp16,fp32,fp16,,0,k,k,n,256,64,128,64,2,2,4096,4096,16384,684.441614151001,348.79866943866944,0.5096105529342021,348.79866943866944,MATH
410,fp16,fp32,fp16,,0,k,k,n,256,128,128,128,2,1,4096,4096,16384,424.5376110076904,348.79866943866944,0.8215966274713669,348.79866943866944,MATH
411,fp16,fp32,fp16,,0,k,k,n,256,128,128,128,2,2,4096,4096,16384,442.9887771606445,348.79866943866944,0.7873758601161623,348.79866943866944,MATH
412,fp16,fp32,fp16,,0,k,k,n,256,192,128,192,2,1,4096,4096,16384,397.5231885910034,348.79866943866944,0.8774297435954993,348.79866943866944,MATH
413,fp16,fp32,fp16,,0,k,k,n,256,192,128,192,2,2,4096,4096,16384,471.2512016296387,348.79866943866944,0.7401544404183695,348.79866943866944,MATH
414,fp16,fp32,fp16,,0,k,k,n,256,256,128,256,2,1,4096,4096,16384,424.5503902435303,348.79866943866944,0.8215718968921258,348.79866943866944,MATH
415,fp16,fp32,fp16,,0,k,k,n,256,256,128,256,2,2,4096,4096,16384,418.4127807617188,348.79866943866944,0.8336233630427896,348.79866943866944,MATH
416,fp16,fp32,fp16,,0,k,k,n,128,64,64,64,2,1,4096,7168,16384,1620.787239074707,610.3976715176715,0.3766056745770914,610.3976715176715,MATH
417,fp16,fp32,fp16,,0,k,k,n,128,64,64,64,2,2,4096,7168,16384,1503.8399696350098,610.3976715176715,0.40589270390639925,610.3976715176715,MATH
418,fp16,fp32,fp16,,0,k,k,n,128,128,64,128,2,1,4096,7168,16384,1046.5279579162598,610.3976715176715,0.583259784796417,610.3976715176715,MATH
419,fp16,fp32,fp16,,0,k,k,n,128,128,64,128,2,2,4096,7168,16384,967.2703742980956,610.3976715176715,0.6310517594014078,610.3976715176715,MATH
420,fp16,fp32,fp16,,0,k,k,n,128,192,64,192,2,1,4096,7168,16384,872.4479675292969,610.3976715176715,0.6996379087755445,610.3976715176715,MATH
421,fp16,fp32,fp16,,0,k,k,n,128,192,64,192,2,2,4096,7168,16384,882.2784423828125,610.3976715176715,0.691842441337613,610.3976715176715,MATH
422,fp16,fp32,fp16,,0,k,k,n,128,256,64,256,2,1,4096,7168,16384,799.5391845703125,610.3976715176715,0.7634368437435756,610.3976715176715,MATH
423,fp16,fp32,fp16,,0,k,k,n,128,256,64,256,2,2,4096,7168,16384,813.4592056274414,610.3976715176715,0.7503728119308165,610.3976715176715,MATH
424,fp16,fp32,fp16,,0,k,k,n,256,64,128,64,2,1,4096,7168,16384,1208.9344024658203,610.3976715176715,0.504905535215695,610.3976715176715,MATH
425,fp16,fp32,fp16,,0,k,k,n,256,64,128,64,2,2,4096,7168,16384,1170.6368446350098,610.3976715176715,0.521423594614422,610.3976715176715,MATH
426,fp16,fp32,fp16,,0,k,k,n,256,128,128,128,2,1,4096,7168,16384,795.4432010650635,610.3976715176715,0.7673680165980121,610.3976715176715,MATH
427,fp16,fp32,fp16,,0,k,k,n,256,128,128,128,2,2,4096,7168,16384,772.9152202606201,610.3976715176715,0.7897343143428471,610.3976715176715,MATH
428,fp16,fp32,fp16,,0,k,k,n,256,192,128,192,2,1,4096,7168,16384,694.271993637085,610.3976715176715,0.8791909757442169,610.3976715176715,MATH
429,fp16,fp32,fp16,,0,k,k,n,256,192,128,192,2,2,4096,7168,16384,769.2287921905518,610.3976715176715,0.7935190124376741,610.3976715176715,MATH
430,fp16,fp32,fp16,,0,k,k,n,256,256,128,256,2,1,4096,7168,16384,720.2816009521484,610.3976715176715,0.847443098242104,610.3976715176715,MATH
431,fp16,fp32,fp16,,0,k,k,n,256,256,128,256,2,2,4096,7168,16384,715.5776023864746,610.3976715176715,0.8530139421384563,610.3976715176715,MATH
432,fp16,fp32,fp16,,0,k,k,n,128,64,64,64,2,1,4096,16384,7168,1502.003192901611,610.3976715176715,0.4063890638864012,610.3976715176715,MATH
433,fp16,fp32,fp16,,0,k,k,n,128,64,64,64,2,2,4096,16384,7168,1382.1951866149902,610.3976715176715,0.44161467022073886,610.3976715176715,MATH
434,fp16,fp32,fp16,,0,k,k,n,128,128,64,128,2,1,4096,16384,7168,988.1600379943848,610.3976715176715,0.6177113504372862,610.3976715176715,MATH
435,fp16,fp32,fp16,,0,k,k,n,128,128,64,128,2,2,4096,16384,7168,924.2624282836914,610.3976715176715,0.6604159736874181,610.3976715176715,MATH
436,fp16,fp32,fp16,,0,k,k,n,128,192,64,192,2,1,4096,16384,7168,841.3375854492188,610.3976715176715,0.7255086211223517,610.3976715176715,MATH
437,fp16,fp32,fp16,,0,k,k,n,128,192,64,192,2,2,4096,16384,7168,836.4031791687012,610.3976715176715,0.7297887988952219,610.3976715176715,MATH
438,fp16,fp32,fp16,,0,k,k,n,128,256,64,256,2,1,4096,16384,7168,767.5903797149658,610.3976715176715,0.7952127692693781,610.3976715176715,MATH
439,fp16,fp32,fp16,,0,k,k,n,128,256,64,256,2,2,4096,16384,7168,797.4912166595459,610.3976715176715,0.7653973595777597,610.3976715176715,MATH
440,fp16,fp32,fp16,,0,k,k,n,256,64,128,64,2,1,4096,16384,7168,1203.1999588012695,610.3976715176715,0.507311911916787,610.3976715176715,MATH
441,fp16,fp32,fp16,,0,k,k,n,256,64,128,64,2,2,4096,16384,7168,1086.2591743469238,610.3976715176715,0.5619263670519995,610.3976715176715,MATH
442,fp16,fp32,fp16,,0,k,k,n,256,128,128,128,2,1,4096,16384,7168,759.8080158233643,610.3976715176715,0.8033577677595509,610.3976715176715,MATH
443,fp16,fp32,fp16,,0,k,k,n,256,128,128,128,2,2,4096,16384,7168,743.4239864349365,610.3976715176715,0.8210626542261731,610.3976715176715,MATH
444,fp16,fp32,fp16,,0,k,k,n,256,192,128,192,2,1,4096,16384,7168,647.1680164337158,610.3976715176715,0.9431826913841154,610.3976715176715,MATH
445,fp16,fp32,fp16,,0,k,k,n,256,192,128,192,2,2,4096,16384,7168,713.1199836730957,610.3976715176715,0.8559536760892209,610.3976715176715,MATH
446,fp16,fp32,fp16,,0,k,k,n,256,256,128,256,2,1,4096,16384,7168,632.0127964019775,610.3976715176715,0.9657995455038885,610.3976715176715,MATH
447,fp16,fp32,fp16,,0,k,k,n,256,256,128,256,2,2,4096,16384,7168,719.2575931549072,610.3976715176715,0.8486496038787171,610.3976715176715,MATH
448,fp16,fp32,fp16,,0,k,k,n,128,64,64,64,2,1,16384,7168,4096,1649.0495681762695,610.3976715176715,0.3701511969665821,610.3976715176715,MATH
449,fp16,fp32,fp16,,0,k,k,n,128,64,64,64,2,2,16384,7168,4096,1520.025634765625,610.3976715176715,0.4015706429923398,610.3976715176715,MATH
450,fp16,fp32,fp16,,0,k,k,n,128,128,64,128,2,1,16384,7168,4096,1033.625602722168,610.3976715176715,0.5905403948103852,610.3976715176715,MATH
451,fp16,fp32,fp16,,0,k,k,n,128,128,64,128,2,2,16384,7168,4096,973.8240242004396,610.3976715176715,0.6268049014490477,610.3976715176715,MATH
452,fp16,fp32,fp16,,0,k,k,n,128,192,64,192,2,1,16384,7168,4096,874.9055862426758,610.3976715176715,0.6976726187554176,610.3976715176715,MATH
453,fp16,fp32,fp16,,0,k,k,n,128,192,64,192,2,2,16384,7168,4096,870.8095550537109,610.3976715176715,0.7009542648851879,610.3976715176715,MATH
454,fp16,fp32,fp16,,0,k,k,n,128,256,64,256,2,1,16384,7168,4096,801.9968032836914,610.3976715176715,0.7610973871946404,610.3976715176715,MATH
455,fp16,fp32,fp16,,0,k,k,n,128,256,64,256,2,2,16384,7168,4096,825.7535934448242,610.3976715176715,0.7392007450688224,610.3976715176715,MATH
456,fp16,fp32,fp16,,0,k,k,n,256,64,128,64,2,1,16384,7168,4096,1539.686393737793,610.3976715176715,0.39644285615582414,610.3976715176715,MATH
457,fp16,fp32,fp16,,0,k,k,n,256,64,128,64,2,2,16384,7168,4096,1300.684833526611,610.3976715176715,0.4692894510522354,610.3976715176715,MATH
458,fp16,fp32,fp16,,0,k,k,n,256,128,128,128,2,1,16384,7168,4096,930.406379699707,610.3976715176715,0.6560549076573187,610.3976715176715,MATH
459,fp16,fp32,fp16,,0,k,k,n,256,128,128,128,2,2,16384,7168,4096,880.6400299072266,610.3976715176715,0.6931295998229555,610.3976715176715,MATH
460,fp16,fp32,fp16,,0,k,k,n,256,192,128,192,2,1,16384,7168,4096,765.5424118041992,610.3976715176715,0.7973401108883191,610.3976715176715,MATH
461,fp16,fp32,fp16,,0,k,k,n,256,192,128,192,2,2,16384,7168,4096,739.3343925476074,610.3976715176715,0.8256043242007933,610.3976715176715,MATH
462,fp16,fp32,fp16,,0,k,k,n,256,256,128,256,2,1,16384,7168,4096,681.7791938781738,610.3976715176715,0.8953011136135413,610.3976715176715,MATH
463,fp16,fp32,fp16,,0,k,k,n,256,256,128,256,2,2,16384,7168,4096,730.3167819976807,610.3976715176715,0.8357985008204426,610.3976715176715,MATH
464,fp16,fp32,fp16,,0,k,k,n,128,64,64,64,2,1,4096,18432,7168,1704.3455123901367,686.6973804573804,0.4029097242696823,686.6973804573804,MATH
465,fp16,fp32,fp16,,0,k,k,n,128,64,64,64,2,2,4096,18432,7168,1545.8304405212402,686.6973804573804,0.4442255518178515,686.6973804573804,MATH
466,fp16,fp32,fp16,,0,k,k,n,128,128,64,128,2,1,4096,18432,7168,1107.148838043213,686.6973804573804,0.6202394446541234,686.6973804573804,MATH
467,fp16,fp32,fp16,,0,k,k,n,128,128,64,128,2,2,4096,18432,7168,1035.4687690734863,686.6973804573804,0.6631753665268161,686.6973804573804,MATH
468,fp16,fp32,fp16,,0,k,k,n,128,192,64,192,2,1,4096,18432,7168,928.7679672241212,686.6973804573804,0.7393637643530758,686.6973804573804,MATH
469,fp16,fp32,fp16,,0,k,k,n,128,192,64,192,2,2,4096,18432,7168,930.6112289428712,686.6973804573804,0.7378993064992725,686.6973804573804,MATH
470,fp16,fp32,fp16,,0,k,k,n,128,256,64,256,2,1,4096,18432,7168,865.8944129943848,686.6973804573804,0.7930497877711027,686.6973804573804,MATH
471,fp16,fp32,fp16,,0,k,k,n,128,256,64,256,2,2,4096,18432,7168,897.2288131713867,686.6973804573804,0.7653536872385405,686.6973804573804,MATH
472,fp16,fp32,fp16,,0,k,k,n,256,64,128,64,2,1,4096,18432,7168,1403.9039611816406,686.6973804573804,0.48913415692580536,686.6973804573804,MATH
473,fp16,fp32,fp16,,0,k,k,n,256,64,128,64,2,2,4096,18432,7168,1219.9935913085938,686.6973804573804,0.5628696620617595,686.6973804573804,MATH
474,fp16,fp32,fp16,,0,k,k,n,256,128,128,128,2,1,4096,18432,7168,881.4784049987793,686.6973804573804,0.7790291589257157,686.6973804573804,MATH
475,fp16,fp32,fp16,,0,k,k,n,256,128,128,128,2,2,4096,18432,7168,822.8927612304688,686.6973804573804,0.8344919445281839,686.6973804573804,MATH
476,fp16,fp32,fp16,,0,k,k,n,256,192,128,192,2,1,4096,18432,7168,714.7520065307617,686.6973804573804,0.9607491468130998,686.6973804573804,MATH
477,fp16,fp32,fp16,,0,k,k,n,256,192,128,192,2,2,4096,18432,7168,813.0559921264648,686.6973804573804,0.844588056797163,686.6973804573804,MATH
478,fp16,fp32,fp16,,0,k,k,n,256,256,128,256,2,1,4096,18432,7168,719.2575931549072,686.6973804573804,0.9547308043635567,686.6973804573804,MATH
479,fp16,fp32,fp16,,0,k,k,n,256,256,128,256,2,2,4096,18432,7168,807.7312469482422,686.6973804573804,0.8501557703157454,686.6973804573804,MATH
480,fp16,fp32,fp16,,0,k,k,n,128,64,64,64,2,1,4096,7168,18432,1872.076797485352,686.6973804573804,0.3668104756064386,686.6973804573804,MATH
481,fp16,fp32,fp16,,0,k,k,n,128,64,64,64,2,2,4096,7168,18432,1696.5631484985352,686.6973804573804,0.40475792549491024,686.6973804573804,MATH
482,fp16,fp32,fp16,,0,k,k,n,128,128,64,128,2,1,4096,7168,18432,1208.9344024658203,686.6973804573804,0.5680187271176569,686.6973804573804,MATH
483,fp16,fp32,fp16,,0,k,k,n,128,128,64,128,2,2,4096,7168,18432,1108.3776473999023,686.6973804573804,0.6195518125688259,686.6973804573804,MATH
484,fp16,fp32,fp16,,0,k,k,n,128,192,64,192,2,1,4096,7168,18432,992.255973815918,686.6973804573804,0.6920566855511576,686.6973804573804,MATH
485,fp16,fp32,fp16,,0,k,k,n,128,192,64,192,2,2,4096,7168,18432,994.3039894104004,686.6973804573804,0.6906312232183403,686.6973804573804,MATH
486,fp16,fp32,fp16,,0,k,k,n,128,256,64,256,2,1,4096,7168,18432,892.7295684814453,686.6973804573804,0.7692109735151591,686.6973804573804,MATH
487,fp16,fp32,fp16,,0,k,k,n,128,256,64,256,2,2,4096,7168,18432,920.3712463378906,686.6973804573804,0.7461091197597857,686.6973804573804,MATH
488,fp16,fp32,fp16,,0,k,k,n,256,64,128,64,2,1,4096,7168,18432,1401.4464378356934,686.6973804573804,0.4899918840408008,686.6973804573804,MATH
489,fp16,fp32,fp16,,0,k,k,n,256,64,128,64,2,2,4096,7168,18432,1321.5744018554688,686.6973804573804,0.5196055397965249,686.6973804573804,MATH
490,fp16,fp32,fp16,,0,k,k,n,256,128,128,128,2,1,4096,7168,18432,897.4335670471191,686.6973804573804,0.7651790680360475,686.6973804573804,MATH
491,fp16,fp32,fp16,,0,k,k,n,256,128,128,128,2,2,4096,7168,18432,867.5328254699707,686.6973804573804,0.7915520431003567,686.6973804573804,MATH
492,fp16,fp32,fp16,,0,k,k,n,256,192,128,192,2,1,4096,7168,18432,779.0656089782715,686.6973804573804,0.8814371633705791,686.6973804573804,MATH
493,fp16,fp32,fp16,,0,k,k,n,256,192,128,192,2,2,4096,7168,18432,863.0271911621094,686.6973804573804,0.7956845247630123,686.6973804573804,MATH
494,fp16,fp32,fp16,,0,k,k,n,256,256,128,256,2,1,4096,7168,18432,806.5024375915527,686.6973804573804,0.8514510910941019,686.6973804573804,MATH
495,fp16,fp32,fp16,,0,k,k,n,256,256,128,256,2,2,4096,7168,18432,803.6416053771973,686.6973804573804,0.8544821172306928,686.6973804573804,MATH
496,fp16,fp32,fp16,,0,k,k,n,128,64,64,64,2,1,7168,18432,4096,1742.848014831543,686.6973804573804,0.3940087572832643,686.6973804573804,MATH
497,fp16,fp32,fp16,,0,k,k,n,128,64,64,64,2,2,7168,18432,4096,1588.0191802978516,686.6973804573804,0.4324238579590596,686.6973804573804,MATH
498,fp16,fp32,fp16,,0,k,k,n,128,128,64,128,2,1,7168,18432,4096,1057.5872421264648,686.6973804573804,0.6493056582988413,686.6973804573804,MATH
499,fp16,fp32,fp16,,0,k,k,n,128,128,64,128,2,2,7168,18432,4096,1055.5392265319824,686.6973804573804,0.6505654770534232,686.6973804573804,MATH
500,fp16,fp32,fp16,,0,k,k,n,128,192,64,192,2,1,7168,18432,4096,910.3360176086426,686.6973804573804,0.7543339680893463,686.6973804573804,MATH
501,fp16,fp32,fp16,,0,k,k,n,128,192,64,192,2,2,7168,18432,4096,937.7792358398438,686.6973804573804,0.7322591013037276,686.6973804573804,MATH
502,fp16,fp32,fp16,,0,k,k,n,128,256,64,256,2,1,7168,18432,4096,854.0160179138184,686.6973804573804,0.8040802116742937,686.6973804573804,MATH
503,fp16,fp32,fp16,,0,k,k,n,128,256,64,256,2,2,7168,18432,4096,899.2768287658691,686.6973804573804,0.7636106685855298,686.6973804573804,MATH
504,fp16,fp32,fp16,,0,k,k,n,256,64,128,64,2,1,7168,18432,4096,1445.2735900878906,686.6973804573804,0.47513314099624604,686.6973804573804,MATH
505,fp16,fp32,fp16,,0,k,k,n,256,64,128,64,2,2,7168,18432,4096,1278.1567573547363,686.6973804573804,0.5372559950146992,686.6973804573804,MATH
506,fp16,fp32,fp16,,0,k,k,n,256,128,128,128,2,1,7168,18432,4096,895.5904006958008,686.6973804573804,0.7667538418498819,686.6973804573804,MATH
507,fp16,fp32,fp16,,0,k,k,n,256,128,128,128,2,2,7168,18432,4096,850.5344390869141,686.6973804573804,0.8073716347036812,686.6973804573804,MATH
508,fp16,fp32,fp16,,0,k,k,n,256,192,128,192,2,1,7168,18432,4096,734.4128131866455,686.6973804573804,0.9350291390992677,686.6973804573804,MATH
509,fp16,fp32,fp16,,0,k,k,n,256,192,128,192,2,2,7168,18432,4096,799.5391845703125,686.6973804573804,0.8588664492115224,686.6973804573804,MATH
510,fp16,fp32,fp16,,0,k,k,n,256,256,128,256,2,1,7168,18432,4096,727.4496078491211,686.6973804573804,0.9439793121722418,686.6973804573804,MATH
511,fp16,fp32,fp16,,0,k,k,n,256,256,128,256,2,2,7168,18432,4096,801.5872001647949,686.6973804573804,0.8566720879727187,686.6973804573804,MATH
512,fp16,fp32,fp16,,0,k,k,n,128,64,64,64,2,1,18432,7168,4096,1960.9600067138672,686.6973804573804,0.35018428632215326,686.6973804573804,MATH
513,fp16,fp32,fp16,,0,k,k,n,128,64,64,64,2,2,18432,7168,4096,1746.1248397827148,686.6973804573804,0.3932693498265748,686.6973804573804,MATH
514,fp16,fp32,fp16,,0,k,k,n,128,128,64,128,2,1,18432,7168,4096,1245.798397064209,686.6973804573804,0.5512106790919139,686.6973804573804,MATH
515,fp16,fp32,fp16,,0,k,k,n,128,128,64,128,2,2,18432,7168,4096,1104.691219329834,686.6973804573804,0.6216192981727224,686.6973804573804,MATH
516,fp16,fp32,fp16,,0,k,k,n,128,192,64,192,2,1,18432,7168,4096,1009.8688125610352,686.6973804573804,0.6799867189837366,686.6973804573804,MATH
517,fp16,fp32,fp16,,0,k,k,n,128,192,64,192,2,2,18432,7168,4096,988.5696411132812,686.6973804573804,0.6946373344866769,686.6973804573804,MATH
518,fp16,fp32,fp16,,0,k,k,n,128,256,64,256,2,1,18432,7168,4096,914.4319534301758,686.6973804573804,0.7509551453024714,686.6973804573804,MATH
519,fp16,fp32,fp16,,0,k,k,n,128,256,64,256,2,2,18432,7168,4096,915.2511596679688,686.6973804573804,0.7502829941308108,686.6973804573804,MATH
520,fp16,fp32,fp16,,0,k,k,n,256,64,128,64,2,1,18432,7168,4096,1766.1951065063477,686.6973804573804,0.3888004093815625,686.6973804573804,MATH
521,fp16,fp32,fp16,,0,k,k,n,256,64,128,64,2,2,18432,7168,4096,1534.7904205322266,686.6973804573804,0.44742094508203345,686.6973804573804,MATH
522,fp16,fp32,fp16,,0,k,k,n,256,128,128,128,2,1,18432,7168,4096,1125.990390777588,686.6973804573804,0.6098607821894111,686.6973804573804,MATH
523,fp16,fp32,fp16,,0,k,k,n,256,128,128,128,2,2,18432,7168,4096,1002.4959564208984,686.6973804573804,0.6849876810566108,686.6973804573804,MATH
524,fp16,fp32,fp16,,0,k,k,n,256,192,128,192,2,1,18432,7168,4096,947.2000122070312,686.6973804573804,0.7249761102275912,686.6973804573804,MATH
525,fp16,fp32,fp16,,0,k,k,n,256,192,128,192,2,2,18432,7168,4096,838.4511947631836,686.6973804573804,0.8190069794716373,686.6973804573804,MATH
526,fp16,fp32,fp16,,0,k,k,n,256,256,128,256,2,1,18432,7168,4096,805.0687789916992,686.6973804573804,0.8529673468612559,686.6973804573804,MATH
527,fp16,fp32,fp16,,0,k,k,n,256,256,128,256,2,2,18432,7168,4096,807.7312469482422,686.6973804573804,0.8501557703157454,686.6973804573804,MATH
528,fp16,fp32,fp16,,0,k,k,n,128,64,64,64,2,1,4096,257,7168,45.67039906978607,9.574719334719335,0.20964825203495172,9.574719334719335,MATH
529,fp16,fp32,fp16,,0,k,k,n,128,64,64,64,2,2,4096,257,7168,45.46560049057007,9.574719334719335,0.21059260696898105,9.574719334719335,MATH
530,fp16,fp32,fp16,,0,k,k,n,128,128,64,128,2,1,4096,257,7168,37.47200071811676,9.574719334719335,0.2555166297829996,9.574719334719335,MATH
531,fp16,fp32,fp16,,0,k,k,n,128,128,64,128,2,2,4096,257,7168,39.93600010871887,9.574719334719335,0.23975158525274973,9.574719334719335,MATH
532,fp16,fp32,fp16,,0,k,k,n,128,192,64,192,2,1,4096,257,7168,30.105599761009216,9.574719334719335,0.31803782056253466,9.574719334719335,MATH
533,fp16,fp32,fp16,,0,k,k,n,128,192,64,192,2,2,4096,257,7168,29.900801181793213,9.574719334719335,0.3202161466010965,9.574719334719335,MATH
534,fp16,fp32,fp16,,0,k,k,n,128,256,64,256,2,1,4096,257,7168,37.2736006975174,9.574719334719335,0.256876694377344,9.574719334719335,MATH
535,fp16,fp32,fp16,,0,k,k,n,128,256,64,256,2,2,4096,257,7168,36.4544004201889,9.574719334719335,0.26264920625101645,9.574719334719335,MATH
536,fp16,fp32,fp16,,0,k,k,n,256,64,128,64,2,1,4096,257,7168,43.827199935913086,9.574719334719335,0.21846523046692687,9.574719334719335,MATH
537,fp16,fp32,fp16,,0,k,k,n,256,64,128,64,2,2,4096,257,7168,45.06239891052246,9.574719334719335,0.21247691126544874,9.574719334719335,MATH
538,fp16,fp32,fp16,,0,k,k,n,256,128,128,128,2,1,4096,257,7168,35.21920144557953,9.574719334719335,0.27186077314995705,9.574719334719335,MATH
539,fp16,fp32,fp16,,0,k,k,n,256,128,128,128,2,2,4096,257,7168,36.4544004201889,9.574719334719335,0.26264920625101645,9.574719334719335,MATH
540,fp16,fp32,fp16,,0,k,k,n,256,192,128,192,2,1,4096,257,7168,45.46560049057007,9.574719334719335,0.21059260696898105,9.574719334719335,MATH
541,fp16,fp32,fp16,,0,k,k,n,256,192,128,192,2,2,4096,257,7168,45.52960097789765,9.574719334719335,0.21029657912810137,9.574719334719335,MATH
542,fp16,fp32,fp16,,0,k,k,n,256,256,128,256,2,1,4096,257,7168,57.75359869003296,9.574719334719335,0.1657856748651704,9.574719334719335,MATH
543,fp16,fp32,fp16,,0,k,k,n,256,256,128,256,2,2,4096,257,7168,57.79839754104614,9.574719334719335,0.16565717635890764,9.574719334719335,MATH
544,fp16,fp32,fp16,,0,k,k,n,128,64,64,64,2,1,4096,7168,257,70.86079716682434,9.574719334719335,0.135120118846222,9.574719334719335,MATH
545,fp16,fp32,fp16,,0,k,k,n,128,64,64,64,2,2,4096,7168,257,62.25919723510742,9.574719334719335,0.15378803068344468,9.574719334719335,MATH
546,fp16,fp32,fp16,,0,k,k,n,128,128,64,128,2,1,4096,7168,257,55.295997858047485,9.574719334719335,0.17315392986123462,9.574719334719335,MATH
547,fp16,fp32,fp16,,0,k,k,n,128,128,64,128,2,2,4096,7168,257,47.16159999370575,9.574719334719335,0.2030193915388195,9.574719334719335,MATH
548,fp16,fp32,fp16,,0,k,k,n,128,192,64,192,2,1,4096,7168,257,49.561598896980286,9.574719334719335,0.19318826566958694,9.574719334719335,MATH
549,fp16,fp32,fp16,,0,k,k,n,128,192,64,192,2,2,4096,7168,257,47.10400104522705,9.574719334719335,0.20326764440936002,9.574719334719335,MATH
550,fp16,fp32,fp16,,0,k,k,n,128,256,64,256,2,1,4096,7168,257,47.58400022983551,9.574719334719335,0.20121720091779752,9.574719334719335,MATH
551,fp16,fp32,fp16,,0,k,k,n,128,256,64,256,2,2,4096,7168,257,44.65920031070709,9.574719334719335,0.21439522580129552,9.574719334719335,MATH
552,fp16,fp32,fp16,,0,k,k,n,256,64,128,64,2,1,4096,7168,257,64.7167980670929,9.574719334719335,0.14794797673384702,9.574719334719335,MATH
553,fp16,fp32,fp16,,0,k,k,n,256,64,128,64,2,2,4096,7168,257,49.15199875831604,9.574719334719335,0.1947981684691792,9.574719334719335,MATH
554,fp16,fp32,fp16,,0,k,k,n,256,128,128,128,2,1,4096,7168,257,47.308799624443054,9.574719334719335,0.20238770399434022,9.574719334719335,MATH
555,fp16,fp32,fp16,,0,k,k,n,256,128,128,128,2,2,4096,7168,257,39.52639997005463,9.574719334719335,0.24223605848175356,9.574719334719335,MATH
556,fp16,fp32,fp16,,0,k,k,n,256,192,128,192,2,1,4096,7168,257,42.5792008638382,9.574719334719335,0.22486846019815704,9.574719334719335,MATH
557,fp16,fp32,fp16,,0,k,k,n,256,192,128,192,2,2,4096,7168,257,37.68320083618164,9.574719334719335,0.2540845555117,9.574719334719335,MATH
558,fp16,fp32,fp16,,0,k,k,n,256,256,128,256,2,1,4096,7168,257,39.40480053424835,9.574719334719335,0.24298357572949894,9.574719334719335,MATH
559,fp16,fp32,fp16,,0,k,k,n,256,256,128,256,2,2,4096,7168,257,35.22560000419617,9.574719334719335,0.27181139096505863,9.574719334719335,MATH
560,fp16,fp32,fp16,,0,k,k,n,128,64,64,64,2,1,7168,257,4096,41.76639914512634,9.574719334719335,0.22924454898421845,9.574719334719335,MATH
561,fp16,fp32,fp16,,0,k,k,n,128,64,64,64,2,2,7168,257,4096,51.60959959030152,9.574719334719335,0.18552206199481186,9.574719334719335,MATH
562,fp16,fp32,fp16,,0,k,k,n,128,128,64,128,2,1,7168,257,4096,37.2736006975174,9.574719334719335,0.256876694377344,9.574719334719335,MATH
563,fp16,fp32,fp16,,0,k,k,n,128,128,64,128,2,2,7168,257,4096,44.85760033130646,9.574719334719335,0.21344698031109494,9.574719334719335,MATH
564,fp16,fp32,fp16,,0,k,k,n,128,192,64,192,2,1,7168,257,4096,33.17759931087494,9.574719334719335,0.2885898779174459,9.574719334719335,MATH
565,fp16,fp32,fp16,,0,k,k,n,128,192,64,192,2,2,7168,257,4096,33.375999331474304,9.574719334719335,0.2868743865802443,9.574719334719335,MATH
566,fp16,fp32,fp16,,0,k,k,n,128,256,64,256,2,1,7168,257,4096,39.32160139083862,9.574719334719335,0.24349769582248268,9.574719334719335,MATH
567,fp16,fp32,fp16,,0,k,k,n,128,256,64,256,2,2,7168,257,4096,39.72479999065399,9.574719334719335,0.24102624398290157,9.574719334719335,MATH
568,fp16,fp32,fp16,,0,k,k,n,256,64,128,64,2,1,7168,257,4096,37.06879913806915,9.574719334719335,0.2582959134731243,9.574719334719335,MATH
569,fp16,fp32,fp16,,0,k,k,n,256,64,128,64,2,2,7168,257,4096,43.82080137729645,9.574719334719335,0.2184971299881338,9.574719334719335,MATH
570,fp16,fp32,fp16,,0,k,k,n,256,128,128,128,2,1,7168,257,4096,39.30880129337311,9.574719334719335,0.24357698580682727,9.574719334719335,MATH
571,fp16,fp32,fp16,,0,k,k,n,256,128,128,128,2,2,7168,257,4096,39.73119854927063,9.574719334719335,0.2409874276217903,9.574719334719335,MATH
572,fp16,fp32,fp16,,0,k,k,n,256,192,128,192,2,1,7168,257,4096,32.972800731658936,9.574719334719335,0.2903823491562286,9.574719334719335,MATH
573,fp16,fp32,fp16,,0,k,k,n,256,192,128,192,2,2,7168,257,4096,33.11359882354736,9.574719334719335,0.289147651565757,9.574719334719335,MATH
574,fp16,fp32,fp16,,0,k,k,n,256,256,128,256,2,1,7168,257,4096,39.31519985198975,9.574719334719335,0.24353734359141901,9.574719334719335,MATH
575,fp16,fp32,fp16,,0,k,k,n,256,256,128,256,2,2,7168,257,4096,40.13440012931824,9.574719334719335,0.2385663994944075,9.574719334719335,MATH
576,fp16,fp32,fp16,,0,k,k,n,128,64,64,64,2,1,4096,2048,7168,186.36800050735476,76.29970893970894,0.4094034852120328,76.29970893970894,MATH
577,fp16,fp32,fp16,,0,k,k,n,128,64,64,64,2,2,4096,2048,7168,195.3791975975037,76.29970893970894,0.3905211500402016,76.29970893970894,MATH
578,fp16,fp32,fp16,,0,k,k,n,128,128,64,128,2,1,4096,2048,7168,122.06720113754272,76.29970893970894,0.6250631474193961,76.29970893970894,MATH
579,fp16,fp32,fp16,,0,k,k,n,128,128,64,128,2,2,4096,2048,7168,129.4335961341858,76.29970893970894,0.5894892146905032,76.29970893970894,MATH
580,fp16,fp32,fp16,,0,k,k,n,128,192,64,192,2,1,4096,2048,7168,114.27839994430542,76.29970893970894,0.6676651841196085,76.29970893970894,MATH
581,fp16,fp32,fp16,,0,k,k,n,128,192,64,192,2,2,4096,2048,7168,129.4271945953369,76.29970893970894,0.5895183711449921,76.29970893970894,MATH
582,fp16,fp32,fp16,,0,k,k,n,128,256,64,256,2,1,4096,2048,7168,117.55520105361938,76.29970893970894,0.6490543017735732,76.29970893970894,MATH
583,fp16,fp32,fp16,,0,k,k,n,128,256,64,256,2,2,4096,2048,7168,116.7423963546753,76.29970893970894,0.6535732632033923,76.29970893970894,MATH
584,fp16,fp32,fp16,,0,k,k,n,256,64,128,64,2,1,4096,2048,7168,149.09440279006958,76.29970893970894,0.5117543483315181,76.29970893970894,MATH
585,fp16,fp32,fp16,,0,k,k,n,256,64,128,64,2,2,4096,2048,7168,152.37120389938354,76.29970893970894,0.5007488750308261,76.29970893970894,MATH
586,fp16,fp32,fp16,,0,k,k,n,256,128,128,128,2,1,4096,2048,7168,116.32640361785889,76.29970893970894,0.6559104946660201,76.29970893970894,MATH
587,fp16,fp32,fp16,,0,k,k,n,256,128,128,128,2,2,4096,2048,7168,116.32000207901,76.29970893970894,0.6559465919531414,76.29970893970894,MATH
588,fp16,fp32,fp16,,0,k,k,n,256,192,128,192,2,1,4096,2048,7168,124.92159605026244,76.29970893970894,0.6107807725175846,76.29970893970894,MATH
589,fp16,fp32,fp16,,0,k,k,n,256,192,128,192,2,2,4096,2048,7168,124.10880327224731,76.29970893970894,0.6147807965913306,76.29970893970894,MATH
590,fp16,fp32,fp16,,0,k,k,n,256,256,128,256,2,1,4096,2048,7168,114.27199840545654,76.29970893970894,0.667702586848832,76.29970893970894,MATH
591,fp16,fp32,fp16,,0,k,k,n,256,256,128,256,2,2,4096,2048,7168,113.4592056274414,76.29970893970894,0.6724858376873298,76.29970893970894,MATH
592,fp16,fp32,fp16,,0,k,k,n,128,64,64,64,2,1,4096,7168,2048,188.8192057609558,76.29970893970894,0.40408870820219417,76.29970893970894,MATH
593,fp16,fp32,fp16,,0,k,k,n,128,64,64,64,2,2,4096,7168,2048,208.90240669250488,76.29970893970894,0.36524092827718707,76.29970893970894,MATH
594,fp16,fp32,fp16,,0,k,k,n,128,128,64,128,2,1,4096,7168,2048,128.62080335617063,76.29970893970894,0.5932143708387779,76.29970893970894,MATH
595,fp16,fp32,fp16,,0,k,k,n,128,128,64,128,2,2,4096,7168,2048,133.93919467926025,76.29970893970894,0.5696593078853529,76.29970893970894,MATH
596,fp16,fp32,fp16,,0,k,k,n,128,192,64,192,2,1,4096,7168,2048,116.33280515670776,76.29970893970894,0.6558744013516078,76.29970893970894,MATH
597,fp16,fp32,fp16,,0,k,k,n,128,192,64,192,2,2,4096,7168,2048,123.28959703445436,76.29970893970894,0.6188657500306884,76.29970893970894,MATH
598,fp16,fp32,fp16,,0,k,k,n,128,256,64,256,2,1,4096,7168,2048,113.4592056274414,76.29970893970894,0.6724858376873298,76.29970893970894,MATH
599,fp16,fp32,fp16,,0,k,k,n,128,256,64,256,2,2,4096,7168,2048,117.97120571136476,76.29970893970894,0.6467655262114406,76.29970893970894,MATH
600,fp16,fp32,fp16,,0,k,k,n,256,64,128,64,2,1,4096,7168,2048,156.87040090560913,76.29970893970894,0.4863869060015944,76.29970893970894,MATH
601,fp16,fp32,fp16,,0,k,k,n,256,64,128,64,2,2,4096,7168,2048,169.57440376281738,76.29970893970894,0.4499482660509828,76.29970893970894,MATH
602,fp16,fp32,fp16,,0,k,k,n,256,128,128,128,2,1,4096,7168,2048,114.6880030632019,76.29970893970894,0.6652806475116838,76.29970893970894,MATH
603,fp16,fp32,fp16,,0,k,k,n,256,128,128,128,2,2,4096,7168,2048,119.60959434509276,76.29970893970894,0.637906259589612,76.29970893970894,MATH
604,fp16,fp32,fp16,,0,k,k,n,256,192,128,192,2,1,4096,7168,2048,113.04960250854492,76.29970893970894,0.6749223990764742,76.29970893970894,MATH
605,fp16,fp32,fp16,,0,k,k,n,256,192,128,192,2,2,4096,7168,2048,119.60320472717284,76.29970893970894,0.6379403387539354,76.29970893970894,MATH
606,fp16,fp32,fp16,,0,k,k,n,256,256,128,256,2,1,4096,7168,2048,112.63999938964844,76.29970893970894,0.6773766810471133,76.29970893970894,MATH
607,fp16,fp32,fp16,,0,k,k,n,256,256,128,256,2,2,4096,7168,2048,113.86879682540894,76.29970893970894,0.6700668757982631,76.29970893970894,MATH
608,fp16,fp32,fp16,,0,k,k,n,128,64,64,64,2,1,7168,2048,4096,200.7040023803711,76.29970893970894,0.3801603756516371,76.29970893970894,MATH
609,fp16,fp32,fp16,,0,k,k,n,128,64,64,64,2,2,7168,2048,4096,200.2943992614746,76.29970893970894,0.3809378056552813,76.29970893970894,MATH
610,fp16,fp32,fp16,,0,k,k,n,128,128,64,128,2,1,7168,2048,4096,130.25280237197876,76.29970893970894,0.5857817071897661,76.29970893970894,MATH
611,fp16,fp32,fp16,,0,k,k,n,128,128,64,128,2,2,7168,2048,4096,132.7232003211975,76.29970893970894,0.5748784594935882,76.29970893970894,MATH
612,fp16,fp32,fp16,,0,k,k,n,128,192,64,192,2,1,7168,2048,4096,119.60320472717284,76.29970893970894,0.6379403387539354,76.29970893970894,MATH
613,fp16,fp32,fp16,,0,k,k,n,128,192,64,192,2,2,7168,2048,4096,134.33599472045898,76.29970893970894,0.5679766550914497,76.29970893970894,MATH
614,fp16,fp32,fp16,,0,k,k,n,128,256,64,256,2,1,7168,2048,4096,117.96480417251588,76.29970893970894,0.6468006239227554,76.29970893970894,MATH
615,fp16,fp32,fp16,,0,k,k,n,128,256,64,256,2,2,7168,2048,4096,118.3743953704834,76.29970893970894,0.6445626074871106,76.29970893970894,MATH
616,fp16,fp32,fp16,,0,k,k,n,256,64,128,64,2,1,7168,2048,4096,173.26079607009888,76.29970893970894,0.44037491844859783,76.29970893970894,MATH
617,fp16,fp32,fp16,,0,k,k,n,256,64,128,64,2,2,7168,2048,4096,162.61119842529297,76.29970893970894,0.46921558710953504,76.29970893970894,MATH
618,fp16,fp32,fp16,,0,k,k,n,256,128,128,128,2,1,7168,2048,4096,119.60320472717284,76.29970893970894,0.6379403387539354,76.29970893970894,MATH
619,fp16,fp32,fp16,,0,k,k,n,256,128,128,128,2,2,7168,2048,4096,119.60320472717284,76.29970893970894,0.6379403387539354,76.29970893970894,MATH
620,fp16,fp32,fp16,,0,k,k,n,256,192,128,192,2,1,7168,2048,4096,122.06079959869383,76.29970893970894,0.625095929164513,76.29970893970894,MATH
621,fp16,fp32,fp16,,0,k,k,n,256,192,128,192,2,2,7168,2048,4096,138.44480514526367,76.29970893970894,0.5511200572650683,76.29970893970894,MATH
622,fp16,fp32,fp16,,0,k,k,n,256,256,128,256,2,1,7168,2048,4096,125.3376007080078,76.29970893970894,0.6087535464912898,76.29970893970894,MATH
623,fp16,fp32,fp16,,0,k,k,n,256,256,128,256,2,2,7168,2048,4096,125.3376007080078,76.29970893970894,0.6087535464912898,76.29970893970894,MATH
624,fp16,fp32,fp16,,0,k,k,n,128,64,64,64,2,1,2048,7168,4096,182.6751947402954,76.29970893970894,0.4176796365165082,76.29970893970894,MATH
625,fp16,fp32,fp16,,0,k,k,n,128,64,64,64,2,2,2048,7168,4096,200.2943992614746,76.29970893970894,0.3809378056552813,76.29970893970894,MATH
626,fp16,fp32,fp16,,0,k,k,n,128,128,64,128,2,1,2048,7168,4096,127.38560438156128,76.29970893970894,0.5989664947631486,76.29970893970894,MATH
627,fp16,fp32,fp16,,0,k,k,n,128,128,64,128,2,2,2048,7168,4096,129.4335961341858,76.29970893970894,0.5894892146905032,76.29970893970894,MATH
628,fp16,fp32,fp16,,0,k,k,n,128,192,64,192,2,1,2048,7168,4096,117.1455979347229,76.29970893970894,0.6513237397296436,76.29970893970894,MATH
629,fp16,fp32,fp16,,0,k,k,n,128,192,64,192,2,2,2048,7168,4096,123.28959703445436,76.29970893970894,0.6188657500306884,76.29970893970894,MATH
630,fp16,fp32,fp16,,0,k,k,n,128,256,64,256,2,1,2048,7168,4096,115.09759426116943,76.29970893970894,0.6629131514823523,76.29970893970894,MATH
631,fp16,fp32,fp16,,0,k,k,n,128,256,64,256,2,2,2048,7168,4096,116.32640361785889,76.29970893970894,0.6559104946660201,76.29970893970894,MATH
632,fp16,fp32,fp16,,0,k,k,n,256,64,128,64,2,1,2048,7168,4096,160.15360355377197,76.29970893970894,0.47641581111280534,76.29970893970894,MATH
633,fp16,fp32,fp16,,0,k,k,n,256,64,128,64,2,2,2048,7168,4096,156.05759620666504,76.29970893970894,0.4889201858438613,76.29970893970894,MATH
634,fp16,fp32,fp16,,0,k,k,n,256,128,128,128,2,1,2048,7168,4096,117.55520105361938,76.29970893970894,0.6490543017735732,76.29970893970894,MATH
635,fp16,fp32,fp16,,0,k,k,n,256,128,128,128,2,2,2048,7168,4096,116.73599481582642,76.29970893970894,0.6536091036880823,76.29970893970894,MATH
636,fp16,fp32,fp16,,0,k,k,n,256,192,128,192,2,1,2048,7168,4096,122.47040271759032,76.29970893970894,0.623005291455207,76.29970893970894,MATH
637,fp16,fp32,fp16,,0,k,k,n,256,192,128,192,2,2,2048,7168,4096,119.19360160827635,76.29970893970894,0.6401325902581919,76.29970893970894,MATH
638,fp16,fp32,fp16,,0,k,k,n,256,256,128,256,2,1,2048,7168,4096,123.69920015335084,76.29970893970894,0.6168165100915738,76.29970893970894,MATH
639,fp16,fp32,fp16,,0,k,k,n,256,256,128,256,2,2,2048,7168,4096,125.3376007080078,76.29970893970894,0.6087535464912898,76.29970893970894,MATH
