results/dsv3_fp16.csv
in_dtype,acc_dtype,out_dtype,sf_dtype,sf_vec_size,a_major,b_major,c_major,mma_m,mma_n,cta_m,cta_n,cluster_m,cluster_n,m,n,k,runtime_us
fp16,fp32,fp16,,0,k,k,n,128,64,64,64,2,1,4096,7168,128000,21252.096557617188
fp16,fp32,fp16,,0,k,k,n,128,64,64,64,2,2,4096,7168,128000,12189.491271972656
fp16,fp32,fp16,,0,k,k,n,128,128,64,128,2,1,4096,7168,128000,12638.617706298828
fp16,fp32,fp16,,0,k,k,n,128,128,64,128,2,2,4096,7168,128000,8048.0255126953125
fp16,fp32,fp16,,0,k,k,n,128,192,64,192,2,1,4096,7168,128000,9741.926574707031
fp16,fp32,fp16,,0,k,k,n,128,192,64,192,2,2,4096,7168,128000,6977.33154296875
fp16,fp32,fp16,,0,k,k,n,128,256,64,256,2,1,4096,7168,128000,7021.1517333984375
fp16,fp32,fp16,,0,k,k,n,128,256,64,256,2,2,4096,7168,128000,6410.841369628906
fp16,fp32,fp16,,0,k,k,n,256,64,128,64,2,1,4096,7168,128000,16423.936462402344
fp16,fp32,fp16,,0,k,k,n,256,64,128,64,2,2,4096,7168,128000,9407.481384277344
fp16,fp32,fp16,,0,k,k,n,256,128,128,128,2,1,4096,7168,128000,7875.583648681641
fp16,fp32,fp16,,0,k,k,n,256,128,128,128,2,2,4096,7168,128000,6016.819381713867
fp16,fp32,fp16,,0,k,k,n,256,192,128,192,2,1,4096,7168,128000,5463.0401611328125
fp16,fp32,fp16,,0,k,k,n,256,192,128,192,2,2,4096,7168,128000,5936.742401123047
fp16,fp32,fp16,,0,k,k,n,256,256,128,256,2,1,4096,7168,128000,5575.680160522461
fp16,fp32,fp16,,0,k,k,n,256,256,128,256,2,2,4096,7168,128000,5507.680130004883
fp16,fp32,fp16,,0,k,k,n,128,64,64,64,2,1,4096,128000,7168,12412.108612060547
fp16,fp32,fp16,,0,k,k,n,128,64,64,64,2,2,4096,128000,7168,10512.569427490234
fp16,fp32,fp16,,0,k,k,n,128,128,64,128,2,1,4096,128000,7168,8172.544097900391
fp16,fp32,fp16,,0,k,k,n,128,128,64,128,2,2,4096,128000,7168,7609.958648681641
fp16,fp32,fp16,,0,k,k,n,128,192,64,192,2,1,4096,128000,7168,6789.119720458984
fp16,fp32,fp16,,0,k,k,n,128,192,64,192,2,2,4096,128000,7168,6863.667297363281
fp16,fp32,fp16,,0,k,k,n,128,256,64,256,2,1,4096,128000,7168,6280.192184448242
fp16,fp32,fp16,,0,k,k,n,128,256,64,256,2,2,4096,128000,7168,6401.023864746094
fp16,fp32,fp16,,0,k,k,n,256,64,128,64,2,1,4096,128000,7168,10153.177642822266
fp16,fp32,fp16,,0,k,k,n,256,64,128,64,2,2,4096,128000,7168,8670.822143554688
fp16,fp32,fp16,,0,k,k,n,256,128,128,128,2,1,4096,128000,7168,6233.087921142578
fp16,fp32,fp16,,0,k,k,n,256,128,128,128,2,2,4096,128000,7168,5682.790374755859
fp16,fp32,fp16,,0,k,k,n,256,192,128,192,2,1,4096,128000,7168,4924.211120605469
fp16,fp32,fp16,,0,k,k,n,256,192,128,192,2,2,4096,128000,7168,5431.084823608398
fp16,fp32,fp16,,0,k,k,n,256,256,128,256,2,1,4096,128000,7168,4841.881561279297
fp16,fp32,fp16,,0,k,k,n,256,256,128,256,2,2,4096,128000,7168,5418.393707275391
fp16,fp32,fp16,,0,k,k,n,128,64,64,64,2,1,128000,7168,4096,17461.23504638672
fp16,fp32,fp16,,0,k,k,n,128,64,64,64,2,2,128000,7168,4096,12197.273254394531
fp16,fp32,fp16,,0,k,k,n,128,128,64,128,2,1,128000,7168,4096,9418.547058105469
fp16,fp32,fp16,,0,k,k,n,128,128,64,128,2,2,128000,7168,4096,7710.720062255859
fp16,fp32,fp16,,0,k,k,n,128,192,64,192,2,1,128000,7168,4096,7125.196838378906
fp16,fp32,fp16,,0,k,k,n,128,192,64,192,2,2,128000,7168,4096,6805.101013183594
fp16,fp32,fp16,,0,k,k,n,128,256,64,256,2,1,128000,7168,4096,6376.038360595703
fp16,fp32,fp16,,0,k,k,n,128,256,64,256,2,2,128000,7168,4096,6318.694305419922
fp16,fp32,fp16,,0,k,k,n,256,64,128,64,2,1,128000,7168,4096,16603.135681152344
fp16,fp32,fp16,,0,k,k,n,256,64,128,64,2,2,128000,7168,4096,11055.923461914062
fp16,fp32,fp16,,0,k,k,n,256,128,128,128,2,1,128000,7168,4096,9229.106903076172
fp16,fp32,fp16,,0,k,k,n,256,128,128,128,2,2,128000,7168,4096,6815.7440185546875
fp16,fp32,fp16,,0,k,k,n,256,192,128,192,2,1,128000,7168,4096,6778.880310058594
fp16,fp32,fp16,,0,k,k,n,256,192,128,192,2,2,128000,7168,4096,5652.275085449219
fp16,fp32,fp16,,0,k,k,n,256,256,128,256,2,1,128000,7168,4096,5395.865631103516
fp16,fp32,fp16,,0,k,k,n,256,256,128,256,2,2,128000,7168,4096,5483.520126342773
fp16,fp32,fp16,,0,k,k,n,128,64,64,64,2,1,4096,512,7168,60.416001081466675
fp16,fp32,fp16,,0,k,k,n,128,64,64,64,2,2,4096,512,7168,59.39199924468994
fp16,fp32,fp16,,0,k,k,n,128,128,64,128,2,1,4096,512,7168,40.95999896526337
fp16,fp32,fp16,,0,k,k,n,128,128,64,128,2,2,4096,512,7168,40.95999896526337
fp16,fp32,fp16,,0,k,k,n,128,192,64,192,2,1,4096,512,7168,48.742398619651794
fp16,fp32,fp16,,0,k,k,n,128,192,64,192,2,2,4096,512,7168,50.79039931297302
fp16,fp32,fp16,,0,k,k,n,128,256,64,256,2,1,4096,512,7168,37.27999925613403
fp16,fp32,fp16,,0,k,k,n,128,256,64,256,2,2,4096,512,7168,37.27999925613403
fp16,fp32,fp16,,0,k,k,n,256,64,128,64,2,1,4096,512,7168,48.127999901771545
fp16,fp32,fp16,,0,k,k,n,256,64,128,64,2,2,4096,512,7168,47.7183997631073
fp16,fp32,fp16,,0,k,k,n,256,128,128,128,2,1,4096,512,7168,37.273600697517395
fp16,fp32,fp16,,0,k,k,n,256,128,128,128,2,2,4096,512,7168,37.47200071811676
fp16,fp32,fp16,,0,k,k,n,256,192,128,192,2,1,4096,512,7168,49.215999245643616
fp16,fp32,fp16,,0,k,k,n,256,192,128,192,2,2,4096,512,7168,49.15199875831604
fp16,fp32,fp16,,0,k,k,n,256,256,128,256,2,1,4096,512,7168,59.39199924468994
fp16,fp32,fp16,,0,k,k,n,256,256,128,256,2,2,4096,512,7168,57.8112006187439
fp16,fp32,fp16,,0,k,k,n,128,64,64,64,2,1,4096,7168,512,72.08960056304932
fp16,fp32,fp16,,0,k,k,n,128,64,64,64,2,2,4096,7168,512,79.04639840126038
fp16,fp32,fp16,,0,k,k,n,128,128,64,128,2,1,4096,7168,512,48.339200019836426
fp16,fp32,fp16,,0,k,k,n,128,128,64,128,2,2,4096,7168,512,49.23520088195801
fp16,fp32,fp16,,0,k,k,n,128,192,64,192,2,1,4096,7168,512,45.05600035190582
fp16,fp32,fp16,,0,k,k,n,128,192,64,192,2,2,4096,7168,512,45.67039906978607
fp16,fp32,fp16,,0,k,k,n,128,256,64,256,2,1,4096,7168,512,43.07839870452881
fp16,fp32,fp16,,0,k,k,n,128,256,64,256,2,2,4096,7168,512,43.41759979724884
fp16,fp32,fp16,,0,k,k,n,256,64,128,64,2,1,4096,7168,512,53.248000144958496
fp16,fp32,fp16,,0,k,k,n,256,64,128,64,2,2,4096,7168,512,55.28320074081421
fp16,fp32,fp16,,0,k,k,n,256,128,128,128,2,1,4096,7168,512,41.58720076084137
fp16,fp32,fp16,,0,k,k,n,256,128,128,128,2,2,4096,7168,512,41.42720103263855
fp16,fp32,fp16,,0,k,k,n,256,192,128,192,2,1,4096,7168,512,39.38559889793396
fp16,fp32,fp16,,0,k,k,n,256,192,128,192,2,2,4096,7168,512,39.32160139083862
fp16,fp32,fp16,,0,k,k,n,256,256,128,256,2,1,4096,7168,512,38.91200125217438
fp16,fp32,fp16,,0,k,k,n,256,256,128,256,2,2,4096,7168,512,38.91200125217438
fp16,fp32,fp16,,0,k,k,n,128,64,64,64,2,1,7168,512,4096,62.23999857902527
fp16,fp32,fp16,,0,k,k,n,128,64,64,64,2,2,7168,512,4096,60.00000238418579
fp16,fp32,fp16,,0,k,k,n,128,128,64,128,2,1,7168,512,4096,46.48959934711456
fp16,fp32,fp16,,0,k,k,n,128,128,64,128,2,2,7168,512,4096,45.45919895172119
fp16,fp32,fp16,,0,k,k,n,128,192,64,192,2,1,7168,512,4096,45.875200629234314
fp16,fp32,fp16,,0,k,k,n,128,192,64,192,2,2,7168,512,4096,57.13279843330383
fp16,fp32,fp16,,0,k,k,n,128,256,64,256,2,1,7168,512,4096,40.95999896526337
fp16,fp32,fp16,,0,k,k,n,128,256,64,256,2,2,7168,512,4096,40.97279906272888
fp16,fp32,fp16,,0,k,k,n,256,64,128,64,2,1,7168,512,4096,58.36799740791321
fp16,fp32,fp16,,0,k,k,n,256,64,128,64,2,2,7168,512,4096,55.295997858047485
fp16,fp32,fp16,,0,k,k,n,256,128,128,128,2,1,7168,512,4096,41.785600781440735
fp16,fp32,fp16,,0,k,k,n,256,128,128,128,2,2,7168,512,4096,41.37600064277649
fp16,fp32,fp16,,0,k,k,n,256,192,128,192,2,1,7168,512,4096,53.248000144958496
fp16,fp32,fp16,,0,k,k,n,256,192,128,192,2,2,7168,512,4096,54.476797580718994
fp16,fp32,fp16,,0,k,k,n,256,256,128,256,2,1,7168,512,4096,41.363200545310974
fp16,fp32,fp16,,0,k,k,n,256,256,128,256,2,2,7168,512,4096,41.574400663375854
fp16,fp32,fp16,,0,k,k,n,128,64,64,64,2,1,4096,1536,7168,146.63679599761963
fp16,fp32,fp16,,0,k,k,n,128,64,64,64,2,2,4096,1536,7168,152.37760543823242
fp16,fp32,fp16,,0,k,k,n,128,128,64,128,2,1,4096,1536,7168,102.80319452285767
fp16,fp32,fp16,,0,k,k,n,128,128,64,128,2,2,4096,1536,7168,99.94239807128906
fp16,fp32,fp16,,0,k,k,n,128,192,64,192,2,1,4096,1536,7168,92.57599711418152
fp16,fp32,fp16,,0,k,k,n,128,192,64,192,2,2,4096,1536,7168,92.97279715538025
fp16,fp32,fp16,,0,k,k,n,128,256,64,256,2,1,4096,1536,7168,91.33440256118774
fp16,fp32,fp16,,0,k,k,n,128,256,64,256,2,2,4096,1536,7168,91.75040125846863
fp16,fp32,fp16,,0,k,k,n,256,64,128,64,2,1,4096,1536,7168,125.7472038269043
fp16,fp32,fp16,,0,k,k,n,256,64,128,64,2,2,4096,1536,7168,119.20640468597412
fp16,fp32,fp16,,0,k,k,n,256,128,128,128,2,1,4096,1536,7168,91.34079813957214
fp16,fp32,fp16,,0,k,k,n,256,128,128,128,2,2,4096,1536,7168,91.34719967842102
fp16,fp32,fp16,,0,k,k,n,256,192,128,192,2,1,4096,1536,7168,89.29920196533203
fp16,fp32,fp16,,0,k,k,n,256,192,128,192,2,2,4096,1536,7168,89.9071991443634
fp16,fp32,fp16,,0,k,k,n,256,256,128,256,2,1,4096,1536,7168,110.18240451812744
fp16,fp32,fp16,,0,k,k,n,256,256,128,256,2,2,4096,1536,7168,108.95359516143799
fp16,fp32,fp16,,0,k,k,n,128,64,64,64,2,1,4096,7168,1536,152.37120389938354
fp16,fp32,fp16,,0,k,k,n,128,64,64,64,2,2,4096,7168,1536,167.53920316696167
fp16,fp32,fp16,,0,k,k,n,128,128,64,128,2,1,4096,7168,1536,103.62880229949951
fp16,fp32,fp16,,0,k,k,n,128,128,64,128,2,2,4096,7168,1536,107.71839618682861
fp16,fp32,fp16,,0,k,k,n,128,192,64,192,2,1,4096,7168,1536,93.094402551651
fp16,fp32,fp16,,0,k,k,n,128,192,64,192,2,2,4096,7168,1536,98.31039905548096
fp16,fp32,fp16,,0,k,k,n,128,256,64,256,2,1,4096,7168,1536,89.2799973487854
fp16,fp32,fp16,,0,k,k,n,128,256,64,256,2,2,4096,7168,1536,95.23199796676636
fp16,fp32,fp16,,0,k,k,n,256,64,128,64,2,1,4096,7168,1536,121.65119647979736
fp16,fp32,fp16,,0,k,k,n,256,64,128,64,2,2,4096,7168,1536,136.00000143051147
fp16,fp32,fp16,,0,k,k,n,256,128,128,128,2,1,4096,7168,1536,89.4976019859314
fp16,fp32,fp16,,0,k,k,n,256,128,128,128,2,2,4096,7168,1536,96.26240134239197
fp16,fp32,fp16,,0,k,k,n,256,192,128,192,2,1,4096,7168,1536,89.08799886703491
fp16,fp32,fp16,,0,k,k,n,256,192,128,192,2,2,4096,7168,1536,93.79839897155762
fp16,fp32,fp16,,0,k,k,n,256,256,128,256,2,1,4096,7168,1536,90.11200070381165
fp16,fp32,fp16,,0,k,k,n,256,256,128,256,2,2,4096,7168,1536,89.4976019859314
fp16,fp32,fp16,,0,k,k,n,128,64,64,64,2,1,7168,1536,4096,153.19039821624756
fp16,fp32,fp16,,0,k,k,n,128,64,64,64,2,2,7168,1536,4096,154.82879877090454
fp16,fp32,fp16,,0,k,k,n,128,128,64,128,2,1,7168,1536,4096,103.21919918060303
fp16,fp32,fp16,,0,k,k,n,128,128,64,128,2,2,7168,1536,4096,105.67679405212402
fp16,fp32,fp16,,0,k,k,n,128,192,64,192,2,1,7168,1536,4096,95.23839950561523
fp16,fp32,fp16,,0,k,k,n,128,192,64,192,2,2,7168,1536,4096,94.62400078773499
fp16,fp32,fp16,,0,k,k,n,128,256,64,256,2,1,7168,1536,4096,91.09119772911072
fp16,fp32,fp16,,0,k,k,n,128,256,64,256,2,2,7168,1536,4096,101.58079862594604
fp16,fp32,fp16,,0,k,k,n,256,64,128,64,2,1,7168,1536,4096,133.52960348129272
fp16,fp32,fp16,,0,k,k,n,256,64,128,64,2,2,7168,1536,4096,128.61440181732178
fp16,fp32,fp16,,0,k,k,n,256,128,128,128,2,1,7168,1536,4096,90.12479782104492
fp16,fp32,fp16,,0,k,k,n,256,128,128,128,2,2,7168,1536,4096,101.99040174484253
fp16,fp32,fp16,,0,k,k,n,256,192,128,192,2,1,7168,1536,4096,97.48479723930359
fp16,fp32,fp16,,0,k,k,n,256,192,128,192,2,2,7168,1536,4096,98.69440197944641
fp16,fp32,fp16,,0,k,k,n,256,256,128,256,2,1,7168,1536,4096,98.71360063552856
fp16,fp32,fp16,,0,k,k,n,256,256,128,256,2,2,7168,1536,4096,98.30399751663208
fp16,fp32,fp16,,0,k,k,n,128,64,64,64,2,1,4096,16384,512,148.69120121002197
fp16,fp32,fp16,,0,k,k,n,128,64,64,64,2,2,4096,16384,512,165.07519483566284
fp16,fp32,fp16,,0,k,k,n,128,128,64,128,2,1,4096,16384,512,97.48479723930359
fp16,fp32,fp16,,0,k,k,n,128,128,64,128,2,2,4096,16384,512,97.89440035820007
fp16,fp32,fp16,,0,k,k,n,128,192,64,192,2,1,4096,16384,512,88.0511999130249
fp16,fp32,fp16,,0,k,k,n,128,192,64,192,2,2,4096,16384,512,87.24480271339417
fp16,fp32,fp16,,0,k,k,n,128,256,64,256,2,1,4096,16384,512,82.7455997467041
fp16,fp32,fp16,,0,k,k,n,128,256,64,256,2,2,4096,16384,512,83.92959833145142
fp16,fp32,fp16,,0,k,k,n,256,64,128,64,2,1,4096,16384,512,107.32159614562988
fp16,fp32,fp16,,0,k,k,n,256,64,128,64,2,2,4096,16384,512,112.23679780960083
fp16,fp32,fp16,,0,k,k,n,256,128,128,128,2,1,4096,16384,512,81.08159899711609
fp16,fp32,fp16,,0,k,k,n,256,128,128,128,2,2,4096,16384,512,79.6671986579895
fp16,fp32,fp16,,0,k,k,n,256,192,128,192,2,1,4096,16384,512,74.54720139503479
fp16,fp32,fp16,,0,k,k,n,256,192,128,192,2,2,4096,16384,512,74.9567985534668
fp16,fp32,fp16,,0,k,k,n,256,256,128,256,2,1,4096,16384,512,73.31200242042542
fp16,fp32,fp16,,0,k,k,n,256,256,128,256,2,2,4096,16384,512,72.70399928092957
fp16,fp32,fp16,,0,k,k,n,128,64,64,64,2,1,4096,512,16384,134.75840091705322
fp16,fp32,fp16,,0,k,k,n,128,64,64,64,2,2,4096,512,16384,119.19360160827637
fp16,fp32,fp16,,0,k,k,n,128,128,64,128,2,1,4096,512,16384,82.12479948997498
fp16,fp32,fp16,,0,k,k,n,128,128,64,128,2,2,4096,512,16384,80.07680177688599
fp16,fp32,fp16,,0,k,k,n,128,192,64,192,2,1,4096,512,16384,98.30399751663208
fp16,fp32,fp16,,0,k,k,n,128,192,64,192,2,2,4096,512,16384,99.53280091285706
fp16,fp32,fp16,,0,k,k,n,128,256,64,256,2,1,4096,512,16384,73.10720086097717
fp16,fp32,fp16,,0,k,k,n,128,256,64,256,2,2,4096,512,16384,72.70399928092957
fp16,fp32,fp16,,0,k,k,n,256,64,128,64,2,1,4096,512,16384,96.25599980354309
fp16,fp32,fp16,,0,k,k,n,256,64,128,64,2,2,4096,512,16384,96.24959826469421
fp16,fp32,fp16,,0,k,k,n,256,128,128,128,2,1,4096,512,16384,72.28800058364868
fp16,fp32,fp16,,0,k,k,n,256,128,128,128,2,2,4096,512,16384,71.27040028572083
fp16,fp32,fp16,,0,k,k,n,256,192,128,192,2,1,4096,512,16384,96.66560292243958
fp16,fp32,fp16,,0,k,k,n,256,192,128,192,2,2,4096,512,16384,97.07520008087158
fp16,fp32,fp16,,0,k,k,n,256,256,128,256,2,1,4096,512,16384,118.78399848937988
fp16,fp32,fp16,,0,k,k,n,256,256,128,256,2,2,4096,512,16384,117.56160259246826
fp16,fp32,fp16,,0,k,k,n,128,64,64,64,2,1,512,16384,4096,109.77280139923096
fp16,fp32,fp16,,0,k,k,n,128,64,64,64,2,2,512,16384,4096,121.65759801864624
fp16,fp32,fp16,,0,k,k,n,128,128,64,128,2,1,512,16384,4096,79.25119996070862
fp16,fp32,fp16,,0,k,k,n,128,128,64,128,2,2,512,16384,4096,81.10079765319824
fp16,fp32,fp16,,0,k,k,n,128,192,64,192,2,1,512,16384,4096,74.1375982761383
fp16,fp32,fp16,,0,k,k,n,128,192,64,192,2,2,512,16384,4096,80.28159737586975
fp16,fp32,fp16,,0,k,k,n,128,256,64,256,2,1,512,16384,4096,74.1375982761383
fp16,fp32,fp16,,0,k,k,n,128,256,64,256,2,2,512,16384,4096,74.1375982761383
fp16,fp32,fp16,,0,k,k,n,256,64,128,64,2,1,512,16384,4096,92.56960153579712
fp16,fp32,fp16,,0,k,k,n,256,64,128,64,2,2,512,16384,4096,96.67199850082397
fp16,fp32,fp16,,0,k,k,n,256,128,128,128,2,1,512,16384,4096,74.54079985618591
fp16,fp32,fp16,,0,k,k,n,256,128,128,128,2,2,512,16384,4096,73.31200242042542
fp16,fp32,fp16,,0,k,k,n,256,192,128,192,2,1,512,16384,4096,79.2639970779419
fp16,fp32,fp16,,0,k,k,n,256,192,128,192,2,2,512,16384,4096,78.44480276107788
fp16,fp32,fp16,,0,k,k,n,256,256,128,256,2,1,512,16384,4096,72.90880084037781
fp16,fp32,fp16,,0,k,k,n,256,256,128,256,2,2,512,16384,4096,72.08960056304932
fp16,fp32,fp16,,0,k,k,n,128,64,64,64,2,1,4096,16384,1536,319.26400661468506
fp16,fp32,fp16,,0,k,k,n,128,64,64,64,2,2,4096,16384,1536,356.15360736846924
fp16,fp32,fp16,,0,k,k,n,128,128,64,128,2,1,4096,16384,1536,205.62560558319092
fp16,fp32,fp16,,0,k,k,n,128,128,64,128,2,2,4096,16384,1536,214.63680267333984
fp16,fp32,fp16,,0,k,k,n,128,192,64,192,2,1,4096,16384,1536,185.13920307159424
fp16,fp32,fp16,,0,k,k,n,128,192,64,192,2,2,4096,16384,1536,194.96959447860718
fp16,fp32,fp16,,0,k,k,n,128,256,64,256,2,1,4096,16384,1536,175.30879974365234
fp16,fp32,fp16,,0,k,k,n,128,256,64,256,2,2,4096,16384,1536,188.00640106201172
fp16,fp32,fp16,,0,k,k,n,256,64,128,64,2,1,4096,16384,1536,260.915207862854
fp16,fp32,fp16,,0,k,k,n,256,64,128,64,2,2,4096,16384,1536,288.35840225219727
fp16,fp32,fp16,,0,k,k,n,256,128,128,128,2,1,4096,16384,1536,178.5856008529663
fp16,fp32,fp16,,0,k,k,n,256,128,128,128,2,2,4096,16384,1536,188.0128026008606
fp16,fp32,fp16,,0,k,k,n,256,192,128,192,2,1,4096,16384,1536,166.71359539031982
fp16,fp32,fp16,,0,k,k,n,256,192,128,192,2,2,4096,16384,1536,176.12799406051636
fp16,fp32,fp16,,0,k,k,n,256,256,128,256,2,1,4096,16384,1536,164.24959897994995
fp16,fp32,fp16,,0,k,k,n,256,256,128,256,2,2,4096,16384,1536,178.17599773406982
fp16,fp32,fp16,,0,k,k,n,128,64,64,64,2,1,4096,1536,16384,368.63999366760254
fp16,fp32,fp16,,0,k,k,n,128,64,64,64,2,2,4096,1536,16384,334.23359394073486
fp16,fp32,fp16,,0,k,k,n,128,128,64,128,2,1,4096,1536,16384,234.6816062927246
fp16,fp32,fp16,,0,k,k,n,128,128,64,128,2,2,4096,1536,16384,219.9552059173584
fp16,fp32,fp16,,0,k,k,n,128,192,64,192,2,1,4096,1536,16384,193.74079704284668
fp16,fp32,fp16,,0,k,k,n,128,192,64,192,2,2,4096,1536,16384,189.23519849777222
fp16,fp32,fp16,,0,k,k,n,128,256,64,256,2,1,4096,1536,16384,183.50720405578613
fp16,fp32,fp16,,0,k,k,n,128,256,64,256,2,2,4096,1536,16384,181.86880350112915
fp16,fp32,fp16,,0,k,k,n,256,64,128,64,2,1,4096,1536,16384,278.52799892425537
fp16,fp32,fp16,,0,k,k,n,256,64,128,64,2,2,4096,1536,16384,264.6080017089844
fp16,fp32,fp16,,0,k,k,n,256,128,128,128,2,1,4096,1536,16384,182.27200508117676
fp16,fp32,fp16,,0,k,k,n,256,128,128,128,2,2,4096,1536,16384,181.04959726333618
fp16,fp32,fp16,,0,k,k,n,256,192,128,192,2,1,4096,1536,16384,178.17599773406982
fp16,fp32,fp16,,0,k,k,n,256,192,128,192,2,2,4096,1536,16384,176.53759717941284
fp16,fp32,fp16,,0,k,k,n,256,256,128,256,2,1,4096,1536,16384,228.55679988861084
fp16,fp32,fp16,,0,k,k,n,256,256,128,256,2,2,4096,1536,16384,224.05118942260742
fp16,fp32,fp16,,0,k,k,n,128,64,64,64,2,1,1536,16384,4096,319.28319931030273
fp16,fp32,fp16,,0,k,k,n,128,64,64,64,2,2,1536,16384,4096,320.5120086669922
fp16,fp32,fp16,,0,k,k,n,128,128,64,128,2,1,1536,16384,4096,222.82240390777588
fp16,fp32,fp16,,0,k,k,n,128,128,64,128,2,2,1536,16384,4096,209.3183994293213
fp16,fp32,fp16,,0,k,k,n,128,192,64,192,2,1,1536,16384,4096,183.91679525375366
fp16,fp32,fp16,,0,k,k,n,128,192,64,192,2,2,1536,16384,4096,190.05440473556519
fp16,fp32,fp16,,0,k,k,n,128,256,64,256,2,1,1536,16384,4096,178.9952039718628
fp16,fp32,fp16,,0,k,k,n,128,256,64,256,2,2,1536,16384,4096,183.50720405578613
fp16,fp32,fp16,,0,k,k,n,256,64,128,64,2,1,1536,16384,4096,262.55359649658203
fp16,fp32,fp16,,0,k,k,n,256,64,128,64,2,2,1536,16384,4096,253.54239940643308
fp16,fp32,fp16,,0,k,k,n,256,128,128,128,2,1,1536,16384,4096,185.95839738845825
fp16,fp32,fp16,,0,k,k,n,256,128,128,128,2,2,1536,16384,4096,181.4527988433838
fp16,fp32,fp16,,0,k,k,n,256,192,128,192,2,1,1536,16384,4096,166.29760265350342
fp16,fp32,fp16,,0,k,k,n,256,192,128,192,2,2,1536,16384,4096,177.3568034172058
fp16,fp32,fp16,,0,k,k,n,256,256,128,256,2,1,1536,16384,4096,182.27200508117676
fp16,fp32,fp16,,0,k,k,n,256,256,128,256,2,2,1536,16384,4096,176.9536018371582
fp16,fp32,fp16,,0,k,k,n,128,64,64,64,2,1,4096,8192,7168,772.0960140228271
fp16,fp32,fp16,,0,k,k,n,128,64,64,64,2,2,4096,8192,7168,706.1503887176514
fp16,fp32,fp16,,0,k,k,n,128,128,64,128,2,1,4096,8192,7168,476.16000175476074
fp16,fp32,fp16,,0,k,k,n,128,128,64,128,2,2,4096,8192,7168,467.9679870605469
fp16,fp32,fp16,,0,k,k,n,128,192,64,192,2,1,4096,8192,7168,408.16640853881836
fp16,fp32,fp16,,0,k,k,n,128,192,64,192,2,2,4096,8192,7168,442.5727844238281
fp16,fp32,fp16,,0,k,k,n,128,256,64,256,2,1,4096,8192,7168,375.8016109466553
fp16,fp32,fp16,,0,k,k,n,128,256,64,256,2,2,4096,8192,7168,409.8048210144043
fp16,fp32,fp16,,0,k,k,n,256,64,128,64,2,1,4096,8192,7168,596.5888023376465
fp16,fp32,fp16,,0,k,k,n,256,64,128,64,2,2,4096,8192,7168,552.345609664917
fp16,fp32,fp16,,0,k,k,n,256,128,128,128,2,1,4096,8192,7168,374.16319847106934
fp16,fp32,fp16,,0,k,k,n,256,128,128,128,2,2,4096,8192,7168,386.6431951522827
fp16,fp32,fp16,,0,k,k,n,256,192,128,192,2,1,4096,8192,7168,353.2799959182739
fp16,fp32,fp16,,0,k,k,n,256,192,128,192,2,2,4096,8192,7168,383.99999141693115
fp16,fp32,fp16,,0,k,k,n,256,256,128,256,2,1,4096,8192,7168,331.1552047729492
fp16,fp32,fp16,,0,k,k,n,256,256,128,256,2,2,4096,8192,7168,370.8928108215332
fp16,fp32,fp16,,0,k,k,n,128,64,64,64,2,1,4096,7168,8192,768.4224128723145
fp16,fp32,fp16,,0,k,k,n,128,64,64,64,2,2,4096,7168,8192,697.9584217071533
fp16,fp32,fp16,,0,k,k,n,128,128,64,128,2,1,4096,7168,8192,496.230411529541
fp16,fp32,fp16,,0,k,k,n,128,128,64,128,2,2,4096,7168,8192,471.65441513061523
fp16,fp32,fp16,,0,k,k,n,128,192,64,192,2,1,4096,7168,8192,428.4416198730469
fp16,fp32,fp16,,0,k,k,n,128,192,64,192,2,2,4096,7168,8192,437.65759468078613
fp16,fp32,fp16,,0,k,k,n,128,256,64,256,2,1,4096,7168,8192,392.5951957702637
fp16,fp32,fp16,,0,k,k,n,128,256,64,256,2,2,4096,7168,8192,408.57601165771484
fp16,fp32,fp16,,0,k,k,n,256,64,128,64,2,1,4096,7168,8192,629.5551776885986
fp16,fp32,fp16,,0,k,k,n,256,64,128,64,2,2,4096,7168,8192,555.2127838134766
fp16,fp32,fp16,,0,k,k,n,256,128,128,128,2,1,4096,7168,8192,397.5167989730835
fp16,fp32,fp16,,0,k,k,n,256,128,128,128,2,2,4096,7168,8192,390.1439905166626
fp16,fp32,fp16,,0,k,k,n,256,192,128,192,2,1,4096,7168,8192,365.5679941177368
fp16,fp32,fp16,,0,k,k,n,256,192,128,192,2,2,4096,7168,8192,398.74560832977295
fp16,fp32,fp16,,0,k,k,n,256,256,128,256,2,1,4096,7168,8192,373.9648103713989
fp16,fp32,fp16,,0,k,k,n,256,256,128,256,2,2,4096,7168,8192,370.4832077026367
fp16,fp32,fp16,,0,k,k,n,128,64,64,64,2,1,7168,8192,4096,780.2879810333252
fp16,fp32,fp16,,0,k,k,n,128,64,64,64,2,2,7168,8192,4096,717.6191806793213
fp16,fp32,fp16,,0,k,k,n,128,128,64,128,2,1,7168,8192,4096,473.4975814819336
fp16,fp32,fp16,,0,k,k,n,128,128,64,128,2,2,7168,8192,4096,481.07519149780273
fp16,fp32,fp16,,0,k,k,n,128,192,64,192,2,1,7168,8192,4096,407.7568054199219
fp16,fp32,fp16,,0,k,k,n,128,192,64,192,2,2,7168,8192,4096,442.5727844238281
fp16,fp32,fp16,,0,k,k,n,128,256,64,256,2,1,7168,8192,4096,387.2767925262451
fp16,fp32,fp16,,0,k,k,n,128,256,64,256,2,2,7168,8192,4096,410.00962257385254
fp16,fp32,fp16,,0,k,k,n,256,64,128,64,2,1,7168,8192,4096,647.9872226715088
fp16,fp32,fp16,,0,k,k,n,256,64,128,64,2,2,7168,8192,4096,584.3071937561035
fp16,fp32,fp16,,0,k,k,n,256,128,128,128,2,1,7168,8192,4096,404.0703773498535
fp16,fp32,fp16,,0,k,k,n,256,128,128,128,2,2,7168,8192,4096,390.1439905166626
fp16,fp32,fp16,,0,k,k,n,256,192,128,192,2,1,7168,8192,4096,348.7744092941284
fp16,fp32,fp16,,0,k,k,n,256,192,128,192,2,2,7168,8192,4096,382.77759552001953
fp16,fp32,fp16,,0,k,k,n,256,256,128,256,2,1,7168,8192,4096,352.46078968048096
fp16,fp32,fp16,,0,k,k,n,256,256,128,256,2,2,7168,8192,4096,373.3504056930542
fp16,fp32,fp16,,0,k,k,n,128,64,64,64,2,1,4096,8192,1536,168.74879598617554
fp16,fp32,fp16,,0,k,k,n,128,64,64,64,2,2,4096,8192,1536,188.82559537887573
fp16,fp32,fp16,,0,k,k,n,128,128,64,128,2,1,4096,8192,1536,114.69440460205078
fp16,fp32,fp16,,0,k,k,n,128,128,64,128,2,2,4096,8192,1536,118.3743953704834
fp16,fp32,fp16,,0,k,k,n,128,192,64,192,2,1,4096,8192,1536,101.99040174484253
fp16,fp32,fp16,,0,k,k,n,128,192,64,192,2,2,4096,8192,1536,112.63999938964844
fp16,fp32,fp16,,0,k,k,n,128,256,64,256,2,1,4096,8192,1536,97.89440035820007
fp16,fp32,fp16,,0,k,k,n,128,256,64,256,2,2,4096,8192,1536,105.67679405212402
fp16,fp32,fp16,,0,k,k,n,256,64,128,64,2,1,4096,8192,1536,138.44480514526367
fp16,fp32,fp16,,0,k,k,n,256,64,128,64,2,2,4096,8192,1536,154.41919565200806
fp16,fp32,fp16,,0,k,k,n,256,128,128,128,2,1,4096,8192,1536,98.71360063552856
fp16,fp32,fp16,,0,k,k,n,256,128,128,128,2,2,4096,8192,1536,107.32159614562988
fp16,fp32,fp16,,0,k,k,n,256,192,128,192,2,1,4096,8192,1536,96.66560292243958
fp16,fp32,fp16,,0,k,k,n,256,192,128,192,2,2,4096,8192,1536,103.21919918060303
fp16,fp32,fp16,,0,k,k,n,256,256,128,256,2,1,4096,8192,1536,93.39519739151001
fp16,fp32,fp16,,0,k,k,n,256,256,128,256,2,2,4096,8192,1536,99.94239807128906
fp16,fp32,fp16,,0,k,k,n,128,64,64,64,2,1,4096,1536,8192,170.80960273742676
fp16,fp32,fp16,,0,k,k,n,128,64,64,64,2,2,4096,1536,8192,169.9903964996338
fp16,fp32,fp16,,0,k,k,n,128,128,64,128,2,1,4096,1536,8192,118.3743953704834
fp16,fp32,fp16,,0,k,k,n,128,128,64,128,2,2,4096,1536,8192,111.81440353393555
fp16,fp32,fp16,,0,k,k,n,128,192,64,192,2,1,4096,1536,8192,104.4543981552124
fp16,fp32,fp16,,0,k,k,n,128,192,64,192,2,2,4096,1536,8192,104.038405418396
fp16,fp32,fp16,,0,k,k,n,128,256,64,256,2,1,4096,1536,8192,101.98400020599365
fp16,fp32,fp16,,0,k,k,n,128,256,64,256,2,2,4096,1536,8192,101.57439708709717
fp16,fp32,fp16,,0,k,k,n,256,64,128,64,2,1,4096,1536,8192,144.17920112609863
fp16,fp32,fp16,,0,k,k,n,256,64,128,64,2,2,4096,1536,8192,134.75199937820435
fp16,fp32,fp16,,0,k,k,n,256,128,128,128,2,1,4096,1536,8192,101.58079862594604
fp16,fp32,fp16,,0,k,k,n,256,128,128,128,2,2,4096,1536,8192,102.40000486373901
fp16,fp32,fp16,,0,k,k,n,256,192,128,192,2,1,4096,1536,8192,100.35840272903442
fp16,fp32,fp16,,0,k,k,n,256,192,128,192,2,2,4096,1536,8192,99.53920245170593
fp16,fp32,fp16,,0,k,k,n,256,256,128,256,2,1,4096,1536,8192,124.11520481109619
fp16,fp32,fp16,,0,k,k,n,256,256,128,256,2,2,4096,1536,8192,122.06079959869385
fp16,fp32,fp16,,0,k,k,n,128,64,64,64,2,1,1536,8192,4096,158.11200141906738
fp16,fp32,fp16,,0,k,k,n,128,64,64,64,2,2,1536,8192,4096,174.48960542678833
fp16,fp32,fp16,,0,k,k,n,128,128,64,128,2,1,1536,8192,4096,111.81440353393555
fp16,fp32,fp16,,0,k,k,n,128,128,64,128,2,2,1536,8192,4096,111.82719469070435
fp16,fp32,fp16,,0,k,k,n,128,192,64,192,2,1,1536,8192,4096,97.48479723930359
fp16,fp32,fp16,,0,k,k,n,128,192,64,192,2,2,1536,8192,4096,103.63520383834839
fp16,fp32,fp16,,0,k,k,n,128,256,64,256,2,1,1536,8192,4096,102.40000486373901
fp16,fp32,fp16,,0,k,k,n,128,256,64,256,2,2,1536,8192,4096,101.99040174484253
fp16,fp32,fp16,,0,k,k,n,256,64,128,64,2,1,1536,8192,4096,138.84799480438232
fp16,fp32,fp16,,0,k,k,n,256,64,128,64,2,2,1536,8192,4096,135.57759523391724
fp16,fp32,fp16,,0,k,k,n,256,128,128,128,2,1,1536,8192,4096,104.0511965751648
fp16,fp32,fp16,,0,k,k,n,256,128,128,128,2,2,1536,8192,4096,102.81599760055542
fp16,fp32,fp16,,0,k,k,n,256,192,128,192,2,1,1536,8192,4096,101.99040174484253
fp16,fp32,fp16,,0,k,k,n,256,192,128,192,2,2,1536,8192,4096,99.53280091285706
fp16,fp32,fp16,,0,k,k,n,256,256,128,256,2,1,1536,8192,4096,101.17119550704956
fp16,fp32,fp16,,0,k,k,n,256,256,128,256,2,2,1536,8192,4096,99.53280091285706
fp16,fp32,fp16,,0,k,k,n,128,64,64,64,2,1,4096,4096,192,28.467199206352234
fp16,fp32,fp16,,0,k,k,n,128,64,64,64,2,2,4096,4096,192,31.12959861755371
fp16,fp32,fp16,,0,k,k,n,128,128,64,128,2,1,4096,4096,192,21.062399446964264
fp16,fp32,fp16,,0,k,k,n,128,128,64,128,2,2,4096,4096,192,22.32320010662079
fp16,fp32,fp16,,0,k,k,n,128,192,64,192,2,1,4096,4096,192,19.859200716018677
fp16,fp32,fp16,,0,k,k,n,128,192,64,192,2,2,4096,4096,192,21.09439969062805
fp16,fp32,fp16,,0,k,k,n,128,256,64,256,2,1,4096,4096,192,19.26400065422058
fp16,fp32,fp16,,0,k,k,n,128,256,64,256,2,2,4096,4096,192,20.057600736618042
fp16,fp32,fp16,,0,k,k,n,256,64,128,64,2,1,4096,4096,192,21.503999829292297
fp16,fp32,fp16,,0,k,k,n,256,64,128,64,2,2,4096,4096,192,22.412799298763275
fp16,fp32,fp16,,0,k,k,n,256,128,128,128,2,1,4096,4096,192,18.860800564289093
fp16,fp32,fp16,,0,k,k,n,256,128,128,128,2,2,4096,4096,192,19.45600062608719
fp16,fp32,fp16,,0,k,k,n,256,192,128,192,2,1,4096,4096,192,18.220800161361694
fp16,fp32,fp16,,0,k,k,n,256,192,128,192,2,2,4096,4096,192,19.66080069541931
fp16,fp32,fp16,,0,k,k,n,256,256,128,256,2,1,4096,4096,192,19.654400646686554
fp16,fp32,fp16,,0,k,k,n,256,256,128,256,2,2,4096,4096,192,19.046400487422943
fp16,fp32,fp16,,0,k,k,n,128,64,64,64,2,1,4096,192,4096,23.14240038394928
fp16,fp32,fp16,,0,k,k,n,128,64,64,64,2,2,4096,192,4096,22.815999388694763
fp16,fp32,fp16,,0,k,k,n,128,128,64,128,2,1,4096,192,4096,19.0528005361557
fp16,fp32,fp16,,0,k,k,n,128,128,64,128,2,2,4096,192,4096,18.860800564289093
fp16,fp32,fp16,,0,k,k,n,128,192,64,192,2,1,4096,192,4096,20.057600736618042
fp16,fp32,fp16,,0,k,k,n,128,192,64,192,2,2,4096,192,4096,21.09439969062805
fp16,fp32,fp16,,0,k,k,n,128,256,64,256,2,1,4096,192,4096,22.623999416828156
fp16,fp32,fp16,,0,k,k,n,128,256,64,256,2,2,4096,192,4096,24.672000110149384
fp16,fp32,fp16,,0,k,k,n,256,64,128,64,2,1,4096,192,4096,19.66080069541931
fp16,fp32,fp16,,0,k,k,n,256,64,128,64,2,2,4096,192,4096,20.870399475097656
fp16,fp32,fp16,,0,k,k,n,256,128,128,128,2,1,4096,192,4096,22.732800245285034
fp16,fp32,fp16,,0,k,k,n,256,128,128,128,2,2,4096,192,4096,23.14240038394928
fp16,fp32,fp16,,0,k,k,n,256,192,128,192,2,1,4096,192,4096,28.87040078639984
fp16,fp32,fp16,,0,k,k,n,256,192,128,192,2,2,4096,192,4096,29.08160090446472
fp16,fp32,fp16,,0,k,k,n,256,256,128,256,2,1,4096,192,4096,35.22560000419617
fp16,fp32,fp16,,0,k,k,n,256,256,128,256,2,2,4096,192,4096,36.44799888134003
fp16,fp32,fp16,,0,k,k,n,128,64,64,64,2,1,192,4096,4096,23.14240038394928
fp16,fp32,fp16,,0,k,k,n,128,64,64,64,2,2,192,4096,4096,22.52800017595291
fp16,fp32,fp16,,0,k,k,n,128,128,64,128,2,1,192,4096,4096,19.046400487422943
fp16,fp32,fp16,,0,k,k,n,128,128,64,128,2,2,192,4096,4096,19.45600062608719
fp16,fp32,fp16,,0,k,k,n,128,192,64,192,2,1,192,4096,4096,20.684799551963806
fp16,fp32,fp16,,0,k,k,n,128,192,64,192,2,2,192,4096,4096,20.88959962129593
fp16,fp32,fp16,,0,k,k,n,128,256,64,256,2,1,192,4096,4096,23.14240038394928
fp16,fp32,fp16,,0,k,k,n,128,256,64,256,2,2,192,4096,4096,23.14240038394928
fp16,fp32,fp16,,0,k,k,n,256,64,128,64,2,1,192,4096,4096,20.870399475097656
fp16,fp32,fp16,,0,k,k,n,256,64,128,64,2,2,192,4096,4096,20.838400721549988
fp16,fp32,fp16,,0,k,k,n,256,128,128,128,2,1,192,4096,4096,22.937600314617157
fp16,fp32,fp16,,0,k,k,n,256,128,128,128,2,2,192,4096,4096,23.96160066127777
fp16,fp32,fp16,,0,k,k,n,256,192,128,192,2,1,192,4096,4096,28.966400027275085
fp16,fp32,fp16,,0,k,k,n,256,192,128,192,2,2,192,4096,4096,29.369598627090454
fp16,fp32,fp16,,0,k,k,n,256,256,128,256,2,1,192,4096,4096,35.28960049152374
fp16,fp32,fp16,,0,k,k,n,256,256,128,256,2,2,192,4096,4096,35.308799147605896
fp16,fp32,fp16,,0,k,k,n,128,64,64,64,2,1,4096,16384,4096,921.8048095703125
fp16,fp32,fp16,,0,k,k,n,128,64,64,64,2,2,4096,16384,4096,828.2112121582031
fp16,fp32,fp16,,0,k,k,n,128,128,64,128,2,1,4096,16384,4096,569.9584007263184
fp16,fp32,fp16,,0,k,k,n,128,128,64,128,2,2,4096,16384,4096,531.8655967712402
fp16,fp32,fp16,,0,k,k,n,128,192,64,192,2,1,4096,16384,4096,451.1744022369385
fp16,fp32,fp16,,0,k,k,n,128,192,64,192,2,2,4096,16384,4096,470.4256057739258
fp16,fp32,fp16,,0,k,k,n,128,256,64,256,2,1,4096,16384,4096,415.334415435791
fp16,fp32,fp16,,0,k,k,n,128,256,64,256,2,2,4096,16384,4096,455.679988861084
fp16,fp32,fp16,,0,k,k,n,256,64,128,64,2,1,4096,16384,4096,723.3471870422363
fp16,fp32,fp16,,0,k,k,n,256,64,128,64,2,2,4096,16384,4096,630.3743839263916
fp16,fp32,fp16,,0,k,k,n,256,128,128,128,2,1,4096,16384,4096,437.0431900024414
fp16,fp32,fp16,,0,k,k,n,256,128,128,128,2,2,4096,16384,4096,433.1520080566406
fp16,fp32,fp16,,0,k,k,n,256,192,128,192,2,1,4096,16384,4096,383.5968017578125
fp16,fp32,fp16,,0,k,k,n,256,192,128,192,2,2,4096,16384,4096,414.7200107574463
fp16,fp32,fp16,,0,k,k,n,256,256,128,256,2,1,4096,16384,4096,374.5728015899658
fp16,fp32,fp16,,0,k,k,n,256,256,128,256,2,2,4096,16384,4096,420.03841400146484
fp16,fp32,fp16,,0,k,k,n,128,64,64,64,2,1,4096,4096,16384,918.5088157653809
fp16,fp32,fp16,,0,k,k,n,128,64,64,64,2,2,4096,4096,16384,869.7855949401855
fp16,fp32,fp16,,0,k,k,n,128,128,64,128,2,1,4096,4096,16384,579.1744232177734
fp16,fp32,fp16,,0,k,k,n,128,128,64,128,2,2,4096,4096,16384,574.8735904693604
fp16,fp32,fp16,,0,k,k,n,128,192,64,192,2,1,4096,4096,16384,499.0975856781006
fp16,fp32,fp16,,0,k,k,n,128,192,64,192,2,2,4096,4096,16384,508.10880661010737
fp16,fp32,fp16,,0,k,k,n,128,256,64,256,2,1,4096,4096,16384,420.04480361938477
fp16,fp32,fp16,,0,k,k,n,128,256,64,256,2,2,4096,4096,16384,461.00478172302246
fp16,fp32,fp16,,0,k,k,n,256,64,128,64,2,1,4096,4096,16384,670.3104019165039
fp16,fp32,fp16,,0,k,k,n,256,64,128,64,2,2,4096,4096,16384,684.441614151001
fp16,fp32,fp16,,0,k,k,n,256,128,128,128,2,1,4096,4096,16384,424.53761100769043
fp16,fp32,fp16,,0,k,k,n,256,128,128,128,2,2,4096,4096,16384,442.98877716064453
fp16,fp32,fp16,,0,k,k,n,256,192,128,192,2,1,4096,4096,16384,397.5231885910034
fp16,fp32,fp16,,0,k,k,n,256,192,128,192,2,2,4096,4096,16384,471.2512016296387
fp16,fp32,fp16,,0,k,k,n,256,256,128,256,2,1,4096,4096,16384,424.5503902435303
fp16,fp32,fp16,,0,k,k,n,256,256,128,256,2,2,4096,4096,16384,418.41278076171875
fp16,fp32,fp16,,0,k,k,n,128,64,64,64,2,1,4096,7168,16384,1620.787239074707
fp16,fp32,fp16,,0,k,k,n,128,64,64,64,2,2,4096,7168,16384,1503.8399696350098
fp16,fp32,fp16,,0,k,k,n,128,128,64,128,2,1,4096,7168,16384,1046.5279579162598
fp16,fp32,fp16,,0,k,k,n,128,128,64,128,2,2,4096,7168,16384,967.2703742980957
fp16,fp32,fp16,,0,k,k,n,128,192,64,192,2,1,4096,7168,16384,872.4479675292969
fp16,fp32,fp16,,0,k,k,n,128,192,64,192,2,2,4096,7168,16384,882.2784423828125
fp16,fp32,fp16,,0,k,k,n,128,256,64,256,2,1,4096,7168,16384,799.5391845703125
fp16,fp32,fp16,,0,k,k,n,128,256,64,256,2,2,4096,7168,16384,813.4592056274414
fp16,fp32,fp16,,0,k,k,n,256,64,128,64,2,1,4096,7168,16384,1208.9344024658203
fp16,fp32,fp16,,0,k,k,n,256,64,128,64,2,2,4096,7168,16384,1170.6368446350098
fp16,fp32,fp16,,0,k,k,n,256,128,128,128,2,1,4096,7168,16384,795.4432010650635
fp16,fp32,fp16,,0,k,k,n,256,128,128,128,2,2,4096,7168,16384,772.9152202606201
fp16,fp32,fp16,,0,k,k,n,256,192,128,192,2,1,4096,7168,16384,694.271993637085
fp16,fp32,fp16,,0,k,k,n,256,192,128,192,2,2,4096,7168,16384,769.2287921905518
fp16,fp32,fp16,,0,k,k,n,256,256,128,256,2,1,4096,7168,16384,720.2816009521484
fp16,fp32,fp16,,0,k,k,n,256,256,128,256,2,2,4096,7168,16384,715.5776023864746
fp16,fp32,fp16,,0,k,k,n,128,64,64,64,2,1,4096,16384,7168,1502.0031929016113
fp16,fp32,fp16,,0,k,k,n,128,64,64,64,2,2,4096,16384,7168,1382.1951866149902
fp16,fp32,fp16,,0,k,k,n,128,128,64,128,2,1,4096,16384,7168,988.1600379943848
fp16,fp32,fp16,,0,k,k,n,128,128,64,128,2,2,4096,16384,7168,924.2624282836914
fp16,fp32,fp16,,0,k,k,n,128,192,64,192,2,1,4096,16384,7168,841.3375854492188
fp16,fp32,fp16,,0,k,k,n,128,192,64,192,2,2,4096,16384,7168,836.4031791687012
fp16,fp32,fp16,,0,k,k,n,128,256,64,256,2,1,4096,16384,7168,767.5903797149658
fp16,fp32,fp16,,0,k,k,n,128,256,64,256,2,2,4096,16384,7168,797.4912166595459
fp16,fp32,fp16,,0,k,k,n,256,64,128,64,2,1,4096,16384,7168,1203.1999588012695
fp16,fp32,fp16,,0,k,k,n,256,64,128,64,2,2,4096,16384,7168,1086.2591743469238
fp16,fp32,fp16,,0,k,k,n,256,128,128,128,2,1,4096,16384,7168,759.8080158233643
fp16,fp32,fp16,,0,k,k,n,256,128,128,128,2,2,4096,16384,7168,743.4239864349365
fp16,fp32,fp16,,0,k,k,n,256,192,128,192,2,1,4096,16384,7168,647.1680164337158
fp16,fp32,fp16,,0,k,k,n,256,192,128,192,2,2,4096,16384,7168,713.1199836730957
fp16,fp32,fp16,,0,k,k,n,256,256,128,256,2,1,4096,16384,7168,632.0127964019775
fp16,fp32,fp16,,0,k,k,n,256,256,128,256,2,2,4096,16384,7168,719.2575931549072
fp16,fp32,fp16,,0,k,k,n,128,64,64,64,2,1,16384,7168,4096,1649.0495681762695
fp16,fp32,fp16,,0,k,k,n,128,64,64,64,2,2,16384,7168,4096,1520.025634765625
fp16,fp32,fp16,,0,k,k,n,128,128,64,128,2,1,16384,7168,4096,1033.625602722168
fp16,fp32,fp16,,0,k,k,n,128,128,64,128,2,2,16384,7168,4096,973.8240242004395
fp16,fp32,fp16,,0,k,k,n,128,192,64,192,2,1,16384,7168,4096,874.9055862426758
fp16,fp32,fp16,,0,k,k,n,128,192,64,192,2,2,16384,7168,4096,870.8095550537109
fp16,fp32,fp16,,0,k,k,n,128,256,64,256,2,1,16384,7168,4096,801.9968032836914
fp16,fp32,fp16,,0,k,k,n,128,256,64,256,2,2,16384,7168,4096,825.7535934448242
fp16,fp32,fp16,,0,k,k,n,256,64,128,64,2,1,16384,7168,4096,1539.686393737793
fp16,fp32,fp16,,0,k,k,n,256,64,128,64,2,2,16384,7168,4096,1300.6848335266113
fp16,fp32,fp16,,0,k,k,n,256,128,128,128,2,1,16384,7168,4096,930.406379699707
fp16,fp32,fp16,,0,k,k,n,256,128,128,128,2,2,16384,7168,4096,880.6400299072266
fp16,fp32,fp16,,0,k,k,n,256,192,128,192,2,1,16384,7168,4096,765.5424118041992
fp16,fp32,fp16,,0,k,k,n,256,192,128,192,2,2,16384,7168,4096,739.3343925476074
fp16,fp32,fp16,,0,k,k,n,256,256,128,256,2,1,16384,7168,4096,681.7791938781738
fp16,fp32,fp16,,0,k,k,n,256,256,128,256,2,2,16384,7168,4096,730.3167819976807
fp16,fp32,fp16,,0,k,k,n,128,64,64,64,2,1,4096,18432,7168,1704.3455123901367
fp16,fp32,fp16,,0,k,k,n,128,64,64,64,2,2,4096,18432,7168,1545.8304405212402
fp16,fp32,fp16,,0,k,k,n,128,128,64,128,2,1,4096,18432,7168,1107.148838043213
fp16,fp32,fp16,,0,k,k,n,128,128,64,128,2,2,4096,18432,7168,1035.4687690734863
fp16,fp32,fp16,,0,k,k,n,128,192,64,192,2,1,4096,18432,7168,928.7679672241211
fp16,fp32,fp16,,0,k,k,n,128,192,64,192,2,2,4096,18432,7168,930.6112289428711
fp16,fp32,fp16,,0,k,k,n,128,256,64,256,2,1,4096,18432,7168,865.8944129943848
fp16,fp32,fp16,,0,k,k,n,128,256,64,256,2,2,4096,18432,7168,897.2288131713867
fp16,fp32,fp16,,0,k,k,n,256,64,128,64,2,1,4096,18432,7168,1403.9039611816406
fp16,fp32,fp16,,0,k,k,n,256,64,128,64,2,2,4096,18432,7168,1219.9935913085938
fp16,fp32,fp16,,0,k,k,n,256,128,128,128,2,1,4096,18432,7168,881.4784049987793
fp16,fp32,fp16,,0,k,k,n,256,128,128,128,2,2,4096,18432,7168,822.8927612304688
fp16,fp32,fp16,,0,k,k,n,256,192,128,192,2,1,4096,18432,7168,714.7520065307617
fp16,fp32,fp16,,0,k,k,n,256,192,128,192,2,2,4096,18432,7168,813.0559921264648
fp16,fp32,fp16,,0,k,k,n,256,256,128,256,2,1,4096,18432,7168,719.2575931549072
fp16,fp32,fp16,,0,k,k,n,256,256,128,256,2,2,4096,18432,7168,807.7312469482422
fp16,fp32,fp16,,0,k,k,n,128,64,64,64,2,1,4096,7168,18432,1872.0767974853516
fp16,fp32,fp16,,0,k,k,n,128,64,64,64,2,2,4096,7168,18432,1696.5631484985352
fp16,fp32,fp16,,0,k,k,n,128,128,64,128,2,1,4096,7168,18432,1208.9344024658203
fp16,fp32,fp16,,0,k,k,n,128,128,64,128,2,2,4096,7168,18432,1108.3776473999023
fp16,fp32,fp16,,0,k,k,n,128,192,64,192,2,1,4096,7168,18432,992.255973815918
fp16,fp32,fp16,,0,k,k,n,128,192,64,192,2,2,4096,7168,18432,994.3039894104004
fp16,fp32,fp16,,0,k,k,n,128,256,64,256,2,1,4096,7168,18432,892.7295684814453
fp16,fp32,fp16,,0,k,k,n,128,256,64,256,2,2,4096,7168,18432,920.3712463378906
fp16,fp32,fp16,,0,k,k,n,256,64,128,64,2,1,4096,7168,18432,1401.4464378356934
fp16,fp32,fp16,,0,k,k,n,256,64,128,64,2,2,4096,7168,18432,1321.5744018554688
fp16,fp32,fp16,,0,k,k,n,256,128,128,128,2,1,4096,7168,18432,897.4335670471191
fp16,fp32,fp16,,0,k,k,n,256,128,128,128,2,2,4096,7168,18432,867.5328254699707
fp16,fp32,fp16,,0,k,k,n,256,192,128,192,2,1,4096,7168,18432,779.0656089782715
fp16,fp32,fp16,,0,k,k,n,256,192,128,192,2,2,4096,7168,18432,863.0271911621094
fp16,fp32,fp16,,0,k,k,n,256,256,128,256,2,1,4096,7168,18432,806.5024375915527
fp16,fp32,fp16,,0,k,k,n,256,256,128,256,2,2,4096,7168,18432,803.6416053771973
fp16,fp32,fp16,,0,k,k,n,128,64,64,64,2,1,7168,18432,4096,1742.848014831543
fp16,fp32,fp16,,0,k,k,n,128,64,64,64,2,2,7168,18432,4096,1588.0191802978516
fp16,fp32,fp16,,0,k,k,n,128,128,64,128,2,1,7168,18432,4096,1057.5872421264648
fp16,fp32,fp16,,0,k,k,n,128,128,64,128,2,2,7168,18432,4096,1055.5392265319824
fp16,fp32,fp16,,0,k,k,n,128,192,64,192,2,1,7168,18432,4096,910.3360176086426
fp16,fp32,fp16,,0,k,k,n,128,192,64,192,2,2,7168,18432,4096,937.7792358398438
fp16,fp32,fp16,,0,k,k,n,128,256,64,256,2,1,7168,18432,4096,854.0160179138184
fp16,fp32,fp16,,0,k,k,n,128,256,64,256,2,2,7168,18432,4096,899.2768287658691
fp16,fp32,fp16,,0,k,k,n,256,64,128,64,2,1,7168,18432,4096,1445.2735900878906
fp16,fp32,fp16,,0,k,k,n,256,64,128,64,2,2,7168,18432,4096,1278.1567573547363
fp16,fp32,fp16,,0,k,k,n,256,128,128,128,2,1,7168,18432,4096,895.5904006958008
fp16,fp32,fp16,,0,k,k,n,256,128,128,128,2,2,7168,18432,4096,850.5344390869141
fp16,fp32,fp16,,0,k,k,n,256,192,128,192,2,1,7168,18432,4096,734.4128131866455
fp16,fp32,fp16,,0,k,k,n,256,192,128,192,2,2,7168,18432,4096,799.5391845703125
fp16,fp32,fp16,,0,k,k,n,256,256,128,256,2,1,7168,18432,4096,727.4496078491211
fp16,fp32,fp16,,0,k,k,n,256,256,128,256,2,2,7168,18432,4096,801.5872001647949
fp16,fp32,fp16,,0,k,k,n,128,64,64,64,2,1,18432,7168,4096,1960.9600067138672
fp16,fp32,fp16,,0,k,k,n,128,64,64,64,2,2,18432,7168,4096,1746.1248397827148
fp16,fp32,fp16,,0,k,k,n,128,128,64,128,2,1,18432,7168,4096,1245.798397064209
fp16,fp32,fp16,,0,k,k,n,128,128,64,128,2,2,18432,7168,4096,1104.691219329834
fp16,fp32,fp16,,0,k,k,n,128,192,64,192,2,1,18432,7168,4096,1009.8688125610352
fp16,fp32,fp16,,0,k,k,n,128,192,64,192,2,2,18432,7168,4096,988.5696411132812
fp16,fp32,fp16,,0,k,k,n,128,256,64,256,2,1,18432,7168,4096,914.4319534301758
fp16,fp32,fp16,,0,k,k,n,128,256,64,256,2,2,18432,7168,4096,915.2511596679688
fp16,fp32,fp16,,0,k,k,n,256,64,128,64,2,1,18432,7168,4096,1766.1951065063477
fp16,fp32,fp16,,0,k,k,n,256,64,128,64,2,2,18432,7168,4096,1534.7904205322266
fp16,fp32,fp16,,0,k,k,n,256,128,128,128,2,1,18432,7168,4096,1125.990390777588
fp16,fp32,fp16,,0,k,k,n,256,128,128,128,2,2,18432,7168,4096,1002.4959564208984
fp16,fp32,fp16,,0,k,k,n,256,192,128,192,2,1,18432,7168,4096,947.2000122070312
fp16,fp32,fp16,,0,k,k,n,256,192,128,192,2,2,18432,7168,4096,838.4511947631836
fp16,fp32,fp16,,0,k,k,n,256,256,128,256,2,1,18432,7168,4096,805.0687789916992
fp16,fp32,fp16,,0,k,k,n,256,256,128,256,2,2,18432,7168,4096,807.7312469482422
fp16,fp32,fp16,,0,k,k,n,128,64,64,64,2,1,4096,257,7168,45.67039906978607
fp16,fp32,fp16,,0,k,k,n,128,64,64,64,2,2,4096,257,7168,45.46560049057007
fp16,fp32,fp16,,0,k,k,n,128,128,64,128,2,1,4096,257,7168,37.47200071811676
fp16,fp32,fp16,,0,k,k,n,128,128,64,128,2,2,4096,257,7168,39.93600010871887
fp16,fp32,fp16,,0,k,k,n,128,192,64,192,2,1,4096,257,7168,30.105599761009216
fp16,fp32,fp16,,0,k,k,n,128,192,64,192,2,2,4096,257,7168,29.900801181793213
fp16,fp32,fp16,,0,k,k,n,128,256,64,256,2,1,4096,257,7168,37.273600697517395
fp16,fp32,fp16,,0,k,k,n,128,256,64,256,2,2,4096,257,7168,36.454400420188904
fp16,fp32,fp16,,0,k,k,n,256,64,128,64,2,1,4096,257,7168,43.827199935913086
fp16,fp32,fp16,,0,k,k,n,256,64,128,64,2,2,4096,257,7168,45.06239891052246
fp16,fp32,fp16,,0,k,k,n,256,128,128,128,2,1,4096,257,7168,35.21920144557953
fp16,fp32,fp16,,0,k,k,n,256,128,128,128,2,2,4096,257,7168,36.454400420188904
fp16,fp32,fp16,,0,k,k,n,256,192,128,192,2,1,4096,257,7168,45.46560049057007
fp16,fp32,fp16,,0,k,k,n,256,192,128,192,2,2,4096,257,7168,45.529600977897644
fp16,fp32,fp16,,0,k,k,n,256,256,128,256,2,1,4096,257,7168,57.75359869003296
fp16,fp32,fp16,,0,k,k,n,256,256,128,256,2,2,4096,257,7168,57.79839754104614
fp16,fp32,fp16,,0,k,k,n,128,64,64,64,2,1,4096,7168,257,70.86079716682434
fp16,fp32,fp16,,0,k,k,n,128,64,64,64,2,2,4096,7168,257,62.25919723510742
fp16,fp32,fp16,,0,k,k,n,128,128,64,128,2,1,4096,7168,257,55.295997858047485
fp16,fp32,fp16,,0,k,k,n,128,128,64,128,2,2,4096,7168,257,47.16159999370575
fp16,fp32,fp16,,0,k,k,n,128,192,64,192,2,1,4096,7168,257,49.561598896980286
fp16,fp32,fp16,,0,k,k,n,128,192,64,192,2,2,4096,7168,257,47.10400104522705
fp16,fp32,fp16,,0,k,k,n,128,256,64,256,2,1,4096,7168,257,47.58400022983551
fp16,fp32,fp16,,0,k,k,n,128,256,64,256,2,2,4096,7168,257,44.65920031070709
fp16,fp32,fp16,,0,k,k,n,256,64,128,64,2,1,4096,7168,257,64.7167980670929
fp16,fp32,fp16,,0,k,k,n,256,64,128,64,2,2,4096,7168,257,49.15199875831604
fp16,fp32,fp16,,0,k,k,n,256,128,128,128,2,1,4096,7168,257,47.308799624443054
fp16,fp32,fp16,,0,k,k,n,256,128,128,128,2,2,4096,7168,257,39.52639997005463
fp16,fp32,fp16,,0,k,k,n,256,192,128,192,2,1,4096,7168,257,42.579200863838196
fp16,fp32,fp16,,0,k,k,n,256,192,128,192,2,2,4096,7168,257,37.68320083618164
fp16,fp32,fp16,,0,k,k,n,256,256,128,256,2,1,4096,7168,257,39.40480053424835
fp16,fp32,fp16,,0,k,k,n,256,256,128,256,2,2,4096,7168,257,35.22560000419617
fp16,fp32,fp16,,0,k,k,n,128,64,64,64,2,1,7168,257,4096,41.76639914512634
fp16,fp32,fp16,,0,k,k,n,128,64,64,64,2,2,7168,257,4096,51.609599590301514
fp16,fp32,fp16,,0,k,k,n,128,128,64,128,2,1,7168,257,4096,37.273600697517395
fp16,fp32,fp16,,0,k,k,n,128,128,64,128,2,2,7168,257,4096,44.85760033130646
fp16,fp32,fp16,,0,k,k,n,128,192,64,192,2,1,7168,257,4096,33.17759931087494
fp16,fp32,fp16,,0,k,k,n,128,192,64,192,2,2,7168,257,4096,33.375999331474304
fp16,fp32,fp16,,0,k,k,n,128,256,64,256,2,1,7168,257,4096,39.32160139083862
fp16,fp32,fp16,,0,k,k,n,128,256,64,256,2,2,7168,257,4096,39.72479999065399
fp16,fp32,fp16,,0,k,k,n,256,64,128,64,2,1,7168,257,4096,37.06879913806915
fp16,fp32,fp16,,0,k,k,n,256,64,128,64,2,2,7168,257,4096,43.82080137729645
fp16,fp32,fp16,,0,k,k,n,256,128,128,128,2,1,7168,257,4096,39.30880129337311
fp16,fp32,fp16,,0,k,k,n,256,128,128,128,2,2,7168,257,4096,39.73119854927063
fp16,fp32,fp16,,0,k,k,n,256,192,128,192,2,1,7168,257,4096,32.972800731658936
fp16,fp32,fp16,,0,k,k,n,256,192,128,192,2,2,7168,257,4096,33.11359882354736
fp16,fp32,fp16,,0,k,k,n,256,256,128,256,2,1,7168,257,4096,39.315199851989746
fp16,fp32,fp16,,0,k,k,n,256,256,128,256,2,2,7168,257,4096,40.13440012931824
fp16,fp32,fp16,,0,k,k,n,128,64,64,64,2,1,4096,2048,7168,186.36800050735474
fp16,fp32,fp16,,0,k,k,n,128,64,64,64,2,2,4096,2048,7168,195.37919759750366
fp16,fp32,fp16,,0,k,k,n,128,128,64,128,2,1,4096,2048,7168,122.06720113754272
fp16,fp32,fp16,,0,k,k,n,128,128,64,128,2,2,4096,2048,7168,129.4335961341858
fp16,fp32,fp16,,0,k,k,n,128,192,64,192,2,1,4096,2048,7168,114.27839994430542
fp16,fp32,fp16,,0,k,k,n,128,192,64,192,2,2,4096,2048,7168,129.4271945953369
fp16,fp32,fp16,,0,k,k,n,128,256,64,256,2,1,4096,2048,7168,117.55520105361938
fp16,fp32,fp16,,0,k,k,n,128,256,64,256,2,2,4096,2048,7168,116.7423963546753
fp16,fp32,fp16,,0,k,k,n,256,64,128,64,2,1,4096,2048,7168,149.09440279006958
fp16,fp32,fp16,,0,k,k,n,256,64,128,64,2,2,4096,2048,7168,152.37120389938354
fp16,fp32,fp16,,0,k,k,n,256,128,128,128,2,1,4096,2048,7168,116.32640361785889
fp16,fp32,fp16,,0,k,k,n,256,128,128,128,2,2,4096,2048,7168,116.32000207901001
fp16,fp32,fp16,,0,k,k,n,256,192,128,192,2,1,4096,2048,7168,124.92159605026245
fp16,fp32,fp16,,0,k,k,n,256,192,128,192,2,2,4096,2048,7168,124.10880327224731
fp16,fp32,fp16,,0,k,k,n,256,256,128,256,2,1,4096,2048,7168,114.27199840545654
fp16,fp32,fp16,,0,k,k,n,256,256,128,256,2,2,4096,2048,7168,113.4592056274414
fp16,fp32,fp16,,0,k,k,n,128,64,64,64,2,1,4096,7168,2048,188.8192057609558
fp16,fp32,fp16,,0,k,k,n,128,64,64,64,2,2,4096,7168,2048,208.90240669250488
fp16,fp32,fp16,,0,k,k,n,128,128,64,128,2,1,4096,7168,2048,128.62080335617065
fp16,fp32,fp16,,0,k,k,n,128,128,64,128,2,2,4096,7168,2048,133.93919467926025
fp16,fp32,fp16,,0,k,k,n,128,192,64,192,2,1,4096,7168,2048,116.33280515670776
fp16,fp32,fp16,,0,k,k,n,128,192,64,192,2,2,4096,7168,2048,123.28959703445435
fp16,fp32,fp16,,0,k,k,n,128,256,64,256,2,1,4096,7168,2048,113.4592056274414
fp16,fp32,fp16,,0,k,k,n,128,256,64,256,2,2,4096,7168,2048,117.97120571136475
fp16,fp32,fp16,,0,k,k,n,256,64,128,64,2,1,4096,7168,2048,156.87040090560913
fp16,fp32,fp16,,0,k,k,n,256,64,128,64,2,2,4096,7168,2048,169.57440376281738
fp16,fp32,fp16,,0,k,k,n,256,128,128,128,2,1,4096,7168,2048,114.6880030632019
fp16,fp32,fp16,,0,k,k,n,256,128,128,128,2,2,4096,7168,2048,119.60959434509277
fp16,fp32,fp16,,0,k,k,n,256,192,128,192,2,1,4096,7168,2048,113.04960250854492
fp16,fp32,fp16,,0,k,k,n,256,192,128,192,2,2,4096,7168,2048,119.60320472717285
fp16,fp32,fp16,,0,k,k,n,256,256,128,256,2,1,4096,7168,2048,112.63999938964844
fp16,fp32,fp16,,0,k,k,n,256,256,128,256,2,2,4096,7168,2048,113.86879682540894
fp16,fp32,fp16,,0,k,k,n,128,64,64,64,2,1,7168,2048,4096,200.7040023803711
fp16,fp32,fp16,,0,k,k,n,128,64,64,64,2,2,7168,2048,4096,200.2943992614746
fp16,fp32,fp16,,0,k,k,n,128,128,64,128,2,1,7168,2048,4096,130.25280237197876
fp16,fp32,fp16,,0,k,k,n,128,128,64,128,2,2,7168,2048,4096,132.7232003211975
fp16,fp32,fp16,,0,k,k,n,128,192,64,192,2,1,7168,2048,4096,119.60320472717285
fp16,fp32,fp16,,0,k,k,n,128,192,64,192,2,2,7168,2048,4096,134.33599472045898
fp16,fp32,fp16,,0,k,k,n,128,256,64,256,2,1,7168,2048,4096,117.96480417251587
fp16,fp32,fp16,,0,k,k,n,128,256,64,256,2,2,7168,2048,4096,118.3743953704834
fp16,fp32,fp16,,0,k,k,n,256,64,128,64,2,1,7168,2048,4096,173.26079607009888
fp16,fp32,fp16,,0,k,k,n,256,64,128,64,2,2,7168,2048,4096,162.61119842529297
fp16,fp32,fp16,,0,k,k,n,256,128,128,128,2,1,7168,2048,4096,119.60320472717285
fp16,fp32,fp16,,0,k,k,n,256,128,128,128,2,2,7168,2048,4096,119.60320472717285
fp16,fp32,fp16,,0,k,k,n,256,192,128,192,2,1,7168,2048,4096,122.06079959869385
fp16,fp32,fp16,,0,k,k,n,256,192,128,192,2,2,7168,2048,4096,138.44480514526367
fp16,fp32,fp16,,0,k,k,n,256,256,128,256,2,1,7168,2048,4096,125.33760070800781
fp16,fp32,fp16,,0,k,k,n,256,256,128,256,2,2,7168,2048,4096,125.33760070800781
fp16,fp32,fp16,,0,k,k,n,128,64,64,64,2,1,2048,7168,4096,182.6751947402954
fp16,fp32,fp16,,0,k,k,n,128,64,64,64,2,2,2048,7168,4096,200.2943992614746
fp16,fp32,fp16,,0,k,k,n,128,128,64,128,2,1,2048,7168,4096,127.38560438156127
fp16,fp32,fp16,,0,k,k,n,128,128,64,128,2,2,2048,7168,4096,129.4335961341858
fp16,fp32,fp16,,0,k,k,n,128,192,64,192,2,1,2048,7168,4096,117.1455979347229
fp16,fp32,fp16,,0,k,k,n,128,192,64,192,2,2,2048,7168,4096,123.28959703445435
fp16,fp32,fp16,,0,k,k,n,128,256,64,256,2,1,2048,7168,4096,115.09759426116943
fp16,fp32,fp16,,0,k,k,n,128,256,64,256,2,2,2048,7168,4096,116.32640361785889
fp16,fp32,fp16,,0,k,k,n,256,64,128,64,2,1,2048,7168,4096,160.15360355377197
fp16,fp32,fp16,,0,k,k,n,256,64,128,64,2,2,2048,7168,4096,156.05759620666504
fp16,fp32,fp16,,0,k,k,n,256,128,128,128,2,1,2048,7168,4096,117.55520105361938
fp16,fp32,fp16,,0,k,k,n,256,128,128,128,2,2,2048,7168,4096,116.73599481582642
fp16,fp32,fp16,,0,k,k,n,256,192,128,192,2,1,2048,7168,4096,122.47040271759033
fp16,fp32,fp16,,0,k,k,n,256,192,128,192,2,2,2048,7168,4096,119.19360160827637
fp16,fp32,fp16,,0,k,k,n,256,256,128,256,2,1,2048,7168,4096,123.69920015335083
fp16,fp32,fp16,,0,k,k,n,256,256,128,256,2,2,2048,7168,4096,125.33760070800781
