results/dsv3_nvfp4.csv
in_dtype,acc_dtype,out_dtype,sf_dtype,sf_vec_size,a_major,b_major,c_major,mma_m,mma_n,cta_m,cta_n,cluster_m,cluster_n,m,n,k,runtime_us
e2m1,fp32,fp32,e8m0,16,k,k,n,256,64,128,64,2,1,4096,7168,128000,2966.7327880859375
e2m1,fp32,fp32,e8m0,16,k,k,n,256,64,128,64,2,2,4096,7168,128000,2982.5023651123047
e2m1,fp32,fp32,e8m0,16,k,k,n,256,64,128,64,2,4,4096,7168,128000,3155.7632446289062
e2m1,fp32,fp32,e8m0,16,k,k,n,256,64,128,64,4,2,4096,7168,128000,3245.4654693603516
e2m1,fp32,fp32,e8m0,16,k,k,n,256,128,128,128,2,1,4096,7168,128000,1856.9215774536133
e2m1,fp32,fp32,e8m0,16,k,k,n,256,128,128,128,2,2,4096,7168,128000,1981.8496704101562
e2m1,fp32,fp32,e8m0,16,k,k,n,256,128,128,128,2,4,4096,7168,128000,2073.6000061035156
e2m1,fp32,fp32,e8m0,16,k,k,n,256,128,128,128,4,2,4096,7168,128000,2127.257537841797
e2m1,fp32,fp32,e8m0,16,k,k,n,256,192,128,192,2,1,4096,7168,128000,1585.1519584655762
e2m1,fp32,fp32,e8m0,16,k,k,n,256,192,128,192,2,2,4096,7168,128000,1783.8079452514648
e2m1,fp32,fp32,e8m0,16,k,k,n,256,192,128,192,2,4,4096,7168,128000,1939.6608352661133
e2m1,fp32,fp32,e8m0,16,k,k,n,256,192,128,192,4,2,4096,7168,128000,1968.332862854004
e2m1,fp32,fp32,e8m0,16,k,k,n,256,256,128,256,2,1,4096,7168,128000,1430.5279731750488
e2m1,fp32,fp32,e8m0,16,k,k,n,256,256,128,256,2,2,4096,7168,128000,1419.4687843322754
e2m1,fp32,fp32,e8m0,16,k,k,n,256,256,128,256,2,4,4096,7168,128000,1618.3231353759766
e2m1,fp32,fp32,e8m0,16,k,k,n,256,256,128,256,4,2,4096,7168,128000,1622.425651550293
e2m1,fp32,fp32,e8m0,16,k,k,n,256,64,128,64,2,1,4096,128000,7168,3108.8640213012695
e2m1,fp32,fp32,e8m0,16,k,k,n,256,64,128,64,2,2,4096,128000,7168,3438.5921478271484
e2m1,fp32,fp32,e8m0,16,k,k,n,256,64,128,64,2,4,4096,128000,7168,3673.497772216797
e2m1,fp32,fp32,e8m0,16,k,k,n,256,64,128,64,4,2,4096,128000,7168,3684.147262573242
e2m1,fp32,fp32,e8m0,16,k,k,n,256,128,128,128,2,1,4096,128000,7168,1901.9775390625
e2m1,fp32,fp32,e8m0,16,k,k,n,256,128,128,128,2,2,4096,128000,7168,2108.006477355957
e2m1,fp32,fp32,e8m0,16,k,k,n,256,128,128,128,2,4,4096,128000,7168,2399.0272521972656
e2m1,fp32,fp32,e8m0,16,k,k,n,256,128,128,128,4,2,4096,128000,7168,2367.283248901367
e2m1,fp32,fp32,e8m0,16,k,k,n,256,192,128,192,2,1,4096,128000,7168,1685.0944519042969
e2m1,fp32,fp32,e8m0,16,k,k,n,256,192,128,192,2,2,4096,128000,7168,1856.9215774536133
e2m1,fp32,fp32,e8m0,16,k,k,n,256,192,128,192,2,4,4096,128000,7168,2125.209617614746
e2m1,fp32,fp32,e8m0,16,k,k,n,256,192,128,192,4,2,4096,128000,7168,2079.7439575195312
e2m1,fp32,fp32,e8m0,16,k,k,n,256,256,128,256,2,1,4096,128000,7168,1635.5327606201172
e2m1,fp32,fp32,e8m0,16,k,k,n,256,256,128,256,2,2,4096,128000,7168,1801.215934753418
e2m1,fp32,fp32,e8m0,16,k,k,n,256,256,128,256,2,4,4096,128000,7168,1977.337646484375
e2m1,fp32,fp32,e8m0,16,k,k,n,256,256,128,256,4,2,4096,128000,7168,1967.513656616211
e2m1,fp32,fp32,e8m0,16,k,k,n,256,64,128,64,2,1,128000,7168,4096,4385.996627807617
e2m1,fp32,fp32,e8m0,16,k,k,n,256,64,128,64,2,2,128000,7168,4096,4271.718215942383
e2m1,fp32,fp32,e8m0,16,k,k,n,256,64,128,64,2,4,128000,7168,4096,4504.576110839844
e2m1,fp32,fp32,e8m0,16,k,k,n,256,64,128,64,4,2,128000,7168,4096,4660.63346862793
e2m1,fp32,fp32,e8m0,16,k,k,n,256,128,128,128,2,1,128000,7168,4096,3188.7359619140625
e2m1,fp32,fp32,e8m0,16,k,k,n,256,128,128,128,2,2,128000,7168,4096,2851.0208129882812
e2m1,fp32,fp32,e8m0,16,k,k,n,256,128,128,128,2,4,128000,7168,4096,2950.1440048217773
e2m1,fp32,fp32,e8m0,16,k,k,n,256,128,128,128,4,2,128000,7168,4096,3090.0224685668945
e2m1,fp32,fp32,e8m0,16,k,k,n,256,192,128,192,2,1,128000,7168,4096,2536.6527557373047
e2m1,fp32,fp32,e8m0,16,k,k,n,256,192,128,192,2,2,128000,7168,4096,2487.500762939453
e2m1,fp32,fp32,e8m0,16,k,k,n,256,192,128,192,2,4,128000,7168,4096,2749.02400970459
e2m1,fp32,fp32,e8m0,16,k,k,n,256,192,128,192,4,2,128000,7168,4096,2700.281524658203
e2m1,fp32,fp32,e8m0,16,k,k,n,256,256,128,256,2,1,128000,7168,4096,2208.768081665039
e2m1,fp32,fp32,e8m0,16,k,k,n,256,256,128,256,2,2,128000,7168,4096,2297.2415924072266
e2m1,fp32,fp32,e8m0,16,k,k,n,256,256,128,256,2,4,128000,7168,4096,2376.710319519043
e2m1,fp32,fp32,e8m0,16,k,k,n,256,256,128,256,4,2,128000,7168,4096,2486.2720489501953
e2m1,fp32,fp32,e8m0,16,k,k,n,256,64,128,64,2,1,4096,512,7168,24.57599937915802
e2m1,fp32,fp32,e8m0,16,k,k,n,256,64,128,64,2,2,4096,512,7168,25.190401077270508
e2m1,fp32,fp32,e8m0,16,k,k,n,256,64,128,64,2,4,4096,512,7168,29.69599962234497
e2m1,fp32,fp32,e8m0,16,k,k,n,256,64,128,64,4,2,4096,512,7168,30.31040132045746
e2m1,fp32,fp32,e8m0,16,k,k,n,256,128,128,128,2,1,4096,512,7168,23.756800591945648
e2m1,fp32,fp32,e8m0,16,k,k,n,256,128,128,128,2,2,4096,512,7168,23.340800404548645
e2m1,fp32,fp32,e8m0,16,k,k,n,256,128,128,128,2,4,4096,512,7168,27.647998929023743
e2m1,fp32,fp32,e8m0,16,k,k,n,256,128,128,128,4,2,4096,512,7168,27.033600211143494
e2m1,fp32,fp32,e8m0,16,k,k,n,256,192,128,192,2,1,4096,512,7168,23.96160066127777
e2m1,fp32,fp32,e8m0,16,k,k,n,256,192,128,192,2,2,4096,512,7168,24.36479926109314
e2m1,fp32,fp32,e8m0,16,k,k,n,256,192,128,192,2,4,4096,512,7168,33.59360098838806
e2m1,fp32,fp32,e8m0,16,k,k,n,256,192,128,192,4,2,4096,512,7168,31.539198756217953
e2m1,fp32,fp32,e8m0,16,k,k,n,256,256,128,256,2,1,4096,512,7168,25.177600979804993
e2m1,fp32,fp32,e8m0,16,k,k,n,256,256,128,256,2,2,4096,512,7168,25.804799795150757
e2m1,fp32,fp32,e8m0,16,k,k,n,256,256,128,256,2,4,4096,512,7168,38.707199692726135
e2m1,fp32,fp32,e8m0,16,k,k,n,256,256,128,256,4,2,4096,512,7168,25.600001215934753
e2m1,fp32,fp32,e8m0,16,k,k,n,256,64,128,64,2,1,4096,7168,512,39.32160139083862
e2m1,fp32,fp32,e8m0,16,k,k,n,256,64,128,64,2,2,4096,7168,512,41.36959910392761
e2m1,fp32,fp32,e8m0,16,k,k,n,256,64,128,64,2,4,4096,7168,512,43.41759979724884
e2m1,fp32,fp32,e8m0,16,k,k,n,256,64,128,64,4,2,4096,7168,512,43.42400133609772
e2m1,fp32,fp32,e8m0,16,k,k,n,256,128,128,128,2,1,4096,7168,512,35.43680012226105
e2m1,fp32,fp32,e8m0,16,k,k,n,256,128,128,128,2,2,4096,7168,512,37.887999415397644
e2m1,fp32,fp32,e8m0,16,k,k,n,256,128,128,128,2,4,4096,7168,512,37.4783992767334
e2m1,fp32,fp32,e8m0,16,k,k,n,256,128,128,128,4,2,4096,7168,512,37.676799297332764
e2m1,fp32,fp32,e8m0,16,k,k,n,256,192,128,192,2,1,4096,7168,512,35.42400002479553
e2m1,fp32,fp32,e8m0,16,k,k,n,256,192,128,192,2,2,4096,7168,512,39.32160139083862
e2m1,fp32,fp32,e8m0,16,k,k,n,256,192,128,192,2,4,4096,7168,512,40.35840034484863
e2m1,fp32,fp32,e8m0,16,k,k,n,256,192,128,192,4,2,4096,7168,512,40.13440012931824
e2m1,fp32,fp32,e8m0,16,k,k,n,256,256,128,256,2,1,4096,7168,512,39.32160139083862
e2m1,fp32,fp32,e8m0,16,k,k,n,256,256,128,256,2,2,4096,7168,512,41.58079922199249
e2m1,fp32,fp32,e8m0,16,k,k,n,256,256,128,256,2,4,4096,7168,512,43.62240135669708
e2m1,fp32,fp32,e8m0,16,k,k,n,256,256,128,256,4,2,4096,7168,512,43.62240135669708
e2m1,fp32,fp32,e8m0,16,k,k,n,256,64,128,64,2,1,7168,512,4096,28.467199206352234
e2m1,fp32,fp32,e8m0,16,k,k,n,256,64,128,64,2,2,7168,512,4096,29.683199524879456
e2m1,fp32,fp32,e8m0,16,k,k,n,256,64,128,64,2,4,7168,512,4096,29.08160090446472
e2m1,fp32,fp32,e8m0,16,k,k,n,256,64,128,64,4,2,7168,512,4096,29.689601063728333
e2m1,fp32,fp32,e8m0,16,k,k,n,256,128,128,128,2,1,7168,512,4096,24.377599358558655
e2m1,fp32,fp32,e8m0,16,k,k,n,256,128,128,128,2,2,7168,512,4096,25.196799635887146
e2m1,fp32,fp32,e8m0,16,k,k,n,256,128,128,128,2,4,7168,512,4096,24.985599517822266
e2m1,fp32,fp32,e8m0,16,k,k,n,256,128,128,128,4,2,7168,512,4096,25.18399953842163
e2m1,fp32,fp32,e8m0,16,k,k,n,256,192,128,192,2,1,7168,512,4096,25.190401077270508
e2m1,fp32,fp32,e8m0,16,k,k,n,256,192,128,192,2,2,7168,512,4096,26.82879865169525
e2m1,fp32,fp32,e8m0,16,k,k,n,256,192,128,192,2,4,7168,512,4096,27.033600211143494
e2m1,fp32,fp32,e8m0,16,k,k,n,256,192,128,192,4,2,7168,512,4096,27.039998769760132
e2m1,fp32,fp32,e8m0,16,k,k,n,256,256,128,256,2,1,7168,512,4096,25.811201333999634
e2m1,fp32,fp32,e8m0,16,k,k,n,256,256,128,256,2,2,7168,512,4096,25.79199969768524
e2m1,fp32,fp32,e8m0,16,k,k,n,256,256,128,256,2,4,7168,512,4096,31.12959861755371
e2m1,fp32,fp32,e8m0,16,k,k,n,256,256,128,256,4,2,7168,512,4096,24.588799476623535
e2m1,fp32,fp32,e8m0,16,k,k,n,256,64,128,64,2,1,4096,1536,7168,54.88640069961548
e2m1,fp32,fp32,e8m0,16,k,k,n,256,64,128,64,2,2,4096,1536,7168,56.11519813537598
e2m1,fp32,fp32,e8m0,16,k,k,n,256,64,128,64,2,4,4096,1536,7168,62.035202980041504
e2m1,fp32,fp32,e8m0,16,k,k,n,256,64,128,64,4,2,4096,1536,7168,61.64479851722717
e2m1,fp32,fp32,e8m0,16,k,k,n,256,128,128,128,2,1,4096,1536,7168,39.12320137023926
e2m1,fp32,fp32,e8m0,16,k,k,n,256,128,128,128,2,2,4096,1536,7168,39.41760063171387
e2m1,fp32,fp32,e8m0,16,k,k,n,256,128,128,128,2,4,4096,1536,7168,47.513601183891296
e2m1,fp32,fp32,e8m0,16,k,k,n,256,128,128,128,4,2,4096,1536,7168,47.57759869098663
e2m1,fp32,fp32,e8m0,16,k,k,n,256,192,128,192,2,1,4096,1536,7168,36.742401123046875
e2m1,fp32,fp32,e8m0,16,k,k,n,256,192,128,192,2,2,4096,1536,7168,37.145599722862244
e2m1,fp32,fp32,e8m0,16,k,k,n,256,192,128,192,2,4,4096,1536,7168,47.08479940891266
e2m1,fp32,fp32,e8m0,16,k,k,n,256,192,128,192,4,2,4096,1536,7168,47.174400091171265
e2m1,fp32,fp32,e8m0,16,k,k,n,256,256,128,256,2,1,4096,1536,7168,42.073601484298706
e2m1,fp32,fp32,e8m0,16,k,k,n,256,256,128,256,2,2,4096,1536,7168,42.08639860153198
e2m1,fp32,fp32,e8m0,16,k,k,n,256,256,128,256,2,4,4096,1536,7168,57.75359869003296
e2m1,fp32,fp32,e8m0,16,k,k,n,256,256,128,256,4,2,4096,1536,7168,43.41759979724884
e2m1,fp32,fp32,e8m0,16,k,k,n,256,64,128,64,2,1,4096,7168,1536,67.57760047912598
e2m1,fp32,fp32,e8m0,16,k,k,n,256,64,128,64,2,2,4096,7168,1536,68.60160231590271
e2m1,fp32,fp32,e8m0,16,k,k,n,256,64,128,64,2,4,4096,7168,1536,71.86560034751892
e2m1,fp32,fp32,e8m0,16,k,k,n,256,64,128,64,4,2,4096,7168,1536,73.93280267715454
e2m1,fp32,fp32,e8m0,16,k,k,n,256,128,128,128,2,1,4096,7168,1536,53.862398862838745
e2m1,fp32,fp32,e8m0,16,k,k,n,256,128,128,128,2,2,4096,7168,1536,55.289602279663086
e2m1,fp32,fp32,e8m0,16,k,k,n,256,128,128,128,2,4,4096,7168,1536,57.91360139846802
e2m1,fp32,fp32,e8m0,16,k,k,n,256,128,128,128,4,2,4096,7168,1536,58.771198987960815
e2m1,fp32,fp32,e8m0,16,k,k,n,256,192,128,192,2,1,4096,7168,1536,51.40479803085327
e2m1,fp32,fp32,e8m0,16,k,k,n,256,192,128,192,2,2,4096,7168,1536,53.45280170440674
e2m1,fp32,fp32,e8m0,16,k,k,n,256,192,128,192,2,4,4096,7168,1536,59.79520082473755
e2m1,fp32,fp32,e8m0,16,k,k,n,256,192,128,192,4,2,4096,7168,1536,56.52480125427246
e2m1,fp32,fp32,e8m0,16,k,k,n,256,256,128,256,2,1,4096,7168,1536,53.6575973033905
e2m1,fp32,fp32,e8m0,16,k,k,n,256,256,128,256,2,2,4096,7168,1536,55.72479963302612
e2m1,fp32,fp32,e8m0,16,k,k,n,256,256,128,256,2,4,4096,7168,1536,59.801602363586426
e2m1,fp32,fp32,e8m0,16,k,k,n,256,256,128,256,4,2,4096,7168,1536,59.79520082473755
e2m1,fp32,fp32,e8m0,16,k,k,n,256,64,128,64,2,1,7168,1536,4096,56.518399715423584
e2m1,fp32,fp32,e8m0,16,k,k,n,256,64,128,64,2,2,7168,1536,4096,61.51040196418762
e2m1,fp32,fp32,e8m0,16,k,k,n,256,64,128,64,2,4,7168,1536,4096,67.17439889907837
e2m1,fp32,fp32,e8m0,16,k,k,n,256,64,128,64,4,2,7168,1536,4096,66.35519862174988
e2m1,fp32,fp32,e8m0,16,k,k,n,256,128,128,128,2,1,7168,1536,4096,43.21280121803284
e2m1,fp32,fp32,e8m0,16,k,k,n,256,128,128,128,2,2,7168,1536,4096,47.513601183891296
e2m1,fp32,fp32,e8m0,16,k,k,n,256,128,128,128,2,4,7168,1536,4096,47.513601183891296
e2m1,fp32,fp32,e8m0,16,k,k,n,256,128,128,128,4,2,7168,1536,4096,47.7183997631073
e2m1,fp32,fp32,e8m0,16,k,k,n,256,192,128,192,2,1,7168,1536,4096,43.21280121803284
e2m1,fp32,fp32,e8m0,16,k,k,n,256,192,128,192,2,2,7168,1536,4096,43.827199935913086
e2m1,fp32,fp32,e8m0,16,k,k,n,256,192,128,192,2,4,7168,1536,4096,44.85119879245758
e2m1,fp32,fp32,e8m0,16,k,k,n,256,192,128,192,4,2,7168,1536,4096,44.441598653793335
e2m1,fp32,fp32,e8m0,16,k,k,n,256,256,128,256,2,1,7168,1536,4096,43.41759979724884
e2m1,fp32,fp32,e8m0,16,k,k,n,256,256,128,256,2,2,7168,1536,4096,43.41759979724884
e2m1,fp32,fp32,e8m0,16,k,k,n,256,256,128,256,2,4,7168,1536,4096,53.331202268600464
e2m1,fp32,fp32,e8m0,16,k,k,n,256,256,128,256,4,2,7168,1536,4096,43.507200479507446
e2m1,fp32,fp32,e8m0,16,k,k,n,256,64,128,64,2,1,4096,16384,512,79.05920147895813
e2m1,fp32,fp32,e8m0,16,k,k,n,256,64,128,64,2,2,4096,16384,512,82.40000009536743
e2m1,fp32,fp32,e8m0,16,k,k,n,256,64,128,64,2,4,4096,16384,512,87.24480271339417
e2m1,fp32,fp32,e8m0,16,k,k,n,256,64,128,64,4,2,4096,16384,512,89.29280042648315
e2m1,fp32,fp32,e8m0,16,k,k,n,256,128,128,128,2,1,4096,16384,512,68.87680292129517
e2m1,fp32,fp32,e8m0,16,k,k,n,256,128,128,128,2,2,4096,16384,512,72.08960056304932
e2m1,fp32,fp32,e8m0,16,k,k,n,256,128,128,128,2,4,4096,16384,512,78.71360182762146
e2m1,fp32,fp32,e8m0,16,k,k,n,256,128,128,128,4,2,4096,16384,512,78.438401222229
e2m1,fp32,fp32,e8m0,16,k,k,n,256,192,128,192,2,1,4096,16384,512,72.08960056304932
e2m1,fp32,fp32,e8m0,16,k,k,n,256,192,128,192,2,2,4096,16384,512,72.08960056304932
e2m1,fp32,fp32,e8m0,16,k,k,n,256,192,128,192,2,4,4096,16384,512,78.85439991950989
e2m1,fp32,fp32,e8m0,16,k,k,n,256,192,128,192,4,2,4096,16384,512,76.39039754867554
e2m1,fp32,fp32,e8m0,16,k,k,n,256,256,128,256,2,1,4096,16384,512,73.52319955825806
e2m1,fp32,fp32,e8m0,16,k,k,n,256,256,128,256,2,2,4096,16384,512,82.32319951057434
e2m1,fp32,fp32,e8m0,16,k,k,n,256,256,128,256,2,4,4096,16384,512,86.42560243606567
e2m1,fp32,fp32,e8m0,16,k,k,n,256,256,128,256,4,2,4096,16384,512,86.21439933776855
e2m1,fp32,fp32,e8m0,16,k,k,n,256,64,128,64,2,1,4096,512,16384,40.95999896526337
e2m1,fp32,fp32,e8m0,16,k,k,n,256,64,128,64,2,2,4096,512,16384,41.36959910392761
e2m1,fp32,fp32,e8m0,16,k,k,n,256,64,128,64,2,4,4096,512,16384,54.476797580718994
e2m1,fp32,fp32,e8m0,16,k,k,n,256,64,128,64,4,2,4096,512,16384,54.27200198173523
e2m1,fp32,fp32,e8m0,16,k,k,n,256,128,128,128,2,1,4096,512,16384,30.105599761009216
e2m1,fp32,fp32,e8m0,16,k,k,n,256,128,128,128,2,2,4096,512,16384,29.849600791931152
e2m1,fp32,fp32,e8m0,16,k,k,n,256,128,128,128,2,4,4096,512,16384,46.48959934711456
e2m1,fp32,fp32,e8m0,16,k,k,n,256,128,128,128,4,2,4096,512,16384,43.92319917678833
e2m1,fp32,fp32,e8m0,16,k,k,n,256,192,128,192,2,1,4096,512,16384,35.22560000419617
e2m1,fp32,fp32,e8m0,16,k,k,n,256,192,128,192,2,2,4096,512,16384,35.92959940433502
e2m1,fp32,fp32,e8m0,16,k,k,n,256,192,128,192,2,4,4096,512,16384,57.75359869003296
e2m1,fp32,fp32,e8m0,16,k,k,n,256,192,128,192,4,2,4096,512,16384,55.70560097694397
e2m1,fp32,fp32,e8m0,16,k,k,n,256,256,128,256,2,1,4096,512,16384,40.35840034484863
e2m1,fp32,fp32,e8m0,16,k,k,n,256,256,128,256,2,2,4096,512,16384,39.61600065231323
e2m1,fp32,fp32,e8m0,16,k,k,n,256,256,128,256,2,4,4096,512,16384,67.99359917640686
e2m1,fp32,fp32,e8m0,16,k,k,n,256,256,128,256,4,2,4096,512,16384,39.41760063171387
e2m1,fp32,fp32,e8m0,16,k,k,n,256,64,128,64,2,1,512,16384,4096,44.31999921798706
e2m1,fp32,fp32,e8m0,16,k,k,n,256,64,128,64,2,2,512,16384,4096,49.56800043582916
e2m1,fp32,fp32,e8m0,16,k,k,n,256,64,128,64,2,4,512,16384,4096,52.83200144767761
e2m1,fp32,fp32,e8m0,16,k,k,n,256,64,128,64,4,2,512,16384,4096,55.50079941749573
e2m1,fp32,fp32,e8m0,16,k,k,n,256,128,128,128,2,1,512,16384,4096,37.06879913806915
e2m1,fp32,fp32,e8m0,16,k,k,n,256,128,128,128,2,2,512,16384,4096,36.25600039958954
e2m1,fp32,fp32,e8m0,16,k,k,n,256,128,128,128,2,4,512,16384,4096,41.36959910392761
e2m1,fp32,fp32,e8m0,16,k,k,n,256,128,128,128,4,2,512,16384,4096,43.20000112056732
e2m1,fp32,fp32,e8m0,16,k,k,n,256,192,128,192,2,1,512,16384,4096,38.092800974845886
e2m1,fp32,fp32,e8m0,16,k,k,n,256,192,128,192,2,2,512,16384,4096,36.86400055885315
e2m1,fp32,fp32,e8m0,16,k,k,n,256,192,128,192,2,4,512,16384,4096,37.06879913806915
e2m1,fp32,fp32,e8m0,16,k,k,n,256,192,128,192,4,2,512,16384,4096,36.87039911746979
e2m1,fp32,fp32,e8m0,16,k,k,n,256,256,128,256,2,1,512,16384,4096,32.77440071105957
e2m1,fp32,fp32,e8m0,16,k,k,n,256,256,128,256,2,2,512,16384,4096,32.35839903354645
e2m1,fp32,fp32,e8m0,16,k,k,n,256,256,128,256,2,4,512,16384,4096,41.574400663375854
e2m1,fp32,fp32,e8m0,16,k,k,n,256,256,128,256,4,2,512,16384,4096,41.66400134563446
e2m1,fp32,fp32,e8m0,16,k,k,n,256,64,128,64,2,1,4096,16384,1536,136.8127942085266
e2m1,fp32,fp32,e8m0,16,k,k,n,256,64,128,64,2,2,4096,16384,1536,140.49919843673706
e2m1,fp32,fp32,e8m0,16,k,k,n,256,64,128,64,2,4,4096,16384,1536,147.84640073776245
e2m1,fp32,fp32,e8m0,16,k,k,n,256,64,128,64,4,2,4096,16384,1536,151.55199766159058
e2m1,fp32,fp32,e8m0,16,k,k,n,256,128,128,128,2,1,4096,16384,1536,110.17600297927856
e2m1,fp32,fp32,e8m0,16,k,k,n,256,128,128,128,2,2,4096,16384,1536,110.59199571609497
e2m1,fp32,fp32,e8m0,16,k,k,n,256,128,128,128,2,4,4096,16384,1536,122.06079959869385
e2m1,fp32,fp32,e8m0,16,k,k,n,256,128,128,128,4,2,4096,16384,1536,118.58559846878052
e2m1,fp32,fp32,e8m0,16,k,k,n,256,192,128,192,2,1,4096,16384,1536,100.55040121078491
e2m1,fp32,fp32,e8m0,16,k,k,n,256,192,128,192,2,2,4096,16384,1536,105.06240129470825
e2m1,fp32,fp32,e8m0,16,k,k,n,256,192,128,192,2,4,4096,16384,1536,120.21759748458862
e2m1,fp32,fp32,e8m0,16,k,k,n,256,192,128,192,4,2,4096,16384,1536,115.71199893951416
e2m1,fp32,fp32,e8m0,16,k,k,n,256,256,128,256,2,1,4096,16384,1536,103.42400074005127
e2m1,fp32,fp32,e8m0,16,k,k,n,256,256,128,256,2,2,4096,16384,1536,113.24800252914429
e2m1,fp32,fp32,e8m0,16,k,k,n,256,256,128,256,2,4,4096,16384,1536,116.52480363845825
e2m1,fp32,fp32,e8m0,16,k,k,n,256,256,128,256,4,2,4096,16384,1536,117.7664041519165
e2m1,fp32,fp32,e8m0,16,k,k,n,256,64,128,64,2,1,4096,1536,16384,103.83360385894775
e2m1,fp32,fp32,e8m0,16,k,k,n,256,64,128,64,2,2,4096,1536,16384,105.67679405212402
e2m1,fp32,fp32,e8m0,16,k,k,n,256,64,128,64,2,4,4096,1536,16384,118.78399848937988
e2m1,fp32,fp32,e8m0,16,k,k,n,256,64,128,64,4,2,4096,1536,16384,117.55520105361938
e2m1,fp32,fp32,e8m0,16,k,k,n,256,128,128,128,2,1,4096,1536,16384,70.04160284996033
e2m1,fp32,fp32,e8m0,16,k,k,n,256,128,128,128,2,2,4096,1536,16384,70.45120000839233
e2m1,fp32,fp32,e8m0,16,k,k,n,256,128,128,128,2,4,4096,1536,16384,86.01599931716919
e2m1,fp32,fp32,e8m0,16,k,k,n,256,128,128,128,4,2,4096,1536,16384,86.01599931716919
e2m1,fp32,fp32,e8m0,16,k,k,n,256,192,128,192,2,1,4096,1536,16384,64.30720090866089
e2m1,fp32,fp32,e8m0,16,k,k,n,256,192,128,192,2,2,4096,1536,16384,64.7167980670929
e2m1,fp32,fp32,e8m0,16,k,k,n,256,192,128,192,2,4,4096,1536,16384,85.1967990398407
e2m1,fp32,fp32,e8m0,16,k,k,n,256,192,128,192,4,2,4096,1536,16384,86.83519959449768
e2m1,fp32,fp32,e8m0,16,k,k,n,256,256,128,256,2,1,4096,1536,16384,75.77599883079529
e2m1,fp32,fp32,e8m0,16,k,k,n,256,256,128,256,2,2,4096,1536,16384,75.44320225715637
e2m1,fp32,fp32,e8m0,16,k,k,n,256,256,128,256,2,4,4096,1536,16384,105.67679405212402
e2m1,fp32,fp32,e8m0,16,k,k,n,256,256,128,256,4,2,4096,1536,16384,75.8400022983551
e2m1,fp32,fp32,e8m0,16,k,k,n,256,64,128,64,2,1,1536,16384,4096,107.73119926452637
e2m1,fp32,fp32,e8m0,16,k,k,n,256,64,128,64,2,2,1536,16384,4096,121.44639492034912
e2m1,fp32,fp32,e8m0,16,k,k,n,256,64,128,64,2,4,1536,16384,4096,129.84319925308228
e2m1,fp32,fp32,e8m0,16,k,k,n,256,64,128,64,4,2,1536,16384,4096,136.8064045906067
e2m1,fp32,fp32,e8m0,16,k,k,n,256,128,128,128,2,1,1536,16384,4096,82.12479948997498
e2m1,fp32,fp32,e8m0,16,k,k,n,256,128,128,128,2,2,1536,16384,4096,86.83519959449768
e2m1,fp32,fp32,e8m0,16,k,k,n,256,128,128,128,2,4,1536,16384,4096,92.3583984375
e2m1,fp32,fp32,e8m0,16,k,k,n,256,128,128,128,4,2,1536,16384,4096,95.4367995262146
e2m1,fp32,fp32,e8m0,16,k,k,n,256,192,128,192,2,1,1536,16384,4096,74.14399981498718
e2m1,fp32,fp32,e8m0,16,k,k,n,256,192,128,192,2,2,1536,16384,4096,80.07680177688599
e2m1,fp32,fp32,e8m0,16,k,k,n,256,192,128,192,2,4,1536,16384,4096,87.04000115394592
e2m1,fp32,fp32,e8m0,16,k,k,n,256,192,128,192,4,2,1536,16384,4096,86.8287980556488
e2m1,fp32,fp32,e8m0,16,k,k,n,256,256,128,256,2,1,1536,16384,4096,78.0351996421814
e2m1,fp32,fp32,e8m0,16,k,k,n,256,256,128,256,2,2,1536,16384,4096,77.81760096549988
e2m1,fp32,fp32,e8m0,16,k,k,n,256,256,128,256,2,4,1536,16384,4096,87.65439987182617
e2m1,fp32,fp32,e8m0,16,k,k,n,256,256,128,256,4,2,1536,16384,4096,86.83519959449768
e2m1,fp32,fp32,e8m0,16,k,k,n,256,64,128,64,2,1,4096,8192,7168,212.5823974609375
e2m1,fp32,fp32,e8m0,16,k,k,n,256,64,128,64,2,2,4096,8192,7168,235.52000522613525
e2m1,fp32,fp32,e8m0,16,k,k,n,256,64,128,64,2,4,4096,8192,7168,256.39679431915283
e2m1,fp32,fp32,e8m0,16,k,k,n,256,64,128,64,4,2,4096,8192,7168,255.9999942779541
e2m1,fp32,fp32,e8m0,16,k,k,n,256,128,128,128,2,1,4096,8192,7168,144.58880424499512
e2m1,fp32,fp32,e8m0,16,k,k,n,256,128,128,128,2,2,4096,8192,7168,157.2864055633545
e2m1,fp32,fp32,e8m0,16,k,k,n,256,128,128,128,2,4,4096,8192,7168,170.3935980796814
e2m1,fp32,fp32,e8m0,16,k,k,n,256,128,128,128,4,2,4096,8192,7168,172.44160175323486
e2m1,fp32,fp32,e8m0,16,k,k,n,256,192,128,192,2,1,4096,8192,7168,138.0352020263672
e2m1,fp32,fp32,e8m0,16,k,k,n,256,192,128,192,2,2,4096,8192,7168,146.63679599761963
e2m1,fp32,fp32,e8m0,16,k,k,n,256,192,128,192,2,4,4096,8192,7168,160.15360355377197
e2m1,fp32,fp32,e8m0,16,k,k,n,256,192,128,192,4,2,4096,8192,7168,161.38880252838135
e2m1,fp32,fp32,e8m0,16,k,k,n,256,256,128,256,2,1,4096,8192,7168,130.25280237197876
e2m1,fp32,fp32,e8m0,16,k,k,n,256,256,128,256,2,2,4096,8192,7168,140.90240001678467
e2m1,fp32,fp32,e8m0,16,k,k,n,256,256,128,256,2,4,4096,8192,7168,155.2575945854187
e2m1,fp32,fp32,e8m0,16,k,k,n,256,256,128,256,4,2,4096,8192,7168,155.6480050086975
e2m1,fp32,fp32,e8m0,16,k,k,n,256,64,128,64,2,1,4096,7168,8192,210.94400882720947
e2m1,fp32,fp32,e8m0,16,k,k,n,256,64,128,64,2,2,4096,7168,8192,235.92960834503174
e2m1,fp32,fp32,e8m0,16,k,k,n,256,64,128,64,2,4,4096,7168,8192,251.50721073150635
e2m1,fp32,fp32,e8m0,16,k,k,n,256,64,128,64,4,2,4096,7168,8192,249.03039932250977
e2m1,fp32,fp32,e8m0,16,k,k,n,256,128,128,128,2,1,4096,7168,8192,143.76959800720215
e2m1,fp32,fp32,e8m0,16,k,k,n,256,128,128,128,2,2,4096,7168,8192,153.60640287399292
e2m1,fp32,fp32,e8m0,16,k,k,n,256,128,128,128,2,4,4096,7168,8192,166.29760265350342
e2m1,fp32,fp32,e8m0,16,k,k,n,256,128,128,128,4,2,4096,7168,8192,169.57440376281738
e2m1,fp32,fp32,e8m0,16,k,k,n,256,192,128,192,2,1,4096,7168,8192,137.6255989074707
e2m1,fp32,fp32,e8m0,16,k,k,n,256,192,128,192,2,2,4096,7168,8192,147.0463991165161
e2m1,fp32,fp32,e8m0,16,k,k,n,256,192,128,192,2,4,4096,7168,8192,163.02080154418945
e2m1,fp32,fp32,e8m0,16,k,k,n,256,192,128,192,4,2,4096,7168,8192,160.15360355377197
e2m1,fp32,fp32,e8m0,16,k,k,n,256,256,128,256,2,1,4096,7168,8192,139.26399946212769
e2m1,fp32,fp32,e8m0,16,k,k,n,256,256,128,256,2,2,4096,7168,8192,138.44480514526367
e2m1,fp32,fp32,e8m0,16,k,k,n,256,256,128,256,2,4,4096,7168,8192,154.41919565200806
e2m1,fp32,fp32,e8m0,16,k,k,n,256,256,128,256,4,2,4096,7168,8192,154.82239723205566
e2m1,fp32,fp32,e8m0,16,k,k,n,256,64,128,64,2,1,7168,8192,4096,222.41919040679932
e2m1,fp32,fp32,e8m0,16,k,k,n,256,64,128,64,2,2,7168,8192,4096,256.81920051574707
e2m1,fp32,fp32,e8m0,16,k,k,n,256,64,128,64,2,4,7168,8192,4096,279.34720516204834
e2m1,fp32,fp32,e8m0,16,k,k,n,256,64,128,64,4,2,7168,8192,4096,270.34239768981934
e2m1,fp32,fp32,e8m0,16,k,k,n,256,128,128,128,2,1,7168,8192,4096,158.52160453796387
e2m1,fp32,fp32,e8m0,16,k,k,n,256,128,128,128,2,2,7168,8192,4096,179.8143982887268
e2m1,fp32,fp32,e8m0,16,k,k,n,256,128,128,128,2,4,7168,8192,4096,195.37919759750366
e2m1,fp32,fp32,e8m0,16,k,k,n,256,128,128,128,4,2,7168,8192,4096,195.37919759750366
e2m1,fp32,fp32,e8m0,16,k,k,n,256,192,128,192,2,1,7168,8192,4096,153.1775951385498
e2m1,fp32,fp32,e8m0,16,k,k,n,256,192,128,192,2,2,7168,8192,4096,167.11679697036743
e2m1,fp32,fp32,e8m0,16,k,k,n,256,192,128,192,2,4,7168,8192,4096,180.63360452651978
e2m1,fp32,fp32,e8m0,16,k,k,n,256,192,128,192,4,2,7168,8192,4096,179.8143982887268
e2m1,fp32,fp32,e8m0,16,k,k,n,256,256,128,256,2,1,7168,8192,4096,156.4479947090149
e2m1,fp32,fp32,e8m0,16,k,k,n,256,256,128,256,2,2,7168,8192,4096,162.19520568847656
e2m1,fp32,fp32,e8m0,16,k,k,n,256,256,128,256,2,4,7168,8192,4096,171.6223955154419
e2m1,fp32,fp32,e8m0,16,k,k,n,256,256,128,256,4,2,7168,8192,4096,171.6223955154419
e2m1,fp32,fp32,e8m0,16,k,k,n,256,64,128,64,2,1,4096,8192,1536,74.9567985534668
e2m1,fp32,fp32,e8m0,16,k,k,n,256,64,128,64,2,2,4096,8192,1536,75.97439885139465
e2m1,fp32,fp32,e8m0,16,k,k,n,256,64,128,64,2,4,4096,8192,1536,81.12000226974487
e2m1,fp32,fp32,e8m0,16,k,k,n,256,64,128,64,4,2,4096,8192,1536,82.7455997467041
e2m1,fp32,fp32,e8m0,16,k,k,n,256,128,128,128,2,1,4096,8192,1536,59.807997941970825
e2m1,fp32,fp32,e8m0,16,k,k,n,256,128,128,128,2,2,4096,8192,1536,61.85600161552429
e2m1,fp32,fp32,e8m0,16,k,k,n,256,128,128,128,2,4,4096,8192,1536,64.7104024887085
e2m1,fp32,fp32,e8m0,16,k,k,n,256,128,128,128,4,2,4096,8192,1536,64.7167980670929
e2m1,fp32,fp32,e8m0,16,k,k,n,256,192,128,192,2,1,4096,8192,1536,56.992000341415405
e2m1,fp32,fp32,e8m0,16,k,k,n,256,192,128,192,2,2,4096,8192,1536,58.982402086257935
e2m1,fp32,fp32,e8m0,16,k,k,n,256,192,128,192,2,4,4096,8192,1536,65.54239988327026
e2m1,fp32,fp32,e8m0,16,k,k,n,256,192,128,192,4,2,4096,8192,1536,63.90399932861328
e2m1,fp32,fp32,e8m0,16,k,k,n,256,256,128,256,2,1,4096,8192,1536,56.11519813537598
e2m1,fp32,fp32,e8m0,16,k,k,n,256,256,128,256,2,2,4096,8192,1536,61.849600076675415
e2m1,fp32,fp32,e8m0,16,k,k,n,256,256,128,256,2,4,4096,8192,1536,65.94560146331787
e2m1,fp32,fp32,e8m0,16,k,k,n,256,256,128,256,4,2,4096,8192,1536,65.94560146331787
e2m1,fp32,fp32,e8m0,16,k,k,n,256,64,128,64,2,1,4096,1536,8192,59.801602363586426
e2m1,fp32,fp32,e8m0,16,k,k,n,256,64,128,64,2,2,4096,1536,8192,62.668800354003906
e2m1,fp32,fp32,e8m0,16,k,k,n,256,64,128,64,2,4,4096,1536,8192,68.81279945373535
e2m1,fp32,fp32,e8m0,16,k,k,n,256,64,128,64,4,2,4096,1536,8192,69.22240257263184
e2m1,fp32,fp32,e8m0,16,k,k,n,256,128,128,128,2,1,4096,1536,8192,41.574400663375854
e2m1,fp32,fp32,e8m0,16,k,k,n,256,128,128,128,2,2,4096,1536,8192,42.399999499320984
e2m1,fp32,fp32,e8m0,16,k,k,n,256,128,128,128,2,4,4096,1536,8192,50.995200872421265
e2m1,fp32,fp32,e8m0,16,k,k,n,256,128,128,128,4,2,4096,1536,8192,51.20000243186951
e2m1,fp32,fp32,e8m0,16,k,k,n,256,192,128,192,2,1,4096,1536,8192,39.32160139083862
e2m1,fp32,fp32,e8m0,16,k,k,n,256,192,128,192,2,2,4096,1536,8192,39.52639997005463
e2m1,fp32,fp32,e8m0,16,k,k,n,256,192,128,192,2,4,4096,1536,8192,51.19360089302063
e2m1,fp32,fp32,e8m0,16,k,k,n,256,192,128,192,4,2,4096,1536,8192,51.20000243186951
e2m1,fp32,fp32,e8m0,16,k,k,n,256,256,128,256,2,1,4096,1536,8192,45.56159973144531
e2m1,fp32,fp32,e8m0,16,k,k,n,256,256,128,256,2,2,4096,1536,8192,45.74719965457916
e2m1,fp32,fp32,e8m0,16,k,k,n,256,256,128,256,2,4,4096,1536,8192,62.25919723510742
e2m1,fp32,fp32,e8m0,16,k,k,n,256,256,128,256,4,2,4096,1536,8192,46.57280147075653
e2m1,fp32,fp32,e8m0,16,k,k,n,256,64,128,64,2,1,1536,8192,4096,62.463998794555664
e2m1,fp32,fp32,e8m0,16,k,k,n,256,64,128,64,2,2,1536,8192,4096,67.98719763755798
e2m1,fp32,fp32,e8m0,16,k,k,n,256,64,128,64,2,4,1536,8192,4096,71.27040028572083
e2m1,fp32,fp32,e8m0,16,k,k,n,256,64,128,64,4,2,1536,8192,4096,74.34239983558655
e2m1,fp32,fp32,e8m0,16,k,k,n,256,128,128,128,2,1,1536,8192,4096,47.513601183891296
e2m1,fp32,fp32,e8m0,16,k,k,n,256,128,128,128,2,2,1536,8192,4096,48.742398619651794
e2m1,fp32,fp32,e8m0,16,k,k,n,256,128,128,128,2,4,1536,8192,4096,53.248000144958496
e2m1,fp32,fp32,e8m0,16,k,k,n,256,128,128,128,4,2,1536,8192,4096,54.06720042228699
e2m1,fp32,fp32,e8m0,16,k,k,n,256,192,128,192,2,1,1536,8192,4096,45.049598813056946
e2m1,fp32,fp32,e8m0,16,k,k,n,256,192,128,192,2,2,1536,8192,4096,45.2672004699707
e2m1,fp32,fp32,e8m0,16,k,k,n,256,192,128,192,2,4,1536,8192,4096,51.20000243186951
e2m1,fp32,fp32,e8m0,16,k,k,n,256,192,128,192,4,2,1536,8192,4096,51.40479803085327
e2m1,fp32,fp32,e8m0,16,k,k,n,256,256,128,256,2,1,1536,8192,4096,43.41759979724884
e2m1,fp32,fp32,e8m0,16,k,k,n,256,256,128,256,2,2,1536,8192,4096,43.513599038124084
e2m1,fp32,fp32,e8m0,16,k,k,n,256,256,128,256,2,4,1536,8192,4096,53.248000144958496
e2m1,fp32,fp32,e8m0,16,k,k,n,256,256,128,256,4,2,1536,8192,4096,53.24159860610962
e2m1,fp32,fp32,e8m0,16,k,k,n,256,64,128,64,2,1,4096,4096,192,25.190401077270508
e2m1,fp32,fp32,e8m0,16,k,k,n,256,64,128,64,2,2,4096,4096,192,27.44320034980774
e2m1,fp32,fp32,e8m0,16,k,k,n,256,64,128,64,2,4,4096,4096,192,27.846398949623108
e2m1,fp32,fp32,e8m0,16,k,k,n,256,64,128,64,4,2,4096,4096,192,28.05759906768799
e2m1,fp32,fp32,e8m0,16,k,k,n,256,128,128,128,2,1,4096,4096,192,23.545600473880768
e2m1,fp32,fp32,e8m0,16,k,k,n,256,128,128,128,2,2,4096,4096,192,24.57599937915802
e2m1,fp32,fp32,e8m0,16,k,k,n,256,128,128,128,2,4,4096,4096,192,25.804799795150757
e2m1,fp32,fp32,e8m0,16,k,k,n,256,128,128,128,4,2,4096,4096,192,27.039998769760132
e2m1,fp32,fp32,e8m0,16,k,k,n,256,192,128,192,2,1,4096,4096,192,24.582399427890778
e2m1,fp32,fp32,e8m0,16,k,k,n,256,192,128,192,2,2,4096,4096,192,27.027198672294617
e2m1,fp32,fp32,e8m0,16,k,k,n,256,192,128,192,2,4,4096,4096,192,28.87040078639984
e2m1,fp32,fp32,e8m0,16,k,k,n,256,192,128,192,4,2,4096,4096,192,26.83520019054413
e2m1,fp32,fp32,e8m0,16,k,k,n,256,256,128,256,2,1,4096,4096,192,25.600001215934753
e2m1,fp32,fp32,e8m0,16,k,k,n,256,256,128,256,2,2,4096,4096,192,24.985599517822266
e2m1,fp32,fp32,e8m0,16,k,k,n,256,256,128,256,2,4,4096,4096,192,27.44320034980774
e2m1,fp32,fp32,e8m0,16,k,k,n,256,256,128,256,4,2,4096,4096,192,28.05759906768799
e2m1,fp32,fp32,e8m0,16,k,k,n,256,64,128,64,2,1,4096,192,4096,23.552000522613525
e2m1,fp32,fp32,e8m0,16,k,k,n,256,64,128,64,2,2,4096,192,4096,24.160000681877136
e2m1,fp32,fp32,e8m0,16,k,k,n,256,64,128,64,2,4,4096,192,4096,24.172799289226532
e2m1,fp32,fp32,e8m0,16,k,k,n,256,64,128,64,4,2,4096,192,4096,24.172799289226532
e2m1,fp32,fp32,e8m0,16,k,k,n,256,128,128,128,2,1,4096,192,4096,23.136000335216522
e2m1,fp32,fp32,e8m0,16,k,k,n,256,128,128,128,2,2,4096,192,4096,23.96160066127777
e2m1,fp32,fp32,e8m0,16,k,k,n,256,128,128,128,2,4,4096,192,4096,24.371199309825897
e2m1,fp32,fp32,e8m0,16,k,k,n,256,128,128,128,4,2,4096,192,4096,25.190401077270508
e2m1,fp32,fp32,e8m0,16,k,k,n,256,192,128,192,2,1,4096,192,4096,24.166400730609894
e2m1,fp32,fp32,e8m0,16,k,k,n,256,192,128,192,2,2,4096,192,4096,24.780799448490143
e2m1,fp32,fp32,e8m0,16,k,k,n,256,192,128,192,2,4,4096,192,4096,26.624000072479248
e2m1,fp32,fp32,e8m0,16,k,k,n,256,192,128,192,4,2,4096,192,4096,23.552000522613525
e2m1,fp32,fp32,e8m0,16,k,k,n,256,256,128,256,2,1,4096,192,4096,24.371199309825897
e2m1,fp32,fp32,e8m0,16,k,k,n,256,256,128,256,2,2,4096,192,4096,24.377599358558655
e2m1,fp32,fp32,e8m0,16,k,k,n,256,256,128,256,2,4,4096,192,4096,28.460800647735596
e2m1,fp32,fp32,e8m0,16,k,k,n,256,256,128,256,4,2,4096,192,4096,26.009601354599
e2m1,fp32,fp32,e8m0,16,k,k,n,256,64,128,64,2,1,192,4096,4096,23.75040054321289
e2m1,fp32,fp32,e8m0,16,k,k,n,256,64,128,64,2,2,192,4096,4096,24.166400730609894
e2m1,fp32,fp32,e8m0,16,k,k,n,256,64,128,64,2,4,192,4096,4096,24.166400730609894
e2m1,fp32,fp32,e8m0,16,k,k,n,256,64,128,64,4,2,192,4096,4096,24.371199309825897
e2m1,fp32,fp32,e8m0,16,k,k,n,256,128,128,128,2,1,192,4096,4096,24.172799289226532
e2m1,fp32,fp32,e8m0,16,k,k,n,256,128,128,128,2,2,192,4096,4096,23.955200612545013
e2m1,fp32,fp32,e8m0,16,k,k,n,256,128,128,128,2,4,192,4096,4096,24.569599330425262
e2m1,fp32,fp32,e8m0,16,k,k,n,256,128,128,128,4,2,192,4096,4096,23.96160066127777
e2m1,fp32,fp32,e8m0,16,k,k,n,256,192,128,192,2,1,192,4096,4096,24.166400730609894
e2m1,fp32,fp32,e8m0,16,k,k,n,256,192,128,192,2,2,192,4096,4096,23.96160066127777
e2m1,fp32,fp32,e8m0,16,k,k,n,256,192,128,192,2,4,192,4096,4096,24.371199309825897
e2m1,fp32,fp32,e8m0,16,k,k,n,256,192,128,192,4,2,192,4096,4096,24.36479926109314
e2m1,fp32,fp32,e8m0,16,k,k,n,256,256,128,256,2,1,192,4096,4096,24.780799448490143
e2m1,fp32,fp32,e8m0,16,k,k,n,256,256,128,256,2,2,192,4096,4096,23.96160066127777
e2m1,fp32,fp32,e8m0,16,k,k,n,256,256,128,256,2,4,192,4096,4096,24.780799448490143
e2m1,fp32,fp32,e8m0,16,k,k,n,256,256,128,256,4,2,192,4096,4096,24.166400730609894
e2m1,fp32,fp32,e8m0,16,k,k,n,256,64,128,64,2,1,4096,16384,4096,249.04320240020752
e2m1,fp32,fp32,e8m0,16,k,k,n,256,64,128,64,2,2,4096,16384,4096,285.4912042617798
e2m1,fp32,fp32,e8m0,16,k,k,n,256,64,128,64,2,4,4096,16384,4096,313.13281059265137
e2m1,fp32,fp32,e8m0,16,k,k,n,256,64,128,64,4,2,4096,16384,4096,317.21599102020264
e2m1,fp32,fp32,e8m0,16,k,k,n,256,128,128,128,2,1,4096,16384,4096,184.72959995269775
e2m1,fp32,fp32,e8m0,16,k,k,n,256,128,128,128,2,2,4096,16384,4096,197.8368043899536
e2m1,fp32,fp32,e8m0,16,k,k,n,256,128,128,128,2,4,4096,16384,4096,226.09920501708984
e2m1,fp32,fp32,e8m0,16,k,k,n,256,128,128,128,4,2,4096,16384,4096,221.18399143218994
e2m1,fp32,fp32,e8m0,16,k,k,n,256,192,128,192,2,1,4096,16384,4096,175.71840286254883
e2m1,fp32,fp32,e8m0,16,k,k,n,256,192,128,192,2,2,4096,16384,4096,181.4527988433838
e2m1,fp32,fp32,e8m0,16,k,k,n,256,192,128,192,2,4,4096,16384,4096,207.25760459899902
e2m1,fp32,fp32,e8m0,16,k,k,n,256,192,128,192,4,2,4096,16384,4096,199.4752049446106
e2m1,fp32,fp32,e8m0,16,k,k,n,256,256,128,256,2,1,4096,16384,4096,167.52640008926392
e2m1,fp32,fp32,e8m0,16,k,k,n,256,256,128,256,2,2,4096,16384,4096,184.31999683380127
e2m1,fp32,fp32,e8m0,16,k,k,n,256,256,128,256,2,4,4096,16384,4096,192.1023964881897
e2m1,fp32,fp32,e8m0,16,k,k,n,256,256,128,256,4,2,4096,16384,4096,192.51840114593506
e2m1,fp32,fp32,e8m0,16,k,k,n,256,64,128,64,2,1,4096,4096,16384,225.27999877929688
e2m1,fp32,fp32,e8m0,16,k,k,n,256,64,128,64,2,2,4096,4096,16384,247.37920761108398
e2m1,fp32,fp32,e8m0,16,k,k,n,256,64,128,64,2,4,4096,4096,16384,260.915207862854
e2m1,fp32,fp32,e8m0,16,k,k,n,256,64,128,64,4,2,4096,4096,16384,259.27679538726807
e2m1,fp32,fp32,e8m0,16,k,k,n,256,128,128,128,2,1,4096,4096,16384,146.23359441757202
e2m1,fp32,fp32,e8m0,16,k,k,n,256,128,128,128,2,2,4096,4096,16384,158.515202999115
e2m1,fp32,fp32,e8m0,16,k,k,n,256,128,128,128,2,4,4096,4096,16384,177.76639461517334
e2m1,fp32,fp32,e8m0,16,k,k,n,256,128,128,128,4,2,4096,4096,16384,178.17599773406982
e2m1,fp32,fp32,e8m0,16,k,k,n,256,192,128,192,2,1,4096,4096,16384,140.49279689788818
e2m1,fp32,fp32,e8m0,16,k,k,n,256,192,128,192,2,2,4096,4096,16384,160.5631947517395
e2m1,fp32,fp32,e8m0,16,k,k,n,256,192,128,192,2,4,4096,4096,16384,183.91040563583374
e2m1,fp32,fp32,e8m0,16,k,k,n,256,192,128,192,4,2,4096,4096,16384,163.02080154418945
e2m1,fp32,fp32,e8m0,16,k,k,n,256,256,128,256,2,1,4096,4096,16384,143.5647964477539
e2m1,fp32,fp32,e8m0,16,k,k,n,256,256,128,256,2,2,4096,4096,16384,142.13119745254517
e2m1,fp32,fp32,e8m0,16,k,k,n,256,256,128,256,2,4,4096,4096,16384,169.9839949607849
e2m1,fp32,fp32,e8m0,16,k,k,n,256,256,128,256,4,2,4096,4096,16384,169.9903964996338
e2m1,fp32,fp32,e8m0,16,k,k,n,256,64,128,64,2,1,4096,7168,16384,394.649600982666
e2m1,fp32,fp32,e8m0,16,k,k,n,256,64,128,64,2,2,4096,7168,16384,410.62397956848145
e2m1,fp32,fp32,e8m0,16,k,k,n,256,64,128,64,2,4,4096,7168,16384,438.68160247802734
e2m1,fp32,fp32,e8m0,16,k,k,n,256,64,128,64,4,2,4096,7168,16384,437.6704216003418
e2m1,fp32,fp32,e8m0,16,k,k,n,256,128,128,128,2,1,4096,7168,16384,251.90401077270508
e2m1,fp32,fp32,e8m0,16,k,k,n,256,128,128,128,2,2,4096,7168,16384,258.4575891494751
e2m1,fp32,fp32,e8m0,16,k,k,n,256,128,128,128,2,4,4096,7168,16384,285.0816011428833
e2m1,fp32,fp32,e8m0,16,k,k,n,256,128,128,128,4,2,4096,7168,16384,288.76800537109375
e2m1,fp32,fp32,e8m0,16,k,k,n,256,192,128,192,2,1,4096,7168,16384,232.65280723571777
e2m1,fp32,fp32,e8m0,16,k,k,n,256,192,128,192,2,2,4096,7168,16384,251.4944076538086
e2m1,fp32,fp32,e8m0,16,k,k,n,256,192,128,192,2,4,4096,7168,16384,277.7087926864624
e2m1,fp32,fp32,e8m0,16,k,k,n,256,192,128,192,4,2,4096,7168,16384,271.1551904678345
e2m1,fp32,fp32,e8m0,16,k,k,n,256,256,128,256,2,1,4096,7168,16384,229.7856092453003
e2m1,fp32,fp32,e8m0,16,k,k,n,256,256,128,256,2,2,4096,7168,16384,228.14719676971436
e2m1,fp32,fp32,e8m0,16,k,k,n,256,256,128,256,2,4,4096,7168,16384,255.9999942779541
e2m1,fp32,fp32,e8m0,16,k,k,n,256,256,128,256,4,2,4096,7168,16384,255.9999942779541
e2m1,fp32,fp32,e8m0,16,k,k,n,256,64,128,64,2,1,4096,16384,7168,405.70878982543945
e2m1,fp32,fp32,e8m0,16,k,k,n,256,64,128,64,2,2,4096,16384,7168,450.3551959991455
e2m1,fp32,fp32,e8m0,16,k,k,n,256,64,128,64,2,4,4096,16384,7168,484.3520164489746
e2m1,fp32,fp32,e8m0,16,k,k,n,256,64,128,64,4,2,4096,16384,7168,484.3520164489746
e2m1,fp32,fp32,e8m0,16,k,k,n,256,128,128,128,2,1,4096,16384,7168,261.3312005996704
e2m1,fp32,fp32,e8m0,16,k,k,n,256,128,128,128,2,2,4096,16384,7168,286.31041049957275
e2m1,fp32,fp32,e8m0,16,k,k,n,256,128,128,128,2,4,4096,16384,7168,324.6079921722412
e2m1,fp32,fp32,e8m0,16,k,k,n,256,128,128,128,4,2,4096,16384,7168,320.1024055480957
e2m1,fp32,fp32,e8m0,16,k,k,n,256,192,128,192,2,1,4096,16384,7168,242.48321056365967
e2m1,fp32,fp32,e8m0,16,k,k,n,256,192,128,192,2,2,4096,16384,7168,258.46400260925293
e2m1,fp32,fp32,e8m0,16,k,k,n,256,192,128,192,2,4,4096,16384,7168,297.57440090179443
e2m1,fp32,fp32,e8m0,16,k,k,n,256,192,128,192,4,2,4096,16384,7168,289.17760848999023
e2m1,fp32,fp32,e8m0,16,k,k,n,256,256,128,256,2,1,4096,16384,7168,234.29760932922363
e2m1,fp32,fp32,e8m0,16,k,k,n,256,256,128,256,2,2,4096,16384,7168,259.27679538726807
e2m1,fp32,fp32,e8m0,16,k,k,n,256,256,128,256,2,4,4096,16384,7168,276.0704040527344
e2m1,fp32,fp32,e8m0,16,k,k,n,256,256,128,256,4,2,4096,16384,7168,276.48000717163086
e2m1,fp32,fp32,e8m0,16,k,k,n,256,64,128,64,2,1,16384,7168,4096,434.79042053222656
e2m1,fp32,fp32,e8m0,16,k,k,n,256,64,128,64,2,2,16384,7168,4096,513.0368232727051
e2m1,fp32,fp32,e8m0,16,k,k,n,256,64,128,64,2,4,16384,7168,4096,568.7295913696289
e2m1,fp32,fp32,e8m0,16,k,k,n,256,64,128,64,4,2,16384,7168,4096,567.7055835723877
e2m1,fp32,fp32,e8m0,16,k,k,n,256,128,128,128,2,1,16384,7168,4096,318.0543899536133
e2m1,fp32,fp32,e8m0,16,k,k,n,256,128,128,128,2,2,16384,7168,4096,352.87039279937744
e2m1,fp32,fp32,e8m0,16,k,k,n,256,128,128,128,2,4,16384,7168,4096,385.2288007736206
e2m1,fp32,fp32,e8m0,16,k,k,n,256,128,128,128,4,2,16384,7168,4096,387.2767925262451
e2m1,fp32,fp32,e8m0,16,k,k,n,256,192,128,192,2,1,16384,7168,4096,283.85279178619385
e2m1,fp32,fp32,e8m0,16,k,k,n,256,192,128,192,2,2,16384,7168,4096,312.1216058731079
e2m1,fp32,fp32,e8m0,16,k,k,n,256,192,128,192,2,4,16384,7168,4096,359.8464012145996
e2m1,fp32,fp32,e8m0,16,k,k,n,256,192,128,192,4,2,16384,7168,4096,341.4016008377075
e2m1,fp32,fp32,e8m0,16,k,k,n,256,256,128,256,2,1,16384,7168,4096,277.2991895675659
e2m1,fp32,fp32,e8m0,16,k,k,n,256,256,128,256,2,2,16384,7168,4096,302.4895906448364
e2m1,fp32,fp32,e8m0,16,k,k,n,256,256,128,256,2,4,16384,7168,4096,322.1503973007202
e2m1,fp32,fp32,e8m0,16,k,k,n,256,256,128,256,4,2,16384,7168,4096,326.4575958251953
e2m1,fp32,fp32,e8m0,16,k,k,n,256,64,128,64,2,1,4096,18432,7168,455.2703857421875
e2m1,fp32,fp32,e8m0,16,k,k,n,256,64,128,64,2,2,4096,18432,7168,506.06079101562494
e2m1,fp32,fp32,e8m0,16,k,k,n,256,64,128,64,2,4,4096,18432,7168,537.1903896331787
e2m1,fp32,fp32,e8m0,16,k,k,n,256,64,128,64,4,2,4096,18432,7168,539.2384052276611
e2m1,fp32,fp32,e8m0,16,k,k,n,256,128,128,128,2,1,4096,18432,7168,292.4607992172241
e2m1,fp32,fp32,e8m0,16,k,k,n,256,128,128,128,2,2,4096,18432,7168,313.5488033294678
e2m1,fp32,fp32,e8m0,16,k,k,n,256,128,128,128,2,4,4096,18432,7168,359.42399501800537
e2m1,fp32,fp32,e8m0,16,k,k,n,256,128,128,128,4,2,4096,18432,7168,355.7375907897949
e2m1,fp32,fp32,e8m0,16,k,k,n,256,192,128,192,2,1,4096,18432,7168,268.287992477417
e2m1,fp32,fp32,e8m0,16,k,k,n,256,192,128,192,2,2,4096,18432,7168,290.4063940048218
e2m1,fp32,fp32,e8m0,16,k,k,n,256,192,128,192,2,4,4096,18432,7168,318.668794631958
e2m1,fp32,fp32,e8m0,16,k,k,n,256,192,128,192,4,2,4096,18432,7168,321.74079418182373
e2m1,fp32,fp32,e8m0,16,k,k,n,256,256,128,256,2,1,4096,18432,7168,264.1983985900879
e2m1,fp32,fp32,e8m0,16,k,k,n,256,256,128,256,2,2,4096,18432,7168,288.76800537109375
e2m1,fp32,fp32,e8m0,16,k,k,n,256,256,128,256,2,4,4096,18432,7168,315.59040546417236
e2m1,fp32,fp32,e8m0,16,k,k,n,256,256,128,256,4,2,4096,18432,7168,313.753604888916
e2m1,fp32,fp32,e8m0,16,k,k,n,256,64,128,64,2,1,4096,7168,18432,429.8687934875488
e2m1,fp32,fp32,e8m0,16,k,k,n,256,64,128,64,2,2,4096,7168,18432,454.860782623291
e2m1,fp32,fp32,e8m0,16,k,k,n,256,64,128,64,2,4,4096,7168,18432,486.3999843597412
e2m1,fp32,fp32,e8m0,16,k,k,n,256,64,128,64,4,2,4096,7168,18432,485.9903812408447
e2m1,fp32,fp32,e8m0,16,k,k,n,256,128,128,128,2,1,4096,7168,18432,276.0704040527344
e2m1,fp32,fp32,e8m0,16,k,k,n,256,128,128,128,2,2,4096,7168,18432,293.27359199523926
e2m1,fp32,fp32,e8m0,16,k,k,n,256,128,128,128,2,4,4096,7168,18432,318.46399307250977
e2m1,fp32,fp32,e8m0,16,k,k,n,256,128,128,128,4,2,4096,7168,18432,319.28319931030273
e2m1,fp32,fp32,e8m0,16,k,k,n,256,192,128,192,2,1,4096,7168,18432,259.68639850616455
e2m1,fp32,fp32,e8m0,16,k,k,n,256,192,128,192,2,2,4096,7168,18432,282.2144031524658
e2m1,fp32,fp32,e8m0,16,k,k,n,256,192,128,192,2,4,4096,7168,18432,308.63358974456787
e2m1,fp32,fp32,e8m0,16,k,k,n,256,192,128,192,4,2,4096,7168,18432,306.58559799194336
e2m1,fp32,fp32,e8m0,16,k,k,n,256,256,128,256,2,1,4096,7168,18432,251.47519111633298
e2m1,fp32,fp32,e8m0,16,k,k,n,256,256,128,256,2,2,4096,7168,18432,249.8624086380005
e2m1,fp32,fp32,e8m0,16,k,k,n,256,256,128,256,2,4,4096,7168,18432,280.17280101776123
e2m1,fp32,fp32,e8m0,16,k,k,n,256,256,128,256,4,2,4096,7168,18432,280.5759906768799
e2m1,fp32,fp32,e8m0,16,k,k,n,256,64,128,64,2,1,7168,18432,4096,470.83520889282227
e2m1,fp32,fp32,e8m0,16,k,k,n,256,64,128,64,2,2,7168,18432,4096,541.6959762573242
e2m1,fp32,fp32,e8m0,16,k,k,n,256,64,128,64,2,4,7168,18432,4096,629.145622253418
e2m1,fp32,fp32,e8m0,16,k,k,n,256,64,128,64,4,2,7168,18432,4096,582.6560020446777
e2m1,fp32,fp32,e8m0,16,k,k,n,256,128,128,128,2,1,7168,18432,4096,325.0240087509155
e2m1,fp32,fp32,e8m0,16,k,k,n,256,128,128,128,2,2,7168,18432,4096,377.03680992126465
e2m1,fp32,fp32,e8m0,16,k,k,n,256,128,128,128,2,4,7168,18432,4096,414.3104076385498
e2m1,fp32,fp32,e8m0,16,k,k,n,256,128,128,128,4,2,7168,18432,4096,413.9008045196533
e2m1,fp32,fp32,e8m0,16,k,k,n,256,192,128,192,2,1,7168,18432,4096,306.58559799194336
e2m1,fp32,fp32,e8m0,16,k,k,n,256,192,128,192,2,2,7168,18432,4096,336.4864110946655
e2m1,fp32,fp32,e8m0,16,k,k,n,256,192,128,192,2,4,7168,18432,4096,364.3392086029053
e2m1,fp32,fp32,e8m0,16,k,k,n,256,192,128,192,4,2,7168,18432,4096,365.9775972366333
e2m1,fp32,fp32,e8m0,16,k,k,n,256,256,128,256,2,1,7168,18432,4096,314.37439918518066
e2m1,fp32,fp32,e8m0,16,k,k,n,256,256,128,256,2,2,7168,18432,4096,336.07680797576904
e2m1,fp32,fp32,e8m0,16,k,k,n,256,256,128,256,2,4,7168,18432,4096,358.188796043396
e2m1,fp32,fp32,e8m0,16,k,k,n,256,256,128,256,4,2,7168,18432,4096,356.1471939086914
e2m1,fp32,fp32,e8m0,16,k,k,n,256,64,128,64,2,1,18432,7168,4096,494.5919990539551
e2m1,fp32,fp32,e8m0,16,k,k,n,256,64,128,64,2,2,18432,7168,4096,582.6560020446777
e2m1,fp32,fp32,e8m0,16,k,k,n,256,64,128,64,2,4,18432,7168,4096,643.4815883636475
e2m1,fp32,fp32,e8m0,16,k,k,n,256,64,128,64,4,2,18432,7168,4096,638.5663986206055
e2m1,fp32,fp32,e8m0,16,k,k,n,256,128,128,128,2,1,18432,7168,4096,358.40001106262207
e2m1,fp32,fp32,e8m0,16,k,k,n,256,128,128,128,2,2,18432,7168,4096,402.4320125579834
e2m1,fp32,fp32,e8m0,16,k,k,n,256,128,128,128,2,4,18432,7168,4096,438.0671977996826
e2m1,fp32,fp32,e8m0,16,k,k,n,256,128,128,128,4,2,18432,7168,4096,438.4768009185791
e2m1,fp32,fp32,e8m0,16,k,k,n,256,192,128,192,2,1,18432,7168,4096,318.0543899536133
e2m1,fp32,fp32,e8m0,16,k,k,n,256,192,128,192,2,2,18432,7168,4096,357.5808048248291
e2m1,fp32,fp32,e8m0,16,k,k,n,256,192,128,192,2,4,18432,7168,4096,402.8416156768799
e2m1,fp32,fp32,e8m0,16,k,k,n,256,192,128,192,4,2,18432,7168,4096,384.6143960952759
e2m1,fp32,fp32,e8m0,16,k,k,n,256,256,128,256,2,1,18432,7168,4096,310.6816053390503
e2m1,fp32,fp32,e8m0,16,k,k,n,256,256,128,256,2,2,18432,7168,4096,340.1792049407959
e2m1,fp32,fp32,e8m0,16,k,k,n,256,256,128,256,2,4,18432,7168,4096,361.6767883300781
e2m1,fp32,fp32,e8m0,16,k,k,n,256,256,128,256,4,2,18432,7168,4096,367.411208152771
e2m1,fp32,fp32,e8m0,16,k,k,n,256,64,128,64,2,1,4096,257,7168,23.552000522613525
e2m1,fp32,fp32,e8m0,16,k,k,n,256,64,128,64,2,2,4096,257,7168,24.377599358558655
e2m1,fp32,fp32,e8m0,16,k,k,n,256,64,128,64,2,4,4096,257,7168,29.491201043128967
e2m1,fp32,fp32,e8m0,16,k,k,n,256,64,128,64,4,2,4096,257,7168,24.377599358558655
e2m1,fp32,fp32,e8m0,16,k,k,n,256,128,128,128,2,1,4096,257,7168,24.377599358558655
e2m1,fp32,fp32,e8m0,16,k,k,n,256,128,128,128,2,2,4096,257,7168,24.57599937915802
e2m1,fp32,fp32,e8m0,16,k,k,n,256,128,128,128,2,4,4096,257,7168,27.647998929023743
e2m1,fp32,fp32,e8m0,16,k,k,n,256,128,128,128,4,2,4096,257,7168,26.419198513031006
e2m1,fp32,fp32,e8m0,16,k,k,n,256,192,128,192,2,1,4096,257,7168,23.955200612545013
e2m1,fp32,fp32,e8m0,16,k,k,n,256,192,128,192,2,2,4096,257,7168,23.552000522613525
e2m1,fp32,fp32,e8m0,16,k,k,n,256,192,128,192,2,4,4096,257,7168,32.153600454330444
e2m1,fp32,fp32,e8m0,16,k,k,n,256,192,128,192,4,2,4096,257,7168,25.600001215934753
e2m1,fp32,fp32,e8m0,16,k,k,n,256,256,128,256,2,1,4096,257,7168,24.985599517822266
e2m1,fp32,fp32,e8m0,16,k,k,n,256,256,128,256,2,2,4096,257,7168,24.985599517822266
e2m1,fp32,fp32,e8m0,16,k,k,n,256,256,128,256,2,4,4096,257,7168,37.561601400375366
e2m1,fp32,fp32,e8m0,16,k,k,n,256,256,128,256,4,2,4096,257,7168,26.624000072479248
e2m1,fp32,fp32,e8m0,16,k,k,n,256,64,128,64,2,1,4096,7168,257,49.76640045642853
e2m1,fp32,fp32,e8m0,16,k,k,n,256,64,128,64,2,2,4096,7168,257,45.06239891052246
e2m1,fp32,fp32,e8m0,16,k,k,n,256,64,128,64,2,4,4096,7168,257,45.45919895172119
e2m1,fp32,fp32,e8m0,16,k,k,n,256,64,128,64,4,2,4096,7168,257,45.67039906978607
e2m1,fp32,fp32,e8m0,16,k,k,n,256,128,128,128,2,1,4096,7168,257,41.9840008020401
e2m1,fp32,fp32,e8m0,16,k,k,n,256,128,128,128,2,2,4096,7168,257,41.36959910392761
e2m1,fp32,fp32,e8m0,16,k,k,n,256,128,128,128,2,4,4096,7168,257,41.36959910392761
e2m1,fp32,fp32,e8m0,16,k,k,n,256,128,128,128,4,2,4096,7168,257,39.52000141143799
e2m1,fp32,fp32,e8m0,16,k,k,n,256,192,128,192,2,1,4096,7168,257,39.52639997005463
e2m1,fp32,fp32,e8m0,16,k,k,n,256,192,128,192,2,2,4096,7168,257,41.15839898586273
e2m1,fp32,fp32,e8m0,16,k,k,n,256,192,128,192,2,4,4096,7168,257,43.4112012386322
e2m1,fp32,fp32,e8m0,16,k,k,n,256,192,128,192,4,2,4096,7168,257,41.36959910392761
e2m1,fp32,fp32,e8m0,16,k,k,n,256,256,128,256,2,1,4096,7168,257,41.3567990064621
e2m1,fp32,fp32,e8m0,16,k,k,n,256,256,128,256,2,2,4096,7168,257,41.574400663375854
e2m1,fp32,fp32,e8m0,16,k,k,n,256,256,128,256,2,4,4096,7168,257,45.260798931121826
e2m1,fp32,fp32,e8m0,16,k,k,n,256,256,128,256,4,2,4096,7168,257,44.02559995651245
e2m1,fp32,fp32,e8m0,16,k,k,n,256,64,128,64,2,1,7168,257,4096,23.14240038394928
e2m1,fp32,fp32,e8m0,16,k,k,n,256,64,128,64,2,2,7168,257,4096,25.401601195335388
e2m1,fp32,fp32,e8m0,16,k,k,n,256,64,128,64,2,4,7168,257,4096,27.846398949623108
e2m1,fp32,fp32,e8m0,16,k,k,n,256,64,128,64,4,2,7168,257,4096,27.033600211143494
e2m1,fp32,fp32,e8m0,16,k,k,n,256,128,128,128,2,1,7168,257,4096,24.991999566555023
e2m1,fp32,fp32,e8m0,16,k,k,n,256,128,128,128,2,2,7168,257,4096,23.763200640678406
e2m1,fp32,fp32,e8m0,16,k,k,n,256,128,128,128,2,4,7168,257,4096,23.96160066127777
e2m1,fp32,fp32,e8m0,16,k,k,n,256,128,128,128,4,2,7168,257,4096,23.756800591945648
e2m1,fp32,fp32,e8m0,16,k,k,n,256,192,128,192,2,1,7168,257,4096,26.419198513031006
e2m1,fp32,fp32,e8m0,16,k,k,n,256,192,128,192,2,2,7168,257,4096,24.985599517822266
e2m1,fp32,fp32,e8m0,16,k,k,n,256,192,128,192,2,4,7168,257,4096,26.214399933815002
e2m1,fp32,fp32,e8m0,16,k,k,n,256,192,128,192,4,2,7168,257,4096,25.600001215934753
e2m1,fp32,fp32,e8m0,16,k,k,n,256,256,128,256,2,1,7168,257,4096,24.377599358558655
e2m1,fp32,fp32,e8m0,16,k,k,n,256,256,128,256,2,2,7168,257,4096,23.96160066127777
e2m1,fp32,fp32,e8m0,16,k,k,n,256,256,128,256,2,4,7168,257,4096,30.0927996635437
e2m1,fp32,fp32,e8m0,16,k,k,n,256,256,128,256,4,2,7168,257,4096,24.166400730609894
e2m1,fp32,fp32,e8m0,16,k,k,n,256,64,128,64,2,1,4096,2048,7168,64.7167980670929
e2m1,fp32,fp32,e8m0,16,k,k,n,256,64,128,64,2,2,4096,2048,7168,71.26399874687195
e2m1,fp32,fp32,e8m0,16,k,k,n,256,64,128,64,2,4,4096,2048,7168,76.63360238075256
e2m1,fp32,fp32,e8m0,16,k,k,n,256,64,128,64,4,2,4096,2048,7168,77.61920094490051
e2m1,fp32,fp32,e8m0,16,k,k,n,256,128,128,128,2,1,4096,2048,7168,48.742398619651794
e2m1,fp32,fp32,e8m0,16,k,k,n,256,128,128,128,2,2,4096,2048,7168,49.56800043582916
e2m1,fp32,fp32,e8m0,16,k,k,n,256,128,128,128,2,4,4096,2048,7168,56.93439841270447
e2m1,fp32,fp32,e8m0,16,k,k,n,256,128,128,128,4,2,4096,2048,7168,56.93439841270447
e2m1,fp32,fp32,e8m0,16,k,k,n,256,192,128,192,2,1,4096,2048,7168,47.7183997631073
e2m1,fp32,fp32,e8m0,16,k,k,n,256,192,128,192,2,2,4096,2048,7168,49.1456001996994
e2m1,fp32,fp32,e8m0,16,k,k,n,256,192,128,192,2,4,4096,2048,7168,58.982402086257935
e2m1,fp32,fp32,e8m0,16,k,k,n,256,192,128,192,4,2,4096,2048,7168,59.801602363586426
e2m1,fp32,fp32,e8m0,16,k,k,n,256,256,128,256,2,1,4096,2048,7168,44.64640021324158
e2m1,fp32,fp32,e8m0,16,k,k,n,256,256,128,256,2,2,4096,2048,7168,43.507200479507446
e2m1,fp32,fp32,e8m0,16,k,k,n,256,256,128,256,2,4,4096,2048,7168,58.16320180892944
e2m1,fp32,fp32,e8m0,16,k,k,n,256,256,128,256,4,2,4096,2048,7168,58.57279896736145
e2m1,fp32,fp32,e8m0,16,k,k,n,256,64,128,64,2,1,4096,7168,2048,77.00480222702026
e2m1,fp32,fp32,e8m0,16,k,k,n,256,64,128,64,2,2,4096,7168,2048,79.46879863739014
e2m1,fp32,fp32,e8m0,16,k,k,n,256,64,128,64,2,4,4096,7168,2048,84.78720188140869
e2m1,fp32,fp32,e8m0,16,k,k,n,256,64,128,64,4,2,4096,7168,2048,86.02240085601807
e2m1,fp32,fp32,e8m0,16,k,k,n,256,128,128,128,2,1,4096,7168,2048,60.26239991188049
e2m1,fp32,fp32,e8m0,16,k,k,n,256,128,128,128,2,2,4096,7168,2048,63.08479905128479
e2m1,fp32,fp32,e8m0,16,k,k,n,256,128,128,128,2,4,4096,7168,2048,69.22879815101624
e2m1,fp32,fp32,e8m0,16,k,k,n,256,128,128,128,4,2,4096,7168,2048,70.65600156784058
e2m1,fp32,fp32,e8m0,16,k,k,n,256,192,128,192,2,1,4096,7168,2048,60.659199953079224
e2m1,fp32,fp32,e8m0,16,k,k,n,256,192,128,192,2,2,4096,7168,2048,62.45759725570679
e2m1,fp32,fp32,e8m0,16,k,k,n,256,192,128,192,2,4,4096,7168,2048,71.06559872627258
e2m1,fp32,fp32,e8m0,16,k,k,n,256,192,128,192,4,2,4096,7168,2048,67.37920045852661
e2m1,fp32,fp32,e8m0,16,k,k,n,256,256,128,256,2,1,4096,7168,2048,61.44000291824341
e2m1,fp32,fp32,e8m0,16,k,k,n,256,256,128,256,2,2,4096,7168,2048,62.25919723510742
e2m1,fp32,fp32,e8m0,16,k,k,n,256,256,128,256,2,4,4096,7168,2048,67.37279891967773
e2m1,fp32,fp32,e8m0,16,k,k,n,256,256,128,256,4,2,4096,7168,2048,67.58400201797485
e2m1,fp32,fp32,e8m0,16,k,k,n,256,64,128,64,2,1,7168,2048,4096,71.47520184516907
e2m1,fp32,fp32,e8m0,16,k,k,n,256,64,128,64,2,2,7168,2048,4096,78.02879810333252
e2m1,fp32,fp32,e8m0,16,k,k,n,256,64,128,64,2,4,7168,2048,4096,81.09440207481384
e2m1,fp32,fp32,e8m0,16,k,k,n,256,64,128,64,4,2,7168,2048,4096,80.90239763259888
e2m1,fp32,fp32,e8m0,16,k,k,n,256,128,128,128,2,1,7168,2048,4096,53.248000144958496
e2m1,fp32,fp32,e8m0,16,k,k,n,256,128,128,128,2,2,7168,2048,4096,56.198400259017944
e2m1,fp32,fp32,e8m0,16,k,k,n,256,128,128,128,2,4,7168,2048,4096,60.82559823989868
e2m1,fp32,fp32,e8m0,16,k,k,n,256,128,128,128,4,2,7168,2048,4096,59.801602363586426
e2m1,fp32,fp32,e8m0,16,k,k,n,256,192,128,192,2,1,7168,2048,4096,52.83839702606201
e2m1,fp32,fp32,e8m0,16,k,k,n,256,192,128,192,2,2,7168,2048,4096,59.065598249435425
e2m1,fp32,fp32,e8m0,16,k,k,n,256,192,128,192,2,4,7168,2048,4096,60.62080264091492
e2m1,fp32,fp32,e8m0,16,k,k,n,256,192,128,192,4,2,7168,2048,4096,60.21119952201843
e2m1,fp32,fp32,e8m0,16,k,k,n,256,256,128,256,2,1,7168,2048,4096,53.64480018615723
e2m1,fp32,fp32,e8m0,16,k,k,n,256,256,128,256,2,2,7168,2048,4096,54.06720042228699
e2m1,fp32,fp32,e8m0,16,k,k,n,256,256,128,256,2,4,7168,2048,4096,54.88640069961548
e2m1,fp32,fp32,e8m0,16,k,k,n,256,256,128,256,4,2,7168,2048,4096,54.88640069961548
e2m1,fp32,fp32,e8m0,16,k,k,n,256,64,128,64,2,1,2048,7168,4096,69.4271981716156
e2m1,fp32,fp32,e8m0,16,k,k,n,256,64,128,64,2,2,2048,7168,4096,77.20959782600403
e2m1,fp32,fp32,e8m0,16,k,k,n,256,64,128,64,2,4,2048,7168,4096,81.10079765319824
e2m1,fp32,fp32,e8m0,16,k,k,n,256,64,128,64,4,2,2048,7168,4096,83.9680016040802
e2m1,fp32,fp32,e8m0,16,k,k,n,256,128,128,128,2,1,2048,7168,4096,52.428799867630005
e2m1,fp32,fp32,e8m0,16,k,k,n,256,128,128,128,2,2,2048,7168,4096,54.8799991607666
e2m1,fp32,fp32,e8m0,16,k,k,n,256,128,128,128,2,4,2048,7168,4096,60.00639796257019
e2m1,fp32,fp32,e8m0,16,k,k,n,256,128,128,128,4,2,2048,7168,4096,60.62080264091492
e2m1,fp32,fp32,e8m0,16,k,k,n,256,192,128,192,2,1,2048,7168,4096,51.814401149749756
e2m1,fp32,fp32,e8m0,16,k,k,n,256,192,128,192,2,2,2048,7168,4096,52.83839702606201
e2m1,fp32,fp32,e8m0,16,k,k,n,256,192,128,192,2,4,2048,7168,4096,59.801602363586426
e2m1,fp32,fp32,e8m0,16,k,k,n,256,192,128,192,4,2,2048,7168,4096,55.69919943809509
e2m1,fp32,fp32,e8m0,16,k,k,n,256,256,128,256,2,1,2048,7168,4096,53.248000144958496
e2m1,fp32,fp32,e8m0,16,k,k,n,256,256,128,256,2,2,2048,7168,4096,54.476797580718994
e2m1,fp32,fp32,e8m0,16,k,k,n,256,256,128,256,2,4,2048,7168,4096,54.96320128440857
e2m1,fp32,fp32,e8m0,16,k,k,n,256,256,128,256,4,2,2048,7168,4096,54.8799991607666
