results/dsv3_fp8.csv
in_dtype,acc_dtype,out_dtype,sf_dtype,sf_vec_size,a_major,b_major,c_major,mma_m,mma_n,cta_m,cta_n,cluster_m,cluster_n,m,n,k,runtime_us
fp8,fp32,fp8,,0,k,k,n,128,64,64,64,2,1,4096,7168,128000,10095.001220703125
fp8,fp32,fp8,,0,k,k,n,128,64,64,64,2,2,4096,7168,128000,5797.055816650391
fp8,fp32,fp8,,0,k,k,n,128,128,64,128,2,1,4096,7168,128000,5914.6240234375
fp8,fp32,fp8,,0,k,k,n,128,128,64,128,2,2,4096,7168,128000,3912.499237060547
fp8,fp32,fp8,,0,k,k,n,128,192,64,192,2,1,4096,7168,128000,4231.167984008789
fp8,fp32,fp8,,0,k,k,n,128,192,64,192,2,2,4096,7168,128000,3395.993423461914
fp8,fp32,fp8,,0,k,k,n,128,256,64,256,2,1,4096,7168,128000,3564.339065551758
fp8,fp32,fp8,,0,k,k,n,128,256,64,256,2,2,4096,7168,128000,2921.881675720215
fp8,fp32,fp8,,0,k,k,n,256,64,128,64,2,1,4096,7168,128000,7378.943634033203
fp8,fp32,fp8,,0,k,k,n,256,64,128,64,2,2,4096,7168,128000,4604.108810424805
fp8,fp32,fp8,,0,k,k,n,256,128,128,128,2,1,4096,7168,128000,4425.31852722168
fp8,fp32,fp8,,0,k,k,n,256,128,128,128,2,2,4096,7168,128000,2790.8096313476562
fp8,fp32,fp8,,0,k,k,n,256,192,128,192,2,1,4096,7168,128000,2687.99991607666
fp8,fp32,fp8,,0,k,k,n,256,192,128,192,2,2,4096,7168,128000,2970.419120788574
fp8,fp32,fp8,,0,k,k,n,256,256,128,256,2,1,4096,7168,128000,2796.563148498535
fp8,fp32,fp8,,0,k,k,n,256,256,128,256,2,2,4096,7168,128000,2757.638359069824
fp8,fp32,fp8,,0,k,k,n,128,64,64,64,2,1,4096,128000,7168,6072.934341430664
fp8,fp32,fp8,,0,k,k,n,128,64,64,64,2,2,4096,128000,7168,5642.035293579102
fp8,fp32,fp8,,0,k,k,n,128,128,64,128,2,1,4096,128000,7168,4067.3278808593755
fp8,fp32,fp8,,0,k,k,n,128,128,64,128,2,2,4096,128000,7168,3634.9952697753906
fp8,fp32,fp8,,0,k,k,n,128,192,64,192,2,1,4096,128000,7168,3038.412857055664
fp8,fp32,fp8,,0,k,k,n,128,192,64,192,2,2,4096,128000,7168,3207.3726654052734
fp8,fp32,fp8,,0,k,k,n,128,256,64,256,2,1,4096,128000,7168,2623.4880447387695
fp8,fp32,fp8,,0,k,k,n,128,256,64,256,2,2,4096,128000,7168,2828.4927368164062
fp8,fp32,fp8,,0,k,k,n,256,64,128,64,2,1,4096,128000,7168,5220.147323608398
fp8,fp32,fp8,,0,k,k,n,256,64,128,64,2,2,4096,128000,7168,4246.323013305664
fp8,fp32,fp8,,0,k,k,n,256,128,128,128,2,1,4096,128000,7168,3080.191993713379
fp8,fp32,fp8,,0,k,k,n,256,128,128,128,2,2,4096,128000,7168,2683.9040756225586
fp8,fp32,fp8,,0,k,k,n,256,192,128,192,2,1,4096,128000,7168,2399.0272521972656
fp8,fp32,fp8,,0,k,k,n,256,192,128,192,2,2,4096,128000,7168,2679.814338684082
fp8,fp32,fp8,,0,k,k,n,256,256,128,256,2,1,4096,128000,7168,2404.3519973754883
fp8,fp32,fp8,,0,k,k,n,256,256,128,256,2,2,4096,128000,7168,2690.457534790039
fp8,fp32,fp8,,0,k,k,n,128,64,64,64,2,1,128000,7168,4096,8427.519989013672
fp8,fp32,fp8,,0,k,k,n,128,64,64,64,2,2,128000,7168,4096,6091.3665771484375
fp8,fp32,fp8,,0,k,k,n,128,128,64,128,2,1,128000,7168,4096,4516.454315185547
fp8,fp32,fp8,,0,k,k,n,128,128,64,128,2,2,128000,7168,4096,3847.9873657226562
fp8,fp32,fp8,,0,k,k,n,128,192,64,192,2,1,128000,7168,4096,3459.904098510742
fp8,fp32,fp8,,0,k,k,n,128,192,64,192,2,2,128000,7168,4096,3350.9376525878906
fp8,fp32,fp8,,0,k,k,n,128,256,64,256,2,1,128000,7168,4096,2924.3392944335938
fp8,fp32,fp8,,0,k,k,n,128,256,64,256,2,2,128000,7168,4096,3024.4863510131836
fp8,fp32,fp8,,0,k,k,n,256,64,128,64,2,1,128000,7168,4096,8110.899353027344
fp8,fp32,fp8,,0,k,k,n,256,64,128,64,2,2,128000,7168,4096,5421.260833740234
fp8,fp32,fp8,,0,k,k,n,256,128,128,128,2,1,128000,7168,4096,4378.214263916016
fp8,fp32,fp8,,0,k,k,n,256,128,128,128,2,2,128000,7168,4096,3078.553581237793
fp8,fp32,fp8,,0,k,k,n,256,192,128,192,2,1,128000,7168,4096,3241.779327392578
fp8,fp32,fp8,,0,k,k,n,256,192,128,192,2,2,128000,7168,4096,2746.9823837280273
fp8,fp32,fp8,,0,k,k,n,256,256,128,256,2,1,128000,7168,4096,2565.7344818115234
fp8,fp32,fp8,,0,k,k,n,256,256,128,256,2,2,128000,7168,4096,2685.5424880981445
fp8,fp32,fp8,,0,k,k,n,128,64,64,64,2,1,4096,512,7168,36.04480028152466
fp8,fp32,fp8,,0,k,k,n,128,64,64,64,2,2,4096,512,7168,35.22560000419617
fp8,fp32,fp8,,0,k,k,n,128,128,64,128,2,1,4096,512,7168,25.600001215934753
fp8,fp32,fp8,,0,k,k,n,128,128,64,128,2,2,4096,512,7168,25.39519965648651
fp8,fp32,fp8,,0,k,k,n,128,192,64,192,2,1,4096,512,7168,29.08799946308136
fp8,fp32,fp8,,0,k,k,n,128,192,64,192,2,2,4096,512,7168,31.21280074119568
fp8,fp32,fp8,,0,k,k,n,128,256,64,256,2,1,4096,512,7168,24.780799448490143
fp8,fp32,fp8,,0,k,k,n,128,256,64,256,2,2,4096,512,7168,25.07520020008087
fp8,fp32,fp8,,0,k,k,n,256,64,128,64,2,1,4096,512,7168,28.87679934501648
fp8,fp32,fp8,,0,k,k,n,256,64,128,64,2,2,4096,512,7168,29.95840013027191
fp8,fp32,fp8,,0,k,k,n,256,128,128,128,2,1,4096,512,7168,24.780799448490143
fp8,fp32,fp8,,0,k,k,n,256,128,128,128,2,2,4096,512,7168,24.57599937915802
fp8,fp32,fp8,,0,k,k,n,256,192,128,192,2,1,4096,512,7168,31.136000156402588
fp8,fp32,fp8,,0,k,k,n,256,192,128,192,2,2,4096,512,7168,31.12959861755371
fp8,fp32,fp8,,0,k,k,n,256,256,128,256,2,1,4096,512,7168,35.64159870147705
fp8,fp32,fp8,,0,k,k,n,256,256,128,256,2,2,4096,512,7168,35.22560000419617
fp8,fp32,fp8,,0,k,k,n,128,64,64,64,2,1,4096,7168,512,50.36799907684326
fp8,fp32,fp8,,0,k,k,n,128,64,64,64,2,2,4096,7168,512,56.10880255699158
fp8,fp32,fp8,,0,k,k,n,128,128,64,128,2,1,4096,7168,512,32.56320059299469
fp8,fp32,fp8,,0,k,k,n,128,128,64,128,2,2,4096,7168,512,35.29599905014038
fp8,fp32,fp8,,0,k,k,n,128,192,64,192,2,1,4096,7168,512,29.08160090446472
fp8,fp32,fp8,,0,k,k,n,128,192,64,192,2,2,4096,7168,512,31.839999556541446
fp8,fp32,fp8,,0,k,k,n,128,256,64,256,2,1,4096,7168,512,30.31040132045746
fp8,fp32,fp8,,0,k,k,n,128,256,64,256,2,2,4096,7168,512,30.30399978160858
fp8,fp32,fp8,,0,k,k,n,256,64,128,64,2,1,4096,7168,512,33.17759931087494
fp8,fp32,fp8,,0,k,k,n,256,64,128,64,2,2,4096,7168,512,36.03839874267578
fp8,fp32,fp8,,0,k,k,n,256,128,128,128,2,1,4096,7168,512,29.286399483680725
fp8,fp32,fp8,,0,k,k,n,256,128,128,128,2,2,4096,7168,512,30.105599761009216
fp8,fp32,fp8,,0,k,k,n,256,192,128,192,2,1,4096,7168,512,25.600001215934753
fp8,fp32,fp8,,0,k,k,n,256,192,128,192,2,2,4096,7168,512,27.02080011367798
fp8,fp32,fp8,,0,k,k,n,256,256,128,256,2,1,4096,7168,512,24.985599517822266
fp8,fp32,fp8,,0,k,k,n,256,256,128,256,2,2,4096,7168,512,26.918399333953857
fp8,fp32,fp8,,0,k,k,n,128,64,64,64,2,1,7168,512,4096,37.273600697517395
fp8,fp32,fp8,,0,k,k,n,128,64,64,64,2,2,7168,512,4096,37.33760118484497
fp8,fp32,fp8,,0,k,k,n,128,128,64,128,2,1,7168,512,4096,27.436798810958862
fp8,fp32,fp8,,0,k,k,n,128,128,64,128,2,2,7168,512,4096,28.672000765800476
fp8,fp32,fp8,,0,k,k,n,128,192,64,192,2,1,7168,512,4096,27.033600211143494
fp8,fp32,fp8,,0,k,k,n,128,192,64,192,2,2,7168,512,4096,33.587199449539185
fp8,fp32,fp8,,0,k,k,n,128,256,64,256,2,1,7168,512,4096,26.630398631095886
fp8,fp32,fp8,,0,k,k,n,128,256,64,256,2,2,7168,512,4096,26.009601354599
fp8,fp32,fp8,,0,k,k,n,256,64,128,64,2,1,7168,512,4096,33.184000849723816
fp8,fp32,fp8,,0,k,k,n,256,64,128,64,2,2,7168,512,4096,33.17759931087494
fp8,fp32,fp8,,0,k,k,n,256,128,128,128,2,1,7168,512,4096,27.033600211143494
fp8,fp32,fp8,,0,k,k,n,256,128,128,128,2,2,7168,512,4096,26.508799195289612
fp8,fp32,fp8,,0,k,k,n,256,192,128,192,2,1,7168,512,4096,31.948798894882202
fp8,fp32,fp8,,0,k,k,n,256,192,128,192,2,2,7168,512,4096,33.25439989566803
fp8,fp32,fp8,,0,k,k,n,256,256,128,256,2,1,7168,512,4096,26.412799954414368
fp8,fp32,fp8,,0,k,k,n,256,256,128,256,2,2,7168,512,4096,28.26879918575287
fp8,fp32,fp8,,0,k,k,n,128,64,64,64,2,1,4096,1536,7168,84.3775987625122
fp8,fp32,fp8,,0,k,k,n,128,64,64,64,2,2,4096,1536,7168,88.07039856910706
fp8,fp32,fp8,,0,k,k,n,128,128,64,128,2,1,4096,1536,7168,58.16320180892944
fp8,fp32,fp8,,0,k,k,n,128,128,64,128,2,2,4096,1536,7168,58.982402086257935
fp8,fp32,fp8,,0,k,k,n,128,192,64,192,2,1,4096,1536,7168,54.470402002334595
fp8,fp32,fp8,,0,k,k,n,128,192,64,192,2,2,4096,1536,7168,54.444801807403564
fp8,fp32,fp8,,0,k,k,n,128,256,64,256,2,1,4096,1536,7168,54.476797580718994
fp8,fp32,fp8,,0,k,k,n,128,256,64,256,2,2,4096,1536,7168,54.073601961135864
fp8,fp32,fp8,,0,k,k,n,256,64,128,64,2,1,4096,1536,7168,68.77440214157104
fp8,fp32,fp8,,0,k,k,n,256,64,128,64,2,2,4096,1536,7168,70.04160284996033
fp8,fp32,fp8,,0,k,k,n,256,128,128,128,2,1,4096,1536,7168,54.06079888343811
fp8,fp32,fp8,,0,k,k,n,256,128,128,128,2,2,4096,1536,7168,54.1375994682312
fp8,fp32,fp8,,0,k,k,n,256,192,128,192,2,1,4096,1536,7168,54.06720042228699
fp8,fp32,fp8,,0,k,k,n,256,192,128,192,2,2,4096,1536,7168,53.6575973033905
fp8,fp32,fp8,,0,k,k,n,256,256,128,256,2,1,4096,1536,7168,64.30720090866089
fp8,fp32,fp8,,0,k,k,n,256,256,128,256,2,2,4096,1536,7168,63.897597789764404
fp8,fp32,fp8,,0,k,k,n,128,64,64,64,2,1,4096,7168,1536,95.84640264511108
fp8,fp32,fp8,,0,k,k,n,128,64,64,64,2,2,4096,7168,1536,104.44159507751465
fp8,fp32,fp8,,0,k,k,n,128,128,64,128,2,1,4096,7168,1536,61.86879873275757
fp8,fp32,fp8,,0,k,k,n,128,128,64,128,2,2,4096,7168,1536,65.12640118598938
fp8,fp32,fp8,,0,k,k,n,128,192,64,192,2,1,4096,7168,1536,54.476797580718994
fp8,fp32,fp8,,0,k,k,n,128,192,64,192,2,2,4096,7168,1536,54.88640069961548
fp8,fp32,fp8,,0,k,k,n,128,256,64,256,2,1,4096,7168,1536,52.019202709198
fp8,fp32,fp8,,0,k,k,n,128,256,64,256,2,2,4096,7168,1536,54.073601961135864
fp8,fp32,fp8,,0,k,k,n,256,64,128,64,2,1,4096,7168,1536,67.99359917640686
fp8,fp32,fp8,,0,k,k,n,256,64,128,64,2,2,4096,7168,1536,81.10079765319824
fp8,fp32,fp8,,0,k,k,n,256,128,128,128,2,1,4096,7168,1536,52.22399830818176
fp8,fp32,fp8,,0,k,k,n,256,128,128,128,2,2,4096,7168,1536,54.48319911956787
fp8,fp32,fp8,,0,k,k,n,256,192,128,192,2,1,4096,7168,1536,53.6512017250061
fp8,fp32,fp8,,0,k,k,n,256,192,128,192,2,2,4096,7168,1536,56.12159967422485
fp8,fp32,fp8,,0,k,k,n,256,256,128,256,2,1,4096,7168,1536,53.6512017250061
fp8,fp32,fp8,,0,k,k,n,256,256,128,256,2,2,4096,7168,1536,53.85599732398987
fp8,fp32,fp8,,0,k,k,n,128,64,64,64,2,1,7168,1536,4096,88.07039856910706
fp8,fp32,fp8,,0,k,k,n,128,64,64,64,2,2,7168,1536,4096,91.839998960495
fp8,fp32,fp8,,0,k,k,n,128,128,64,128,2,1,7168,1536,4096,59.79520082473755
fp8,fp32,fp8,,0,k,k,n,128,128,64,128,2,2,7168,1536,4096,62.668800354003906
fp8,fp32,fp8,,0,k,k,n,128,192,64,192,2,1,7168,1536,4096,54.88640069961548
fp8,fp32,fp8,,0,k,k,n,128,192,64,192,2,2,7168,1536,4096,54.88640069961548
fp8,fp32,fp8,,0,k,k,n,128,256,64,256,2,1,7168,1536,4096,53.043198585510254
fp8,fp32,fp8,,0,k,k,n,128,256,64,256,2,2,7168,1536,4096,58.57279896736145
fp8,fp32,fp8,,0,k,k,n,256,64,128,64,2,1,7168,1536,4096,70.04160284996033
fp8,fp32,fp8,,0,k,k,n,256,64,128,64,2,2,7168,1536,4096,74.54079985618591
fp8,fp32,fp8,,0,k,k,n,256,128,128,128,2,1,7168,1536,4096,53.6575973033905
fp8,fp32,fp8,,0,k,k,n,256,128,128,128,2,2,7168,1536,4096,58.16320180892944
fp8,fp32,fp8,,0,k,k,n,256,192,128,192,2,1,7168,1536,4096,56.93439841270447
fp8,fp32,fp8,,0,k,k,n,256,192,128,192,2,2,7168,1536,4096,58.16320180892944
fp8,fp32,fp8,,0,k,k,n,256,256,128,256,2,1,7168,1536,4096,58.246397972106934
fp8,fp32,fp8,,0,k,k,n,256,256,128,256,2,2,7168,1536,4096,57.75359869003296
fp8,fp32,fp8,,0,k,k,n,128,64,64,64,2,1,4096,16384,512,104.85759973526001
fp8,fp32,fp8,,0,k,k,n,128,64,64,64,2,2,4096,16384,512,117.12640523910522
fp8,fp32,fp8,,0,k,k,n,128,128,64,128,2,1,4096,16384,512,62.668800354003906
fp8,fp32,fp8,,0,k,k,n,128,128,64,128,2,2,4096,16384,512,68.81279945373535
fp8,fp32,fp8,,0,k,k,n,128,192,64,192,2,1,4096,16384,512,52.019202709198
fp8,fp32,fp8,,0,k,k,n,128,192,64,192,2,2,4096,16384,512,58.771198987960815
fp8,fp32,fp8,,0,k,k,n,128,256,64,256,2,1,4096,16384,512,56.11519813537598
fp8,fp32,fp8,,0,k,k,n,128,256,64,256,2,2,4096,16384,512,56.93439841270447
fp8,fp32,fp8,,0,k,k,n,256,64,128,64,2,1,4096,16384,512,66.45119786262512
fp8,fp32,fp8,,0,k,k,n,256,64,128,64,2,2,4096,16384,512,71.27040028572083
fp8,fp32,fp8,,0,k,k,n,256,128,128,128,2,1,4096,16384,512,55.295997858047485
fp8,fp32,fp8,,0,k,k,n,256,128,128,128,2,2,4096,16384,512,54.95679974555969
fp8,fp32,fp8,,0,k,k,n,256,192,128,192,2,1,4096,16384,512,45.46560049057007
fp8,fp32,fp8,,0,k,k,n,256,192,128,192,2,2,4096,16384,512,49.15199875831604
fp8,fp32,fp8,,0,k,k,n,256,256,128,256,2,1,4096,16384,512,44.230398535728455
fp8,fp32,fp8,,0,k,k,n,256,256,128,256,2,2,4096,16384,512,47.513601183891296
fp8,fp32,fp8,,0,k,k,n,128,64,64,64,2,1,4096,512,16384,69.0176010131836
fp8,fp32,fp8,,0,k,k,n,128,64,64,64,2,2,4096,512,16384,68.00000071525574
fp8,fp32,fp8,,0,k,k,n,128,128,64,128,2,1,4096,512,16384,46.694400906562805
fp8,fp32,fp8,,0,k,k,n,128,128,64,128,2,2,4096,512,16384,47.10400104522705
fp8,fp32,fp8,,0,k,k,n,128,192,64,192,2,1,4096,512,16384,56.518399715423584
fp8,fp32,fp8,,0,k,k,n,128,192,64,192,2,2,4096,512,16384,58.246397972106934
fp8,fp32,fp8,,0,k,k,n,128,256,64,256,2,1,4096,512,16384,44.23680007457733
fp8,fp32,fp8,,0,k,k,n,128,256,64,256,2,2,4096,512,16384,43.41759979724884
fp8,fp32,fp8,,0,k,k,n,256,64,128,64,2,1,4096,512,16384,54.88640069961548
fp8,fp32,fp8,,0,k,k,n,256,64,128,64,2,2,4096,512,16384,55.295997858047485
fp8,fp32,fp8,,0,k,k,n,256,128,128,128,2,1,4096,512,16384,43.827199935913086
fp8,fp32,fp8,,0,k,k,n,256,128,128,128,2,2,4096,512,16384,43.41759979724884
fp8,fp32,fp8,,0,k,k,n,256,192,128,192,2,1,4096,512,16384,57.34400153160095
fp8,fp32,fp8,,0,k,k,n,256,192,128,192,2,2,4096,512,16384,57.34400153160095
fp8,fp32,fp8,,0,k,k,n,256,256,128,256,2,1,4096,512,16384,68.60799789428711
fp8,fp32,fp8,,0,k,k,n,256,256,128,256,2,2,4096,512,16384,66.75840020179749
fp8,fp32,fp8,,0,k,k,n,128,64,64,64,2,1,512,16384,4096,66.96959733963013
fp8,fp32,fp8,,0,k,k,n,128,64,64,64,2,2,512,16384,4096,73.7280011177063
fp8,fp32,fp8,,0,k,k,n,128,128,64,128,2,1,512,16384,4096,46.26559913158417
fp8,fp32,fp8,,0,k,k,n,128,128,64,128,2,2,512,16384,4096,47.92320132255554
fp8,fp32,fp8,,0,k,k,n,128,192,64,192,2,1,512,16384,4096,43.39840114116669
fp8,fp32,fp8,,0,k,k,n,128,192,64,192,2,2,512,16384,4096,47.116801142692566
fp8,fp32,fp8,,0,k,k,n,128,256,64,256,2,1,512,16384,4096,44.6399986743927
fp8,fp32,fp8,,0,k,k,n,128,256,64,256,2,2,512,16384,4096,43.62240135669708
fp8,fp32,fp8,,0,k,k,n,256,64,128,64,2,1,512,16384,4096,52.505600452423096
fp8,fp32,fp8,,0,k,k,n,256,64,128,64,2,2,512,16384,4096,57.74719715118408
fp8,fp32,fp8,,0,k,k,n,256,128,128,128,2,1,512,16384,4096,44.23680007457733
fp8,fp32,fp8,,0,k,k,n,256,128,128,128,2,2,512,16384,4096,43.62240135669708
fp8,fp32,fp8,,0,k,k,n,256,192,128,192,2,1,512,16384,4096,46.374401450157166
fp8,fp32,fp8,,0,k,k,n,256,192,128,192,2,2,512,16384,4096,47.10400104522705
fp8,fp32,fp8,,0,k,k,n,256,256,128,256,2,1,512,16384,4096,44.230398535728455
fp8,fp32,fp8,,0,k,k,n,256,256,128,256,2,2,512,16384,4096,43.41759979724884
fp8,fp32,fp8,,0,k,k,n,128,64,64,64,2,1,4096,16384,1536,193.74719858169556
fp8,fp32,fp8,,0,k,k,n,128,64,64,64,2,2,4096,16384,1536,216.27519130706787
fp8,fp32,fp8,,0,k,k,n,128,128,64,128,2,1,4096,16384,1536,122.06720113754272
fp8,fp32,fp8,,0,k,k,n,128,128,64,128,2,2,4096,16384,1536,128.61440181732178
fp8,fp32,fp8,,0,k,k,n,128,192,64,192,2,1,4096,16384,1536,106.91200494766235
fp8,fp32,fp8,,0,k,k,n,128,192,64,192,2,2,4096,16384,1536,107.315194606781
fp8,fp32,fp8,,0,k,k,n,128,256,64,256,2,1,4096,16384,1536,99.94239807128906
fp8,fp32,fp8,,0,k,k,n,128,256,64,256,2,2,4096,16384,1536,103.2256007194519
fp8,fp32,fp8,,0,k,k,n,256,64,128,64,2,1,4096,16384,1536,137.21599578857422
fp8,fp32,fp8,,0,k,k,n,256,64,128,64,2,2,4096,16384,1536,165.07519483566284
fp8,fp32,fp8,,0,k,k,n,256,128,128,128,2,1,4096,16384,1536,99.12959933280945
fp8,fp32,fp8,,0,k,k,n,256,128,128,128,2,2,4096,16384,1536,104.44799661636353
fp8,fp32,fp8,,0,k,k,n,256,192,128,192,2,1,4096,16384,1536,99.11680221557617
fp8,fp32,fp8,,0,k,k,n,256,192,128,192,2,2,4096,16384,1536,104.44799661636353
fp8,fp32,fp8,,0,k,k,n,256,256,128,256,2,1,4096,16384,1536,98.31039905548096
fp8,fp32,fp8,,0,k,k,n,256,256,128,256,2,2,4096,16384,1536,104.85759973526001
fp8,fp32,fp8,,0,k,k,n,128,64,64,64,2,1,4096,1536,16384,169.1648006439209
fp8,fp32,fp8,,0,k,k,n,128,64,64,64,2,2,4096,1536,16384,174.48960542678833
fp8,fp32,fp8,,0,k,k,n,128,128,64,128,2,1,4096,1536,16384,119.60320472717285
fp8,fp32,fp8,,0,k,k,n,128,128,64,128,2,2,4096,1536,16384,115.09759426116943
fp8,fp32,fp8,,0,k,k,n,128,192,64,192,2,1,4096,1536,16384,106.91200494766235
fp8,fp32,fp8,,0,k,k,n,128,192,64,192,2,2,4096,1536,16384,107.315194606781
fp8,fp32,fp8,,0,k,k,n,128,256,64,256,2,1,4096,1536,16384,106.49600028991699
fp8,fp32,fp8,,0,k,k,n,128,256,64,256,2,2,4096,1536,16384,106.09279870986938
fp8,fp32,fp8,,0,k,k,n,256,64,128,64,2,1,4096,1536,16384,144.17920112609863
fp8,fp32,fp8,,0,k,k,n,256,64,128,64,2,2,4096,1536,16384,137.63200044631958
fp8,fp32,fp8,,0,k,k,n,256,128,128,128,2,1,4096,1536,16384,106.07999563217163
fp8,fp32,fp8,,0,k,k,n,256,128,128,128,2,2,4096,1536,16384,105.2672028541565
fp8,fp32,fp8,,0,k,k,n,256,192,128,192,2,1,4096,1536,16384,105.67679405212402
fp8,fp32,fp8,,0,k,k,n,256,192,128,192,2,2,4096,1536,16384,104.87680435180664
fp8,fp32,fp8,,0,k,k,n,256,256,128,256,2,1,4096,1536,16384,127.79519557952881
fp8,fp32,fp8,,0,k,k,n,256,256,128,256,2,2,4096,1536,16384,126.5663981437683
fp8,fp32,fp8,,0,k,k,n,128,64,64,64,2,1,1536,16384,4096,169.1648006439209
fp8,fp32,fp8,,0,k,k,n,128,64,64,64,2,2,1536,16384,4096,184.72959995269775
fp8,fp32,fp8,,0,k,k,n,128,128,64,128,2,1,1536,16384,4096,112.23039627075195
fp8,fp32,fp8,,0,k,k,n,128,128,64,128,2,2,1536,16384,4096,117.15199947357178
fp8,fp32,fp8,,0,k,k,n,128,192,64,192,2,1,1536,16384,4096,100.35200119018555
fp8,fp32,fp8,,0,k,k,n,128,192,64,192,2,2,1536,16384,4096,106.49600028991699
fp8,fp32,fp8,,0,k,k,n,128,256,64,256,2,1,1536,16384,4096,100.76160430908203
fp8,fp32,fp8,,0,k,k,n,128,256,64,256,2,2,1536,16384,4096,105.2672028541565
fp8,fp32,fp8,,0,k,k,n,256,64,128,64,2,1,1536,16384,4096,136.8064045906067
fp8,fp32,fp8,,0,k,k,n,256,64,128,64,2,2,1536,16384,4096,147.4560022354126
fp8,fp32,fp8,,0,k,k,n,256,128,128,128,2,1,1536,16384,4096,100.76800584793091
fp8,fp32,fp8,,0,k,k,n,256,128,128,128,2,2,1536,16384,4096,104.85759973526001
fp8,fp32,fp8,,0,k,k,n,256,192,128,192,2,1,1536,16384,4096,97.8879988193512
fp8,fp32,fp8,,0,k,k,n,256,192,128,192,2,2,1536,16384,4096,104.85759973526001
fp8,fp32,fp8,,0,k,k,n,256,256,128,256,2,1,1536,16384,4096,106.08639717102051
fp8,fp32,fp8,,0,k,k,n,256,256,128,256,2,2,1536,16384,4096,104.85759973526001
fp8,fp32,fp8,,0,k,k,n,128,64,64,64,2,1,4096,8192,7168,380.92799186706543
fp8,fp32,fp8,,0,k,k,n,128,64,64,64,2,2,4096,8192,7168,380.3136110305786
fp8,fp32,fp8,,0,k,k,n,128,128,64,128,2,1,4096,8192,7168,232.64639377593994
fp8,fp32,fp8,,0,k,k,n,128,128,64,128,2,2,4096,8192,7168,235.51359176635742
fp8,fp32,fp8,,0,k,k,n,128,192,64,192,2,1,4096,8192,7168,203.1615972518921
fp8,fp32,fp8,,0,k,k,n,128,192,64,192,2,2,4096,8192,7168,222.82240390777588
fp8,fp32,fp8,,0,k,k,n,128,256,64,256,2,1,4096,8192,7168,195.79520225524902
fp8,fp32,fp8,,0,k,k,n,128,256,64,256,2,2,4096,8192,7168,209.71519947052002
fp8,fp32,fp8,,0,k,k,n,256,64,128,64,2,1,4096,8192,7168,285.0879907608032
fp8,fp32,fp8,,0,k,k,n,256,64,128,64,2,2,4096,8192,7168,287.9487991333008
fp8,fp32,fp8,,0,k,k,n,256,128,128,128,2,1,4096,8192,7168,195.3663945198059
fp8,fp32,fp8,,0,k,k,n,256,128,128,128,2,2,4096,8192,7168,208.90240669250488
fp8,fp32,fp8,,0,k,k,n,256,192,128,192,2,1,4096,8192,7168,203.98080348968506
fp8,fp32,fp8,,0,k,k,n,256,192,128,192,2,2,4096,8192,7168,213.40160369873047
fp8,fp32,fp8,,0,k,k,n,256,256,128,256,2,1,4096,8192,7168,192.92160272598267
fp8,fp32,fp8,,0,k,k,n,256,256,128,256,2,2,4096,8192,7168,208.0832004547119
fp8,fp32,fp8,,0,k,k,n,128,64,64,64,2,1,4096,7168,8192,387.6863956451416
fp8,fp32,fp8,,0,k,k,n,128,64,64,64,2,2,4096,7168,8192,376.62720680236816
fp8,fp32,fp8,,0,k,k,n,128,128,64,128,2,1,4096,7168,8192,234.2911958694458
fp8,fp32,fp8,,0,k,k,n,128,128,64,128,2,2,4096,7168,8192,235.52000522613525
fp8,fp32,fp8,,0,k,k,n,128,192,64,192,2,1,4096,7168,8192,207.2767972946167
fp8,fp32,fp8,,0,k,k,n,128,192,64,192,2,2,4096,7168,8192,218.72639656066895
fp8,fp32,fp8,,0,k,k,n,128,256,64,256,2,1,4096,7168,8192,203.98080348968506
fp8,fp32,fp8,,0,k,k,n,128,256,64,256,2,2,4096,7168,8192,210.1248025894165
fp8,fp32,fp8,,0,k,k,n,256,64,128,64,2,1,4096,7168,8192,314.7775888442993
fp8,fp32,fp8,,0,k,k,n,256,64,128,64,2,2,4096,7168,8192,286.31041049957275
fp8,fp32,fp8,,0,k,k,n,256,128,128,128,2,1,4096,7168,8192,203.98080348968506
fp8,fp32,fp8,,0,k,k,n,256,128,128,128,2,2,4096,7168,8192,208.89599323272705
fp8,fp32,fp8,,0,k,k,n,256,192,128,192,2,1,4096,7168,8192,208.076810836792
fp8,fp32,fp8,,0,k,k,n,256,192,128,192,2,2,4096,7168,8192,221.18399143218994
fp8,fp32,fp8,,0,k,k,n,256,256,128,256,2,1,4096,7168,8192,211.35358810424805
fp8,fp32,fp8,,0,k,k,n,256,256,128,256,2,2,4096,7168,8192,207.67359733581543
fp8,fp32,fp8,,0,k,k,n,128,64,64,64,2,1,7168,8192,4096,388.50560188293457
fp8,fp32,fp8,,0,k,k,n,128,64,64,64,2,2,7168,8192,4096,397.72799015045166
fp8,fp32,fp8,,0,k,k,n,128,128,64,128,2,1,7168,8192,4096,232.64639377593994
fp8,fp32,fp8,,0,k,k,n,128,128,64,128,2,2,7168,8192,4096,241.6640043258667
fp8,fp32,fp8,,0,k,k,n,128,192,64,192,2,1,7168,8192,4096,203.97439002990723
fp8,fp32,fp8,,0,k,k,n,128,192,64,192,2,2,7168,8192,4096,220.77438831329346
fp8,fp32,fp8,,0,k,k,n,128,256,64,256,2,1,7168,8192,4096,199.0656018257141
fp8,fp32,fp8,,0,k,k,n,128,256,64,256,2,2,7168,8192,4096,210.9503984451294
fp8,fp32,fp8,,0,k,k,n,256,64,128,64,2,1,7168,8192,4096,325.83680152893066
fp8,fp32,fp8,,0,k,k,n,256,64,128,64,2,2,7168,8192,4096,310.2720022201538
fp8,fp32,fp8,,0,k,k,n,256,128,128,128,2,1,7168,8192,4096,199.88479614257812
fp8,fp32,fp8,,0,k,k,n,256,128,128,128,2,2,7168,8192,4096,210.94400882720947
fp8,fp32,fp8,,0,k,k,n,256,192,128,192,2,1,7168,8192,4096,199.48159456253052
fp8,fp32,fp8,,0,k,k,n,256,192,128,192,2,2,7168,8192,4096,211.76319122314453
fp8,fp32,fp8,,0,k,k,n,256,256,128,256,2,1,7168,8192,4096,202.7519941329956
fp8,fp32,fp8,,0,k,k,n,256,256,128,256,2,2,7168,8192,4096,208.076810836792
fp8,fp32,fp8,,0,k,k,n,128,64,64,64,2,1,4096,8192,1536,106.90560340881348
fp8,fp32,fp8,,0,k,k,n,128,64,64,64,2,2,4096,8192,1536,116.32640361785889
fp8,fp32,fp8,,0,k,k,n,128,128,64,128,2,1,4096,8192,1536,68.5375988483429
fp8,fp32,fp8,,0,k,k,n,128,128,64,128,2,2,4096,8192,1536,70.43840289115906
fp8,fp32,fp8,,0,k,k,n,128,192,64,192,2,1,4096,8192,1536,59.801602363586426
fp8,fp32,fp8,,0,k,k,n,128,192,64,192,2,2,4096,8192,1536,61.849600076675415
fp8,fp32,fp8,,0,k,k,n,128,256,64,256,2,1,4096,8192,1536,56.52480125427246
fp8,fp32,fp8,,0,k,k,n,128,256,64,256,2,2,4096,8192,1536,59.801602363586426
fp8,fp32,fp8,,0,k,k,n,256,64,128,64,2,1,4096,8192,1536,75.36640167236328
fp8,fp32,fp8,,0,k,k,n,256,64,128,64,2,2,4096,8192,1536,89.69600200653076
fp8,fp32,fp8,,0,k,k,n,256,128,128,128,2,1,4096,8192,1536,55.70560097694397
fp8,fp32,fp8,,0,k,k,n,256,128,128,128,2,2,4096,8192,1536,59.89120006561279
fp8,fp32,fp8,,0,k,k,n,256,192,128,192,2,1,4096,8192,1536,57.75359869003296
fp8,fp32,fp8,,0,k,k,n,256,192,128,192,2,2,4096,8192,1536,60.62080264091492
fp8,fp32,fp8,,0,k,k,n,256,256,128,256,2,1,4096,8192,1536,55.78879714012146
fp8,fp32,fp8,,0,k,k,n,256,256,128,256,2,2,4096,8192,1536,59.39199924468994
fp8,fp32,fp8,,0,k,k,n,128,64,64,64,2,1,4096,1536,8192,93.79839897155762
fp8,fp32,fp8,,0,k,k,n,128,64,64,64,2,2,4096,1536,8192,99.11680221557617
fp8,fp32,fp8,,0,k,k,n,128,128,64,128,2,1,4096,1536,8192,64.30720090866089
fp8,fp32,fp8,,0,k,k,n,128,128,64,128,2,2,4096,1536,8192,65.53599834442139
fp8,fp32,fp8,,0,k,k,n,128,192,64,192,2,1,4096,1536,8192,60.627198219299316
fp8,fp32,fp8,,0,k,k,n,128,192,64,192,2,2,4096,1536,8192,59.807997941970825
fp8,fp32,fp8,,0,k,k,n,128,256,64,256,2,1,4096,1536,8192,60.21119952201843
fp8,fp32,fp8,,0,k,k,n,128,256,64,256,2,2,4096,1536,8192,59.79520082473755
fp8,fp32,fp8,,0,k,k,n,256,64,128,64,2,1,4096,1536,8192,76.5887975692749
fp8,fp32,fp8,,0,k,k,n,256,64,128,64,2,2,4096,1536,8192,78.23359966278076
fp8,fp32,fp8,,0,k,k,n,256,128,128,128,2,1,4096,1536,8192,59.79520082473755
fp8,fp32,fp8,,0,k,k,n,256,128,128,128,2,2,4096,1536,8192,59.481602907180786
fp8,fp32,fp8,,0,k,k,n,256,192,128,192,2,1,4096,1536,8192,59.79520082473755
fp8,fp32,fp8,,0,k,k,n,256,192,128,192,2,2,4096,1536,8192,59.801602363586426
fp8,fp32,fp8,,0,k,k,n,256,256,128,256,2,1,4096,1536,8192,71.27040028572083
fp8,fp32,fp8,,0,k,k,n,256,256,128,256,2,2,4096,1536,8192,70.86079716682434
fp8,fp32,fp8,,0,k,k,n,128,64,64,64,2,1,1536,8192,4096,93.79839897155762
fp8,fp32,fp8,,0,k,k,n,128,64,64,64,2,2,1536,8192,4096,102.80959606170654
fp8,fp32,fp8,,0,k,k,n,128,128,64,128,2,1,1536,8192,4096,63.48800063133239
fp8,fp32,fp8,,0,k,k,n,128,128,64,128,2,2,1536,8192,4096,66.35519862174988
fp8,fp32,fp8,,0,k,k,n,128,192,64,192,2,1,1536,8192,4096,56.13440275192261
fp8,fp32,fp8,,0,k,k,n,128,192,64,192,2,2,1536,8192,4096,60.21119952201843
fp8,fp32,fp8,,0,k,k,n,128,256,64,256,2,1,1536,8192,4096,60.204797983169556
fp8,fp32,fp8,,0,k,k,n,128,256,64,256,2,2,1536,8192,4096,59.801602363586426
fp8,fp32,fp8,,0,k,k,n,256,64,128,64,2,1,1536,8192,4096,74.54720139503479
fp8,fp32,fp8,,0,k,k,n,256,64,128,64,2,2,1536,8192,4096,81.09440207481384
fp8,fp32,fp8,,0,k,k,n,256,128,128,128,2,1,1536,8192,4096,59.801602363586426
fp8,fp32,fp8,,0,k,k,n,256,128,128,128,2,2,1536,8192,4096,59.807997941970825
fp8,fp32,fp8,,0,k,k,n,256,192,128,192,2,1,1536,8192,4096,59.385597705841064
fp8,fp32,fp8,,0,k,k,n,256,192,128,192,2,2,1536,8192,4096,58.982402086257935
fp8,fp32,fp8,,0,k,k,n,256,256,128,256,2,1,1536,8192,4096,59.801602363586426
fp8,fp32,fp8,,0,k,k,n,256,256,128,256,2,2,1536,8192,4096,59.801602363586426
fp8,fp32,fp8,,0,k,k,n,128,64,64,64,2,1,4096,4096,192,26.822400093078613
fp8,fp32,fp8,,0,k,k,n,128,64,64,64,2,2,4096,4096,192,28.972798585891724
fp8,fp32,fp8,,0,k,k,n,128,128,64,128,2,1,4096,4096,192,19.648000597953796
fp8,fp32,fp8,,0,k,k,n,128,128,64,128,2,2,4096,4096,192,20.67839950323105
fp8,fp32,fp8,,0,k,k,n,128,192,64,192,2,1,4096,4096,192,18.02240014076233
fp8,fp32,fp8,,0,k,k,n,128,192,64,192,2,2,4096,4096,192,19.66080069541931
fp8,fp32,fp8,,0,k,k,n,128,256,64,256,2,1,4096,4096,192,18.220800161361694
fp8,fp32,fp8,,0,k,k,n,128,256,64,256,2,2,4096,4096,192,19.251200556755066
fp8,fp32,fp8,,0,k,k,n,256,64,128,64,2,1,4096,4096,192,19.251200556755066
fp8,fp32,fp8,,0,k,k,n,256,64,128,64,2,2,4096,4096,192,19.44960057735443
fp8,fp32,fp8,,0,k,k,n,256,128,128,128,2,1,4096,4096,192,18.01600009202957
fp8,fp32,fp8,,0,k,k,n,256,128,128,128,2,2,4096,4096,192,18.649600446224213
fp8,fp32,fp8,,0,k,k,n,256,192,128,192,2,1,4096,4096,192,16.998399794101715
fp8,fp32,fp8,,0,k,k,n,256,192,128,192,2,2,4096,4096,192,17.612800002098083
fp8,fp32,fp8,,0,k,k,n,256,256,128,256,2,1,4096,4096,192,18.227200210094452
fp8,fp32,fp8,,0,k,k,n,256,256,128,256,2,2,4096,4096,192,18.02240014076233
fp8,fp32,fp8,,0,k,k,n,128,64,64,64,2,1,4096,192,4096,18.01600009202957
fp8,fp32,fp8,,0,k,k,n,128,64,64,64,2,2,4096,192,4096,17.612800002098083
fp8,fp32,fp8,,0,k,k,n,128,128,64,128,2,1,4096,192,4096,14.745600521564484
fp8,fp32,fp8,,0,k,k,n,128,128,64,128,2,2,4096,192,4096,15.564799308776855
fp8,fp32,fp8,,0,k,k,n,128,192,64,192,2,1,4096,192,4096,15.769599378108976
fp8,fp32,fp8,,0,k,k,n,128,192,64,192,2,2,4096,192,4096,16.58879965543747
fp8,fp32,fp8,,0,k,k,n,128,256,64,256,2,1,4096,192,4096,17.40799993276596
fp8,fp32,fp8,,0,k,k,n,128,256,64,256,2,2,4096,192,4096,17.817600071430206
fp8,fp32,fp8,,0,k,k,n,256,64,128,64,2,1,4096,192,4096,15.974399447441101
fp8,fp32,fp8,,0,k,k,n,256,64,128,64,2,2,4096,192,4096,15.974399447441101
fp8,fp32,fp8,,0,k,k,n,256,128,128,128,2,1,4096,192,4096,17.817600071430206
fp8,fp32,fp8,,0,k,k,n,256,128,128,128,2,2,4096,192,4096,17.612800002098083
fp8,fp32,fp8,,0,k,k,n,256,192,128,192,2,1,4096,192,4096,19.046400487422943
fp8,fp32,fp8,,0,k,k,n,256,192,128,192,2,2,4096,192,4096,19.129599630832672
fp8,fp32,fp8,,0,k,k,n,256,256,128,256,2,1,4096,192,4096,22.9312002658844
fp8,fp32,fp8,,0,k,k,n,256,256,128,256,2,2,4096,192,4096,22.937600314617157
fp8,fp32,fp8,,0,k,k,n,128,64,64,64,2,1,192,4096,4096,16.991999745368958
fp8,fp32,fp8,,0,k,k,n,128,64,64,64,2,2,192,4096,4096,17.606399953365326
fp8,fp32,fp8,,0,k,k,n,128,128,64,128,2,1,192,4096,4096,14.534400403499603
fp8,fp32,fp8,,0,k,k,n,128,128,64,128,2,2,192,4096,4096,16.806399822235107
fp8,fp32,fp8,,0,k,k,n,128,192,64,192,2,1,192,4096,4096,15.980799496173859
fp8,fp32,fp8,,0,k,k,n,128,192,64,192,2,2,192,4096,4096,16.58879965543747
fp8,fp32,fp8,,0,k,k,n,128,256,64,256,2,1,192,4096,4096,17.40799993276596
fp8,fp32,fp8,,0,k,k,n,128,256,64,256,2,2,192,4096,4096,17.612800002098083
fp8,fp32,fp8,,0,k,k,n,256,64,128,64,2,1,192,4096,4096,15.769599378108976
fp8,fp32,fp8,,0,k,k,n,256,64,128,64,2,2,192,4096,4096,15.571199357509613
fp8,fp32,fp8,,0,k,k,n,256,128,128,128,2,1,192,4096,4096,17.40799993276596
fp8,fp32,fp8,,0,k,k,n,256,128,128,128,2,2,192,4096,4096,17.40799993276596
fp8,fp32,fp8,,0,k,k,n,256,192,128,192,2,1,192,4096,4096,19.64160054922104
fp8,fp32,fp8,,0,k,k,n,256,192,128,192,2,2,192,4096,4096,19.257600605487823
fp8,fp32,fp8,,0,k,k,n,256,256,128,256,2,1,192,4096,4096,22.732800245285034
fp8,fp32,fp8,,0,k,k,n,256,256,128,256,2,2,192,4096,4096,22.726400196552277
fp8,fp32,fp8,,0,k,k,n,128,64,64,64,2,1,4096,16384,4096,420.03841400146484
fp8,fp32,fp8,,0,k,k,n,128,64,64,64,2,2,4096,16384,4096,450.75840950012207
fp8,fp32,fp8,,0,k,k,n,128,128,64,128,2,1,4096,16384,4096,262.5472068786621
fp8,fp32,fp8,,0,k,k,n,128,128,64,128,2,2,4096,16384,4096,269.92640495300293
fp8,fp32,fp8,,0,k,k,n,128,192,64,192,2,1,4096,16384,4096,229.3760061264038
fp8,fp32,fp8,,0,k,k,n,128,192,64,192,2,2,4096,16384,4096,240.42880535125732
fp8,fp32,fp8,,0,k,k,n,128,256,64,256,2,1,4096,16384,4096,217.90719032287598
fp8,fp32,fp8,,0,k,k,n,128,256,64,256,2,2,4096,16384,4096,229.3760061264038
fp8,fp32,fp8,,0,k,k,n,256,64,128,64,2,1,4096,16384,4096,332.3904037475586
fp8,fp32,fp8,,0,k,k,n,256,64,128,64,2,2,4096,16384,4096,348.7744092941284
fp8,fp32,fp8,,0,k,k,n,256,128,128,128,2,1,4096,16384,4096,216.28799438476562
fp8,fp32,fp8,,0,k,k,n,256,128,128,128,2,2,4096,16384,4096,228.55679988861084
fp8,fp32,fp8,,0,k,k,n,256,192,128,192,2,1,4096,16384,4096,218.31679344177246
fp8,fp32,fp8,,0,k,k,n,256,192,128,192,2,2,4096,16384,4096,229.79199886322021
fp8,fp32,fp8,,0,k,k,n,256,256,128,256,2,1,4096,16384,4096,215.03360271453857
fp8,fp32,fp8,,0,k,k,n,256,256,128,256,2,2,4096,16384,4096,231.8336009979248
fp8,fp32,fp8,,0,k,k,n,128,64,64,64,2,1,4096,4096,16384,435.6095790863037
fp8,fp32,fp8,,0,k,k,n,128,64,64,64,2,2,4096,4096,16384,413.49120140075684
fp8,fp32,fp8,,0,k,k,n,128,128,64,128,2,1,4096,4096,16384,269.51680183410645
fp8,fp32,fp8,,0,k,k,n,128,128,64,128,2,2,4096,4096,16384,278.93760204315186
fp8,fp32,fp8,,0,k,k,n,128,192,64,192,2,1,4096,4096,16384,246.58560752868652
fp8,fp32,fp8,,0,k,k,n,128,192,64,192,2,2,4096,4096,16384,255.9999942779541
fp8,fp32,fp8,,0,k,k,n,128,256,64,256,2,1,4096,4096,16384,217.4976110458374
fp8,fp32,fp8,,0,k,k,n,128,256,64,256,2,2,4096,4096,16384,235.51359176635742
fp8,fp32,fp8,,0,k,k,n,256,64,128,64,2,1,4096,4096,16384,345.9199905395508
fp8,fp32,fp8,,0,k,k,n,256,64,128,64,2,2,4096,4096,16384,325.0175952911377
fp8,fp32,fp8,,0,k,k,n,256,128,128,128,2,1,4096,4096,16384,217.9136037826538
fp8,fp32,fp8,,0,k,k,n,256,128,128,128,2,2,4096,4096,16384,232.65280723571777
fp8,fp32,fp8,,0,k,k,n,256,192,128,192,2,1,4096,4096,16384,224.87680912017822
fp8,fp32,fp8,,0,k,k,n,256,192,128,192,2,2,4096,4096,16384,257.6256036758423
fp8,fp32,fp8,,0,k,k,n,256,256,128,256,2,1,4096,4096,16384,236.33921146392822
fp8,fp32,fp8,,0,k,k,n,256,256,128,256,2,2,4096,4096,16384,231.42399787902832
fp8,fp32,fp8,,0,k,k,n,128,64,64,64,2,1,4096,7168,16384,765.1328086853027
fp8,fp32,fp8,,0,k,k,n,128,64,64,64,2,2,4096,7168,16384,705.7407855987549
fp8,fp32,fp8,,0,k,k,n,128,128,64,128,2,1,4096,7168,16384,481.4847946166992
fp8,fp32,fp8,,0,k,k,n,128,128,64,128,2,2,4096,7168,16384,466.7391777038574
fp8,fp32,fp8,,0,k,k,n,128,192,64,192,2,1,4096,7168,16384,418.4063911437988
fp8,fp32,fp8,,0,k,k,n,128,192,64,192,2,2,4096,7168,16384,433.1520080566406
fp8,fp32,fp8,,0,k,k,n,128,256,64,256,2,1,4096,7168,16384,374.9887943267822
fp8,fp32,fp8,,0,k,k,n,128,256,64,256,2,2,4096,7168,16384,395.26400566101074
fp8,fp32,fp8,,0,k,k,n,256,64,128,64,2,1,4096,7168,16384,606.6175937652588
fp8,fp32,fp8,,0,k,k,n,256,64,128,64,2,2,4096,7168,16384,542.5151824951172
fp8,fp32,fp8,,0,k,k,n,256,128,128,128,2,1,4096,7168,16384,379.90400791168213
fp8,fp32,fp8,,0,k,k,n,256,128,128,128,2,2,4096,7168,16384,377.04319953918457
fp8,fp32,fp8,,0,k,k,n,256,192,128,192,2,1,4096,7168,16384,373.7600088119507
fp8,fp32,fp8,,0,k,k,n,256,192,128,192,2,2,4096,7168,16384,399.9743938446045
fp8,fp32,fp8,,0,k,k,n,256,256,128,256,2,1,4096,7168,16384,381.7471981048584
fp8,fp32,fp8,,0,k,k,n,256,256,128,256,2,2,4096,7168,16384,372.94719219207764
fp8,fp32,fp8,,0,k,k,n,128,64,64,64,2,1,4096,16384,7168,783.9744091033936
fp8,fp32,fp8,,0,k,k,n,128,64,64,64,2,2,4096,16384,7168,733.5936069488525
fp8,fp32,fp8,,0,k,k,n,128,128,64,128,2,1,4096,16384,7168,472.88317680358887
fp8,fp32,fp8,,0,k,k,n,128,128,64,128,2,2,4096,16384,7168,451.1744022369385
fp8,fp32,fp8,,0,k,k,n,128,192,64,192,2,1,4096,16384,7168,378.2655954360962
fp8,fp32,fp8,,0,k,k,n,128,192,64,192,2,2,4096,16384,7168,399.5584011077881
fp8,fp32,fp8,,0,k,k,n,128,256,64,256,2,1,4096,16384,7168,348.37119579315186
fp8,fp32,fp8,,0,k,k,n,128,256,64,256,2,2,4096,16384,7168,368.8512086868286
fp8,fp32,fp8,,0,k,k,n,256,64,128,64,2,1,4096,16384,7168,617.2671794891357
fp8,fp32,fp8,,0,k,k,n,256,64,128,64,2,2,4096,16384,7168,549.0687847137451
fp8,fp32,fp8,,0,k,k,n,256,128,128,128,2,1,4096,16384,7168,352.46078968048096
fp8,fp32,fp8,,0,k,k,n,256,128,128,128,2,2,4096,16384,7168,368.4351921081543
fp8,fp32,fp8,,0,k,k,n,256,192,128,192,2,1,4096,16384,7168,348.5759973526001
fp8,fp32,fp8,,0,k,k,n,256,192,128,192,2,2,4096,16384,7168,368.8512086868286
fp8,fp32,fp8,,0,k,k,n,256,256,128,256,2,1,4096,16384,7168,342.01600551605225
fp8,fp32,fp8,,0,k,k,n,256,256,128,256,2,2,4096,16384,7168,374.5856046676636
fp8,fp32,fp8,,0,k,k,n,128,64,64,64,2,1,16384,7168,4096,748.748779296875
fp8,fp32,fp8,,0,k,k,n,128,64,64,64,2,2,16384,7168,4096,769.6383953094482
fp8,fp32,fp8,,0,k,k,n,128,128,64,128,2,1,16384,7168,4096,466.32962226867676
fp8,fp32,fp8,,0,k,k,n,128,128,64,128,2,2,16384,7168,4096,471.24481201171875
fp8,fp32,fp8,,0,k,k,n,128,192,64,192,2,1,16384,7168,4096,404.8895835876465
fp8,fp32,fp8,,0,k,k,n,128,192,64,192,2,2,16384,7168,4096,425.7791996002197
fp8,fp32,fp8,,0,k,k,n,128,256,64,256,2,1,16384,7168,4096,363.5200023651123
fp8,fp32,fp8,,0,k,k,n,128,256,64,256,2,2,16384,7168,4096,396.6975927352905
fp8,fp32,fp8,,0,k,k,n,256,64,128,64,2,1,16384,7168,4096,671.9488143920898
fp8,fp32,fp8,,0,k,k,n,256,64,128,64,2,2,16384,7168,4096,606.6175937652588
fp8,fp32,fp8,,0,k,k,n,256,128,128,128,2,1,16384,7168,4096,388.0959987640381
fp8,fp32,fp8,,0,k,k,n,256,128,128,128,2,2,16384,7168,4096,374.9887943267822
fp8,fp32,fp8,,0,k,k,n,256,192,128,192,2,1,16384,7168,4096,349.1904020309448
fp8,fp32,fp8,,0,k,k,n,256,192,128,192,2,2,16384,7168,4096,371.3088035583496
fp8,fp32,fp8,,0,k,k,n,256,256,128,256,2,1,16384,7168,4096,350.41279792785645
fp8,fp32,fp8,,0,k,k,n,256,256,128,256,2,2,16384,7168,4096,373.77920150756836
fp8,fp32,fp8,,0,k,k,n,128,64,64,64,2,1,4096,18432,7168,889.6512031555176
fp8,fp32,fp8,,0,k,k,n,128,64,64,64,2,2,4096,18432,7168,820.8383560180664
fp8,fp32,fp8,,0,k,k,n,128,128,64,128,2,1,4096,18432,7168,555.2127838134766
fp8,fp32,fp8,,0,k,k,n,128,128,64,128,2,2,4096,18432,7168,503.19361686706543
fp8,fp32,fp8,,0,k,k,n,128,192,64,192,2,1,4096,18432,7168,429.2736053466797
fp8,fp32,fp8,,0,k,k,n,128,192,64,192,2,2,4096,18432,7168,449.3311882019043
fp8,fp32,fp8,,0,k,k,n,128,256,64,256,2,1,4096,18432,7168,390.1439905166626
fp8,fp32,fp8,,0,k,k,n,128,256,64,256,2,2,4096,18432,7168,409.8112106323242
fp8,fp32,fp8,,0,k,k,n,256,64,128,64,2,1,4096,18432,7168,732.3520183563232
fp8,fp32,fp8,,0,k,k,n,256,64,128,64,2,2,4096,18432,7168,614.4000053405762
fp8,fp32,fp8,,0,k,k,n,256,128,128,128,2,1,4096,18432,7168,399.564790725708
fp8,fp32,fp8,,0,k,k,n,256,128,128,128,2,2,4096,18432,7168,407.7695846557617
fp8,fp32,fp8,,0,k,k,n,256,192,128,192,2,1,4096,18432,7168,380.3136110305786
fp8,fp32,fp8,,0,k,k,n,256,192,128,192,2,2,4096,18432,7168,416.3584232330322
fp8,fp32,fp8,,0,k,k,n,256,256,128,256,2,1,4096,18432,7168,383.59038829803467
fp8,fp32,fp8,,0,k,k,n,256,256,128,256,2,2,4096,18432,7168,415.53921699523926
fp8,fp32,fp8,,0,k,k,n,128,64,64,64,2,1,4096,7168,18432,859.340763092041
fp8,fp32,fp8,,0,k,k,n,128,64,64,64,2,2,4096,7168,18432,783.5648059844971
fp8,fp32,fp8,,0,k,k,n,128,128,64,128,2,1,4096,7168,18432,556.6463947296143
fp8,fp32,fp8,,0,k,k,n,128,128,64,128,2,2,4096,7168,18432,532.473611831665
fp8,fp32,fp8,,0,k,k,n,128,192,64,192,2,1,4096,7168,18432,471.65441513061523
fp8,fp32,fp8,,0,k,k,n,128,192,64,192,2,2,4096,7168,18432,490.08641242980957
fp8,fp32,fp8,,0,k,k,n,128,256,64,256,2,1,4096,7168,18432,420.45440673828125
fp8,fp32,fp8,,0,k,k,n,128,256,64,256,2,2,4096,7168,18432,440.934419631958
fp8,fp32,fp8,,0,k,k,n,256,64,128,64,2,1,4096,7168,18432,659.8656177520752
fp8,fp32,fp8,,0,k,k,n,256,64,128,64,2,2,4096,7168,18432,632.0127964019775
fp8,fp32,fp8,,0,k,k,n,256,128,128,128,2,1,4096,7168,18432,426.5984058380127
fp8,fp32,fp8,,0,k,k,n,256,128,128,128,2,2,4096,7168,18432,420.4607963562012
fp8,fp32,fp8,,0,k,k,n,256,192,128,192,2,1,4096,7168,18432,415.1296138763428
fp8,fp32,fp8,,0,k,k,n,256,192,128,192,2,2,4096,7168,18432,445.03040313720703
fp8,fp32,fp8,,0,k,k,n,256,256,128,256,2,1,4096,7168,18432,423.3215808868408
fp8,fp32,fp8,,0,k,k,n,256,256,128,256,2,2,4096,7168,18432,414.3167972564697
fp8,fp32,fp8,,0,k,k,n,128,64,64,64,2,1,7168,18432,4096,925.8879661560059
fp8,fp32,fp8,,0,k,k,n,128,64,64,64,2,2,7168,18432,4096,868.7552452087402
fp8,fp32,fp8,,0,k,k,n,128,128,64,128,2,1,7168,18432,4096,544.9728012084961
fp8,fp32,fp8,,0,k,k,n,128,128,64,128,2,2,7168,18432,4096,504.422378540039
fp8,fp32,fp8,,0,k,k,n,128,192,64,192,2,1,7168,18432,4096,418.8159942626953
fp8,fp32,fp8,,0,k,k,n,128,192,64,192,2,2,7168,18432,4096,442.16318130493164
fp8,fp32,fp8,,0,k,k,n,128,256,64,256,2,1,7168,18432,4096,386.86718940734863
fp8,fp32,fp8,,0,k,k,n,128,256,64,256,2,2,7168,18432,4096,415.7440185546875
fp8,fp32,fp8,,0,k,k,n,256,64,128,64,2,1,7168,18432,4096,730.3167819976807
fp8,fp32,fp8,,0,k,k,n,256,64,128,64,2,2,7168,18432,4096,663.5519981384277
fp8,fp32,fp8,,0,k,k,n,256,128,128,128,2,1,7168,18432,4096,429.87518310546875
fp8,fp32,fp8,,0,k,k,n,256,128,128,128,2,2,7168,18432,4096,413.08159828186035
fp8,fp32,fp8,,0,k,k,n,256,192,128,192,2,1,7168,18432,4096,382.3616027832031
fp8,fp32,fp8,,0,k,k,n,256,192,128,192,2,2,7168,18432,4096,407.7568054199219
fp8,fp32,fp8,,0,k,k,n,256,256,128,256,2,1,7168,18432,4096,383.99999141693115
fp8,fp32,fp8,,0,k,k,n,256,256,128,256,2,2,7168,18432,4096,409.3952178955078
fp8,fp32,fp8,,0,k,k,n,128,64,64,64,2,1,18432,7168,4096,871.4176177978516
fp8,fp32,fp8,,0,k,k,n,128,64,64,64,2,2,18432,7168,4096,862.6175880432129
fp8,fp32,fp8,,0,k,k,n,128,128,64,128,2,1,18432,7168,4096,545.5872058868408
fp8,fp32,fp8,,0,k,k,n,128,128,64,128,2,2,18432,7168,4096,539.0336036682129
fp8,fp32,fp8,,0,k,k,n,128,192,64,192,2,1,18432,7168,4096,462.6431941986084
fp8,fp32,fp8,,0,k,k,n,128,192,64,192,2,2,18432,7168,4096,484.3520164489746
fp8,fp32,fp8,,0,k,k,n,128,256,64,256,2,1,18432,7168,4096,412.67199516296387
fp8,fp32,fp8,,0,k,k,n,128,256,64,256,2,2,18432,7168,4096,439.29600715637207
fp8,fp32,fp8,,0,k,k,n,256,64,128,64,2,1,18432,7168,4096,759.8080158233643
fp8,fp32,fp8,,0,k,k,n,256,64,128,64,2,2,18432,7168,4096,681.1647891998291
fp8,fp32,fp8,,0,k,k,n,256,128,128,128,2,1,18432,7168,4096,439.29600715637207
fp8,fp32,fp8,,0,k,k,n,256,128,128,128,2,2,18432,7168,4096,424.5567798614502
fp8,fp32,fp8,,0,k,k,n,256,192,128,192,2,1,18432,7168,4096,387.47520446777344
fp8,fp32,fp8,,0,k,k,n,256,192,128,192,2,2,18432,7168,4096,416.3584232330322
fp8,fp32,fp8,,0,k,k,n,256,256,128,256,2,1,18432,7168,4096,384.8191976547241
fp8,fp32,fp8,,0,k,k,n,256,256,128,256,2,2,18432,7168,4096,408.9856147766113
fp8,fp32,fp8,,0,k,k,n,128,64,64,64,2,1,4096,257,7168,27.846398949623108
fp8,fp32,fp8,,0,k,k,n,128,64,64,64,2,2,4096,257,7168,28.05759906768799
fp8,fp32,fp8,,0,k,k,n,128,128,64,128,2,1,4096,257,7168,23.769600689411163
fp8,fp32,fp8,,0,k,k,n,128,128,64,128,2,2,4096,257,7168,24.985599517822266
fp8,fp32,fp8,,0,k,k,n,128,192,64,192,2,1,4096,257,7168,19.859200716018677
fp8,fp32,fp8,,0,k,k,n,128,192,64,192,2,2,4096,257,7168,20.479999482631683
fp8,fp32,fp8,,0,k,k,n,128,256,64,256,2,1,4096,257,7168,22.937600314617157
fp8,fp32,fp8,,0,k,k,n,128,256,64,256,2,2,4096,257,7168,23.96160066127777
fp8,fp32,fp8,,0,k,k,n,256,64,128,64,2,1,4096,257,7168,26.82879865169525
fp8,fp32,fp8,,0,k,k,n,256,64,128,64,2,2,4096,257,7168,27.084800601005554
fp8,fp32,fp8,,0,k,k,n,256,128,128,128,2,1,4096,257,7168,22.937600314617157
fp8,fp32,fp8,,0,k,k,n,256,128,128,128,2,2,4096,257,7168,23.231999576091766
fp8,fp32,fp8,,0,k,k,n,256,192,128,192,2,1,4096,257,7168,27.667200565338135
fp8,fp32,fp8,,0,k,k,n,256,192,128,192,2,2,4096,257,7168,27.436798810958862
fp8,fp32,fp8,,0,k,k,n,256,256,128,256,2,1,4096,257,7168,34.39359962940216
fp8,fp32,fp8,,0,k,k,n,256,256,128,256,2,2,4096,257,7168,33.587199449539185
fp8,fp32,fp8,,0,k,k,n,128,64,64,64,2,1,4096,7168,257,46.28480076789856
fp8,fp32,fp8,,0,k,k,n,128,64,64,64,2,2,4096,7168,257,49.97119903564453
fp8,fp32,fp8,,0,k,k,n,128,128,64,128,2,1,4096,7168,257,35.43039858341217
fp8,fp32,fp8,,0,k,k,n,128,128,64,128,2,2,4096,7168,257,31.942400336265568
fp8,fp32,fp8,,0,k,k,n,128,192,64,192,2,1,4096,7168,257,33.1712007522583
fp8,fp32,fp8,,0,k,k,n,128,192,64,192,2,2,4096,7168,257,31.12959861755371
fp8,fp32,fp8,,0,k,k,n,128,256,64,256,2,1,4096,7168,257,35.63520014286041
fp8,fp32,fp8,,0,k,k,n,128,256,64,256,2,2,4096,7168,257,35.22560000419617
fp8,fp32,fp8,,0,k,k,n,256,64,128,64,2,1,4096,7168,257,41.77919924259186
fp8,fp32,fp8,,0,k,k,n,256,64,128,64,2,2,4096,7168,257,31.21280074119568
fp8,fp32,fp8,,0,k,k,n,256,128,128,128,2,1,4096,7168,257,35.22560000419617
fp8,fp32,fp8,,0,k,k,n,256,128,128,128,2,2,4096,7168,257,31.12959861755371
fp8,fp32,fp8,,0,k,k,n,256,192,128,192,2,1,4096,7168,257,29.491201043128967
fp8,fp32,fp8,,0,k,k,n,256,192,128,192,2,2,4096,7168,257,27.033600211143494
fp8,fp32,fp8,,0,k,k,n,256,256,128,256,2,1,4096,7168,257,27.033600211143494
fp8,fp32,fp8,,0,k,k,n,256,256,128,256,2,2,4096,7168,257,25.196799635887146
fp8,fp32,fp8,,0,k,k,n,128,64,64,64,2,1,7168,257,4096,27.033600211143494
fp8,fp32,fp8,,0,k,k,n,128,64,64,64,2,2,7168,257,4096,31.219199299812317
fp8,fp32,fp8,,0,k,k,n,128,128,64,128,2,1,7168,257,4096,22.937600314617157
fp8,fp32,fp8,,0,k,k,n,128,128,64,128,2,2,7168,257,4096,28.147199749946594
fp8,fp32,fp8,,0,k,k,n,128,192,64,192,2,1,7168,257,4096,21.107199788093567
fp8,fp32,fp8,,0,k,k,n,128,192,64,192,2,2,7168,257,4096,21.913599967956543
fp8,fp32,fp8,,0,k,k,n,128,256,64,256,2,1,7168,257,4096,24.7871994972229
fp8,fp32,fp8,,0,k,k,n,128,256,64,256,2,2,7168,257,4096,24.979199469089508
fp8,fp32,fp8,,0,k,k,n,256,64,128,64,2,1,7168,257,4096,22.937600314617157
fp8,fp32,fp8,,0,k,k,n,256,64,128,64,2,2,7168,257,4096,27.44320034980774
fp8,fp32,fp8,,0,k,k,n,256,128,128,128,2,1,7168,257,4096,24.985599517822266
fp8,fp32,fp8,,0,k,k,n,256,128,128,128,2,2,7168,257,4096,24.985599517822266
fp8,fp32,fp8,,0,k,k,n,256,192,128,192,2,1,7168,257,4096,21.09439969062805
fp8,fp32,fp8,,0,k,k,n,256,192,128,192,2,2,7168,257,4096,21.09439969062805
fp8,fp32,fp8,,0,k,k,n,256,256,128,256,2,1,7168,257,4096,24.991999566555023
fp8,fp32,fp8,,0,k,k,n,256,256,128,256,2,2,7168,257,4096,25.26080012321472
fp8,fp32,fp8,,0,k,k,n,128,64,64,64,2,1,4096,2048,7168,104.4543981552124
fp8,fp32,fp8,,0,k,k,n,128,64,64,64,2,2,4096,2048,7168,112.64640092849731
fp8,fp32,fp8,,0,k,k,n,128,128,64,128,2,1,4096,2048,7168,69.23519968986511
fp8,fp32,fp8,,0,k,k,n,128,128,64,128,2,2,4096,2048,7168,74.54079985618591
fp8,fp32,fp8,,0,k,k,n,128,192,64,192,2,1,4096,2048,7168,66.76480174064636
fp8,fp32,fp8,,0,k,k,n,128,192,64,192,2,2,4096,2048,7168,74.34239983558655
fp8,fp32,fp8,,0,k,k,n,128,256,64,256,2,1,4096,2048,7168,68.40959787368774
fp8,fp32,fp8,,0,k,k,n,128,256,64,256,2,2,4096,2048,7168,67.58400201797485
fp8,fp32,fp8,,0,k,k,n,256,64,128,64,2,1,4096,2048,7168,82.32960104942322
fp8,fp32,fp8,,0,k,k,n,256,64,128,64,2,2,4096,2048,7168,89.70239758491516
fp8,fp32,fp8,,0,k,k,n,256,128,128,128,2,1,4096,2048,7168,67.58400201797485
fp8,fp32,fp8,,0,k,k,n,256,128,128,128,2,2,4096,2048,7168,67.52640008926392
fp8,fp32,fp8,,0,k,k,n,256,192,128,192,2,1,4096,2048,7168,72.90880084037781
fp8,fp32,fp8,,0,k,k,n,256,192,128,192,2,2,4096,2048,7168,73.72159957885742
fp8,fp32,fp8,,0,k,k,n,256,256,128,256,2,1,4096,2048,7168,68.07680130004883
fp8,fp32,fp8,,0,k,k,n,256,256,128,256,2,2,4096,2048,7168,66.76480174064636
fp8,fp32,fp8,,0,k,k,n,128,64,64,64,2,1,4096,7168,2048,116.73599481582642
fp8,fp32,fp8,,0,k,k,n,128,64,64,64,2,2,4096,7168,2048,126.16319656372072
fp8,fp32,fp8,,0,k,k,n,128,128,64,128,2,1,4096,7168,2048,74.9567985534668
fp8,fp32,fp8,,0,k,k,n,128,128,64,128,2,2,4096,7168,2048,78.64959836006165
fp8,fp32,fp8,,0,k,k,n,128,192,64,192,2,1,4096,7168,2048,68.00000071525574
fp8,fp32,fp8,,0,k,k,n,128,192,64,192,2,2,4096,7168,2048,69.63199973106384
fp8,fp32,fp8,,0,k,k,n,128,256,64,256,2,1,4096,7168,2048,65.26079773902893
fp8,fp32,fp8,,0,k,k,n,128,256,64,256,2,2,4096,7168,2048,67.98719763755798
fp8,fp32,fp8,,0,k,k,n,256,64,128,64,2,1,4096,7168,2048,86.01599931716919
fp8,fp32,fp8,,0,k,k,n,256,64,128,64,2,2,4096,7168,2048,94.2143976688385
fp8,fp32,fp8,,0,k,k,n,256,128,128,128,2,1,4096,7168,2048,65.2351975440979
fp8,fp32,fp8,,0,k,k,n,256,128,128,128,2,2,4096,7168,2048,67.59039759635925
fp8,fp32,fp8,,0,k,k,n,256,192,128,192,2,1,4096,7168,2048,67.26400256156921
fp8,fp32,fp8,,0,k,k,n,256,192,128,192,2,2,4096,7168,2048,70.44479846954346
fp8,fp32,fp8,,0,k,k,n,256,256,128,256,2,1,4096,7168,2048,66.76480174064636
fp8,fp32,fp8,,0,k,k,n,256,256,128,256,2,2,4096,7168,2048,67.99359917640686
fp8,fp32,fp8,,0,k,k,n,128,64,64,64,2,1,7168,2048,4096,111.00800037384033
fp8,fp32,fp8,,0,k,k,n,128,64,64,64,2,2,7168,2048,4096,118.3743953704834
fp8,fp32,fp8,,0,k,k,n,128,128,64,128,2,1,7168,2048,4096,74.1312026977539
fp8,fp32,fp8,,0,k,k,n,128,128,64,128,2,2,7168,2048,4096,76.94079875946045
fp8,fp32,fp8,,0,k,k,n,128,192,64,192,2,1,7168,2048,4096,68.40959787368774
fp8,fp32,fp8,,0,k,k,n,128,192,64,192,2,2,7168,2048,4096,77.00480222702026
fp8,fp32,fp8,,0,k,k,n,128,256,64,256,2,1,7168,2048,4096,67.58400201797485
fp8,fp32,fp8,,0,k,k,n,128,256,64,256,2,2,7168,2048,4096,67.59039759635925
fp8,fp32,fp8,,0,k,k,n,256,64,128,64,2,1,7168,2048,4096,89.70879912376404
fp8,fp32,fp8,,0,k,k,n,256,64,128,64,2,2,7168,2048,4096,94.20160055160522
fp8,fp32,fp8,,0,k,k,n,256,128,128,128,2,1,7168,2048,4096,68.1984007358551
fp8,fp32,fp8,,0,k,k,n,256,128,128,128,2,2,7168,2048,4096,68.81279945373535
fp8,fp32,fp8,,0,k,k,n,256,192,128,192,2,1,7168,2048,4096,70.86079716682434
fp8,fp32,fp8,,0,k,k,n,256,192,128,192,2,2,7168,2048,4096,79.87200021743774
fp8,fp32,fp8,,0,k,k,n,256,256,128,256,2,1,7168,2048,4096,71.67999744415283
fp8,fp32,fp8,,0,k,k,n,256,256,128,256,2,2,7168,2048,4096,72.90880084037781
fp8,fp32,fp8,,0,k,k,n,128,64,64,64,2,1,2048,7168,4096,109.3824028968811
fp8,fp32,fp8,,0,k,k,n,128,64,64,64,2,2,2048,7168,4096,115.50719738006592
fp8,fp32,fp8,,0,k,k,n,128,128,64,128,2,1,2048,7168,4096,72.10879921913147
fp8,fp32,fp8,,0,k,k,n,128,128,64,128,2,2,2048,7168,4096,75.78240036964417
fp8,fp32,fp8,,0,k,k,n,128,192,64,192,2,1,2048,7168,4096,67.17439889907837
fp8,fp32,fp8,,0,k,k,n,128,192,64,192,2,2,2048,7168,4096,70.83520293235779
fp8,fp32,fp8,,0,k,k,n,128,256,64,256,2,1,2048,7168,4096,67.58400201797485
fp8,fp32,fp8,,0,k,k,n,128,256,64,256,2,2,2048,7168,4096,68.40320229530334
fp8,fp32,fp8,,0,k,k,n,256,64,128,64,2,1,2048,7168,4096,84.78720188140869
fp8,fp32,fp8,,0,k,k,n,256,64,128,64,2,2,2048,7168,4096,91.74399971961975
fp8,fp32,fp8,,0,k,k,n,256,128,128,128,2,1,2048,7168,4096,67.58400201797485
fp8,fp32,fp8,,0,k,k,n,256,128,128,128,2,2,2048,7168,4096,67.59039759635925
fp8,fp32,fp8,,0,k,k,n,256,192,128,192,2,1,2048,7168,4096,70.86079716682434
fp8,fp32,fp8,,0,k,k,n,256,192,128,192,2,2,2048,7168,4096,70.04160284996033
fp8,fp32,fp8,,0,k,k,n,256,256,128,256,2,1,2048,7168,4096,71.75679802894592
fp8,fp32,fp8,,0,k,k,n,256,256,128,256,2,2,2048,7168,4096,72.49919772148132
